record_type,source_id,source_type,source_name,platform,url,focus_area,signal_quality,update_frequency,last_checked,notes,auto_monitor,scrape_category,source_file,Niche,Platform,Handle,Email,ProxyUsed,GoLoginProfile,Status,CreatedDate,LastActive,Notes
signal_source,SRC001,Twitter Account,@levelsio,X,https://x.com/levelsio,Indie hacking numbers revenue,HIGHEST,Daily,,Pure signal. Real numbers. No fluff.,TRUE,INDIE_BUILDING,HIGH_SIGNAL_SOURCES.csv,,,,,,,,,,
signal_source,SRC002,Twitter Account,@tdinh_me,X,https://x.com/tdinh_me,Technical solopreneur indie apps,HIGHEST,Daily,,Deep technical content. Accessible.,TRUE,IOS_APPS,HIGH_SIGNAL_SOURCES.csv,,,,,,,,,,
signal_source,SRC003,Twitter Account,@dannypostmaa,X,https://x.com/dannypostmaa,Honest solopreneur failures,HIGH,Daily,,Admits failures. Real tradeoffs.,TRUE,INDIE_BUILDING,HIGH_SIGNAL_SOURCES.csv,,,,,,,,,,
signal_source,SRC004,Twitter Account,@marc_louvion,X,https://x.com/marc_louvion,Structured how-tos launches,HIGH,Weekly,,Clear step-by-step. Good frameworks.,TRUE,INDIE_BUILDING,HIGH_SIGNAL_SOURCES.csv,,,,,,,,,,
signal_source,SRC005,Twitter Account,@gregisenberg,X,https://x.com/gregisenberg,Startup ideas communities,HIGH,Daily,,Good for trending ideas.,TRUE,INDIE_BUILDING,HIGH_SIGNAL_SOURCES.csv,,,,,,,,,,
signal_source,SRC006,Twitter Account,@paborojek,X,https://x.com/paborojek,AI tools automation,HIGH,Daily,,AI-focused tactics.,TRUE,AI_TOOLS,HIGH_SIGNAL_SOURCES.csv,,,,,,,,,,
signal_source,SRC007,Twitter Account,@caiden_cole,X,https://x.com/caiden_cole,Cold email deliverability,HIGHEST,Weekly,,Best cold email signal.,TRUE,COLD_EMAIL,HIGH_SIGNAL_SOURCES.csv,,,,,,,,,,
signal_source,SRC008,Twitter Account,@alexberman,X,https://x.com/alexberman,B2B outbound sales,HIGH,Daily,,Outbound tactics. Some hype.,TRUE,COLD_EMAIL,HIGH_SIGNAL_SOURCES.csv,,,,,,,,,,
signal_source,SRC009,Twitter Account,@dickiebush,X,https://x.com/dickiebush,Content systems writing,HIGH,Daily,,Writing frameworks.,TRUE,INDIE_BUILDING,HIGH_SIGNAL_SOURCES.csv,,,,,,,,,,
signal_source,SRC010,Twitter Account,@nicolascole77,X,https://x.com/nicolascole77,Writing systems ghostwriting,HIGH,Daily,,Content strategy.,TRUE,INFO_PRODUCTS,HIGH_SIGNAL_SOURCES.csv,,,,,,,,,,
signal_source,SRC011,Twitter Account,@godofprompt,X,https://x.com/godofprompt,Prompt engineering AI,HIGH,Daily,,Prompt tactics.,TRUE,AI_TOOLS,HIGH_SIGNAL_SOURCES.csv,,,,,,,,,,
signal_source,SRC012,Subreddit,r/SideProject,Reddit,https://reddit.com/r/SideProject,Side project launches validation,HIGH,Daily,,Real launches. Real feedback.,TRUE,INDIE_BUILDING,HIGH_SIGNAL_SOURCES.csv,,,,,,,,,,
signal_source,SRC013,Subreddit,r/EntrepreneurRideAlong,Reddit,https://reddit.com/r/EntrepreneurRideAlong,Small business tactics,HIGH,Daily,,Practical small biz.,TRUE,INDIE_BUILDING,HIGH_SIGNAL_SOURCES.csv,,,,,,,,,,
signal_source,SRC014,Subreddit,r/juststart,Reddit,https://reddit.com/r/juststart,SEO content sites,MEDIUM,Weekly,,Affiliate site tactics.,TRUE,SEO_ASO,HIGH_SIGNAL_SOURCES.csv,,,,,,,,,,
signal_source,SRC015,Subreddit,r/coldemail,Reddit,https://reddit.com/r/coldemail,Cold email tactics tools,HIGH,Daily,,Cold email specifics.,TRUE,COLD_EMAIL,HIGH_SIGNAL_SOURCES.csv,,,,,,,,,,
signal_source,SRC016,Subreddit,r/indiehackers,Reddit,https://reddit.com/r/indiehackers,Indie hacker community,HIGH,Daily,,Launch feedback.,TRUE,INDIE_BUILDING,HIGH_SIGNAL_SOURCES.csv,,,,,,,,,,
signal_source,SRC017,Newsletter,TLDR,Email,https://tldr.tech,Tech news daily,HIGH,Daily,,Good for trends.,FALSE,AI_TOOLS,HIGH_SIGNAL_SOURCES.csv,,,,,,,,,,
signal_source,SRC018,Newsletter,Morning Brew,Email,https://morningbrew.com,Business news daily,MEDIUM,Daily,,General business.,FALSE,FINANCE_TRADING,HIGH_SIGNAL_SOURCES.csv,,,,,,,,,,
signal_source,SRC019,Newsletter,Ben's Bites,Email,https://bensbites.co,AI news tools,HIGHEST,Daily,,Best AI signal.,TRUE,AI_TOOLS,HIGH_SIGNAL_SOURCES.csv,,,,,,,,,,
signal_source,SRC020,Newsletter,Indie Hackers,Email,https://indiehackers.com/newsletter,Indie launches revenue,HIGH,Weekly,,Launch case studies.,TRUE,INDIE_BUILDING,HIGH_SIGNAL_SOURCES.csv,,,,,,,,,,
signal_source,SRC021,Website,Product Hunt,Web,https://producthunt.com,New product launches,HIGH,Daily,,Trending tools.,TRUE,INDIE_BUILDING,HIGH_SIGNAL_SOURCES.csv,,,,,,,,,,
signal_source,SRC022,YouTube,My First Million Clips,YouTube,https://youtube.com/@mikieclips,Business ideas breakdowns,HIGH,Weekly,,Idea generation.,FALSE,INDIE_BUILDING,HIGH_SIGNAL_SOURCES.csv,,,,,,,,,,
signal_source,SRC023,YouTube,Greg Isenberg,YouTube,https://youtube.com/@gregisenberg,Startup community ideas,HIGH,Weekly,,Community plays.,FALSE,INDIE_BUILDING,HIGH_SIGNAL_SOURCES.csv,,,,,,,,,,
signal_source,SRC024,YouTube,Fireship,YouTube,https://youtube.com/@fireship,Tech trends dev tools,HIGHEST,Weekly,,Tech signal.,TRUE,VIBE_CODING,HIGH_SIGNAL_SOURCES.csv,,,,,,,,,,
signal_source,SRC025,YouTube,Simon Hoiberg,YouTube,https://youtube.com/@simonhoiberg,SaaS building indie,HIGH,Weekly,,Building in public.,FALSE,INDIE_BUILDING,HIGH_SIGNAL_SOURCES.csv,,,,,,,,,,
signal_source,SRC026,Tool,algrow.online,Web,https://algrow.online,YouTube termination tracking,HIGH,Daily,,Terminated channel arbitrage.,TRUE,CONTENT_CREATION,HIGH_SIGNAL_SOURCES.csv,,,,,,,,,,
signal_source,SRC027,Tool,appkittie,Web,https://appkittie.com,App store movers,HIGH,Daily,,App opportunity tracking.,TRUE,IOS_APPS,HIGH_SIGNAL_SOURCES.csv,,,,,,,,,,
signal_source,SRC028,Podcast,Indie Hackers,Podcast,https://indiehackers.com/podcast,Founder interviews,HIGH,Weekly,,Deep dives on tactics.,FALSE,INDIE_BUILDING,HIGH_SIGNAL_SOURCES.csv,,,,,,,,,,
signal_source,SRC029,Podcast,My First Million,Podcast,https://mfmpod.com,Business ideas trends,HIGH,Weekly,,Idea generation.,FALSE,INDIE_BUILDING,HIGH_SIGNAL_SOURCES.csv,,,,,,,,,,
signal_source,SRC030,Twitter Account,@dansugcmodels,X,https://x.com/dansugcmodels,Eastern EU UGC sourcing,HIGHEST,Weekly,,$3-20/video roster. DM for access.,TRUE,CONTENT_CREATION,HIGH_SIGNAL_SOURCES.csv,,,,,,,,,,
signal_source,SRC031,Twitter Account,@franci__ugc,X,https://x.com/franci__ugc,Cheap UGC creators,HIGH,Weekly,,Alternative UGC source.,TRUE,CONTENT_CREATION,HIGH_SIGNAL_SOURCES.csv,,,,,,,,,,
signal_source,SRC032,Twitter Account,@xivy0k,X,https://x.com/xivy0k,Mobile app marketing solopreneur,HIGH,Daily,,App growth tactics. Good for app factory methods.,TRUE,IOS_APPS,HIGH_SIGNAL_SOURCES.csv,,,,,,,,,,
signal_source,SRC033,Twitter Account,@tatealax,X,https://x.com/tatealax,Growth hacking marketing,HIGH,Daily,,Alternative growth strategies.,TRUE,GROWTH_HACKS,HIGH_SIGNAL_SOURCES.csv,,,,,,,,,,
signal_source,SRC034,Twitter Account,@simonecanciello,X,https://x.com/simonecanciello,Indie app development,HIGH,Daily,,Mobile app building tactics.,TRUE,IOS_APPS,HIGH_SIGNAL_SOURCES.csv,,,,,,,,,,
signal_source,SRC035,Twitter Account,@lottsnomad,X,https://x.com/lottsnomad,YC W26 founder - app scaling hook testing,HIGHEST,Daily,,Lotanna Ezeike. YC W26 batch. TikTok hook testing framework. Volume testing before paid. App scaling tactics.,TRUE,IOS_APPS,HIGH_SIGNAL_SOURCES.csv,,,,,,,,,,
signal_source,SRC036,Twitter Account,@CEOLandshark,X,https://x.com/CEOLandshark,Business acquisition strategies,HIGH,Weekly,,Buy vs build opportunities.,TRUE,INFO_PRODUCTS,HIGH_SIGNAL_SOURCES.csv,,,,,,,,,,
signal_source,SRC037,Twitter Account,@knoxtwts,X,https://x.com/knoxtwts,App marketing content formats,HIGHEST,Daily,,Mobile app growth. Content structure tactics. High signal.,TRUE,IOS_APPS,HIGH_SIGNAL_SOURCES.csv,,,,,,,,,,
signal_source,SRC038,Twitter Account,@wesocialgrowth,X,https://x.com/wesocialgrowth,Social media growth tactics,HIGH,Daily,,Platform-specific growth hacks.,TRUE,GROWTH_HACKS,HIGH_SIGNAL_SOURCES.csv,,,,,,,,,,
signal_source,SRC039,Twitter Account,@matteo_spada,X,https://x.com/matteo_spada,Tech entrepreneurship,HIGH,Daily,,Building in public tactics.,TRUE,INDIE_BUILDING,HIGH_SIGNAL_SOURCES.csv,,,,,,,,,,
signal_source,SRC040,Twitter Account,@alexcooldev,X,https://x.com/alexcooldev,Dev tools indie hacking,HIGH,Daily,,Developer-focused products.,TRUE,INDIE_BUILDING,HIGH_SIGNAL_SOURCES.csv,,,,,,,,,,
signal_source,SRC041,Twitter Account,@pipelineabuser,X,https://x.com/pipelineabuser,Cold email outbound mastery,HIGHEST,Daily,,Best cold email tactics. High signal. Deliverability focused.,TRUE,COLD_EMAIL,HIGH_SIGNAL_SOURCES.csv,,,,,,,,,,
signal_source,SRC042,Twitter Account,@seanb2b,X,https://x.com/seanb2b,B2B sales outbound,HIGH,Daily,,B2B specific sales tactics.,TRUE,COLD_EMAIL,HIGH_SIGNAL_SOURCES.csv,,,,,,,,,,
signal_source,SRC043,Twitter Account,@WorkflowWhisper,X,https://x.com/WorkflowWhisper,Automation workflows,HIGH,Daily,,n8n and automation tactics.,TRUE,AUTOMATION,HIGH_SIGNAL_SOURCES.csv,,,,,,,,,,
signal_source,SRC044,Twitter Account,@joelhooks,X,https://x.com/joelhooks,Info products education,HIGH,Weekly,,Course and info product strategies.,TRUE,INFO_PRODUCTS,HIGH_SIGNAL_SOURCES.csv,,,,,,,,,,
signal_source,SRC045,Twitter Account,@wannercashcow,X,https://x.com/wannercashcow,Cash flow business tactics,HIGH,Daily,,Quick revenue strategies.,TRUE,INDIE_BUILDING,HIGH_SIGNAL_SOURCES.csv,,,,,,,,,,
signal_source,SRC046,Twitter Account,@mattwelter,X,https://x.com/mattwelter,Marketing growth hacks,HIGH,Daily,,Paid and organic growth.,TRUE,GROWTH_HACKS,HIGH_SIGNAL_SOURCES.csv,,,,,,,,,,
signal_source,SRC047,Twitter Account,@Jahjiren,X,https://x.com/Jahjiren,Content marketing tactics,HIGH,Daily,,Content repurposing strategies.,TRUE,CONTENT_CREATION,HIGH_SIGNAL_SOURCES.csv,,,,,,,,,,
signal_source,SRC048,Twitter Account,@purpdevvv,X,https://x.com/purpdevvv,App dev indie strategies,HIGHEST,Daily,,Mobile app winning formulas. Niche adaptation tactics.,TRUE,IOS_APPS,HIGH_SIGNAL_SOURCES.csv,,,,,,,,,,
signal_source,SRC049,Tool,IdeaBrowser,Web,https://ideabrowser.com,Community signals startup ideas,HIGHEST,Daily,,Greg Isenberg tool. Scans Reddit/FB for validated problems.,TRUE,INDIE_BUILDING,HIGH_SIGNAL_SOURCES.csv,,,,,,,,,,
signal_source,SRC050,Company,Cluely,Web,https://cluely.com,AI marketing compliance edge,HIGH,Weekly,,VC-backed. Rides FTC compliance line well. Study their tactics.,TRUE,AI_TOOLS,HIGH_SIGNAL_SOURCES.csv,,,,,,,,,,
signal_source,SRC051,Subreddit,r/AppBusiness,Reddit,https://reddit.com/r/AppBusiness,Mobile app monetization,HIGH,Daily,,App revenue strategies and tactics.,TRUE,IOS_APPS,HIGH_SIGNAL_SOURCES.csv,,,,,,,,,,
signal_source,SRC052,Subreddit,r/growthhacking,Reddit,https://reddit.com/r/growthhacking,Alternative growth tactics,HIGH,Daily,,Non-mainstream growth hacks.,TRUE,GROWTH_HACKS,HIGH_SIGNAL_SOURCES.csv,,,,,,,,,,
signal_source,SRC053,Subreddit,r/affiliatemarketing,Reddit,https://reddit.com/r/affiliatemarketing,Affiliate marketing tactics,HIGH,Daily,,Info affiliate research methods.,TRUE,SEO_ASO,HIGH_SIGNAL_SOURCES.csv,,,,,,,,,,
signal_source,SRC054,Twitter Account,@Hightrafficsite,X,https://x.com/Hightrafficsite,SEO traffic growth tactics,HIGHEST,Daily,,High-traffic site building. SEO arbitrage. Content repurposing.,TRUE,CONTENT_CREATION,HIGH_SIGNAL_SOURCES.csv,,,,,,,,,,
signal_source,SRC055,Twitter Account,@iamgdsa,X,https://x.com/iamgdsa,Creator marketing app virality,HIGHEST,Daily,,Runs FindMeCreators + Shortimize. Micro-influencer alpha. Tool discovery.,TRUE,GROWTH_HACKS,HIGH_SIGNAL_SOURCES.csv,,,,,,,,,,
signal_source,SRC056,Twitter Account,@jasoncfox,X,https://x.com/jasoncfox,Marketing funnels growth hacks,HIGHEST,Daily,,Agency-level tactics. Good for content repurposing ideas.,TRUE,GROWTH_HACKS,HIGH_SIGNAL_SOURCES.csv,,,,,,,,,,
signal_source,SRC057,Twitter Account,@codyschneiderxx,X,https://x.com/codyschneiderxx,SaaS growth paid ads LinkedIn hacks,HIGHEST,Daily,,Real tactics. Sorority BDR hack. Paid ads for SaaS. Raw execution.,TRUE,COLD_EMAIL,HIGH_SIGNAL_SOURCES.csv,,,,,,,,,,
signal_source,SRC058,Twitter Account,@maverickecom,X,https://x.com/maverickecom,TikTok Shop AI UGC,HIGHEST,Daily,,Noah Frydberg. Nano Banana + Kling workflow. AI video factory.,TRUE,CONTENT_CREATION,HIGH_SIGNAL_SOURCES.csv,,,,,,,,,,
signal_source,SRC059,Twitter Account,@Jonnyvandel,X,https://x.com/Jonnyvandel,Mass content automation,HIGH,Daily,,Dark funnel tactics. 200 accounts 600 posts/day methods.,TRUE,GROWTH_HACKS,HIGH_SIGNAL_SOURCES.csv,,,,,,,,,,
signal_source,SRC060,Twitter Account,@AntonioEscudero,X,https://x.com/AntonioEscudero,No-code SaaS vibe coding,HIGH,Daily,,Built SaaS in 4 days. Gemini Flash stack. Good for APP_FACTORY.,TRUE,VIBE_CODING,HIGH_SIGNAL_SOURCES.csv,,,,,,,,,,
signal_source,SRC061,Twitter Account,@paoloanzn,X,https://x.com/paoloanzn,App idea mining vibe coding,HIGH,Daily,,Old forum app idea method. Creative research tactics.,TRUE,VIBE_CODING,HIGH_SIGNAL_SOURCES.csv,,,,,,,,,,
signal_source,SRC062,Twitter Account,@yegormethod,X,https://x.com/yegormethod,Sales psychology closing,HIGH,Daily,,Fear-based closing. Live contract editing. Agency tactics.,TRUE,GROWTH_HACKS,HIGH_SIGNAL_SOURCES.csv,,,,,,,,,,
signal_source,SRC063,Twitter Account,@PrajwalTomar_,X,https://x.com/PrajwalTomar_,AI app building marketing,HIGH,Daily,,AI wave riding. App builder + AI influencer combo strategy.,TRUE,AI_TOOLS,HIGH_SIGNAL_SOURCES.csv,,,,,,,,,,
signal_source,SRC064,Twitter Account,@KCodes7777,X,https://x.com/KCodes7777,Vibe coding app ideas,HIGH,Daily,,Penelope Lopez. Viral app concepts. Rork app builder user.,TRUE,MEME_VIRAL,HIGH_SIGNAL_SOURCES.csv,,,,,,,,,,
signal_source,SRC065,Twitter Account,@thegarrettscott,X,https://x.com/thegarrettscott,AI agents autonomous systems,HIGH,Weekly,,@doanythingapp. Independent agent vision. Future-oriented.,TRUE,AI_TOOLS,HIGH_SIGNAL_SOURCES.csv,,,,,,,,,,
signal_source,SRC066,Twitter Account,@rileybrown,X,https://x.com/rileybrown,AI products content curation,HIGH,Daily,,AI content curator concept. Investment-grade ideas.,TRUE,FINANCE_TRADING,HIGH_SIGNAL_SOURCES.csv,,,,,,,,,,
signal_source,SRC067,Twitter Account,@zephyr_z9,X,https://x.com/zephyr_z9,Solopreneur tactics growth hacks,HIGH,Daily,,New high-signal source. Analyze for alpha extraction.,TRUE,SEO_ASO,HIGH_SIGNAL_SOURCES.csv,,,,,,,,,,
signal_source,SRC068,Twitter Account,@lilyraynyc,X,https://x.com/lilyraynyc,SEO Google updates E-E-A-T,HIGHEST,Daily,,Lily Ray. Senior SEO director. Google algorithm expert. E-E-A-T specialist.,TRUE,SEO_ASO,HIGH_SIGNAL_SOURCES.csv,,,,,,,,,,
signal_source,SRC069,Twitter Account,@aleyda,X,https://x.com/aleyda,Technical SEO international,HIGH,Weekly,,Aleyda Solis. International SEO consultant. Technical depth.,TRUE,SEO_ASO,HIGH_SIGNAL_SOURCES.csv,,,,,,,,,,
signal_source,SRC070,Twitter Account,@JohnMu,X,https://x.com/JohnMu,Google Search official,HIGHEST,Daily,,John Mueller. Google Search Relations. Official algorithm info.,TRUE,SEO_ASO,HIGH_SIGNAL_SOURCES.csv,,,,,,,,,,
signal_source,SRC071,Twitter Account,@iPullRank,X,https://x.com/iPullRank,Advanced SEO strategies,HIGH,Weekly,,Mike King. Enterprise SEO. Advanced tactics.,TRUE,SEO_ASO,HIGH_SIGNAL_SOURCES.csv,,,,,,,,,,
signal_source,SRC072,Twitter Account,@randfish,X,https://x.com/randfish,Audience research SparkToro,HIGH,Weekly,,Rand Fishkin. SparkToro. Audience intelligence.,TRUE,SEO_ASO,HIGH_SIGNAL_SOURCES.csv,,,,,,,,,,
signal_source,SRC073,Twitter Account,@paborns,X,https://x.com/paborns,ASO App Store Optimization,HIGHEST,Daily,,Patrick Borns. ASO expert. App store ranking tactics.,TRUE,IOS_APPS,HIGH_SIGNAL_SOURCES.csv,,,,,,,,,,
signal_source,SRC074,Twitter Account,@thomasbcn,X,https://x.com/thomasbcn,Mobile growth ASO,HIGH,Weekly,,Thomas Petit. Mobile growth. ASO strategies.,TRUE,IOS_APPS,HIGH_SIGNAL_SOURCES.csv,,,,,,,,,,
signal_source,SRC075,Twitter Account,@gaborcselle,X,https://x.com/gaborcselle,AI search GEO,HIGH,Daily,,Gabor Cselle. AI search expert. GEO pioneer.,TRUE,SEO_ASO,HIGH_SIGNAL_SOURCES.csv,,,,,,,,,,
signal_source,SRC076,Subreddit,r/SEO,Reddit,https://reddit.com/r/SEO,SEO discussion tactics,HIGH,Daily,,General SEO subreddit. Algorithm updates community discussion.,TRUE,SEO_ASO,HIGH_SIGNAL_SOURCES.csv,,,,,,,,,,
signal_source,SRC077,Subreddit,r/bigseo,Reddit,https://reddit.com/r/bigseo,Advanced SEO,HIGH,Weekly,,Professional SEO subreddit. Enterprise tactics.,TRUE,SEO_ASO,HIGH_SIGNAL_SOURCES.csv,,,,,,,,,,
signal_source,SRC078,Subreddit,r/AppBusiness,Reddit,https://reddit.com/r/AppBusiness,ASO mobile app business,HIGH,Daily,,App Store Optimization. Mobile monetization discussion.,TRUE,IOS_APPS,HIGH_SIGNAL_SOURCES.csv,,,,,,,,,,
signal_source,SRC079,Tool,AppTweak Blog,Web,https://www.apptweak.com/blog,ASO research data,HIGH,Weekly,,ASO tool blog. Data-backed app store insights.,TRUE,IOS_APPS,HIGH_SIGNAL_SOURCES.csv,,,,,,,,,,
signal_source,SRC080,Tool,Ahrefs Blog,Web,https://ahrefs.com/blog,SEO research studies,HIGHEST,Weekly,,SEO tool blog. Data-driven SEO research.,TRUE,SEO_ASO,HIGH_SIGNAL_SOURCES.csv,,,,,,,,,,
signal_source,SRC081,Tool,Search Engine Journal,Web,https://searchenginejournal.com,SEO news updates,HIGH,Daily,,Daily SEO news. Algorithm updates. Industry trends.,TRUE,SEO_ASO,HIGH_SIGNAL_SOURCES.csv,,,,,,,,,,
signal_source,SRC082,Twitter Account,@wesocialgrowth,X,https://x.com/wesocialgrowth,Social growth viral content,HIGHEST,Daily,,Viral content formats. App marketing hooks. High engagement analysis.,TRUE,GROWTH_HACKS,HIGH_SIGNAL_SOURCES.csv,,,,,,,,,,
signal_source,SRC083,Twitter Account,@startupideaspod,X,https://x.com/startupideaspod,Startup ideas validation,HIGH,Daily,,Startup idea generation. Market validation.,TRUE,INDIE_BUILDING,HIGH_SIGNAL_SOURCES.csv,,,,,,,,,,
signal_source,SRC084,Twitter Account,@LocalBateman,X,https://x.com/LocalBateman,Meme content viral clips,HIGH,Daily,,Meme source for repurposing. Quote tweet potential.,TRUE,CONTENT_CREATION,HIGH_SIGNAL_SOURCES.csv,,,,,,,,,,
signal_source,SRC085,Twitter Account,@ShitpostReels,X,https://x.com/ShitpostReels,Viral reels memes,HIGH,Daily,,Meme compilation source. Repurpose/quote tweet.,TRUE,CONTENT_CREATION,HIGH_SIGNAL_SOURCES.csv,,,,,,,,,,
signal_source,SRC086,Twitter Account,@videosinfolder,X,https://x.com/videosinfolder,Viral video clips,HIGH,Daily,,Video content source. Scrape and repurpose.,TRUE,CONTENT_CREATION,HIGH_SIGNAL_SOURCES.csv,,,,,,,,,,
signal_source,SRC087,Twitter Account,@TheShamdoo,X,https://x.com/TheShamdoo,Roblox vibe coding AI,HIGH,Weekly,,Roblox + AI development. Vibe coding games.,TRUE,ROBLOX_GAMING,HIGH_SIGNAL_SOURCES.csv,,,,,,,,,,
signal_source,SRC088,Twitter Account,@kswint,X,https://x.com/kswint,Roblox MCP server dev,HIGH,Weekly,,Roblox Studio MCP. Claude + Roblox integration.,TRUE,ROBLOX_GAMING,HIGH_SIGNAL_SOURCES.csv,,,,,,,,,,
signal_source,SRC089,GitHub Repo,roblox-studio-rust-mcp-server,GitHub,https://github.com/kevinswint/roblox-studio-rust-mcp-server,Roblox AI development,HIGH,Weekly,,MCP server for Roblox Studio. Vibe coding games.,TRUE,ROBLOX_GAMING,HIGH_SIGNAL_SOURCES.csv,,,,,,,,,,
signal_source,SRC090,GitHub Repo,x-algorithm,GitHub,https://github.com/xai-org/x-algorithm,X algorithm For You feed,HIGHEST,Monthly,,Open-sourced X/Twitter algorithm. Use for post optimization.,TRUE,GROWTH_HACKS,HIGH_SIGNAL_SOURCES.csv,,,,,,,,,,
signal_source,SRC091,Twitter Account,@cjzafir,X,https://x.com/cjzafir,Claude Code workflows X optimization,HIGH,Daily,,Built X verifier suite with Claude. Copilot builder.,TRUE,VIBE_CODING,HIGH_SIGNAL_SOURCES.csv,,,,,,,,,,
signal_source,SRC092,Twitter Account,@weswinder,X,https://x.com/weswinder,Vibe coding MVP building,HIGH,Daily,,#1 vibe coding community. Building mvp.new and thumbnailmaker.ai.,TRUE,VIBE_CODING,HIGH_SIGNAL_SOURCES.csv,,,,,,,,,,
signal_source,SRC093,Twitter Account,@InternetH0F,X,https://x.com/InternetH0F,Viral memes content,HIGH,Daily,,Meme source for repurposing. Quote tweet material.,TRUE,MEME_VIRAL,HIGH_SIGNAL_SOURCES.csv,,,,,,,,,,
signal_source,SRC094,Twitter Account,@venturetwins,X,https://x.com/venturetwins,VC insights AI NSFW legal,HIGHEST,Weekly,,Top VC. AI NSFW legal/compliance insights. Check threads not just parent posts.,TRUE,AI_TOOLS,HIGH_SIGNAL_SOURCES.csv,,,,,,,,,,
signal_source,SRC095,Twitter Account,@damianplayer,X,https://x.com/damianplayer,LLM workflows agent loops,HIGH,Daily,,Agent loop optimization. Ralph-style workflows.,TRUE,VIBE_CODING,HIGH_SIGNAL_SOURCES.csv,,,,,,,,,,
signal_source,SRC096,Twitter Account,@whotfiszackk,X,https://x.com/whotfiszackk,Info products AI scaling,HIGHEST,Daily,,12-venture portfolio framework. 90-day launch system. Info product alpha.,TRUE,AUTOMATION,HIGH_SIGNAL_SOURCES.csv,,,,,,,,,,
signal_source,SRC097,Twitter Account,@zerohedge,X,https://x.com/zerohedge,Macro news market signals,HIGH,Hourly,,Breaking macro news. Good for trading signals but filter noise.,TRUE,FINANCE_TRADING,HIGH_SIGNAL_SOURCES.csv,,,,,,,,,,
signal_source,SRC098,Twitter Account,@unusual_whales,X,https://x.com/unusual_whales,Options flow unusual activity,HIGHEST,Real-time,,Best options flow signal. Whale tracking for stocks.,TRUE,FINANCE_TRADING,HIGH_SIGNAL_SOURCES.csv,,,,,,,,,,
signal_source,SRC099,Twitter Account,@DeItaone,X,https://x.com/DeItaone,Market news breaking alerts,HIGHEST,Real-time,,Fastest breaking news for trading. Must follow for signals.,TRUE,FINANCE_TRADING,HIGH_SIGNAL_SOURCES.csv,,,,,,,,,,
signal_source,SRC100,Twitter Account,@WatcherGuru,X,https://x.com/WatcherGuru,Crypto news whale alerts,HIGHEST,Real-time,,Breaking crypto news. Whale movement alerts.,TRUE,FINANCE_TRADING,HIGH_SIGNAL_SOURCES.csv,,,,,,,,,,
signal_source,SRC101,Twitter Account,@lookonchain,X,https://x.com/lookonchain,On-chain analytics whales,HIGHEST,Daily,,Best on-chain whale tracking. Specific wallet analysis.,TRUE,FINANCE_TRADING,HIGH_SIGNAL_SOURCES.csv,,,,,,,,,,
signal_source,SRC102,Twitter Account,@whale_alert,X,https://x.com/whale_alert,Crypto whale transactions,HIGH,Real-time,,Large crypto transfers. Exchange flow alerts.,TRUE,FINANCE_TRADING,HIGH_SIGNAL_SOURCES.csv,,,,,,,,,,
signal_source,SRC103,Twitter Account,@santaboris,X,https://x.com/santaboris,Crypto macro analysis,HIGH,Daily,,Good for crypto market structure analysis.,TRUE,FINANCE_TRADING,HIGH_SIGNAL_SOURCES.csv,,,,,,,,,,
signal_source,SRC104,Twitter Account,@CoinGlass_com,X,https://x.com/CoinGlass_com,Liquidation data funding,HIGH,Real-time,,Liquidation cascade alerts. Funding rate data.,TRUE,FINANCE_TRADING,HIGH_SIGNAL_SOURCES.csv,,,,,,,,,,
signal_source,SRC105,Twitter Account,@GlassNode,X,https://x.com/GlassNode,On-chain metrics HODL data,HIGHEST,Daily,,Best on-chain data source. HODL waves exchange flows.,TRUE,FINANCE_TRADING,HIGH_SIGNAL_SOURCES.csv,,,,,,,,,,
signal_source,SRC106,Twitter Account,@IntoTheBlock,X,https://x.com/IntoTheBlock,On-chain indicators ML,HIGH,Daily,,Machine learning on-chain analysis.,TRUE,AI_TOOLS,HIGH_SIGNAL_SOURCES.csv,,,,,,,,,,
signal_source,SRC107,Twitter Account,@CryptoQuant_,X,https://x.com/CryptoQuant_,Exchange flow stablecoin,HIGH,Daily,,Exchange flow analysis. Stablecoin supply.,TRUE,FINANCE_TRADING,HIGH_SIGNAL_SOURCES.csv,,,,,,,,,,
signal_source,SRC108,Twitter Account,@10x_Research,X,https://x.com/10x_Research,Crypto institutional analysis,HIGHEST,Weekly,,Premium crypto research. Institutional flow.,TRUE,FINANCE_TRADING,HIGH_SIGNAL_SOURCES.csv,,,,,,,,,,
signal_source,SRC109,Twitter Account,@CryptoDiffer,X,https://x.com/CryptoDiffer,Crypto comparison metrics,HIGH,Daily,,Token comparison data. Market cap changes.,TRUE,FINANCE_TRADING,HIGH_SIGNAL_SOURCES.csv,,,,,,,,,,
signal_source,SRC110,Twitter Account,@TokenUnlocks,X,https://x.com/TokenUnlocks,Token unlock calendar,HIGHEST,Weekly,,Token unlock schedule. Supply shock calendar.,TRUE,FINANCE_TRADING,HIGH_SIGNAL_SOURCES.csv,,,,,,,,,,
signal_source,SRC111,Twitter Account,@arkaborns,X,https://x.com/arkaborns,Arkham intel on-chain,HIGHEST,Daily,,Arkham Intelligence founder. Smart money tracking.,TRUE,FINANCE_TRADING,HIGH_SIGNAL_SOURCES.csv,,,,,,,,,,
signal_source,SRC112,Twitter Account,@tier10k,X,https://x.com/tier10k,Market breaking news,HIGH,Real-time,,Fast breaking news. Market moving events.,TRUE,FINANCE_TRADING,HIGH_SIGNAL_SOURCES.csv,,,,,,,,,,
signal_source,SRC113,Twitter Account,@financialjuice,X,https://x.com/financialjuice,FOMC Fed economic,HIGH,Real-time,,Fed commentary. Economic data releases.,TRUE,FINANCE_TRADING,HIGH_SIGNAL_SOURCES.csv,,,,,,,,,,
signal_source,SRC114,Twitter Account,@zephyr_z9,X,https://x.com/zephyr_z9,Semiconductor tech analysis,HIGHEST,Daily,,Deep semiconductor industry analysis. Tech supply chain.,TRUE,AI_TOOLS,HIGH_SIGNAL_SOURCES.csv,,,,,,,,,,
signal_source,SRC115,Twitter Account,@stockMKTnewz,X,https://x.com/stockMKTnewz,Stock market headlines,HIGH,Real-time,,Breaking stock market news aggregation.,TRUE,FINANCE_TRADING,HIGH_SIGNAL_SOURCES.csv,,,,,,,,,,
signal_source,SRC116,Twitter Account,@OptionsAction,X,https://x.com/OptionsAction,Options flow CNBC,HIGH,Daily,,CNBC options show. Unusual options activity.,TRUE,FINANCE_TRADING,HIGH_SIGNAL_SOURCES.csv,,,,,,,,,,
signal_source,SRC117,Forum,BlackHatWorld,Web,https://blackhatworld.com,Grey hat marketing automation accounts,HIGHEST,Daily,,Best forum for legal grey hat tactics. Account warming proxies automation. Despite name mostly legal tactics.,TRUE,GROWTH_HACKS,HIGH_SIGNAL_SOURCES.csv,,,,,,,,,,
signal_source,SRC118,Subreddit,r/TwitchClippers,Reddit,https://reddit.com/r/TwitchClippers,Clipper community streamer deals,HIGH,Daily,,Find clipping opportunities. Streamer outreach tactics.,TRUE,CONTENT_CREATION,HIGH_SIGNAL_SOURCES.csv,,,,,,,,,,
signal_source,SRC119,Subreddit,r/YouTubeClippers,Reddit,https://reddit.com/r/YouTubeClippers,YouTube clipper community,HIGH,Daily,,Clipper community. Paid gigs and best practices.,TRUE,CONTENT_CREATION,HIGH_SIGNAL_SOURCES.csv,,,,,,,,,,
signal_source,SRC120,Website,VontenRewards,Web,https://vontenrewards.gg,MrBeast clipper network rewards,HIGHEST,Weekly,,Official MrBeast/Beast Philanthropy clipper reward program. Pay per view clipper system.,TRUE,CONTENT_CREATION,HIGH_SIGNAL_SOURCES.csv,,,,,,,,,,
