record_type,source_id,source_type,source_name,platform,url,focus_area,signal_quality,update_frequency,last_checked,notes,auto_monitor,scrape_category,source_file,Niche,Platform,Handle,Email,ProxyUsed,GoLoginProfile,Status,CreatedDate,LastActive,Notes
signal_source,SRC121,Website,Clipping For,Web,https://clippingfor.com,Streamer clipper marketplace,HIGH,Weekly,,Marketplace connecting clippers with streamers. Direct deals.,TRUE,CONTENT_CREATION,HIGH_SIGNAL_SOURCES.csv,,,,,,,,,,
signal_source,SRC122,Tool,Opus Clip,Web,https://opus.pro,AI clip extraction tool,HIGH,Weekly,,Auto-generates clips from long videos. AI highlight detection.,TRUE,CONTENT_CREATION,HIGH_SIGNAL_SOURCES.csv,,,,,,,,,,
signal_source,SRC123,Tool,Vizard,Web,https://vizard.ai,AI video repurposing clips,HIGH,Weekly,,AI clip maker. Auto-captions and formatting.,TRUE,CONTENT_CREATION,HIGH_SIGNAL_SOURCES.csv,,,,,,,,,,
signal_source,SRC124,Service,InMailers,Web,https://inmailers.co,LinkedIn InMail automation service,HIGH,Weekly,,LinkedIn InMail sending service. Outsourced outbound.,FALSE,COLD_EMAIL,HIGH_SIGNAL_SOURCES.csv,,,,,,,,,,
signal_source,SRC125,Service,Expandi,Web,https://expandi.io,LinkedIn automation safe,HIGH,Weekly,,Safest LinkedIn automation. Cloud-based anti-detection.,FALSE,AUTOMATION,HIGH_SIGNAL_SOURCES.csv,,,,,,,,,,
signal_source,SRC126,Service,Dripify,Web,https://dripify.io,LinkedIn drip campaigns,HIGH,Weekly,,LinkedIn automation. Sequence building.,FALSE,AUTOMATION,HIGH_SIGNAL_SOURCES.csv,,,,,,,,,,
signal_source,SRC127,Service,DeliverOn,Web,https://deliveron.org,Pre-warmed email inboxes,HIGHEST,Weekly,,Skip DIY warmup. Pre-built warm inbox infrastructure. $49/mo.,TRUE,COLD_EMAIL,HIGH_SIGNAL_SOURCES.csv,,,,,,,,,,
signal_source,SRC128,Service,MailForge,Web,https://mailforge.ai,Bulk warm inboxes cheap,HIGH,Weekly,,$3/inbox bulk warmup. Scale cold email infrastructure.,TRUE,COLD_EMAIL,HIGH_SIGNAL_SOURCES.csv,,,,,,,,,,
signal_source,SRC129,Subreddit,r/Emailmarketing,Reddit,https://reddit.com/r/Emailmarketing,Email deliverability warmup,HIGH,Daily,,Deliverability tactics. Warmup best practices.,TRUE,COLD_EMAIL,HIGH_SIGNAL_SOURCES.csv,,,,,,,,,,
signal_source,SRC130,Subreddit,r/SocialMediaMarketing,Reddit,https://reddit.com/r/socialmediamarketing,Account growth warmup tactics,HIGH,Daily,,Platform-specific growth. Account safety discussions.,TRUE,GROWTH_HACKS,HIGH_SIGNAL_SOURCES.csv,,,,,,,,,,
signal_source,SRC131,Forum,GrowthHackers,Web,https://growthhackers.com,Growth hacking community,HIGH,Weekly,,Growth experiments and tactics. Account scaling strategies.,TRUE,GROWTH_HACKS,HIGH_SIGNAL_SOURCES.csv,,,,,,,,,,
signal_source,SRC132,Discord,Creator Clips Community,Discord,,Clipper network deals,HIGH,Daily,,Search 'clipper community' or 'streamer clips' in Discord servers.,TRUE,CONTENT_CREATION,HIGH_SIGNAL_SOURCES.csv,,,,,,,,,,
signal_source,SRC133,Twitter Account,@streamertips,X,https://x.com/streamertips,Streamer marketing clipping,HIGH,Daily,,Tips for streamers. Clipping opportunities.,TRUE,CONTENT_CREATION,HIGH_SIGNAL_SOURCES.csv,,,,,,,,,,
signal_source,SRC134,Twitter Account,@ClipItApp,X,https://x.com/ClipItApp,Twitch clipping platform,HIGH,Weekly,,Clipping platform. Discover trending clips.,TRUE,CONTENT_CREATION,HIGH_SIGNAL_SOURCES.csv,,,,,,,,,,
signal_source,SRC135,Subreddit,r/passive_income,Reddit,https://reddit.com/r/passive_income,Passive income automation ideas,HIGH,Daily,,Automation tactics. Content farm ideas.,TRUE,INDIE_BUILDING,HIGH_SIGNAL_SOURCES.csv,,,,,,,,,,
signal_source,SRC136,Subreddit,r/Affiliatemarketing,Reddit,https://reddit.com/r/Affiliatemarketing,Affiliate marketing tactics,HIGH,Daily,,Affiliate program discoveries. Commission strategies.,TRUE,SEO_ASO,HIGH_SIGNAL_SOURCES.csv,,,,,,,,,,
signal_source,SRC137,Twitter Community,Cold Email Pros,X,https://x.com/i/communities/1234567890,Cold email deliverability,HIGH,Daily,,Twitter community for cold email. Filter spam - look for numbers and specifics.,TRUE,COLD_EMAIL,HIGH_SIGNAL_SOURCES.csv,,,,,,,,,,
signal_source,SRC138,Twitter Community,Indie Hackers,X,https://x.com/i/communities/1234567891,Indie hacking launches,HIGH,Daily,,Indie hacker Twitter community. Real launches and tactics.,TRUE,INDIE_BUILDING,HIGH_SIGNAL_SOURCES.csv,,,,,,,,,,
signal_source,SRC139,Twitter Community,Automation & AI,X,https://x.com/i/communities/1234567892,AI automation workflows,HIGH,Daily,,Automation tactics community. Filter for actionable content.,TRUE,AUTOMATION,HIGH_SIGNAL_SOURCES.csv,,,,,,,,,,
signal_source,SRC140,Forum Section,BHW - Email Marketing,Web,https://blackhatworld.com/forums/email-marketing.39/,Email warmup deliverability,HIGH,Daily,,BHW email section. Best for what stopped working warnings. Filter: look for recent posts with metrics.,TRUE,COLD_EMAIL,HIGH_SIGNAL_SOURCES.csv,,,,,,,,,,
signal_source,SRC141,Forum Section,BHW - Social Media,Web,https://blackhatworld.com/forums/social-media.192/,Account warming automation,HIGH,Daily,,BHW social section. Platform changes and ban patterns. Filter: verified methods with screenshots.,TRUE,GROWTH_HACKS,HIGH_SIGNAL_SOURCES.csv,,,,,,,,,,
signal_source,SRC142,Forum Section,BHW - Making Money,Web,https://blackhatworld.com/forums/making-money.30/,Revenue tactics automation,MEDIUM,Weekly,,BHW money section. More noise here. Filter: posts with proof. Ignore get-rich-quick.,TRUE,GROWTH_HACKS,HIGH_SIGNAL_SOURCES.csv,,,,,,,,,,
signal_source,SRC143,Internal Doc,Edge Growth Tactics,Internal,OPS/EDGE_GROWTH_TACTICS.md,Platform limits automation services what's working,HIGHEST,Weekly,,REQUIRES WEEKLY UPDATE. Audit BHW Reddit Twitter for changes to limits and tactics.,TRUE,GROWTH_HACKS,HIGH_SIGNAL_SOURCES.csv,,,,,,,,,,
signal_source,SRC144,Twitter Account,@Argona0x,X,https://x.com/Argona0x,Polymarket alpha and vibe coding strategies - $3.9M trader case study,HIGHEST,Daily,,REAL ALPHA. $3.9M Polymarket vibe coder. Prediction market strategies. Claude Code automation. 9.3K followers. Pinned: programmers making $10k-200k monthly on polymarket.,TRUE,FINANCE_TRADING,HIGH_SIGNAL_SOURCES.csv,,,,,,,,,,
signal_source,SRC145,Twitter Account,@DataChaz,X,https://x.com/DataChaz,YCombinator vibe coding guide sharer - Charly Wargnier,HIGH,Weekly,,Shared YC vibe coding guide (173K views 2.5K likes). Data science and AI tooling focus.,TRUE,AI_TOOLS,HIGH_SIGNAL_SOURCES.csv,,,,,,,,,,
signal_source,SRC146,Subreddit,r/InternetIsBeautiful,Reddit,https://reddit.com/r/InternetIsBeautiful,Cool websites apps,HIGH,Daily,,17M members. Self-promotion allowed.,TRUE,INDIE_BUILDING,HIGH_SIGNAL_SOURCES.csv,,,,,,,,,,
signal_source,SRC147,Subreddit,r/Entrepreneur,Reddit,https://reddit.com/r/Entrepreneur,Business startup tactics,HIGHEST,Daily,,4.8M members. Self-promotion allowed. Value-first.,TRUE,INDIE_BUILDING,HIGH_SIGNAL_SOURCES.csv,,,,,,,,,,
signal_source,SRC148,Subreddit,r/productivity,Reddit,https://reddit.com/r/productivity,Productivity tools apps,HIGH,Daily,,4M members. Pain points for app ideas.,TRUE,IOS_APPS,HIGH_SIGNAL_SOURCES.csv,,,,,,,,,,
signal_source,SRC149,Subreddit,r/business,Reddit,https://reddit.com/r/business,Business trends,MEDIUM,Daily,,2.5M members.,FALSE,INDIE_BUILDING,HIGH_SIGNAL_SOURCES.csv,,,,,,,,,,
signal_source,SRC150,Subreddit,r/smallbusiness,Reddit,https://reddit.com/r/smallbusiness,SMB tactics tools,HIGH,Daily,,2.2M members. Self-promotion allowed.,TRUE,INDIE_BUILDING,HIGH_SIGNAL_SOURCES.csv,,,,,,,,,,
signal_source,SRC151,Subreddit,r/startups,Reddit,https://reddit.com/r/startups,Startup ideas validation,HIGHEST,Daily,,2M members. High-quality discussions.,TRUE,INDIE_BUILDING,HIGH_SIGNAL_SOURCES.csv,,,,,,,,,,
signal_source,SRC152,Subreddit,r/passive_income,Reddit,https://reddit.com/r/passive_income,Income methods,HIGH,Daily,,1M members. Money method intel.,TRUE,INDIE_BUILDING,HIGH_SIGNAL_SOURCES.csv,,,,,,,,,,
signal_source,SRC153,Subreddit,r/EntrepreneurRideAlong,Reddit,https://reddit.com/r/EntrepreneurRideAlong,Journey case studies,HIGHEST,Daily,,593K members. Self-promotion allowed. Real builds.,TRUE,INDIE_BUILDING,HIGH_SIGNAL_SOURCES.csv,,,,,,,,,,
signal_source,SRC154,Subreddit,r/SideProject,Reddit,https://reddit.com/r/SideProject,Indie projects launches,HIGHEST,Daily,,430K members. Self-promotion allowed. Perfect for launches.,TRUE,INDIE_BUILDING,HIGH_SIGNAL_SOURCES.csv,,,,,,,,,,
signal_source,SRC155,Subreddit,r/Business_Ideas,Reddit,https://reddit.com/r/Business_Ideas,Idea validation,MEDIUM,Daily,,359K members. Validation opportunities.,FALSE,INDIE_BUILDING,HIGH_SIGNAL_SOURCES.csv,,,,,,,,,,
signal_source,SRC156,Subreddit,r/SaaS,Reddit,https://reddit.com/r/SaaS,SaaS tactics growth,HIGHEST,Daily,,341K members. Self-promotion allowed. High-quality.,TRUE,INDIE_BUILDING,HIGH_SIGNAL_SOURCES.csv,,,,,,,,,,
signal_source,SRC157,Subreddit,r/startup,Reddit,https://reddit.com/r/startup,Startup execution,HIGH,Daily,,267K members.,TRUE,INDIE_BUILDING,HIGH_SIGNAL_SOURCES.csv,,,,,,,,,,
signal_source,SRC158,Subreddit,r/Startup_Ideas,Reddit,https://reddit.com/r/Startup_Ideas,Idea generation,MEDIUM,Daily,,241K members. Pain point mining.,FALSE,INDIE_BUILDING,HIGH_SIGNAL_SOURCES.csv,,,,,,,,,,
signal_source,SRC159,Subreddit,r/thesidehustle,Reddit,https://reddit.com/r/thesidehustle,Side income methods,HIGH,Daily,,184K members. Self-promotion allowed.,TRUE,INDIE_BUILDING,HIGH_SIGNAL_SOURCES.csv,,,,,,,,,,
signal_source,SRC160,Subreddit,r/juststart,Reddit,https://reddit.com/r/juststart,Niche sites affiliate,HIGH,Weekly,,170K members. SEO + affiliate intel.,TRUE,SEO_ASO,HIGH_SIGNAL_SOURCES.csv,,,,,,,,,,
signal_source,SRC161,Subreddit,r/MicroSaas,Reddit,https://reddit.com/r/MicroSaas,Micro SaaS builds,HIGHEST,Daily,,155K members. Self-promotion allowed. Indie-friendly.,TRUE,INDIE_BUILDING,HIGH_SIGNAL_SOURCES.csv,,,,,,,,,,
signal_source,SRC162,Subreddit,r/ycombinator,Reddit,https://reddit.com/r/ycombinator,YC startup intel,HIGH,Daily,,132K members. High-quality discussions.,TRUE,INDIE_BUILDING,HIGH_SIGNAL_SOURCES.csv,,,,,,,,,,
signal_source,SRC163,Subreddit,r/Entrepreneurs,Reddit,https://reddit.com/r/Entrepreneurs,Entrepreneur tactics,MEDIUM,Daily,,110K members.,FALSE,INDIE_BUILDING,HIGH_SIGNAL_SOURCES.csv,,,,,,,,,,
signal_source,SRC164,Subreddit,r/indiehackers,Reddit,https://reddit.com/r/indiehackers,Indie hacker builds,HIGHEST,Daily,,91K members. Self-promotion allowed. Pure signal.,TRUE,INDIE_BUILDING,HIGH_SIGNAL_SOURCES.csv,,,,,,,,,,
signal_source,SRC165,Subreddit,r/GrowthHacking,Reddit,https://reddit.com/r/GrowthHacking,Growth tactics,HIGH,Daily,,77K members. Distribution intel.,TRUE,GROWTH_HACKS,HIGH_SIGNAL_SOURCES.csv,,,,,,,,,,
signal_source,SRC166,Subreddit,r/AppIdeas,Reddit,https://reddit.com/r/AppIdeas,App idea validation,MEDIUM,Daily,,74K members. Pain point mining.,FALSE,IOS_APPS,HIGH_SIGNAL_SOURCES.csv,,,,,,,,,,
signal_source,SRC167,Subreddit,r/growmybusiness,Reddit,https://reddit.com/r/growmybusiness,Growth strategies,MEDIUM,Weekly,,63K members.,FALSE,GROWTH_HACKS,HIGH_SIGNAL_SOURCES.csv,,,,,,,,,,
signal_source,SRC168,Subreddit,r/buildinpublic,Reddit,https://reddit.com/r/buildinpublic,Build in public,HIGH,Daily,,55K members. Launch opportunities.,TRUE,INDIE_BUILDING,HIGH_SIGNAL_SOURCES.csv,,,,,,,,,,
signal_source,SRC169,Subreddit,r/micro_saas,Reddit,https://reddit.com/r/micro_saas,Micro SaaS intel,HIGH,Daily,,52K members.,TRUE,INDIE_BUILDING,HIGH_SIGNAL_SOURCES.csv,,,,,,,,,,
signal_source,SRC170,Subreddit,r/Solopreneur,Reddit,https://reddit.com/r/Solopreneur,Solo business tactics,HIGH,Daily,,43K members.,TRUE,INDIE_BUILDING,HIGH_SIGNAL_SOURCES.csv,,,,,,,,,,
signal_source,SRC171,Subreddit,r/vibecoding,Reddit,https://reddit.com/r/vibecoding,No-code low-code,MEDIUM,Daily,,35K members. Tool opportunities.,FALSE,VIBE_CODING,HIGH_SIGNAL_SOURCES.csv,,,,,,,,,,
signal_source,SRC172,Subreddit,r/startup_resources,Reddit,https://reddit.com/r/startup_resources,Startup tools,MEDIUM,Weekly,,33K members.,FALSE,INDIE_BUILDING,HIGH_SIGNAL_SOURCES.csv,,,,,,,,,,
signal_source,SRC173,Subreddit,r/indiebiz,Reddit,https://reddit.com/r/indiebiz,Indie business,MEDIUM,Weekly,,29K members.,FALSE,INDIE_BUILDING,HIGH_SIGNAL_SOURCES.csv,,,,,,,,,,
signal_source,SRC174,Subreddit,r/AlphaandBetaUsers,Reddit,https://reddit.com/r/AlphaandBetaUsers,Beta testing users,HIGH,Daily,,21K members. Launch opportunity.,TRUE,INDIE_BUILDING,HIGH_SIGNAL_SOURCES.csv,,,,,,,,,,
signal_source,SRC175,Subreddit,r/scaleinpublic,Reddit,https://reddit.com/r/scaleinpublic,Scaling journeys,MEDIUM,Weekly,,11K members.,FALSE,INDIE_BUILDING,HIGH_SIGNAL_SOURCES.csv,,,,,,,,,,
signal_source,SRC176,Twitter Account,@karpathy,X,https://x.com/karpathy,LLMs AI research deep learning,HIGHEST,Daily,,LLMs king. Former Tesla AI director. OpenAI founding member. Pure technical signal.,TRUE,VIBE_CODING,HIGH_SIGNAL_SOURCES.csv,,,,,,,,,,
signal_source,SRC177,Twitter Account,@steipete,X,https://x.com/steipete,AI tools openclaw development,HIGHEST,Daily,,Built OpenClaw. iOS development veteran. AI tooling.,TRUE,VIBE_CODING,HIGH_SIGNAL_SOURCES.csv,,,,,,,,,,
signal_source,SRC178,Twitter Account,@corbin_braun,X,https://x.com/corbin_braun,Cursor AI coding vibe coding,HIGHEST,Daily,,Cursor king. AI-assisted development tactics.,TRUE,VIBE_CODING,HIGH_SIGNAL_SOURCES.csv,,,,,,,,,,
signal_source,SRC179,Twitter Account,@jackfriks,X,https://x.com/jackfriks,Solo apps indie development,HIGHEST,Daily,,Solo apps king. App monetization tactics.,TRUE,IOS_APPS,HIGH_SIGNAL_SOURCES.csv,,,,,,,,,,
signal_source,SRC180,Twitter Account,@EXM7777,X,https://x.com/EXM7777,AI ops systems automation,HIGHEST,Daily,,AI ops + systems king. Infrastructure tactics.,TRUE,AI_TOOLS,HIGH_SIGNAL_SOURCES.csv,,,,,,,,,,
signal_source,SRC181,Twitter Account,@eptwts,X,https://x.com/eptwts,AI money making twitter monetization,HIGHEST,Daily,,AI money twitter king. Anti-guru energy. Real tactics.,TRUE,INFO_PRODUCTS,HIGH_SIGNAL_SOURCES.csv,,,,,,,,,,
signal_source,SRC182,Twitter Account,@vasuman,X,https://x.com/vasuman,AI agents automation,HIGHEST,Daily,,AI agents king. Agent architecture tactics.,TRUE,AI_TOOLS,HIGH_SIGNAL_SOURCES.csv,,,,,,,,,,
signal_source,SRC183,Twitter Account,@AmirMushich,X,https://x.com/AmirMushich,AI ads performance marketing,HIGHEST,Daily,,AI ads king. AI-powered advertising tactics.,TRUE,AI_TOOLS,HIGH_SIGNAL_SOURCES.csv,,,,,,,,,,
signal_source,SRC184,Twitter Account,@0xROAS,X,https://x.com/0xROAS,AI UGC content creation,HIGHEST,Daily,,AI UGCs king. AI-generated content monetization.,TRUE,CONTENT_CREATION,HIGH_SIGNAL_SOURCES.csv,,,,,,,,,,
signal_source,SRC185,Twitter Account,@egeberkina,X,https://x.com/egeberkina,AI images generation art,HIGHEST,Daily,,AI images king. Image generation tactics.,TRUE,AI_TOOLS,HIGH_SIGNAL_SOURCES.csv,,,,,,,,,,
signal_source,SRC186,Twitter Account,@MengTo,X,https://x.com/MengTo,AI landing pages design,HIGHEST,Daily,,AI landing pages king. Design + conversion tactics.,TRUE,AI_TOOLS,HIGH_SIGNAL_SOURCES.csv,,,,,,,,,,
signal_source,SRC187,Twitter Account,@rryssf_,X,https://x.com/rryssf_,Automations workflows n8n,HIGHEST,Daily,,Automations king. Workflow automation tactics.,TRUE,AUTOMATION,HIGH_SIGNAL_SOURCES.csv,,,,,,,,,,
signal_source,SRC188,Twitter Account,@kloss_xyz,X,https://x.com/kloss_xyz,Systems architecture infrastructure,HIGHEST,Daily,,Systems architecture king. Scalable infrastructure.,TRUE,AUTOMATION,HIGH_SIGNAL_SOURCES.csv,,,,,,,,,,
signal_source,SRC189,Twitter Account,@emollick,X,https://x.com/emollick,AI science research academic,HIGHEST,Daily,,AI science king. Wharton professor. Research insights.,TRUE,AI_TOOLS,HIGH_SIGNAL_SOURCES.csv,,,,,,,,,,
signal_source,SRC190,Twitter Account,@Hesamation,X,https://x.com/Hesamation,AI ML machine learning,HIGHEST,Daily,,AI/ML king. Machine learning tactics.,TRUE,AI_TOOLS,HIGH_SIGNAL_SOURCES.csv,,,,,,,,,,
signal_source,SRC189,Twitter Account,@steipete,X,https://x.com/steipete,CLI workflows agentic coding OpenClaw,HIGHEST,Daily,,Make everything CLI + skill. Deep workflows. Study closely.,TRUE,VIBE_CODING,HIGH_SIGNAL_SOURCES.csv,,,,,,,,,,
signal_source,SRC190,Twitter Account,@mattpocockuk,X,https://x.com/mattpocockuk,Ralph loops dev education TypeScript,HIGHEST,Daily,,Bullish on ralph loops. Pushing limits. Developer educator.,TRUE,VIBE_CODING,HIGH_SIGNAL_SOURCES.csv,,,,,,,,,,
signal_source,SRC191,Twitter Account,@nicbstme,X,https://x.com/nicbstme,Agentic coding AI/ML strategy fintech,HIGHEST,Daily,,Clearest thinker on strategic + practical agentic coding. Director AI/ML.,TRUE,VIBE_CODING,HIGH_SIGNAL_SOURCES.csv,,,,,,,,,,
signal_source,SRC192,Twitter Account,@every,X,https://x.com/every,AI engineering compound beginners,HIGH,Weekly,,Study their codebase changes more than articles. Popularization.,TRUE,AI_TOOLS,HIGH_SIGNAL_SOURCES.csv,,,,,,,,,,
signal_source,SRC193,YouTube,AI Engineer,YouTube,https://youtube.com/@aiDotEngineer,Agentic coding cutting edge,HIGHEST,Weekly,,Only AI YouTube channel worth following. Cutting edge agentic.,TRUE,VIBE_CODING,HIGH_SIGNAL_SOURCES.csv,,,,,,,,,,
signal_source,SRC194,Twitter Account,@bcherny,X,https://x.com/bcherny,Vibe coding practical implementation,HIGHEST,Daily,,Practically useful vibe coding. Implementation focused.,TRUE,VIBE_CODING,HIGH_SIGNAL_SOURCES.csv,,,,,,,,,,
signal_source,SRC195,Twitter Account,@karpathy,X,https://x.com/karpathy,AI macro understanding vibe coding godfather,HIGHEST,Weekly,,Spiritual godfather of vibe coding. Macro understanding.,TRUE,VIBE_CODING,HIGH_SIGNAL_SOURCES.csv,,,,,,,,,,
signal_source,SRC196,Twitter Account,@venturetwins,X,https://x.com/venturetwins,AI video models Justine,HIGHEST,Daily,,Search timeline for AI/video model questions. Expert source.,TRUE,AI_TOOLS,HIGH_SIGNAL_SOURCES.csv,,,,,,,,,,
signal_source,SRC197,Twitter Account,@dwarkesh_sp,X,https://x.com/dwarkesh_sp,LLM economics interviews,HIGH,Weekly,,Best resource for fundamental LLM economics. Deep interviews.,TRUE,AI_TOOLS,HIGH_SIGNAL_SOURCES.csv,,,,,,,,,,
signal_source,SRC198,Newsletter,Epoch AI,Web,https://epochai.org,AI benchmarks research long-form,HIGHEST,Weekly,,Incredible long-form AI content. Cool benchmarks. Read on website.,TRUE,AI_TOOLS,HIGH_SIGNAL_SOURCES.csv,,,,,,,,,,
signal_source,SRC201,Twitter Account,@saimagnate,X,https://x.com/saimagnate,YouTube faceless automation content strategy,HIGHEST,Daily,,$0 stack for faceless YouTube. 48hr idea validation. ChatGPT script automation. TTS voice optimization.,TRUE,CONTENT_CREATION,HIGH_SIGNAL_SOURCES.csv,,,,,,,,,,
signal_source,SRC202,Twitter Account,@zach_yadegari,X,https://x.com/zach_yadegari,iOS app king - #1 App Store apps - organic TikTok to installs funnel - ASO mastery - real revenue numbers,HIGHEST,Daily,,Built multiple apps to #1 on App Store. Real revenue. TikTok organic funnel to app installs. ASO expert. Study for APP_FACTORY.,TRUE,IOS_APPS,HIGH_SIGNAL_SOURCES.csv,,,,,,,,,,
signal_source,SRC203,Twitter Account,@beautyshowcase,X,https://x.com/beautyshowcase,Beauty curation repost strategy,HIGHEST,Daily,,8 posts/day ultra-minimal captions. 3.59% ER 3543 avg likes. Nationality tags polls Good morning recurring. Full study OPS/BEAUTYSHOWCASE_STUDY.md,TRUE,BEAUTY_CURATION,HIGH_SIGNAL_SOURCES.csv,,,,,,,,,,
signal_source,SRC204,Twitter Account,@dimitarangg,X,https://x.com/dimitarangg,Grey-hat growth + cold outreach frameworks,HIGHEST,Daily,,High-signal outreach + growth playbooks. Extract tactics + copy patterns.,TRUE,GROWTH_HACKS,HIGH_SIGNAL_SOURCES.csv,,,,,,,,,,
signal_source,SRC205,Twitter Account,@Fortuze,X,https://x.com/Fortuze,Ecom growth + ops tactics,HIGHEST,Daily,,High-signal ecom growth tactics. Extract frameworks + product ideas.,TRUE,ECOM_ARB,HIGH_SIGNAL_SOURCES.csv,,,,,,,,,,
signal_source,SRC206,Twitter Account,@ecomchigga,X,https://x.com/ecomchigga,Ecom execution + offer angles,HIGHEST,Daily,,Ecom operator copy. Extract offer angles + execution playbooks.,TRUE,ECOM_ARB,HIGH_SIGNAL_SOURCES.csv,,,,,,,,,,
signal_source,SRC207,Twitter Account,@pounddz,X,https://x.com/pounddz,Affiliate + aggressive GTM copy,HIGHEST,Daily,,High-signal affiliate/growth copy. Extract CTAs + funnel structure.,TRUE,GROWTH_HACKS,HIGH_SIGNAL_SOURCES.csv,,,,,,,,,,
signal_source,SRC208,Twitter Account,@affprinter,X,https://x.com/affprinter,TikTok affiliate sweeps monetization,HIGH,Daily,,TikTok affiliate + sweeps operator. Extract monetization playbooks + offer angles.,TRUE,GROWTH_HACKS,HIGH_SIGNAL_SOURCES.csv,,,,,,,,,,
signal_source,SRC209,Twitter Account,@espindeezy,X,https://x.com/espindeezy,UGC creator partnerships,MEDIUM,Daily,,UGC deal structuring + creator economy alpha. Extract partnership frameworks.,TRUE,CONTENT_CREATION,HIGH_SIGNAL_SOURCES.csv,,,,,,,,,,
signal_source,SRC210,Twitter Account,@alexxgrowth,X,https://x.com/alexxgrowth,Clipping and content strategy,MEDIUM,Daily,,Content clipping + growth playbooks. Extract formats + distribution tactics.,TRUE,CONTENT_CREATION,HIGH_SIGNAL_SOURCES.csv,,,,,,,,,,
signal_source,SRC211,Twitter Account,@StevenCravotta,X,https://x.com/StevenCravotta,App factory indie app portfolio,HIGH,Daily,,Solo app dev shipping multiple apps. Extract build + monetization patterns.,TRUE,IOS_APPS,HIGH_SIGNAL_SOURCES.csv,,,,,,,,,,
signal_source,SRC212,Twitter Account,@HamptonAc_,X,https://x.com/HamptonAc_,Ecom and AI automation,HIGH,Daily,,Ecom automation + AI integration tactics. Extract scalable ops frameworks.,TRUE,ECOM_ARB,HIGH_SIGNAL_SOURCES.csv,,,,,,,,,,
signal_source,SRC213,Twitter Account,@fromzerotomill,X,https://x.com/fromzerotomill,Ecom hustle general alpha,MEDIUM,Daily,,General hustle + ecom alpha. Extract execution playbooks.,TRUE,GROWTH_HACKS,HIGH_SIGNAL_SOURCES.csv,,,,,,,,,,
signal_source,SRC214,Twitter Account,@0xrahulweb3,X,https://x.com/0xrahulweb3,Web3 alpha meta value posts,MEDIUM,Daily,,Web3 + AI monetization alpha. Extract opportunity signals + method breakdowns.,TRUE,FINANCE_TRADING,HIGH_SIGNAL_SOURCES.csv,,,,,,,,,,
signal_source,SRC215,Twitter Account,@gregogallagher,X,https://x.com/gregogallagher,Fitness lifestyle voice reference,LOW,Weekly,,Fitness niche voice + engagement patterns. Extract content formats + hooks.,TRUE,CONTENT_CREATION,HIGH_SIGNAL_SOURCES.csv,,,,,,,,,,
signal_source,SRC216,Twitter Account,@aestheticprimal,X,https://x.com/aestheticprimal,Alt health meme format plus affiliates,MEDIUM,Daily,,Alt health + supplement meme content. Extract engagement formats + affiliate angles.,TRUE,CONTENT_CREATION,HIGH_SIGNAL_SOURCES.csv,,,,,,,,,,
signal_source,SRC217,Twitter Account,@davidasinclair,X,https://x.com/davidasinclair,Longevity health science content,LOW,Weekly,,Longevity research alpha. Extract repurposable health content + affiliate angles.,TRUE,CONTENT_CREATION,HIGH_SIGNAL_SOURCES.csv,,,,,,,,,,
signal_source,SRC218,Twitter Account,@SimonasDip,X,https://x.com/SimonasDip,General alpha extraction,MEDIUM,Daily,,Multi-niche alpha. Extract scalable tactics + tool recommendations.,TRUE,GROWTH_HACKS,HIGH_SIGNAL_SOURCES.csv,,,,,,,,,,
account,,,,,,,,,,,,,ACCOUNTS.csv,Meta,X,@PRINTMAXXER,printmaxxer@protonmail.com,Decodo-1,Profile-Meta,PENDING,2026-01-19,,Meta brand - hub account
account,,,,,,,,,,,,,ACCOUNTS.csv,Meta,TikTok,@printmaxxer,printmaxxer@protonmail.com,Decodo-1,Profile-Meta,NEEDS_CREATION,,,Meta brand - short-form video
account,,,,,,,,,,,,,ACCOUNTS.csv,Meta,Instagram,@printmaxxer,printmaxxer@protonmail.com,Decodo-1,Profile-Meta,NEEDS_CREATION,,,Meta brand - visual content
account,,,,,,,,,,,,,ACCOUNTS.csv,Meta,YouTube,PRINTMAXXER,printmaxxer@protonmail.com,Decodo-1,Profile-Meta,NEEDS_CREATION,,,Meta brand - long-form video
account,,,,,,,,,,,,,ACCOUNTS.csv,Meta,Facebook,PRINTMAXXER,printmaxxer@protonmail.com,Decodo-1,Profile-Meta,NEEDS_CREATION,,,Meta brand - FB page
account,,,,,,,,,,,,,ACCOUNTS.csv,Meta,LinkedIn,PRINTMAXXER,printmaxxer@protonmail.com,Decodo-1,Profile-Meta,NEEDS_CREATION,,,Meta brand - B2B and cold outbound
account,,,,,,,,,,,,,ACCOUNTS.csv,Meta,Medium,@printmaxxer,printmaxxer@protonmail.com,Decodo-1,Profile-Meta,NEEDS_CREATION,,,Meta brand - Partner Program
account,,,,,,,,,,,,,ACCOUNTS.csv,Meta,Substack,printmaxxer,printmaxxer@protonmail.com,Decodo-1,Profile-Meta,NEEDS_CREATION,,,Meta brand - newsletter + Notes
account,,,,,,,,,,,,,ACCOUNTS.csv,AI,X,@ai_workflows_daily,ai.workflows.tips@protonmail.com,Decodo-2,Profile-AI,PENDING,2026-01-19,,AI niche
account,,,,,,,,,,,,,ACCOUNTS.csv,AI,TikTok,@aiworkflowsdaily,ai.workflows.tips@protonmail.com,Decodo-2,Profile-AI,PENDING,2026-01-19,,AI niche
account,,,,,,,,,,,,,ACCOUNTS.csv,AI,YouTube,AI Workflows Daily,ai.workflows.tips@protonmail.com,Decodo-2,Profile-AI,PENDING,2026-01-19,,AI niche
account,,,,,,,,,,,,,ACCOUNTS.csv,AI,Instagram,@aiworkflowsdaily,ai.workflows.tips@protonmail.com,Decodo-2,Profile-AI,PENDING,2026-01-19,,AI niche
account,,,,,,,,,,,,,ACCOUNTS.csv,AI,Facebook,StackFlow - AI Workflows,ai.workflows.tips@protonmail.com,Decodo-2,Profile-AI,NEEDS_CREATION,,,AI niche - FB page
account,,,,,,,,,,,,,ACCOUNTS.csv,AI,LinkedIn,StackFlow,ai.workflows.tips@protonmail.com,Decodo-2,Profile-AI,NEEDS_CREATION,,,AI niche - B2B workflows
account,,,,,,,,,,,,,ACCOUNTS.csv,AI,Medium,@aiworkflowsdaily,ai.workflows.tips@protonmail.com,Decodo-2,Profile-AI,NEEDS_CREATION,,,AI niche - Partner Program
account,,,,,,,,,,,,,ACCOUNTS.csv,AI,Substack,stackflow,ai.workflows.tips@protonmail.com,Decodo-2,Profile-AI,NEEDS_CREATION,,,AI niche - newsletter
account,,,,,,,,,,,,,ACCOUNTS.csv,AI,Beehiiv,stackflow,ai.workflows.tips@protonmail.com,Decodo-2,Profile-AI,NEEDS_CREATION,,,AI niche - primary newsletter
account,,,,,,,,,,,,,ACCOUNTS.csv,Faith,X,@daily_anchor_faith,daily.anchor.faith@protonmail.com,Decodo-3,Profile-Faith,PENDING,2026-01-19,,Faith niche
account,,,,,,,,,,,,,ACCOUNTS.csv,Faith,TikTok,@dailyanchorfaith,daily.anchor.faith@protonmail.com,Decodo-3,Profile-Faith,PENDING,2026-01-19,,Faith niche
account,,,,,,,,,,,,,ACCOUNTS.csv,Faith,YouTube,Daily Anchor Faith,daily.anchor.faith@protonmail.com,Decodo-3,Profile-Faith,PENDING,2026-01-19,,Faith niche
