Text,Link,Image,Scheduled Date,Scheduled Time,Profile
"YouTube just changed something important:

""330 videos in 11 months stuck at 290 views. Here's what was actually broken the whole time""

if you're posting on YouTube, adjust now. most creators won't notice for weeks. that's your edge.

#contentcreator #youtube",,,2026-03-15,07:30,printmaxxer Twitter
"Instagram just changed something important:

""330 videos in 11 months stuck at 290 views. Here's what was actually broken the whole time""

if you're posting on Instagram, adjust now. most creators won't notice for weeks. that's your edge.

#contentcreator #instagram",,,2026-03-15,09:00,printmaxxer Twitter
spotted a live gig on reddit: [Hiring] 🎬 Looking for Blender Editor for Fern-Sty,,,2026-03-15,11:00,printmaxxer Twitter
drafted a response in 3 minutes with ai-assisted portfolio generation.,,,2026-03-15,13:00,printmaxxer Twitter
most freelancers spend 30 min per application. i batch 10 in the same time.,,,2026-03-15,15:00,printmaxxer Twitter
the game is speed + volume + quality samples.,,,2026-03-15,17:00,printmaxxer Twitter
"spotted a live gig on reddit: [Hiring] remote job for US based citizens

drafted a response in 3 minutes with ai-assisted portfolio generation.

most freelancers spend 30 min per application. i batch 10 in the same time.

the game is speed + volume + quality samples.",,,2026-03-15,19:00,printmaxxer Twitter
"spotted a live gig on reddit: [Hiring] looking for tiktok , instagram and twitte",,,2026-03-15,21:00,printmaxxer Twitter
spotted a live gig on reddit: [Hiring] TikTok Slideshow Creators – Earn Up to $4,,,2026-03-16,07:30,printmaxxer Twitter
spotted a live gig on reddit: [Hiring] Software Engineers (Cyber security) | Rem,,,2026-03-16,09:00,printmaxxer Twitter
it's literally a config file and some instructions. people are buying it.,,,2026-03-16,11:00,printmaxxer Twitter
"i have 33 autonomous agents, 310 automation scripts, and a full orchestration system running 24/7.",,,2026-03-16,13:00,printmaxxer Twitter
"the productization of developer workflows is a real market. most devs are terrible at setting up their tools. sell the setup, not the tool.",,,2026-03-16,15:00,printmaxxer Twitter
it tells you if your hardware can run a specific AI model.,,,2026-03-16,17:00,printmaxxer Twitter
"the genius: affiliate links to GPU retailers when the answer is ""no.""",,,2026-03-16,19:00,printmaxxer Twitter
"""can you do X?"" sites are underrated. simple boolean answer + affiliate upsell when the answer is negative. works for hardware, software, anything with a purchase decision.",,,2026-03-16,21:00,printmaxxer Twitter
"when two independent teams ship the same idea simultaneously, the market is screaming for it.",,,2026-03-17,07:30,printmaxxer Twitter
agent orchestration isn't a feature anymore. it's a category.,,,2026-03-17,09:00,printmaxxer Twitter
"that's roughly 3,000 pages of text in a single prompt.",,,2026-03-17,11:00,printmaxxer Twitter
most people will use this to summarize documents.,,,2026-03-17,13:00,printmaxxer Twitter
the real play: feed it your entire codebase + all your docs + all your data and let it find patterns humans can't see.,,,2026-03-17,15:00,printmaxxer Twitter
context window size isn't about reading more. it's about connecting dots across larger datasets.,,,2026-03-17,17:00,printmaxxer Twitter
the comments are losing their minds,,,2026-03-17,19:00,printmaxxer Twitter
but here's the thing. $40k/mo is $480k/year. that's generational comfort money. no investors. no board. no growth-at-all-costs pressure.,,,2026-03-17,21:00,printmaxxer Twitter
the real flex isn't the number. it's the decision to stop chasing.,,,2026-03-18,07:30,printmaxxer Twitter
"4 were a complete waste of time.
3 actually worked.",,,2026-03-18,09:00,printmaxxer Twitter
"most people would keep all 7 running ""just in case."" that's how you burn out at $500 MRR.",,,2026-03-18,11:00,printmaxxer Twitter
"the move is always: test fast, kill losers, double winners.",,,2026-03-18,13:00,printmaxxer Twitter
not magic. not virality. not luck.,,,2026-03-18,15:00,printmaxxer Twitter
they just went where the users already were and solved a problem people were actively complaining about.,,,2026-03-18,17:00,printmaxxer Twitter
the best distribution channel is already-frustrated people.,,,2026-03-18,19:00,printmaxxer Twitter
this post is getting traction because everyone knows it's true but nobody wants to hear it.,,,2026-03-18,21:00,printmaxxer Twitter
"you vibe-coded an app in 4 hours. cool. what happens when:
- the AI model changes
- your prompt stops working
- you need to debug actual logic",,,2026-03-19,07:30,printmaxxer Twitter
the app is the easy part. maintaining it is the real game.,,,2026-03-19,09:00,printmaxxer Twitter
"1/5
there's a growing movement of SaaS founders who hit $30-50k MRR and deliberately stop growing.",,,2026-03-19,11:00,printmaxxer Twitter
not because they can't scale. because they don't want to.,,,2026-03-19,13:00,printmaxxer Twitter
here's why this is the most underrated strategy in tech:,,,2026-03-19,15:00,printmaxxer Twitter
"2/5
at $40k MRR you're making $480k/year. probably 70-80% margins if you're solo.",,,2026-03-19,17:00,printmaxxer Twitter
that's $336-384k take-home. no employees. no office. no investors.,,,2026-03-19,19:00,printmaxxer Twitter
"most VCs would call this a ""lifestyle business"" like it's an insult.",,,2026-03-19,21:00,printmaxxer Twitter
"3/5
the math on scaling past $40k MRR:
- hire 2-3 people: -$200k/year
- office/tools: -$50k/year
- your stress: 3x
- your time: goes from 20hrs/week to 60",,,2026-03-20,07:30,printmaxxer Twitter
net result: you make LESS money working MORE hours,,,2026-03-20,09:00,printmaxxer Twitter
"4/5
the founders doing this aren't lazy. they're running the numbers.",,,2026-03-20,11:00,printmaxxer Twitter
$384k/year working 20 hours/week = $370/hour effective rate,,,2026-03-20,13:00,printmaxxer Twitter
"scale to $100k MRR with a team of 5?
$1.2M revenue - $600k costs = $600k profit
but now you're working 60hrs/week
= $192/hour",,,2026-03-20,15:00,printmaxxer Twitter
"you literally made less per hour by ""succeeding""",,,2026-03-20,17:00,printmaxxer Twitter
"5/5
the real alpha: build something that hits $30-50k MRR. stop. enjoy your life.",,,2026-03-20,19:00,printmaxxer Twitter
use the extra time to build another $30k MRR product.,,,2026-03-20,21:00,printmaxxer Twitter
