date_found,title,subreddit,url,budget,matched_services,delivery_time,score,status,notes,revenue_estimate_monthly
2026-04-07,Magazine Layout Designer 24-40+ pages,r/DesignJobs,https://reddit.com/r/DesignJobs/comments/1s05856/,500,automation_design,2-6 hours,75,ACTIVE,"InDesign template required for wedding journalism studio. Recurring potential.",500
2026-04-07,Band Logo Designer - Art Deco,r/DesignJobs,https://reddit.com/r/DesignJobs/comments/1s153v3/,300,logo_design,30 min,70,ACTIVE,"Cover rock band logo. Simple scope, fast turnaround. Repeatable skill.",300
2026-04-07,Social Media Manager Full Time Remote,r/slavelabour,https://reddit.com/r/slavelabour/comments/1s187pq/,100,social_media_management,2-4 hours,65,ACTIVE,"Post short-form videos TikTok/Instagram/YouTube. Entry-level content work.",100
2026-04-07,YouTube Shorts/TikTok Editor,r/forhire,https://reddit.com/r/forhire/comments/1s1i4q9/,200,video_editing,2 hours,75,ACTIVE,"Recurring 10-20 clips per week. Gaming/podcast content. Monthly retainer model.",200
2026-04-07,YT Script Writer Warhammer 40k,r/DesignJobs,https://reddit.com/r/DesignJobs/comments/1s18qwi/,70,content_creation,2-6 hours,60,ACTIVE,"$70/script. Channel-specific content. Repeatable once format established.",300
2026-04-07,Logo Fish Embroidery Hat Print,r/DesignJobs,https://reddit.com/r/DesignJobs/comments/1s00prb/,200,logo_design,30 min,65,ACTIVE,"College professor research lab logo. Simple scope.",200
2026-04-07,Senior Software Engineer Python Java,r/remotejs,https://reddit.com/r/remotejs/comments/1rkmjhn/,140,automation_development,2-6 hours,60,ACTIVE,"Remote position. $140K/year salary listing (high anchor for service positioning).",0
2026-04-07,Printed Magazine Layout Design,r/DesignJobs,https://reddit.com/r/DesignJobs/comments/1s05856/,500,design_automation,2-6 hours,65,ACTIVE,"Template-based design with scaling potential. One-shot = template = recurring.",500
2026-04-07,30 Remote JavaScript Jobs,r/remotejs,https://reddit.com/r/remotejs/comments/1rhch1n/,104,web_development,2-4 hours,65,ACTIVE,"Job aggregator listing. Meta-opportunity for recruitment/arbitrage.",0
2026-04-07,Script Writer YouTube Channel,r/DesignJobs,https://reddit.com/r/DesignJobs/comments/1s18qwi/,70,content_creation_writing,2-6 hours,60,ACTIVE,"YouTube script writing. Repeatable at scale with AI + human QA.",350
2026-04-07,Shorts/TikTok Editor Gaming Podcast,r/forhire,https://reddit.com/r/forhire/comments/1s1i4q9/,200,video_editing,2 hours,75,ACTIVE,"Recurring clips editing. High-demand skill. Scalable to team.",200
2026-04-07,Social Media Manager Full Time,r/slavelabour,https://reddit.com/r/slavelabour/comments/1s187pq/,100,social_media_posting,2-4 hours,65,ACTIVE,"Short-form video posting across platforms. Simple repeatable work.",100
2026-04-07,Willing to grind 15-20hrs day week,r/slavelabour,https://reddit.com/r/slavelabour/comments/1s17u9p/,100,general_labor,2 hours,65,ACTIVE,"Backpacker grinding short gigs. Indicator of low-barrier opportunity market.",0
2026-04-07,Logo Fish Embroidery Shirt,r/DesignJobs,https://reddit.com/r/DesignJobs/comments/1s00prb/,200,logo_design,30 min,65,ACTIVE,"Fish logo for embroidery + shirt print. Design + production coordination.",200
2026-04-07,Band Logo Designer,r/DesignJobs,https://reddit.com/r/DesignJobs/comments/1s153v3/,300,logo_design,30 min,60,ACTIVE,"Art deco band logo. Fast-turnaround design work.",300
2026-04-07,Script Writer YouTube Warhammer,r/DesignJobs,https://reddit.com/r/DesignJobs/comments/1s18qwi/,70,content_scripting,2-6 hours,60,ACTIVE,"Niche channel scripting. Repeatable once voice/style established.",300
2026-04-07,JavaScript Jobs Hiring,r/remotejs,https://reddit.com/r/remotejs/comments/1rhch1n/,104,tech_recruiting,2-4 hours,65,ACTIVE,"Job listing aggregator. Revenue model: affiliate placement fees or recruitment.",0
