id,category,post_text,hashtags,media_type,thread_position,status
T01,launch_thread,"I built a tool that generates complete Roblox games from one sentence. tycoon with monetization. obby with checkpoints. simulator with pets. 47 seconds each. RobloxMaxx is live. here's what it does:",#RobloxDev #GameDev #AI,video,1/5,READY
T02,launch_thread,"how it works: type 'make a pizza tycoon with 8 stations and gamepasses.' hit generate. get 15+ Luau scripts. ServerScriptService. ReplicatedStorage. StarterGui. all connected. paste into Roblox Studio. hit play. done.",#RobloxStudio #Luau,image,2/5,READY
T03,launch_thread,"what makes this different from ChatGPT: genre-specific prompts trained on real Roblox patterns. modern Luau with type annotations. proper RemoteEvent architecture. DataStore persistence. monetization hooks. ChatGPT doesn't know what a Humanoid is.",#RobloxDev #CodingWithAI,image,3/5,READY
T04,launch_thread,"pricing: free = 250 actions/month (enough for 5+ complete games). Pro = $19/mo for 2500 actions. Studio = $49/mo for teams + priority generation. or bring your own API key and pay per token.",#IndieDev #BuildInPublic #SaaS,image,4/5,READY
T05,launch_thread,"try it free. no credit card. robloxmaxx.com. Roblox Studio plugin + web dashboard. if you build something cool tag me. I want to see what 47 seconds of AI can produce in your hands.",#RobloxMaxx #ShipFast,text,5/5,READY
T06,feature,"built 3 Roblox games before lunch today. pizza tycoon: 47 seconds. obstacle course with 20 stages: 52 seconds. pet simulator with hatching mechanic: 61 seconds. all with gamepasses and dev products baked in. total dev time: 2 minutes 40 seconds.",#RobloxDev #AI #IndieDev,video,,READY
T07,feature,"RobloxMaxx doesn't write snippets. it writes the WHOLE game. ServerScriptService handlers. ReplicatedStorage modules. StarterGui interfaces. StarterPlayerScripts. all connected. all working. all from one sentence.",#RobloxDev #AI #GameDev,image,,READY
T08,feature,"new template: horror game scaffold. flickering lights system. chase AI with pathfinding. jumpscare triggers. ambient sound controller. atmosphere manager. one prompt generates everything. your Roblox horror game in under 2 minutes.",#RobloxDev #RobloxHorror #GameDev,video,,READY
T09,feature,"just added conversation memory. tell RobloxMaxx 'add a pet system to my tycoon.' it remembers YOUR tycoon code. generates pets that integrate with your existing economy. not a new game. an upgrade to YOUR game.",#RobloxDev #AI,video,,READY
T10,feature,"people keep asking about code quality. here's a side-by-side. left: RobloxMaxx generated tycoon code. right: top-rated free model tycoon. ours has type annotations. proper cleanup. no memory leaks. no deprecated calls. judge for yourself.",#RobloxDev #Luau #CodeQuality,image,,READY
T11,feature,"template library: 8 genres. tycoon. obby. simulator. RPG. horror. racing. tower defense. fighting. each generates a complete playable game with monetization. not code snippets. full games from one prompt.",#RobloxMaxx #RobloxDev,image,,READY
T12,feature,"BYOK mode is live. bring your own Claude or OpenAI API key. pay per token instead of subscription. RobloxMaxx becomes the Roblox-optimized prompt layer. full control. you own the pipeline.",#RobloxDev #AI #SaaS,text,,READY
T13,feature,"free tier bump: 300 actions/month. that's 6+ complete games for $0. the best marketing is people using the tool and tagging their friends. so go build something.",#RobloxMaxx #RobloxDev #Free,text,,READY
T14,feature,"scaffold mode demo. I typed: 'racing game with 5 tracks, nitro boost, and a garage for car customization.' 73 seconds later: 22 scripts. vehicle physics. track system. garage UI. leaderboards. working game.",#RobloxDev #Racing #AI,video,,READY
T15,feature,"just shipped multi-turn editing. generate a tycoon. then say 'add a rebirth system.' then 'add a VIP room behind the rebirth counter.' each command builds on the last. conversational game development.",#RobloxDev #AI,video,,READY
T16,dev_tip,"the #1 mistake in Roblox code: putting game logic in LocalScripts. RemoteEvents exist for a reason. server authoritative or get exploited. every script RobloxMaxx generates is server-authoritative by default because exploiters don't sleep.",#RobloxDev #GameDev #Security,text,,READY
T17,dev_tip,"stop copy-pasting tycoon code from 2019 YouTube tutorials. deprecated API. no type annotations. no proper cleanup. memory leaks everywhere. generate modern Luau with task.spawn and typed functions instead.",#RobloxDev #Luau #RobloxStudio,text,,READY
T18,dev_tip,"Roblox monetization pattern that works: gamepasses for permanent upgrades. dev products for consumables. put the purchase prompt AFTER the player experiences value. not before. RobloxMaxx templates follow this by default.",#RobloxDev #GameDev #IndieDev,text,,READY
T19,dev_tip,"Roblox tip: .Destroying a part doesn't disconnect its RBXScriptConnections. always :Disconnect() or you get memory leaks that compound over time. AI-generated code handles cleanup automatically. humans forget. every time.",#RobloxDev #Luau #Coding,text,,READY
T20,dev_tip,"unpopular Roblox opinion: most devs over-engineer their games. you don't need a custom physics engine for a tycoon. you don't need 15 modules. keep it simple. ship it. iterate based on real player data. not imagined edge cases.",#RobloxDev #IndieDev,text,,READY
T21,dev_tip,"Roblox DataStore: always use UpdateAsync not SetAsync for player data. SetAsync overwrites without checking current value. UpdateAsync lets you merge safely. one lost save = one angry player who never comes back.",#RobloxDev #Luau #DataStore,text,,READY
T22,dev_tip,"Roblox UI tip: never use Offset for positioning. always Scale. Offset breaks on different screen sizes. 60%+ of Roblox players are on mobile. if your UI uses Offset, you're broken for most of your players.",#RobloxDev #UI #Mobile,text,,READY
T23,dev_tip,"the difference between a 50-player game and a 5000-player game is almost never the gameplay. it's the first 30 seconds. loading screen. tutorial. first reward. nail those 3 things. everything else is secondary.",#RobloxDev #GameDev,text,,READY
T24,dev_tip,"Roblox leaderboard code should be 8 lines. if yours is 50 you're doing it wrong. OrderedDataStore:GetSortedAsync() handles sorting. stop reinventing sorted lists. or generate it and skip the debugging entirely.",#RobloxDev #Luau #Tips,text,,READY
T25,dev_tip,"free models are not free. they cost you debugging time. backdoor risk. deprecated API calls. code you don't understand. generate clean code in 47 seconds instead. actually free. actually safe.",#RobloxDev #FreeModels,text,,READY
T26,engagement,"roblox devs: what takes you the longest when building a new game? (wrong answers only)",#RobloxDev #GameDev,text,,READY
T27,engagement,"poll: hardest part of Roblox development? A) DataStore/persistence B) UI/UX design C) monetization D) getting players to your game",#RobloxDev #GameDev,text,,READY
T28,engagement,"name a Roblox game genre and I'll generate the full code live. most liked reply gets built first. timer starts at 100 likes.",#RobloxDev #GameDev #LiveCoding,text,,READY
T29,engagement,"hot take: in 2 years no serious Roblox dev will hand-write boilerplate. AI generates it better and faster. the devs who adopt now ship 10x more games than those who don't. early movers eat.",#RobloxDev #AI #GameDev,text,,READY
T30,engagement,"roblox free model code: if script.Parent then script.Parent:Destroy() end. definitely not suspicious. vs AI generated code: fully typed. documented. no backdoors. choose wisely.",#RobloxDev #FreeModels #Meme,image,,READY
