alpha_id,category,summary,routed_at
"ALPHA15286","APP_FACTORY","ChatBase $250K MRR + PDF.ai $30K MRR. Pattern: AI wrapper on existing platforms. Simple UX > features. Time-to-value < 60s.","2026-03-07 00:27"
"ALPHA15284","APP_LAUNCH","$500 UGC + TikTok organic > paid subs. Full funnel: UGC > social > downloads > conversion.","2026-03-07 00:27"
"IH_BATCH_20260307","GEO_SERVICES","GEO (Generative Engine Optimization) is $10K/mo category with no dominant player. Lucid Engine first mover. Build GEO tools/services NOW.","2026-03-07 00:41"
"IH_BATCH_20260307","VERTICAL_AI_SAAS","Vertical AI SaaS printing: construction $50K/mo, medical $10K/mo, logistics $30K/mo. None of these industries have real SaaS yet.","2026-03-07 00:41"
"IH_BATCH_20260307","FACELESS_VIDEO","Faceless video automation validated: Sumoclip $3.5K/mo + Storyclips $2.5K/mo. Same revenue band, category confirmed.","2026-03-07 00:41"
"IH_BATCH_20260307","AI_HUMANIZER","AI text humanizer is #1 pain point in AI content 2026. Text Humanizer Pro $15K/mo with zero tech. Simple NLP wrapper.","2026-03-07 00:41"
ALPHA16740,APP_FACTORY,Free trial paywall framework: 7-day trial = 5x conversion lift (2% to 11%). Hard paywall kills conversion. Let users experience full value before asking for money. Exact setup from r/SideProject with 26 comments validating.,2026-03-07 15:21
ALPHA16310,PRODUCT_DISCOVERY,"PDF editor: 158pts, 80 comments on r/SideProject. 100% local, zero paywalls. Privacy-first tools get massive Reddit engagement. Signal for local-first APP_FACTORY candidates.",2026-03-07 15:21
