alpha_id,category,ops_type,output_file,created_at,status,priority,notes
ALPHA_HN_47609372,TOOL_ALPHA,tool_eval,AUTOMATIONS/auto_ops/tool_evals/TOOL_ALPHA_HN_47609372.md,2026-04-04 03:52:47,GENERATED,HIGH,"Show HN: Semantic atlas of 188 constitutions in 3D (30k articles, embeddings). I built this after noticing that exist..."
ALPHA_HN_47609725,TOOL_ALPHA,tool_eval,AUTOMATIONS/auto_ops/tool_evals/TOOL_ALPHA_HN_47609725.md,2026-04-04 03:52:47,GENERATED,MEDIUM,Show HN: NASA Artemis II Mission Timeline Tracker
ALPHA_HN_47616777,TOOL_ALPHA,tool_eval,AUTOMATIONS/auto_ops/tool_evals/TOOL_ALPHA_HN_47616777.md,2026-04-04 03:52:47,GENERATED,MEDIUM,"Show HN: Portcullis, a review gate for curl|bash"
ALPHA_HN_47599956,TOOL_ALPHA,tool_eval,AUTOMATIONS/auto_ops/tool_evals/TOOL_ALPHA_HN_47599956.md,2026-04-04 03:52:47,GENERATED,MEDIUM,Show HN: Sycamore . next gen Rust web UI library using fine-grained reactivity
ALPHA_HN_47616185,APP_FACTORY,app_spec,AUTOMATIONS/auto_ops/app_specs/APP_SPEC_ALPHA_HN_47616185.md,2026-04-04 03:52:47,GENERATED,HIGH,Show HN: AI-first PostgreSQL client for Mac. &quot;Can you check if this user is on the premium plan?&quot; &quot;I h...
ALPHA_HN_47575061,APP_FACTORY,app_spec,AUTOMATIONS/auto_ops/app_specs/APP_SPEC_ALPHA_HN_47575061.md,2026-04-04 03:52:47,GENERATED,MEDIUM,"Show HN: QWERTY mini Pro . Why a 2-row, 16-key keyboard works better. This post explains why a 2-row, 16-key keyboard..."
ALPHA_HN_47610194,TOOL_ALPHA,tool_eval,AUTOMATIONS/auto_ops/tool_evals/TOOL_ALPHA_HN_47610194.md,2026-04-04 03:52:47,GENERATED,MEDIUM,Show HN: Tileserver-RS . Tile Server in Rust with MapLibre Native Rendering
ALPHA1774000076,ECOM,listing_spec,AUTOMATIONS/auto_ops/listings/LISTING_ALPHA1774000076.md,2026-04-04 03:52:47,GENERATED,HIGH,"Someone in this sub called my morning shopify check ""pretending to work"" and i c"
ALPHA1774000080,OUTBOUND,email_template,AUTOMATIONS/auto_ops/email_templates/EMAIL_ALPHA1774000080.md,2026-04-04 03:52:47,GENERATED,LOW,8 strangers are paying for my code
ALPHA1774000081,APP_FACTORY,app_spec,AUTOMATIONS/auto_ops/app_specs/APP_SPEC_ALPHA1774000081.md,2026-04-04 03:52:47,GENERATED,HIGH,Most people waste thousands building a startup idea no one wants . here’s what I
ALPHA1774000082,ECOM,listing_spec,AUTOMATIONS/auto_ops/listings/LISTING_ALPHA1774000082.md,2026-04-04 03:52:47,GENERATED,HIGH,"Started managing this TikTok Shop in December 4 months later, the growth is surp"
ALPHA1774000084,OUTBOUND,email_template,AUTOMATIONS/auto_ops/email_templates/EMAIL_ALPHA1774000084.md,2026-04-04 03:52:47,GENERATED,MEDIUM,I will not promote: Good Idea
ALPHA1774000085,APP_FACTORY,app_spec,AUTOMATIONS/auto_ops/app_specs/APP_SPEC_ALPHA1774000085.md,2026-04-04 03:52:47,GENERATED,LOW,How can I earn ₹200/day using my tech skills with limited time
ALPHA1774000086,APP_FACTORY,app_spec,AUTOMATIONS/auto_ops/app_specs/APP_SPEC_ALPHA1774000086.md,2026-04-04 03:52:47,GENERATED,MEDIUM,"Bought a ""passive income"" blog"
ALPHA1774000088,APP_FACTORY,app_spec,AUTOMATIONS/auto_ops/app_specs/APP_SPEC_ALPHA1774000088.md,2026-04-04 03:52:47,GENERATED,MEDIUM,Made $800. 1k/mo on IG
ALPHA1774000089,APP_FACTORY,app_spec,AUTOMATIONS/auto_ops/app_specs/APP_SPEC_ALPHA1774000089.md,2026-04-04 03:52:47,GENERATED,LOW,Stuck on content production
ALPHA1774000091,APP_FACTORY,app_spec,AUTOMATIONS/auto_ops/app_specs/APP_SPEC_ALPHA1774000091.md,2026-04-04 03:52:47,GENERATED,LOW,"I tracked 200,000+ digital products on Gumroad"
ALPHA1774000093,APP_FACTORY,app_spec,AUTOMATIONS/auto_ops/app_specs/APP_SPEC_ALPHA1774000093.md,2026-04-04 03:52:47,GENERATED,HIGH,Lost &gt;$2k in 2025 because I couldn't focus for more than 20 minutes
ALPHA1774000094,APP_FACTORY,app_spec,AUTOMATIONS/auto_ops/app_specs/APP_SPEC_ALPHA1774000094.md,2026-04-04 03:52:47,GENERATED,LOW,I built a debt automation tool and stumbled into a $7 trillion problem nobody ta
ALPHA1774000095,APP_FACTORY,app_spec,AUTOMATIONS/auto_ops/app_specs/APP_SPEC_ALPHA1774000095.md,2026-04-04 03:52:47,GENERATED,LOW,Is this just part of growing an agency or am I doing something wrong
ALPHA1774000099,APP_FACTORY,app_spec,AUTOMATIONS/auto_ops/app_specs/APP_SPEC_ALPHA1774000099.md,2026-04-04 03:52:47,GENERATED,LOW,Stop digging for AI gold
ALPHA1774000100,APP_FACTORY,app_spec,AUTOMATIONS/auto_ops/app_specs/APP_SPEC_ALPHA1774000100.md,2026-04-04 03:52:47,GENERATED,MEDIUM,I donate 25% of my side project's revenue to the EFF
ALPHA1774000101,ECOM,listing_spec,AUTOMATIONS/auto_ops/listings/LISTING_ALPHA1774000101.md,2026-04-04 03:52:47,GENERATED,LOW,Google Merchant Center = Merri-go-round of Hell
ALPHA1774000102,FREELANCE,service_listing,AUTOMATIONS/auto_ops/freelance/SERVICE_ALPHA1774000102.md,2026-04-04 03:52:47,GENERATED,LOW,find remote closers
ALPHA1774000103,ECOM,listing_spec,AUTOMATIONS/auto_ops/listings/LISTING_ALPHA1774000103.md,2026-04-04 03:52:47,GENERATED,LOW,best business account for e-commerce sellers
ALPHA1774000109,GENERAL,growth_playbook,AUTOMATIONS/auto_ops/playbooks/PLAYBOOK_ALPHA1774000109.md,2026-04-04 03:52:47,GENERATED,LOW,Do people ever use small online gigs to get started with passive income
ALPHA_ECOM_ARB_ENG_6B0C63AF,MONETIZATION,monetization_plan,AUTOMATIONS/auto_ops/monetization/PLAN_ALPHA_ECOM_ARB_ENG_6B0C63AF.md,2026-04-04 03:52:47,GENERATED,HIGH,Ecom arb: yoga mat | Sell $35.99 on FB Marketplace | Source $7.0 | Profit $22.69 (63.0% margin) | Trend 30/100
ALPHA_ECOM_ARB_ENG_FC76810F,MONETIZATION,monetization_plan,AUTOMATIONS/auto_ops/monetization/PLAN_ALPHA_ECOM_ARB_ENG_FC76810F.md,2026-04-04 03:52:47,GENERATED,MEDIUM,Ecom arb: posture corrector | Sell $17.01 on FB Marketplace | Source $4.25 | Profit $3.91 (23.0% margin) | Trend 46/100
ALPHA_ECOM_ARB_ENG_3D39D6F5,MONETIZATION,monetization_plan,AUTOMATIONS/auto_ops/monetization/PLAN_ALPHA_ECOM_ARB_ENG_3D39D6F5.md,2026-04-04 03:52:47,GENERATED,HIGH,Ecom arb: cable organizer | Sell $12.98 on FB Marketplace | Source $2.0 | Profit $5.83 (44.9% margin) | Trend 0/100
