alpha_id,category,ops_type,output_file,created_at,status,priority,notes
ALPHA248,TOOL_ALPHA,tool_eval,AUTOMATIONS/auto_ops/tool_evals/TOOL_ALPHA248.md,2026-02-13 20:20:45,READY_TO_DEPLOY,HIGH,MCP multi-server automation
SCRAPE_20260314_1854,COMPETITIVE_INTEL,SCRAPING_CYCLE,AUTOMATIONS/reddit_scraper_output/,2026-03-14T18:54:39.235575,COMPLETED,,
ALPHA103204,TOOL_ALPHA,tool_eval,AUTOMATIONS/auto_ops/tool_evals/TOOL_ALPHA103204.md,2026-03-17 06:21:42,GENERATED,HIGH,"MIT repo: karthironald/BodyProgress (272 stars, Swift)"
ALPHA_HN_47586614,TOOL_ALPHA,tool_eval,AUTOMATIONS/auto_ops/tool_evals/TOOL_ALPHA_HN_47586614.md,2026-04-01 05:52:18,GENERATED,HIGH,Open source CAD in the browser (Solvespace)
ALPHA_HN_47584795,TOOL_ALPHA,tool_eval,AUTOMATIONS/auto_ops/tool_evals/TOOL_ALPHA_HN_47584795.md,2026-04-01 05:52:18,GENERATED,MEDIUM,Why the US Navy won't blast the Iranians and 'open' Strait of Hormuz
ALPHA_HN_47597908,TOOL_ALPHA,tool_eval,AUTOMATIONS/auto_ops/tool_evals/TOOL_ALPHA_HN_47597908.md,2026-04-01 05:52:18,GENERATED,MEDIUM,Remembering Magnetic Memories and the Apollo AGC
ALPHA_HN_47596457,TOOL_ALPHA,tool_eval,AUTOMATIONS/auto_ops/tool_evals/TOOL_ALPHA_HN_47596457.md,2026-04-01 05:52:18,GENERATED,MEDIUM,Analyzing Geekbench 6 under Intel's BOT
ALPHA_HN_47568146,TOOL_ALPHA,tool_eval,AUTOMATIONS/auto_ops/tool_evals/TOOL_ALPHA_HN_47568146.md,2026-04-01 05:52:18,GENERATED,MEDIUM,Butterfly-collecting: The history of an insult (2017)
ALPHA_HN_47546775,TOOL_ALPHA,tool_eval,AUTOMATIONS/auto_ops/tool_evals/TOOL_ALPHA_HN_47546775.md,2026-04-01 05:52:18,GENERATED,MEDIUM,Back to FreeBSD . Part 2 . Jails
ALPHA_HN_47550433,TOOL_ALPHA,tool_eval,AUTOMATIONS/auto_ops/tool_evals/TOOL_ALPHA_HN_47550433.md,2026-04-01 05:52:18,GENERATED,MEDIUM,Teenage Engineering's PO-32 acoustic modem and synth implementation
ALPHA_HN_47582220,APP_FACTORY,app_spec,AUTOMATIONS/auto_ops/app_specs/APP_SPEC_ALPHA_HN_47582220.md,2026-04-01 05:52:18,GENERATED,MEDIUM,Axios compromised on NPM . Malicious versions drop remote access trojan
ALPHA_HN_47593634,TOOL_ALPHA,tool_eval,AUTOMATIONS/auto_ops/tool_evals/TOOL_ALPHA_HN_47593634.md,2026-04-01 05:52:18,GENERATED,MEDIUM,Ordinary Lab Gloves May Have Skewed Microplastic Data
ALPHA_HN_47589818,TOOL_ALPHA,tool_eval,AUTOMATIONS/auto_ops/tool_evals/TOOL_ALPHA_HN_47589818.md,2026-04-01 05:52:18,GENERATED,MEDIUM,Cohere Transcribe: Speech Recognition
ALPHA_HN_47556074,MONETIZATION,monetization_plan,AUTOMATIONS/auto_ops/monetization/PLAN_ALPHA_HN_47556074.md,2026-04-01 05:52:18,GENERATED,MEDIUM,"Learn Something Old Every Day, Part XVIII: How Does FPU Detection Work?"
ALPHA_HN_47558733,TOOL_ALPHA,tool_eval,AUTOMATIONS/auto_ops/tool_evals/TOOL_ALPHA_HN_47558733.md,2026-04-01 05:52:18,GENERATED,MEDIUM,From 300KB to 69KB per Token: How LLM Architectures Solve the KV Cache Problem
ALPHA_HN_47562994,TOOL_ALPHA,tool_eval,AUTOMATIONS/auto_ops/tool_evals/TOOL_ALPHA_HN_47562994.md,2026-04-01 05:52:18,GENERATED,MEDIUM,Joel Meyerowitz on Photographing Giorgio Morandi's Studio
ALPHA_HN_47592462,GROWTH_HACK,growth_playbook,AUTOMATIONS/auto_ops/playbooks/PLAYBOOK_ALPHA_HN_47592462.md,2026-04-01 05:52:18,GENERATED,MEDIUM,I traced my traffic through a home Tailscale exit node
ALPHA_HN_47595865,APP_FACTORY,app_spec,AUTOMATIONS/auto_ops/app_specs/APP_SPEC_ALPHA_HN_47595865.md,2026-04-01 05:52:18,GENERATED,MEDIUM,We intercepted the White House app's network traffic
ALPHA_HN_47574960,TOOL_ALPHA,tool_eval,AUTOMATIONS/auto_ops/tool_evals/TOOL_ALPHA_HN_47574960.md,2026-04-01 05:52:18,GENERATED,MEDIUM,Inside the 'self-driving' lab revolution
ALPHA_HN_47597119,TOOL_ALPHA,tool_eval,AUTOMATIONS/auto_ops/tool_evals/TOOL_ALPHA_HN_47597119.md,2026-04-01 05:52:18,GENERATED,MEDIUM,Claude Wrote a Full FreeBSD Remote Kernel RCE with Root Shell (CVE-2026-4747)
ALPHA_HN_47591928,TOOL_ALPHA,tool_eval,AUTOMATIONS/auto_ops/tool_evals/TOOL_ALPHA_HN_47591928.md,2026-04-01 05:52:18,GENERATED,MEDIUM,GitHub's Historic Uptime
ALPHA_HN_47588349,TOOL_ALPHA,tool_eval,AUTOMATIONS/auto_ops/tool_evals/TOOL_ALPHA_HN_47588349.md,2026-04-01 05:52:18,GENERATED,MEDIUM,GitHub Monaspace Case Study
ALPHA_HN_47597651,TOOL_ALPHA,tool_eval,AUTOMATIONS/auto_ops/tool_evals/TOOL_ALPHA_HN_47597651.md,2026-04-01 05:52:18,GENERATED,MEDIUM,The German state (Schleswig-Holstein) trying to break free from Microsoft
ALPHA_HN_47585974,TOOL_ALPHA,tool_eval,AUTOMATIONS/auto_ops/tool_evals/TOOL_ALPHA_HN_47585974.md,2026-04-01 05:52:18,GENERATED,MEDIUM,Combinators
ALPHA_HN_47556076,TOOL_ALPHA,tool_eval,AUTOMATIONS/auto_ops/tool_evals/TOOL_ALPHA_HN_47556076.md,2026-04-01 05:52:18,GENERATED,MEDIUM,What major works of literature were written after age of 85? 75? 65?
ALPHA_HN_47542545,TOOL_ALPHA,tool_eval,AUTOMATIONS/auto_ops/tool_evals/TOOL_ALPHA_HN_47542545.md,2026-04-01 05:52:18,GENERATED,MEDIUM,Nematophagous Fungus
ALPHA_HN_47583959,TOOL_ALPHA,tool_eval,AUTOMATIONS/auto_ops/tool_evals/TOOL_ALPHA_HN_47583959.md,2026-04-01 05:52:18,GENERATED,MEDIUM,Accidentally created my first fork bomb with Claude Code
ALPHA_HN_47592626,TOOL_ALPHA,tool_eval,AUTOMATIONS/auto_ops/tool_evals/TOOL_ALPHA_HN_47592626.md,2026-04-01 05:52:18,GENERATED,MEDIUM,Super Micro Computer Investors Look for Exits
ALPHA_HN_47583045,TOOL_ALPHA,tool_eval,AUTOMATIONS/auto_ops/tool_evals/TOOL_ALPHA_HN_47583045.md,2026-04-01 05:52:18,GENERATED,MEDIUM,Google's 200M-parameter time-series foundation model with 16k context
ALPHA_HN_47587866,TOOL_ALPHA,tool_eval,AUTOMATIONS/auto_ops/tool_evals/TOOL_ALPHA_HN_47587866.md,2026-04-01 05:52:18,GENERATED,MEDIUM,Microsoft: Copilot is for entertainment purposes only
ALPHA_HN_47582043,TOOL_ALPHA,tool_eval,AUTOMATIONS/auto_ops/tool_evals/TOOL_ALPHA_HN_47582043.md,2026-04-01 05:52:18,GENERATED,MEDIUM,Artemis II is not safe to fly
ALPHA_HN_47571330,TOOL_ALPHA,tool_eval,AUTOMATIONS/auto_ops/tool_evals/TOOL_ALPHA_HN_47571330.md,2026-04-01 05:52:18,GENERATED,MEDIUM,"Good CTE, Bad CTE"
ALPHA_HN_47582482,APP_FACTORY,app_spec,AUTOMATIONS/auto_ops/app_specs/APP_SPEC_ALPHA_HN_47582482.md,2026-04-01 05:52:18,GENERATED,MEDIUM,Ollama is now powered by MLX on Apple Silicon in preview
ALPHA_HN_47594816,TOOL_ALPHA,tool_eval,AUTOMATIONS/auto_ops/tool_evals/TOOL_ALPHA_HN_47594816.md,2026-04-01 05:52:18,GENERATED,MEDIUM,Prompt Engineering for Humans
ALPHA_HN_47594804,TOOL_ALPHA,tool_eval,AUTOMATIONS/auto_ops/tool_evals/TOOL_ALPHA_HN_47594804.md,2026-04-01 05:52:18,GENERATED,MEDIUM,Show HN: Claude Code rewritten as a bash script. Have you ever wondered if Claude Code could be rewritten as a bash s...
ALPHA_HN_47597764,TOOL_ALPHA,tool_eval,AUTOMATIONS/auto_ops/tool_evals/TOOL_ALPHA_HN_47597764.md,2026-04-01 05:52:18,GENERATED,MEDIUM,Art schools are being torn apart by AI
ALPHA_HN_47584540,TOOL_ALPHA,tool_eval,AUTOMATIONS/auto_ops/tool_evals/TOOL_ALPHA_HN_47584540.md,2026-04-01 05:52:18,GENERATED,HIGH,Claude Code's source code has been leaked via a map file in their NPM registry. https:&#x2F;&#x2F;xcancel.com&#x2F;Fr...
ALPHA_HN_47597929,APP_FACTORY,app_spec,AUTOMATIONS/auto_ops/app_specs/APP_SPEC_ALPHA_HN_47597929.md,2026-04-01 05:52:18,GENERATED,MEDIUM,AWS App Runner availability change
ALPHA_HN_47586176,TOOL_ALPHA,tool_eval,AUTOMATIONS/auto_ops/tool_evals/TOOL_ALPHA_HN_47586176.md,2026-04-01 05:52:18,GENERATED,MEDIUM,Claude Code users hitting usage limits 'way faster than expected'
ALPHA_HN_47593015,TOOL_ALPHA,tool_eval,AUTOMATIONS/auto_ops/tool_evals/TOOL_ALPHA_HN_47593015.md,2026-04-01 05:52:18,GENERATED,MEDIUM,Safe ways to do things in bash (2023)
ALPHA_HN_47598105,TOOL_ALPHA,tool_eval,AUTOMATIONS/auto_ops/tool_evals/TOOL_ALPHA_HN_47598105.md,2026-04-01 05:52:18,GENERATED,MEDIUM,A Look at Some Retro Desktop Graphical User Interfaces
ALPHA_HN_47589567,TOOL_ALPHA,tool_eval,AUTOMATIONS/auto_ops/tool_evals/TOOL_ALPHA_HN_47589567.md,2026-04-01 05:52:18,GENERATED,MEDIUM,Scotty: A beautiful SSH task runner
ALPHA_HN_47595068,TOOL_ALPHA,tool_eval,AUTOMATIONS/auto_ops/tool_evals/TOOL_ALPHA_HN_47595068.md,2026-04-01 05:52:18,GENERATED,MEDIUM,Pretext's most interesting use cases have no DOM at all
ALPHA_HN_47598374,TOOL_ALPHA,tool_eval,AUTOMATIONS/auto_ops/tool_evals/TOOL_ALPHA_HN_47598374.md,2026-04-01 05:52:18,GENERATED,HIGH,Show HN: A sandboxed AI agent that can watch webpages without constant API calls. It can also adapt by creating its o...
ALPHA_HN_47597981,TOOL_ALPHA,tool_eval,AUTOMATIONS/auto_ops/tool_evals/TOOL_ALPHA_HN_47597981.md,2026-04-01 05:52:18,GENERATED,MEDIUM,Show HN: TraceLit . debug LeetCode step by step. I built TraceLit because I was tired of manually dry-running LeetCod...
ALPHA_HN_47597591,APP_FACTORY,app_spec,AUTOMATIONS/auto_ops/app_specs/APP_SPEC_ALPHA_HN_47597591.md,2026-04-01 05:52:18,GENERATED,MEDIUM,Show HN: WordBattle . Daily word game where AI agents compete against humans. WordBattle is a daily 6-letter word gue...
ALPHA_HN_47555035,MONETIZATION,monetization_plan,AUTOMATIONS/auto_ops/monetization/PLAN_ALPHA_HN_47555035.md,2026-04-01 05:52:18,GENERATED,HIGH,"Show HN: Loreline, narrative language transpiled via Haxe: C++/C#/JS/Java/Py/Lua"
ALPHA_HN_47588324,TOOL_ALPHA,tool_eval,AUTOMATIONS/auto_ops/tool_evals/TOOL_ALPHA_HN_47588324.md,2026-04-01 05:52:18,GENERATED,MEDIUM,Show HN: Sundial . a new way to look at a weather forecast
ALPHA_HN_47592392,TOOL_ALPHA,tool_eval,AUTOMATIONS/auto_ops/tool_evals/TOOL_ALPHA_HN_47592392.md,2026-04-01 05:52:18,GENERATED,MEDIUM,Show HN: EU Leadership . Live API data site comparing Europe to the world
ALPHA_HN_47594637,TOOL_ALPHA,tool_eval,AUTOMATIONS/auto_ops/tool_evals/TOOL_ALPHA_HN_47594637.md,2026-04-01 05:52:18,GENERATED,MEDIUM,Show HN: Asciimap . Interactive ASCII world map with live data
ALPHA_HN_47580910,TOOL_ALPHA,tool_eval,AUTOMATIONS/auto_ops/tool_evals/TOOL_ALPHA_HN_47580910.md,2026-04-01 05:52:18,GENERATED,MEDIUM,Show HN: I turned a sketch into a 3D-print pegboard for my kid with an AI agent. We have pegboards and plywood all ov...
ALPHA_HN_47575417,TOOL_ALPHA,tool_eval,AUTOMATIONS/auto_ops/tool_evals/TOOL_ALPHA_HN_47575417.md,2026-04-01 05:52:18,GENERATED,MEDIUM,Show HN: Coasts . Containerized Hosts for Agents. Hi HN - We&#x27;ve been working on Coasts (“containerized hosts”) t...
ALPHA_HN_47588776,APP_FACTORY,app_spec,AUTOMATIONS/auto_ops/app_specs/APP_SPEC_ALPHA_HN_47588776.md,2026-04-01 05:52:18,GENERATED,MEDIUM,Show HN: DeepTable . an API that converts messy Excel files into structured data. We tried to build an Excel error ch...
ALPHA_HN_47590389,TOOL_ALPHA,tool_eval,AUTOMATIONS/auto_ops/tool_evals/TOOL_ALPHA_HN_47590389.md,2026-04-01 05:52:18,GENERATED,MEDIUM,Show HN: Margo . Find the font your brain reads fastest
ALPHA_HN_47585192,TOOL_ALPHA,tool_eval,AUTOMATIONS/auto_ops/tool_evals/TOOL_ALPHA_HN_47585192.md,2026-04-01 05:52:18,GENERATED,MEDIUM,Show HN: Pardus Browser- a browser for AI agents without Chromium
ALPHA_HN_47589451,TOOL_ALPHA,tool_eval,AUTOMATIONS/auto_ops/tool_evals/TOOL_ALPHA_HN_47589451.md,2026-04-01 05:52:18,GENERATED,MEDIUM,Show HN: Hyprmoncfg . Terminal-based monitor config manager for Hyprland
ALPHA_HN_47589900,TOOL_ALPHA,tool_eval,AUTOMATIONS/auto_ops/tool_evals/TOOL_ALPHA_HN_47589900.md,2026-04-01 05:52:18,GENERATED,HIGH,Show HN: Lazy-tool: reducing prompt bloat in MCP-based agent workflows
ALPHA_HN_47587191,TOOL_ALPHA,tool_eval,AUTOMATIONS/auto_ops/tool_evals/TOOL_ALPHA_HN_47587191.md,2026-04-01 05:52:18,GENERATED,MEDIUM,Show HN: Rust UEFI UI Lib
ALPHA_HN_47589499,TOOL_ALPHA,tool_eval,AUTOMATIONS/auto_ops/tool_evals/TOOL_ALPHA_HN_47589499.md,2026-04-01 05:52:18,GENERATED,MEDIUM,Show HN: ClawDesk . Agent orchestration layer on top of OpenClaw
ALPHA_HN_47589420,TOOL_ALPHA,tool_eval,AUTOMATIONS/auto_ops/tool_evals/TOOL_ALPHA_HN_47589420.md,2026-04-01 05:52:18,GENERATED,MEDIUM,Show HN: I built a self-hosted Fly.io engine using Go and Firecracker
ALPHA_HN_47589325,TOOL_ALPHA,tool_eval,AUTOMATIONS/auto_ops/tool_evals/TOOL_ALPHA_HN_47589325.md,2026-04-01 05:52:18,GENERATED,MEDIUM,Show HN: LogicStamp . A Context Compiler for TypeScript
ALPHA_HN_47589304,TOOL_ALPHA,tool_eval,AUTOMATIONS/auto_ops/tool_evals/TOOL_ALPHA_HN_47589304.md,2026-04-01 05:52:18,GENERATED,HIGH,Show HN: INTERCALsky.ATproto client.Ada carries packets.INTERCAL carries meaning. An ATproto &#x2F; Bluesky client wh...
ALPHA_HN_47589294,TOOL_ALPHA,tool_eval,AUTOMATIONS/auto_ops/tool_evals/TOOL_ALPHA_HN_47589294.md,2026-04-01 05:52:18,GENERATED,MEDIUM,"Show HN: Gravimera, AI(LLM) driven 3D world editor and explorer"
ALPHA_HN_47589285,APP_FACTORY,app_spec,AUTOMATIONS/auto_ops/app_specs/APP_SPEC_ALPHA_HN_47589285.md,2026-04-01 05:52:18,GENERATED,MEDIUM,"Show HN: Prawduct, a product development framework for Claude Code. Claude Code is amazing at writing code, but it wi..."
ALPHA_HN_47582537,TOOL_ALPHA,tool_eval,AUTOMATIONS/auto_ops/tool_evals/TOOL_ALPHA_HN_47582537.md,2026-04-01 05:52:18,GENERATED,MEDIUM,"Show HN: Free AI API gateway that auto-fails over Gemini, Groq, Mistral, etc."
ALPHA_HN_47575910,TOOL_ALPHA,tool_eval,AUTOMATIONS/auto_ops/tool_evals/TOOL_ALPHA_HN_47575910.md,2026-04-01 05:52:18,GENERATED,MEDIUM,Show HN: A 3D Body Scan for Nine Cents . Without SMPL
ALPHA_HN_47588735,TOOL_ALPHA,tool_eval,AUTOMATIONS/auto_ops/tool_evals/TOOL_ALPHA_HN_47588735.md,2026-04-01 05:52:18,GENERATED,MEDIUM,Show HN: PromptQL . AI-Native Slack
ALPHA_HN_47588729,TOOL_ALPHA,tool_eval,AUTOMATIONS/auto_ops/tool_evals/TOOL_ALPHA_HN_47588729.md,2026-04-01 05:52:18,GENERATED,MEDIUM,"Show HN: A complete index of all 14,000 articles on MDN Web Docs"
ALPHA_HN_47588285,APP_FACTORY,app_spec,AUTOMATIONS/auto_ops/app_specs/APP_SPEC_ALPHA_HN_47588285.md,2026-04-01 05:52:18,GENERATED,MEDIUM,Show HN: Vibe Check . UX Benchmark for vibe designs. Vibe check shares benchmarking insights on any vibe coded URLs l...
ALPHA1773999930,APP_FACTORY,app_spec,AUTOMATIONS/auto_ops/app_specs/APP_SPEC_ALPHA1773999930.md,2026-04-01 05:52:18,GENERATED,HIGH,"Cash flow planning used to stress me out every month, here's the specific thing"
ALPHA1773999931,APP_FACTORY,app_spec,AUTOMATIONS/auto_ops/app_specs/APP_SPEC_ALPHA1773999931.md,2026-04-01 05:52:18,GENERATED,HIGH,Email outreach agencies bombed my edtech course sales to schools with zero enrol
ALPHA1773999932,APP_FACTORY,app_spec,AUTOMATIONS/auto_ops/app_specs/APP_SPEC_ALPHA1773999932.md,2026-04-01 05:52:18,GENERATED,MEDIUM,I spent ~$45 on Instagram ads to validate my app idea before writing any code
ALPHA1773999934,OUTBOUND,email_template,AUTOMATIONS/auto_ops/email_templates/EMAIL_ALPHA1773999934.md,2026-04-01 05:52:18,GENERATED,HIGH,I tracked every marketing channel for 12 months
ALPHA1773999935,APP_FACTORY,app_spec,AUTOMATIONS/auto_ops/app_specs/APP_SPEC_ALPHA1773999935.md,2026-04-01 05:52:18,GENERATED,HIGH,Where can I get a true full-body checkup abroad for under ~$1k. $1
ALPHA1773999937,APP_FACTORY,app_spec,AUTOMATIONS/auto_ops/app_specs/APP_SPEC_ALPHA1773999937.md,2026-04-01 05:52:18,GENERATED,LOW,The reasons why passive income failed my experiences
ALPHA1773999939,APP_FACTORY,app_spec,AUTOMATIONS/auto_ops/app_specs/APP_SPEC_ALPHA1773999939.md,2026-04-01 05:52:18,GENERATED,MEDIUM,Stop stacking jobs
ALPHA1773999940,APP_FACTORY,app_spec,AUTOMATIONS/auto_ops/app_specs/APP_SPEC_ALPHA1773999940.md,2026-04-01 05:52:18,GENERATED,LOW,Built a pay-per-minute expert call app . got first revenue organically
ALPHA1773999942,OUTBOUND,email_template,AUTOMATIONS/auto_ops/email_templates/EMAIL_ALPHA1773999942.md,2026-04-01 05:52:18,GENERATED,LOW,"reddit lead gen tip: stop scrolling, start automating"
ALPHA1773999943,OUTBOUND,email_template,AUTOMATIONS/auto_ops/email_templates/EMAIL_ALPHA1773999943.md,2026-04-01 05:52:18,GENERATED,LOW,I built 5 features for one reason
ALPHA1773999944,APP_FACTORY,app_spec,AUTOMATIONS/auto_ops/app_specs/APP_SPEC_ALPHA1773999944.md,2026-04-01 05:52:18,GENERATED,MEDIUM,Potential nightmare for those who accept Credit Card payments
ALPHA1773999951,APP_FACTORY,app_spec,AUTOMATIONS/auto_ops/app_specs/APP_SPEC_ALPHA1773999951.md,2026-04-01 05:52:18,GENERATED,LOW,Proof of income from eBay sales/in person
ALPHA1773999955,APP_FACTORY,app_spec,AUTOMATIONS/auto_ops/app_specs/APP_SPEC_ALPHA1773999955.md,2026-04-01 05:52:18,GENERATED,LOW,E-commerce owners: How do you handle social proof without slowing down your stor
ALPHA1773999960,GENERAL,growth_playbook,AUTOMATIONS/auto_ops/playbooks/PLAYBOOK_ALPHA1773999960.md,2026-04-01 05:52:18,GENERATED,LOW,it‘s my first time to use reddit
ALPHA1773999964,APP_FACTORY,app_spec,AUTOMATIONS/auto_ops/app_specs/APP_SPEC_ALPHA1773999964.md,2026-04-01 05:52:18,GENERATED,LOW,Looking for a way just to make money as a 13 year old student
ALPHA1773999966,GENERAL,growth_playbook,AUTOMATIONS/auto_ops/playbooks/PLAYBOOK_ALPHA1773999966.md,2026-04-01 05:52:18,GENERATED,LOW,I’m looking for a way out of my current job
ALPHA1773999967,APP_FACTORY,app_spec,AUTOMATIONS/auto_ops/app_specs/APP_SPEC_ALPHA1773999967.md,2026-04-01 05:52:18,GENERATED,LOW,approach unequal personal guarantees - I will not promote
ALPHA1773999968,ECOM,listing_spec,AUTOMATIONS/auto_ops/listings/LISTING_ALPHA1773999968.md,2026-04-01 05:52:18,GENERATED,LOW,How do I go about scaling my reselling business
ALPHA1773999969,CONTENT_FARM,content_pack,AUTOMATIONS/auto_ops/content/CONTENT_ALPHA1773999969.md,2026-04-01 05:52:18,GENERATED,LOW,How do people actually afford long-term solo travel (not just vacations)
ALPHA1773999970,ECOM,listing_spec,AUTOMATIONS/auto_ops/listings/LISTING_ALPHA1773999970.md,2026-04-01 05:52:18,GENERATED,LOW,Struggling to manage a very niche small business
ALPHA1773999971,ECOM,listing_spec,AUTOMATIONS/auto_ops/listings/LISTING_ALPHA1773999971.md,2026-04-01 05:52:18,GENERATED,LOW,"From blank page to listed on Etsy in 20 minutes, real numbers from a $7 experime"
ALPHA_SCAN_073,APP_FACTORY,app_spec,AUTOMATIONS/auto_ops/app_specs/APP_SPEC_ALPHA_SCAN_073.md,2026-04-02 15:57:50,GENERATED,HIGH,Agent Observability Dashboard SaaS: hosted real-time monitoring for multi-agent Claude Code/Codex sessions. 166 stars...
ALPHA_SCAN_074,APP_FACTORY,app_spec,AUTOMATIONS/auto_ops/app_specs/APP_SPEC_ALPHA_SCAN_074.md,2026-04-02 15:57:50,GENERATED,HIGH,LLM Context Optimizer SaaS: proxy service reducing API costs 89-99% via context compression. lean-ctx repo 403 stars ...
ALPHA_SCAN_075,APP_FACTORY,app_spec,AUTOMATIONS/auto_ops/app_specs/APP_SPEC_ALPHA_SCAN_075.md,2026-04-02 15:57:50,GENERATED,HIGH,Distraction-Free Social Media App: strips Reels/Shorts/algo feeds from Instagram/TikTok/YouTube/X. Dull app 64 HN pts...
ALPHA_SCAN_076,OUTBOUND,email_template,AUTOMATIONS/auto_ops/email_templates/EMAIL_ALPHA_SCAN_076.md,2026-04-02 15:57:50,GENERATED,HIGH,"Professional Services Lead Intelligence Tool: scrape public data for dental/legal/CPA businesses, score their online ..."
ALPHA_SCAN_078,APP_FACTORY,app_spec,AUTOMATIONS/auto_ops/app_specs/APP_SPEC_ALPHA_SCAN_078.md,2026-04-02 15:57:50,GENERATED,HIGH,"Forced-Action Alarm Clock App: alarm won't stop until physical action (QR scan in bathroom, photo of coffee maker, 50..."
ALPHA_SCAN_079,APP_FACTORY,app_spec,AUTOMATIONS/auto_ops/app_specs/APP_SPEC_ALPHA_SCAN_079.md,2026-04-02 15:57:50,GENERATED,HIGH,1-Bit LLM API Wrapper Service: hosted API for 1-bit quantized LLMs at 10-50x lower cost than standard APIs. PrismML 1...
ALPHA_HN_47622670,TOOL_ALPHA,tool_eval,AUTOMATIONS/auto_ops/tool_evals/TOOL_ALPHA_HN_47622670.md,2026-04-04 03:52:47,GENERATED,MEDIUM,EmDash Feedback
ALPHA_HN_47540441,TOOL_ALPHA,tool_eval,AUTOMATIONS/auto_ops/tool_evals/TOOL_ALPHA_HN_47540441.md,2026-04-04 03:52:47,GENERATED,MEDIUM,Reinventing the pull request
ALPHA_HN_47574851,TOOL_ALPHA,tool_eval,AUTOMATIONS/auto_ops/tool_evals/TOOL_ALPHA_HN_47574851.md,2026-04-04 03:52:47,GENERATED,MEDIUM,Foxing aspires to be an eBPF-powered replication engine for Linux filesystems
ALPHA_HN_47615756,TOOL_ALPHA,tool_eval,AUTOMATIONS/auto_ops/tool_evals/TOOL_ALPHA_HN_47615756.md,2026-04-04 03:52:47,GENERATED,MEDIUM,Renewables reached nearly 50% of global electricity capacity last year
ALPHA_HN_47618120,TOOL_ALPHA,tool_eval,AUTOMATIONS/auto_ops/tool_evals/TOOL_ALPHA_HN_47618120.md,2026-04-04 03:52:47,GENERATED,MEDIUM,Hugo's New CSS Powers
ALPHA_HN_47615434,TOOL_ALPHA,tool_eval,AUTOMATIONS/auto_ops/tool_evals/TOOL_ALPHA_HN_47615434.md,2026-04-04 03:52:47,GENERATED,HIGH,Look at allegedly forked an open-source tool and sold it as its own
ALPHA_HN_47609564,TOOL_ALPHA,tool_eval,AUTOMATIONS/auto_ops/tool_evals/TOOL_ALPHA_HN_47609564.md,2026-04-04 03:52:47,GENERATED,MEDIUM,Steam on Linux Use Skyrocketed Above 5% in March
ALPHA_HN_47611921,TOOL_ALPHA,tool_eval,AUTOMATIONS/auto_ops/tool_evals/TOOL_ALPHA_HN_47611921.md,2026-04-04 03:52:47,GENERATED,MEDIUM,Significant raise of reports
ALPHA_HN_47615844,APP_FACTORY,app_spec,AUTOMATIONS/auto_ops/app_specs/APP_SPEC_ALPHA_HN_47615844.md,2026-04-04 03:52:47,GENERATED,MEDIUM,"Show HN: A P2P messenger with dual network modes (Fast and Tor). Hello HN, I have been working on a desktop P2P messe..."
ALPHA_HN_47620939,TOOL_ALPHA,tool_eval,AUTOMATIONS/auto_ops/tool_evals/TOOL_ALPHA_HN_47620939.md,2026-04-04 03:52:47,GENERATED,MEDIUM,rpg: A modern psql-compatible Postgres terminal and TUI written in Rust
ALPHA_HN_47623053,TOOL_ALPHA,tool_eval,AUTOMATIONS/auto_ops/tool_evals/TOOL_ALPHA_HN_47623053.md,2026-04-04 03:52:47,GENERATED,MEDIUM,"Show HN: Minimal Brain Teaser Web Game (Handcrafted, No AI). Built and open-sourced in the era before AI. I’m sure yo..."
ALPHA_HN_47618581,TOOL_ALPHA,tool_eval,AUTOMATIONS/auto_ops/tool_evals/TOOL_ALPHA_HN_47618581.md,2026-04-04 03:52:47,GENERATED,MEDIUM,Amazon is adding a fuel surcharge to fees it collects from third-party sellers
ALPHA_HN_47611721,TOOL_ALPHA,tool_eval,AUTOMATIONS/auto_ops/tool_evals/TOOL_ALPHA_HN_47611721.md,2026-04-04 03:52:47,GENERATED,MEDIUM,IBM Announces Strategic Collaboration with Arm
ALPHA_HN_47615876,TOOL_ALPHA,tool_eval,AUTOMATIONS/auto_ops/tool_evals/TOOL_ALPHA_HN_47615876.md,2026-04-04 03:52:47,GENERATED,MEDIUM,The case for zero-error horizons in trustworthy LLMs
ALPHA_HN_47563486,TOOL_ALPHA,tool_eval,AUTOMATIONS/auto_ops/tool_evals/TOOL_ALPHA_HN_47563486.md,2026-04-04 03:52:47,GENERATED,MEDIUM,Emacs-libgterm: Terminal emulator for Emacs using libghostty-vt
ALPHA_HN_47620039,TOOL_ALPHA,tool_eval,AUTOMATIONS/auto_ops/tool_evals/TOOL_ALPHA_HN_47620039.md,2026-04-04 03:52:47,GENERATED,MEDIUM,"Reporting potholes with an ESP32, LoRA, and AI"
ALPHA_HN_47618100,TOOL_ALPHA,tool_eval,AUTOMATIONS/auto_ops/tool_evals/TOOL_ALPHA_HN_47618100.md,2026-04-04 03:52:47,GENERATED,MEDIUM,Yggdrasil Network
ALPHA_HN_47547938,TOOL_ALPHA,tool_eval,AUTOMATIONS/auto_ops/tool_evals/TOOL_ALPHA_HN_47547938.md,2026-04-04 03:52:47,GENERATED,MEDIUM,Quadratic Micropass Type Inference
ALPHA_HN_47618247,TOOL_ALPHA,tool_eval,AUTOMATIONS/auto_ops/tool_evals/TOOL_ALPHA_HN_47618247.md,2026-04-04 03:52:47,GENERATED,HIGH,Show HN: SyNumpy . a Header only C++17 library for working with NumPy Arrays
ALPHA_HN_47623802,TOOL_ALPHA,tool_eval,AUTOMATIONS/auto_ops/tool_evals/TOOL_ALPHA_HN_47623802.md,2026-04-04 03:52:47,GENERATED,HIGH,"Show HN: I thought merging two photos with AI would be a weekend project. Nope. At a friend&#x27;s gathering, someone..."
ALPHA_HN_47612321,TOOL_ALPHA,tool_eval,AUTOMATIONS/auto_ops/tool_evals/TOOL_ALPHA_HN_47612321.md,2026-04-04 03:52:47,GENERATED,MEDIUM,Show HN: I built a DNS resolver from scratch in Rust . no DNS libraries. I built a DNS resolver that lets me use http...
ALPHA_HN_47621937,TOOL_ALPHA,tool_eval,AUTOMATIONS/auto_ops/tool_evals/TOOL_ALPHA_HN_47621937.md,2026-04-04 03:52:47,GENERATED,MEDIUM,Show HN: A Minimal Basic Inspired by Brainfuck
ALPHA_HN_47557921,TOOL_ALPHA,tool_eval,AUTOMATIONS/auto_ops/tool_evals/TOOL_ALPHA_HN_47557921.md,2026-04-04 03:52:47,GENERATED,HIGH,Show HN: Git bayesect . Bayesian Git bisection for non-deterministic bugs
ALPHA_HN_47574871,TOOL_ALPHA,tool_eval,AUTOMATIONS/auto_ops/tool_evals/TOOL_ALPHA_HN_47574871.md,2026-04-04 03:52:47,GENERATED,HIGH,"Show HN: Zerobox . Sandbox any command with file, network, credential controls. I&#x27;m excited to introduce Zerobox..."
ALPHA_HN_47621557,MONETIZATION,monetization_plan,AUTOMATIONS/auto_ops/monetization/PLAN_ALPHA_HN_47621557.md,2026-04-04 03:52:47,GENERATED,HIGH,Show HN: SkiFlee (an HTML5 game). This is a silly little multiplayer game I made for a gamejam that involves skiiing ...
ALPHA_HN_47603966,TOOL_ALPHA,tool_eval,AUTOMATIONS/auto_ops/tool_evals/TOOL_ALPHA_HN_47603966.md,2026-04-04 03:52:47,GENERATED,MEDIUM,Show HN: Flight-Viz . 10K flights on a 3D globe in 3.5MB of Rust+WASM. I built a real-time flight tracker that render...
ALPHA_HN_47620198,TOOL_ALPHA,tool_eval,AUTOMATIONS/auto_ops/tool_evals/TOOL_ALPHA_HN_47620198.md,2026-04-04 03:52:47,GENERATED,MEDIUM,Show HN: I built an offline and privacy-first photo sorter
ALPHA_HN_47619405,APP_FACTORY,app_spec,AUTOMATIONS/auto_ops/app_specs/APP_SPEC_ALPHA_HN_47619405.md,2026-04-04 03:52:47,GENERATED,MEDIUM,Show HN: Cue: Desktop app for subtitling and burned-in video export
ALPHA_HN_47619319,APP_FACTORY,app_spec,AUTOMATIONS/auto_ops/app_specs/APP_SPEC_ALPHA_HN_47619319.md,2026-04-04 03:52:47,GENERATED,MEDIUM,"Show HN: RiceVM . A Dis virtual machine and Limbo compiler in Rust. Hi, I&#x27;ve made a Dis virtual machine and Limb..."
ALPHA_HN_47618235,APP_FACTORY,app_spec,AUTOMATIONS/auto_ops/app_specs/APP_SPEC_ALPHA_HN_47618235.md,2026-04-04 03:52:47,GENERATED,MEDIUM,Show HN: Most products have no idea what their AI agents did yesterday. We build collaboration SDKs at Velt (YC W22)....
ALPHA_HN_47609425,TOOL_ALPHA,tool_eval,AUTOMATIONS/auto_ops/tool_evals/TOOL_ALPHA_HN_47609425.md,2026-04-04 03:52:47,GENERATED,MEDIUM,Show HN: We open-sourced our content writing workflow as a Claude Code skill
