source,subreddit_or_community,post_url,title,signal_type,signal_text,score,extracted_numbers,platform_mentioned,timestamp,processed
reddit,r/juststart,https://reddit.com/r/juststart/comments/1ri48gp/built_a_programmatic_seo_site_to_700k_impressions/,Built a programmatic SEO site to 700K impressions in 12 months while working full-time. Here's the full breakdown,revenue,"with ads, you spend $50/day and know by next week if it worked",55,$50; 700K; 2K; 5K,instagram; amazon; google,2026-03-01 18:05:47,FALSE
reddit_comment,r/juststart,https://reddit.com/r/juststart/comments/1r07rek/small_directory_site_getting_traffic_what/,"[comment] for directories, featured listings usually convert better than adsense. charge businesses $20-50/mo ",revenue,charge businesses $20-50/mo for premium placement,39,$20,google,2026-02-09 15:50:52,FALSE
hackernews,HN,https://news.ycombinator.com/item?id=47384352,Rack-Mount Hydroponics,general,rack-mount hydroponics ,33,,,2026-03-15 04:23:43,FALSE
hackernews_comment,HN,https://news.ycombinator.com/item?id=47361235,"[comment] There&#x27;s got to be a better way to share this than:     - a 16 hour old HN account sharing
  - a",tool," there&#x27;s got to be a better way to share this than:     - a 16 hour old hn account sharing
  - an 18 hour old github account with
  - a 17 hour old repo
  
where your hn post says &quot;several months of work&quot; but your repo doesn&#x27;t have months of commits, and claims you started resear",42,,,2026-03-13 06:14:59,FALSE
producthunt,ProductHunt,https://www.hcap.dev/,Show HN: HCAP – Agent-to-agent (A2A) negotiation,tool,Product Hunt launch: Show HN: HCAP – Agent-to-agent (A2A) negotiation,23,,,2026-03-12 17:52:10,FALSE
reddit,r/juststart,https://reddit.com/r/juststart/comments/1sbjg5r/seeking_feedback_from_servicenowmaximo/,Seeking feedback from ServiceNow/Maximo consultants on a billing automation MVP,platform_change,"seeking feedback from servicenow/maximo consultants on a billing automation mvp ​hi all,

​i’m currently in the validation phase for a saas solution focused on the enterprise/billing space, and i’m looking to connect with a few early design partners to stress-test the logic.

​the context:

i’ve dev",29,,instagram,2026-04-03 17:09:05,FALSE
reddit,r/juststart,https://reddit.com/r/juststart/comments/1sb46r8/im_running_a_geo_experiment_on_a_static_github/,I'm running a GEO experiment on a static GitHub Pages site — trying to get AI assistants to cite my content. Here's what I've done so far,tool,"i'm running a geo experiment on a static github pages site — trying to get ai assistants to cite my content. here's what i've done so far i have a small niche site on github pages (completely static html, no wordpress, no hosting costs) and i've been experimenting with something i think this sub wou",39,,instagram; google,2026-04-03 04:54:23,FALSE
reddit,r/juststart,https://reddit.com/r/juststart/comments/1sage07/removed_by_reddit/,[ Removed by Reddit ],platform_change,[ removed by reddit ] [ removed by reddit on account of violating the [content policy](/help/contentpolicy). ],19,,reddit,2026-04-02 12:45:16,FALSE
reddit,r/juststart,https://reddit.com/r/juststart/comments/1s7q1ud/month_3_update_new_domain_0_to_500k_impressions/,"Month 3 update: new domain, 0 to 500K impressions. Here's the full breakdown.",tool,"month 3 update: new domain, 0 to 500k impressions. here's the full breakdown. quick progress update since this sub helped me a lot when i was getting started.

we launched a brand new domain 3 months ago in the ai and seo space. specifically we write about how brands can improve their visibility in ",27,500K; 500K; 15K; 120K; 500K,instagram; google,2026-03-30 13:06:27,FALSE
reddit,r/juststart,https://reddit.com/r/juststart/comments/1s7vqha/before_you_launch_your_shopify_store_do_this/,"Before you launch your Shopify store, do this competitor research (most people skip it)",tool,"before you launch your shopify store, do this competitor research (most people skip it)     i see a lot of people launch shopify stores and price themselves based on gut feel or a quick google search. here's what i'd recommend instead:
    
    **pre-launch competitor research checklist:**
    
    ",16,,instagram; shopify; amazon; google,2026-03-30 16:37:01,FALSE
reddit,r/juststart,https://reddit.com/r/juststart/comments/1s687h8/one_repeatable_way_to_get_your_first/,One repeatable way to get your first international B2B clients from your laptop,platform_change,"one repeatable way to get your first international b2b clients from your laptop a lot of people here are stuck at the same stage: offer figured out, skills in place, but the first paying client outside their home country still feels out of reach. the usual advice is ""post more content"" or ""network o",33,,instagram; google; linkedin,2026-03-28 18:34:09,FALSE
reddit_comment,r/juststart,https://reddit.com/r/juststart/comments/1s687h8/one_repeatable_way_to_get_your_first/,[comment] I went through something similar but with Berlin and then Austin instead of Dubai. What helped me wa,warning," i went through something similar but with berlin and then austin instead of dubai. what helped me was getting way more narrow than “city + niche” and layering in a trigger. so instead of “websites for clinics,” i filtered for clinics that had a bad mobile site or no online booking and only reached ",23,,instagram; reddit,2026-03-28 18:34:09,FALSE
reddit,r/juststart,https://reddit.com/r/juststart/comments/1s5xwl1/teen_working_on_seo_to_save_family_business/,Teen working on SEO to save family business,general,"teen working on seo to save family business hello guys, thanks in advance for reading :)

my family has got a small business on which we all rely on. this last year sales have been slowing down, partialy because we had an agency change our website and they did an awful job, so we lost about 30/40% o",27,40%; 100k; 60k,instagram; google,2026-03-28 11:31:03,FALSE
reddit,r/juststart,https://reddit.com/r/juststart/comments/1s57rzs/5_sites_4_months_250_in_the_bank_discussion/,"5 sites, 4 months, $2.50 in the bank- Discussion",revenue,"5 sites, 4 months, $2",39,$2.50; $2.58; $25,instagram; youtube; amazon; google,2026-03-27 15:44:04,FALSE
reddit,r/juststart,https://reddit.com/r/juststart/comments/1s57rzs/5_sites_4_months_250_in_the_bank_discussion/,"5 sites, 4 months, $2.50 in the bank- Discussion",revenue,"now i have 5 websites:

	•	home gym affiliate site

	•	home gadgets affiliate site

	•	kitchen niche site

	•	diy / “anything is fixable” site

	•	local lead gen (commercial cleaning)

total revenue: $2",39,$2.50; $2.58; $25,instagram; youtube; amazon; google,2026-03-27 15:44:04,FALSE
reddit,r/juststart,https://reddit.com/r/juststart/comments/1s57rzs/5_sites_4_months_250_in_the_bank_discussion/,"5 sites, 4 months, $2.50 in the bank- Discussion",platform_change,"5 sites, 4 months, $2.50 in the bank- discussion i did the thing everyone here says to do.

i “just started.”

4 months ago, zero seo knowledge, decided to go all in and build niche sites.

now i have 5 websites:

	•	home gym affiliate site

	•	home gadgets affiliate site

	•	kitchen niche site

	•	",38,$2.50; $2.58; $25,instagram; youtube; amazon; google,2026-03-27 15:44:04,FALSE
reddit_comment,r/juststart,https://reddit.com/r/juststart/comments/1s57rzs/5_sites_4_months_250_in_the_bank_discussion/,"[comment] The ""Discovered - currently not indexed"" thing usually means Google crawled it and decided it wasn't",revenue,"not ""best home gym equipment"" but ""best power rack for low ceilings under $500",49,$500,youtube; google,2026-03-27 15:44:04,FALSE
reddit,r/juststart,https://reddit.com/r/juststart/comments/1s2cdwr/does_onlyfans_allow_ai_generated_content_and_how/,Does onlyfans allow ai generated content and how creators are actually using ai for promotion,platform_change,"does onlyfans allow ai generated content and how creators are actually using ai for promotion this question keeps coming up in every creator space i'm in and the answer is more nuanced than most people make it, so here's where things actually stand since i've been deep in this space researching the ",22,,instagram; twitter; reddit,2026-03-24 12:29:32,FALSE
reddit,r/juststart,https://reddit.com/r/juststart/comments/1s1dbdb/just_launched_a_site_and_it_has_zero_traffic/,"Just launched a site, and it has zero traffic – should I put money straight into professional SEO articles or better into ads?",platform_change,"just launched a site, and it has zero traffic – should i put money straight into professional seo articles or better into ads? i launched my first site about 5 weeks ago, brand new domain, cheap hosting around 4–5€/month, pretty specific niche around services for small businesses.  
  
i published 6",29,,instagram; youtube; google,2026-03-23 10:39:28,FALSE
reddit_comment,r/juststart,https://reddit.com/r/juststart/comments/1s1dbdb/just_launched_a_site_and_it_has_zero_traffic/,[comment] Tbh that traffic level at 5 weeks in is pretty standard for a new domain. SEO doesn’t usually kick i,revenue,"if i only had $300 to spend on ads, i would probably run ads to verify if the service page converts at all before investing more in content",28,$300,google,2026-03-23 10:39:28,FALSE
reddit_comment,r/juststart,https://reddit.com/r/juststart/comments/1s1dbdb/just_launched_a_site_and_it_has_zero_traffic/,"[comment] At your stage, putting that $300 purely into ads is risky you’ll likely get a short spike in traffic",revenue,"at your stage, putting that $300 purely into ads is risky you’ll likely get a short spike in traffic and then be back to zero, especially on platforms like google ads or meta ads where costs add up fast and optimization takes time",33,$300,instagram; google; facebook,2026-03-23 10:39:28,FALSE
reddit,r/juststart,https://reddit.com/r/juststart/comments/1s14s85/4_months_in_250_posts_across_5_niche_affiliate/,"4 months in, 250 posts across 5 niche affiliate sites, made $2, and just spent the weekend rebuilding all 5 frontends from scratch. Here’s where I’m at.",revenue,"4 months in, 250 posts across 5 niche affiliate sites, made $2, and just spent the weekend rebuilding all 5 frontends from scratch",59,"$2,; $2; $2; $3k; 5k; 50k; 3k; 8.5k",instagram; youtube; amazon; google,2026-03-23 02:26:30,FALSE
reddit,r/juststart,https://reddit.com/r/juststart/comments/1s14s85/4_months_in_250_posts_across_5_niche_affiliate/,"4 months in, 250 posts across 5 niche affiliate sites, made $2, and just spent the weekend rebuilding all 5 frontends from scratch. Here’s where I’m at.",platform_change,"4 months in, 250 posts across 5 niche affiliate sites, made $2, and just spent the weekend rebuilding all 5 frontends from scratch. here’s where i’m at. i know $2 isn’t exactly “quit your day job” money but hear me out.

back in november i launched 5 affiliate sites simultaneously across different n",58,"$2,; $2; $2; $3k; 5k; 50k; 3k; 8.5k",instagram; youtube; amazon; google,2026-03-23 02:26:30,FALSE
reddit,r/juststart,https://reddit.com/r/juststart/comments/1s0z6v1/what_actually_works_for_link_building_and_brand/,What actually works for link building and brand mentions in 2026 (after 2 years of trial and error)What actually works for link building and brand mentions in 2026 (after 2 years of trial and error),pricing,"what actually works for link building and brand mentions in 2026 (after 2 years of trial and error)what actually works for link building and brand mentions in 2026 (after 2 years of trial and error) i’ve been doing seo and digital pr for a while now, and i want to share what’s actually moved the nee",36,30%,instagram; google,2026-03-22 22:21:17,FALSE
reddit,r/juststart,https://reddit.com/r/juststart/comments/1rzs95s/starting_a_financeniche_seocontent_agency_what_do/,Starting a finance-niche SEO/content agency — what do finance professionals actually look for when hiring a marketing agency?,warning,"starting a finance-niche seo/content agency — what do finance professionals actually look for when hiring a marketing agency? hey everyone, i'm doing some market research before launching a content marketing / seo agency focused exclusively on the finance niche, and i'd love to hear from people insi",22,,instagram; youtube; google,2026-03-21 14:02:13,FALSE
reddit,r/juststart,https://reddit.com/r/juststart/comments/1rxgp1k/my_app_got_2000_downloads_in_the_first_day_of/,My app got 2000 downloads in the first day of launching!,growth_tactic,"my app got 2000 downloads in the first day of launching! hey everyone, wanted to share a quick win and the strategy behind it in case it helps anyone else who's building something.

i recently launched a workout app (not linking it here to avoid self-promotion) and hit 2,000 downloads in the first w",28,,instagram; reddit; apple,2026-03-18 21:19:10,FALSE
reddit,r/juststart,https://reddit.com/r/juststart/comments/1rww525/the_fastest_path_to_5kmonth_isnt_a_revolutionary/,the fastest path to $5K/month isn't a revolutionary idea. it's a boring tool that saves someone 4 hours a week. here's how to find one tonight,revenue,the fastest path to $5k/month isn't a revolutionary idea,75,$5K; $5K; $25; $50; $100; $300; $25; $50; $200; $29,instagram; reddit,2026-03-18 06:21:38,FALSE
reddit,r/juststart,https://reddit.com/r/juststart/comments/1rww525/the_fastest_path_to_5kmonth_isnt_a_revolutionary/,the fastest path to $5K/month isn't a revolutionary idea. it's a boring tool that saves someone 4 hours a week. here's how to find one tonight,platform_change,"the fastest path to $5k/month isn't a revolutionary idea. it's a boring tool that saves someone 4 hours a week. here's how to find one tonight everyone on this sub wants to start. the thing that stops most people isn't motivation. it's picking the wrong target.

if your goal is $5k/month, you don't ",74,$5K; $5K; $25; $50; $100; $300; $25; $50; $200; $29,instagram; reddit,2026-03-18 06:21:38,FALSE
reddit_comment,r/juststart,https://reddit.com/r/juststart/comments/1rww525/the_fastest_path_to_5kmonth_isnt_a_revolutionary/,"[comment] This works, but it depends a lot on who you’re targeting. Affiliates and SEO people are a bit differ",revenue,"hitting $5k is realistic, but getting past that without adding complexity or new segments is where it usually stalls",33,$5K; 5K,google,2026-03-18 06:21:38,FALSE
reddit_comment,r/juststart,https://reddit.com/r/juststart/comments/1rww525/the_fastest_path_to_5kmonth_isnt_a_revolutionary/,"[comment] This works, but it depends a lot on who you’re targeting. Affiliates and SEO people are a bit differ",tool," this works, but it depends a lot on who you’re targeting. affiliates and seo people are a bit different from operators or local service folks, since a lot of the “4 hours a week” pain is messy and not always cleanly automatable.

the way i usually sanity check this is not just “does it save time,” ",31,$5K; 5K,google,2026-03-18 06:21:38,FALSE
reddit,r/juststart,https://reddit.com/r/juststart/comments/1rwf17y/was_spending_300mo_on_ads_with_a_05_conversion/,was spending $300/mo on ads with a 0.5% conversion rate — fixed 3 things on my landing page and it doubled,revenue,was spending $300/mo on ads with a 0,48,$300; $300; $300; 0.5%,instagram; google,2026-03-17 18:32:13,FALSE
reddit,r/juststart,https://reddit.com/r/juststart/comments/1rwf17y/was_spending_300mo_on_ads_with_a_05_conversion/,was spending $300/mo on ads with a 0.5% conversion rate — fixed 3 things on my landing page and it doubled,warning,"was spending $300/mo on ads with a 0.5% conversion rate — fixed 3 things on my landing page and it doubled i've been running a small niche site for about a year. started running google ads to it about 6 months ago. traffic was fine, around 800 visits a month, but barely anyone was converting. like 4",48,$300; $300; $300; 0.5%,instagram; google,2026-03-17 18:32:13,FALSE
reddit,r/juststart,https://reddit.com/r/juststart/comments/1rvggis/data_from_15000_urls_on_content_refreshing_only/,"Data from 15,000 URLs on content refreshing: only major expansions work, and your niche matters more than you think",warning,"data from 15,000 urls on content refreshing: only major expansions work, and your niche matters more than you think for anyone building a niche or affiliate site, the refresh-vs-new-content debate is a real resource allocation question. here's data that might help.

we studied 14,987 urls across 20 ",33,100%; 87%; 67%; 63%; 60%; 50%; 14%; 46%; 40%; 44%,instagram,2026-03-16 17:42:59,FALSE
reddit,r/juststart,https://reddit.com/r/juststart/comments/1rsn05g/guys_my_app_just_passed_1300_users/,"Guys my app just passed 1,300 users!",warning,"guys my app just passed 1,300 users! hey guys, you might have seen my previous posts where i was celebrating previous milestones! since then, i've implemented some huge updates because i currently have more time to work on the platform. you should really check it out again :)

i've built indieappcir",24,,instagram; reddit,2026-03-13 13:14:09,FALSE
reddit,r/juststart,https://reddit.com/r/juststart/comments/1rqzpuo/i_launched_a_small_site_in_february_and_im/,I launched a small site in February and I’m experimenting with cluster-first SEO instead of keyword targeting. Watching how Google indexes it.,platform_change,i launched a small site in february and i’m experimenting with cluster-first seo instead of keyword targeting. watching how google indexes it. i’m trying something a little different as a learning project. launched in early february and currently sitting around **\~100 impressions in search console*,38,,instagram; google,2026-03-11 17:10:14,FALSE
reddit,r/juststart,https://reddit.com/r/juststart/comments/1rp5zo2/how_much_time_are_you_actually_spending_on_acf/,How much time are you actually spending on ACF admin vs. real work?,pricing,"how much time are you actually spending on acf admin vs. real work? i’ve been looking at my hours lately and realized i was spending way too much time on basic site admin—specifically with advanced custom fields (acf). every time i started a new project, i was manually recreating field groups or hun",30,,instagram; google,2026-03-09 17:06:32,FALSE
reddit,r/juststart,https://reddit.com/r/juststart/comments/1rmsin6/i_wasted_5_months_manually_pinning_before_i/,I wasted 5 months manually pinning before I figured out Pinterest scheduling actually matters,platform_change,i wasted 5 months manually pinning before i figured out pinterest scheduling actually matters ok i know pinterest comes up here sometimes and people have mixed feelings about it. figured i'd share what happened with my site because i made some genuinely stupid mistakes early on and maybe it saves so,21,4K; 4K; 30K,instagram; youtube; twitter; google,2026-03-06 22:38:18,FALSE
reddit,r/SideProject,https://reddit.com/r/SideProject/comments/1ppr6gh/as_the_year_wraps_up_whats_the_project_youre_most/,As the year wraps up: what’s the project you’re most proud of building and why?,warning,"as the year wraps up: what’s the project you’re most proud of building and why? like the title says, instead of what you built or how much money it made, i’m curious what project you’re most proud of this year and why.

could be a client site, a personal project, something that never launched, or so",24,,,2025-12-18 13:45:29,FALSE
reddit,r/SideProject,https://reddit.com/r/SideProject/comments/1oaq2kx/share_your_notai_projects/,Share your ***Not-AI*** projects,general,"share your ***not-ai*** projects i miss seeing original ideas that aren’t just another ai wrapper.

if you’re building something in 2025 that’s **not ai-related** here’s your space to self-promote.

drop your project here",32,,instagram,2025-10-19 13:47:14,FALSE
reddit,r/SideProject,https://reddit.com/r/SideProject/comments/1se7x8h/i_stopped_telling_people_what_im_building_and_it/,I stopped telling people what I'm building and it actually helped,revenue,"still no life changing revenue, maybe $200 a month",60,$200,instagram,2026-04-06 18:56:56,FALSE
reddit,r/SideProject,https://reddit.com/r/SideProject/comments/1se7x8h/i_stopped_telling_people_what_im_building_and_it/,I stopped telling people what I'm building and it actually helped,warning,"i stopped telling people what i'm building and it actually helped i used to try explaining my side project to everyone. friends, family, coworkers, whoever would listen. and every single time i'd get the same look. that polite nod where you can tell they have no idea what you're talking about and th",60,$200,instagram,2026-04-06 18:56:56,FALSE
reddit_comment,r/SideProject,https://reddit.com/r/SideProject/comments/1se7x8h/i_stopped_telling_people_what_im_building_and_it/,"[comment] Eight months in and $200/month is more real than most people who have an idea.

The stopping-explain",revenue,eight months in and $200/month is more real than most people who have an idea,49,$200,instagram,2026-04-06 18:56:56,FALSE
reddit_comment,r/SideProject,https://reddit.com/r/SideProject/comments/1se7x8h/i_stopped_telling_people_what_im_building_and_it/,"[comment] explaining saas to family is a losing battle. they hear subscription and think netflix, or they hear",revenue,the only opinions that matter are the people paying that $200 a month and the few peers who actually understand why payment integrations are a nightmare,56,$200; $200,instagram,2026-04-06 18:56:56,FALSE
reddit_comment,r/SideProject,https://reddit.com/r/SideProject/comments/1se7x8h/i_stopped_telling_people_what_im_building_and_it/,"[comment] explaining saas to family is a losing battle. they hear subscription and think netflix, or they hear",revenue,congrats on the $200/mo by the way,56,$200; $200,instagram,2026-04-06 18:56:56,FALSE
reddit_comment,r/SideProject,https://reddit.com/r/SideProject/comments/1se7x8h/i_stopped_telling_people_what_im_building_and_it/,"[comment] I usually get - ""I don't get it"" or ""It's not for me - why are you bothering?"" from my wife... I'm n",warning," i usually get - ""i don't get it"" or ""it's not for me - why are you bothering?"" from my wife... i'm now three projects in, two released, one to go...",30,,,2026-04-06 18:56:56,FALSE
reddit,r/SideProject,https://reddit.com/r/SideProject/comments/1se90u5/i_finally_created_an_app_that_hit_whats_next/,I finally created an app that hit. What's next?,warning,"i finally created an app that hit. what's next? created a social app. 

80% 1 tier countries. 

4k users in under 2 months. 

700+ daily active users. 

25 minutes engagement time per day per user 

55% approx retention 

no marketing. 

no social media. 

no advertising whatsoever. 

100-200 daily ",49,80%; 55%; 4k,,2026-04-06 19:33:50,FALSE
reddit_comment,r/SideProject,https://reddit.com/r/SideProject/comments/1se90u5/i_finally_created_an_app_that_hit_whats_next/,"[comment] retention of 55% on a social app is insane, especially with zero marketing. that is your biggest win",warning," retention of 55% on a social app is insane, especially with zero marketing. that is your biggest win. 

  
before you chase vc money, fix the backend. investors will smell a fragile product a mile away. if you have 700 dau now, you are in a good spot to rebuild while the current version runs. 

  
",49,55%; 4k,instagram,2026-04-06 19:33:50,FALSE
reddit,r/SideProject,https://reddit.com/r/SideProject/comments/1se0y79/i_built_an_open_source_ai_worker_desktop_because/,I built an open source AI worker desktop because one-off agents kept handing the work back to me,tool,"i built an open source ai worker desktop because one-off agents kept handing the work back to me i kept running into the same problem with ai agents: they could finish a task, but they never really held the job.  
the work would come back the next day and i was still the one rebuilding context, chec",36,,instagram,2026-04-06 14:47:11,FALSE
reddit,r/SideProject,https://reddit.com/r/SideProject/comments/1sdtt4n/i_built_6_side_projects_in_4_months_heres_the/,I built 6 side projects in ~4 months. Here's the lineup.,general,"i built 6 side projects in ~4 months. here's the lineup. i've been on a building streak recently and wanted to share what i've shipped so far. all solo dev, all live.

&nbsp;

**burn after reading** ([readandburn.app](https://readandburn.app)) - location-based ephemeral messaging for (ios)

drop ano",42,,instagram; apple,2026-04-06 09:15:47,FALSE
reddit_comment,r/SideProject,https://reddit.com/r/SideProject/comments/1sdtt4n/i_built_6_side_projects_in_4_months_heres_the/,[comment] Ashfeld sounds interesting but without any screenshots or videos I‘m definitely not going to link my,tool, ashfeld sounds interesting but without any screenshots or videos i‘m definitely not going to link my discord nor my github to a random page …,32,,,2026-04-06 09:15:47,FALSE
reddit_comment,r/SideProject,https://reddit.com/r/SideProject/comments/1sdtt4n/i_built_6_side_projects_in_4_months_heres_the/,"[comment] You don't want to print ahead for this, and you don't need bulk prints of the same code as one or tw",revenue,"they cost about $25, no ink,  and then you only pay for the paper roll",45,"$25,",amazon,2026-04-06 09:15:47,FALSE
reddit_comment,r/SideProject,https://reddit.com/r/SideProject/comments/1sdtt4n/i_built_6_side_projects_in_4_months_heres_the/,"[comment] You don't want to print ahead for this, and you don't need bulk prints of the same code as one or tw",warning," you don't want to print ahead for this, and you don't need bulk prints of the same code as one or two will be enough. get a small thermal printer on amazon and print qr codes on the go when you're at a particular place. they cost about $25, no ink,  and then you only pay for the paper roll. ",45,"$25,",amazon,2026-04-06 09:15:47,FALSE
