source,subreddit_or_community,post_url,title,signal_type,signal_text,score,extracted_numbers,platform_mentioned,timestamp,processed
reddit_comment,r/WorkOnline,https://reddit.com/r/WorkOnline/comments/1d28xfg/invisible_technologies_warning/,[comment] I work on a different project making over $22/hr.  Different projects have different pay.  They have,revenue,i work on a different project making over $22/hr,30,$22,,2024-05-28 02:29:32,FALSE
reddit_comment,r/WorkOnline,https://reddit.com/r/WorkOnline/comments/1d28xfg/invisible_technologies_warning/,[comment] I work on a different project making over $22/hr.  Different projects have different pay.  They have,warning," i work on a different project making over $22/hr.  different projects have different pay.  they have suggested downloading the hubstaff app, however, i use the browser app for the reasons op mentioned.  

i'm used to being an independent contractor (in fact, i prefer it), so i don't have the same c",30,$22,,2024-05-28 02:29:32,FALSE
reddit,r/WorkOnline,https://reddit.com/r/WorkOnline/comments/1sc4cdg/teaching_english_on_engoo/,Teaching English on Engoo?,general,"teaching english on engoo? hi i applied to an english teacher website called engoo months ago. i am a native english speaker, i am well rounded professionally and actually know about the language. plus i have experience teaching abroad. i still haven’t been approved or onboarded. when have you guys ",24,,,2026-04-04 08:59:52,FALSE
reddit,r/WorkOnline,https://reddit.com/r/WorkOnline/comments/1sa2xmh/transcription_job/,Transcription job,general,"transcription job i'm very new to transcription jobs and i'm unsure if this will be a good deal. is a transcription job for 200 hours of valid audio in the timeline of a month, with 22 dollar/hour a good deal? does this mean i'll get 4.4k dollar (22x200) or is this not what it means?",30,4.4k,,2026-04-02 00:53:26,FALSE
reddit_comment,r/WorkOnline,https://reddit.com/r/WorkOnline/comments/1sa2xmh/transcription_job/,"[comment] You might get $4400 but it probably isn't worth it.  

It often takes an experienced transcriber 3+ ",revenue,you might get $4400 but it probably isn't worth it,50,$4400; $5,instagram,2026-04-02 00:53:26,FALSE
reddit_comment,r/WorkOnline,https://reddit.com/r/WorkOnline/comments/1sa2xmh/transcription_job/,"[comment] You might get $4400 but it probably isn't worth it.  

It often takes an experienced transcriber 3+ ",revenue,that brings you down to being paid less than $5/hour of your time,50,$4400; $5,instagram,2026-04-02 00:53:26,FALSE
reddit,r/WorkOnline,https://reddit.com/r/WorkOnline/comments/1s8lo53/data_annotation_account/,Data annotation account,platform_change,"data annotation account i created an account on data annotation 4 months ago completed the assessment and didn't hear anything from their side. (i wasn't good enough then, but am confident now.)


i assume i got rejected. 


so, i wanna know if i can delete this account and create a new one using th",23,,instagram; youtube,2026-03-31 12:12:25,FALSE
reddit_comment,r/WorkOnline,https://reddit.com/r/WorkOnline/comments/1s8lo53/data_annotation_account/,"[comment] I work for DA, and if you need money right away, DA isn't the place for you.
You can't try again if ",warning," i work for da, and if you need money right away, da isn't the place for you.
you can't try again if you got rejected. the acceptance rate of people who apply is 2% who get hired through the company.  


if you are a lawyer or a doctor or accountant, kind of guessing you're not if you're needing imm",32,2%,instagram; youtube; reddit,2026-03-31 12:12:25,FALSE
reddit_comment,r/WorkOnline,https://reddit.com/r/WorkOnline/comments/1s8lo53/data_annotation_account/,[comment] Yes you can delete it. They will never come back to you. I did 2 lenghty qualifications for them and,tool," yes you can delete it. they will never come back to you. i did 2 lenghty qualifications for them and they never replied not even after months and after i've contacted them.

to me this is the definition of a scam company. i've also reported their ads multiple times on indeed.",22,,,2026-03-31 12:12:25,FALSE
reddit,r/WorkOnline,https://reddit.com/r/WorkOnline/comments/1s8dyn7/is_mindrift_legit_kind_of_but_not_worth_the_effort/,"Is Mindrift Legit? Kind of, but not worth the effort.",revenue,"pay looks to be $20+/hr after you get rolling, but i doubt it",50,$20,instagram,2026-03-31 04:53:22,FALSE
reddit,r/WorkOnline,https://reddit.com/r/WorkOnline/comments/1s8dyn7/is_mindrift_legit_kind_of_but_not_worth_the_effort/,"Is Mindrift Legit? Kind of, but not worth the effort.",pricing,"is mindrift legit? kind of, but not worth the effort. i'm making this post for anyone who may end up googling these guys.

mindrift is another ai training platform. they hire people for all sorts of things to make ai search responses and things like that better. 

at first glance their offers look e",48,$20,instagram,2026-03-31 04:53:22,FALSE
reddit,r/WorkOnline,https://reddit.com/r/WorkOnline/comments/1s8di10/going_back_to_school_what_are_my_best_options_to/,"Going back to school, what are my best options to lead to remote positions?",general,"going back to school, what are my best options to lead to remote positions? i did a search on this sub and didn't find anything. i'm already a licensed pharmacy tech, so i'm thinking medical billing and coding might be good to expand on skills i already have.",19,,instagram; youtube,2026-03-31 04:29:09,FALSE
reddit,r/WorkOnline,https://reddit.com/r/WorkOnline/comments/1s7w13l/how_can_i_make_a_living_as_a_thirdworld_artist/,How can I make a living as a third-world artist?,platform_change,"how can i make a living as a third-world artist? paypal and stripe aren’t available in my country, so i can’t use many platforms.
i used to use payoneer, but my account got banned and i still don’t know why.

right now, my only option is through boosty (which is basically a russian patreon), then wi",21,,instagram; stripe,2026-03-30 16:47:19,FALSE
reddit,r/WorkOnline,https://reddit.com/r/WorkOnline/comments/1s4uzb7/telus_map_exam/,Telus map exam,warning,"telus map exam i recently took a telus map exam where i had around 38–40 pins to rate. i reviewed the guidelines beforehand and tried to follow them carefully during the task.

it’s now been about 5 days, and i never received any email saying whether i passed or failed. but today, they sent me a lin",34,,,2026-03-27 05:07:09,FALSE
reddit,r/WorkOnline,https://reddit.com/r/WorkOnline/comments/1s3e8su/any_gig_website_that_actually_pay_u_a_good_money/,any gig website that actually pay u a good money even if am in a third world country,general,any gig website that actually pay u a good money even if am in a third world country can somebody help me with some websites cause i really want some side money i can make in my free time cause the minimum monthly wage in my country is 200-400 $ a month ,27,,instagram,2026-03-25 15:38:51,FALSE
reddit,r/WorkOnline,https://reddit.com/r/WorkOnline/comments/1s01por/best_transcription_jobs_in_2026/,Best Transcription jobs in 2026?,warning,"best transcription jobs in 2026? anyone have recommendations for transcription jobs for 2026? i'm sure it's a loaded question since people may not want to share where they work since it would increase competition but thought i'd try anyway.

i worked for one online company on and off for years but t",24,,,2026-03-21 20:22:26,FALSE
reddit,r/WorkOnline,https://reddit.com/r/WorkOnline/comments/1rwv1h7/live_chat_agent/,Live chat agent,platform_change,live chat agent i currently moved to vietnam with my husband. i am looking for some remote jobs like customer service. i don't know if it is easy to find a job like that. i am authorized for work in vietnam and the united states by the way.,16,,,2026-03-18 05:19:21,FALSE
reddit,r/WorkOnline,https://reddit.com/r/WorkOnline/comments/1rucyn1/any_idea_for_remote_work_that_pay_with_bank/,Any idea for remote work that pay with bank transfer not PayPal or something else?,platform_change,any idea for remote work that pay with bank transfer not paypal or something else? ,16,,,2026-03-15 12:37:05,FALSE
reddit,r/WorkOnline,https://reddit.com/r/WorkOnline/comments/1rtxait/any_remote_work_recommendations_from_italy/,Any remote work recommendations from Italy?,platform_change,"any remote work recommendations from italy? hi everyone, i've been looking for a proper remote job that i can have from italy.
i'm currently half bed ridden so i really need something that works and i have all the time in the world honestly.
i speak multiple languages.

what i already use: (which is",16,,youtube,2026-03-14 22:42:40,FALSE
reddit,r/beermoney,https://reddit.com/r/beermoney/comments/1qveb14/the_most_common_beermoney_sites_please_dont/,The Most Common BeerMoney Sites: Please Don't Create Threads Or Comments Promoting These,revenue,"1,000 coins = $1",53,$1; $0.50; $7.50; 90%,amazon; apple,2026-02-04 04:05:18,FALSE
reddit,r/beermoney,https://reddit.com/r/beermoney/comments/1qveb14/the_most_common_beermoney_sites_please_dont/,The Most Common BeerMoney Sites: Please Don't Create Threads Or Comments Promoting These,revenue,">↪ age minimum: 13+

>↪ offers: surveys, offer walls and tasks

>↪ payout: [**low minimum cashout starting at $0",53,$1; $0.50; $7.50; 90%,amazon; apple,2026-02-04 04:05:18,FALSE
reddit,r/beermoney,https://reddit.com/r/beermoney/comments/1qveb14/the_most_common_beermoney_sites_please_dont/,The Most Common BeerMoney Sites: Please Don't Create Threads Or Comments Promoting These,platform_change,"the most common beermoney sites: please don't create threads or comments promoting these ##**[gain.gg](https://gain.gg/r/beermoneygain?utm_source=beermoney)** [international*]

new users can start out with **100 coins** by using the above [link](https://gain.gg/r/beermoneygain?utm_source=beermoney).",52,$1; $0.50; $7.50; 90%,amazon; apple,2026-02-04 04:05:18,FALSE
reddit,r/beermoney,https://reddit.com/r/beermoney/comments/1s95dlh/who_paid_you_forin_march_2026/,Who Paid You For/In March 2026?,warning,"who paid you for/in march 2026? hello,

if you feel like sharing any /r/beermoney sites that paid you in marach 2026, please feel free to do so below.

here is [last month's](https://www.reddit.com/r/beermoney/comments/1rhjd9t/who_paid_you_forin_february_2026/) post. 

here is our list of the **[mos",48,,reddit,2026-04-01 00:37:19,FALSE
reddit,r/beermoney,https://reddit.com/r/beermoney/comments/1scz2a2/flash_survey_panel/,Flash Survey Panel?,general,flash survey panel? i just finished a survey and after it took me to a page inviting me to a survey panel called flash survey panel. it's asking for my email to join. has anyone heard of it or is part of it? is it legit?,24,,,2026-04-05 09:15:50,FALSE
reddit_comment,r/beermoney,https://reddit.com/r/beermoney/comments/1scz2a2/flash_survey_panel/,[comment] Never heard of that one but survey panels that pop up right after you finish another survey are usua,platform_change," never heard of that one but survey panels that pop up right after you finish another survey are usually sketchy as hell 💀 they're banking on you being in that ""just made some money"" mood to sign up for whatever. 

  
i'd skip it and stick with the established ones like swagbucks or inboxdollars. if",24,,instagram,2026-04-05 09:15:50,FALSE
reddit,r/beermoney,https://reddit.com/r/beermoney/comments/1sci2ei/dscout_diary_mission_questions/,Dscout Diary Mission Questions,revenue,"dscout diary mission questions hi everyone, i’m completely new to dscout and i got this diary mission that pays $175, i’m confused because it randomly invited me",51,"$175,",,2026-04-04 19:19:30,FALSE
reddit,r/beermoney,https://reddit.com/r/beermoney/comments/1sbsa2q/studies_being_deleted_from_ui_dashboard/,studies being deleted from UI dashboard?,revenue,it's happened to me twice this week and now i feel like i got scammed and won't get paid for 2 studies that i did for over $100+,49,$100,,2026-04-03 22:44:41,FALSE
reddit,r/beermoney,https://reddit.com/r/beermoney/comments/1sbsa2q/studies_being_deleted_from_ui_dashboard/,studies being deleted from UI dashboard?,warning,studies being deleted from ui dashboard? anyone have issues on userinterviews lately? i've been having a specific issue where the study will disappear from my dashboard after i've completed it and there's no way for me to contact the researcher anymore. i messaged ui support and they said it's not n,49,$100,,2026-04-03 22:44:41,FALSE
reddit,r/beermoney,https://reddit.com/r/beermoney/comments/1sbroow/fieldwork_market_research_payment_process_help/,Fieldwork Market Research Payment Process Help,platform_change,"fieldwork market research payment process help i hope y'all can help me and others in the future who might be looking for the same answers..

  
has anyone ever used fieldwork before or online or in person focus group..

  
when you're emailed the payment through rewards or virtual how does someone ",23,,instagram,2026-04-03 22:19:44,FALSE
reddit,r/beermoney,https://reddit.com/r/beermoney/comments/1sbliya/pixel_point_tv_not_showing_ads_anymore_i_used_to/,Pixel Point TV not showing ads anymore? I used to get at least 100 points per day running it for a couple hours on my laptop but now I’m barely making it to 25 points.,revenue,i made it to $1,46,$1.80,google,2026-04-03 18:24:28,FALSE
reddit,r/beermoney,https://reddit.com/r/beermoney/comments/1sbliya/pixel_point_tv_not_showing_ads_anymore_i_used_to/,Pixel Point TV not showing ads anymore? I used to get at least 100 points per day running it for a couple hours on my laptop but now I’m barely making it to 25 points.,warning,pixel point tv not showing ads anymore? i used to get at least 100 points per day running it for a couple hours on my laptop but now i’m barely making it to 25 points. i have been running pixel point tv via lootup.me for four to five hours a couple times a week on my laptop. i typically can get a mi,46,$1.80,google,2026-04-03 18:24:28,FALSE
reddit,r/beermoney,https://reddit.com/r/beermoney/comments/1sb9rjp/im_giving_up_on_toloka/,I'm giving up on Toloka.,warning,"i'm giving up on toloka.   
after hours and hours of trying to pass, i have to wait until 2027.

**we’re sorry, but your access to this annotation project is temporarily suspended.**

* **reason:** you have exceeded the maximum number of training attempts within the allowed interval.
* **suspension ",31,,,2026-04-03 10:23:28,FALSE
reddit,r/beermoney,https://reddit.com/r/beermoney/comments/1sb33c1/is_walkboost_a_scam/,Is “WalkBoost” a scam?,warning,is “walkboost” a scam? it accumulates money too easily and im wondering if i will be able to withdraw anything once i have reached 35$ as it requires. i haven’t seen anyone talk about this app and don’t want to waste time on a scam. to distinguish which app i mean its the one named walkboost and the,24,,youtube,2026-04-03 03:57:53,FALSE
reddit,r/beermoney,https://reddit.com/r/beermoney/comments/1sb19m0/is_anyone_on_the_screenwise_panel/,Is anyone on the Screenwise Panel?,general,"is anyone on the screenwise panel? i have a router etc i have been on this for about 4 years. last time, they just had an extension.  anyway, two days ago i got a notice of a new device on my network it keeps popping up. does anyone know how to disable this notice? i called them and was told they ha",24,,,2026-04-03 02:28:46,FALSE
reddit,r/beermoney,https://reddit.com/r/beermoney/comments/1samu2h/paidviewpoint_is_a_survey_platform_that_pays/,PaidViewpoint is a survey platform that pays users through PayPal for answering short surveys,revenue,"the only one i’ve kept using is paidviewpoint because:

* you never get disqualified after starting a survey
* most surveys take only 2–10 minutes
* you can cash out to paypal
* the more active you are, the more surveys you get

i haven’t reached the $15 minimum cashout yet, but so far the surveys h",50,$15 m,,2026-04-02 16:51:40,FALSE
reddit,r/beermoney,https://reddit.com/r/beermoney/comments/1samu2h/paidviewpoint_is_a_survey_platform_that_pays/,PaidViewpoint is a survey platform that pays users through PayPal for answering short surveys,warning,"paidviewpoint is a survey platform that pays users through paypal for answering short surveys i tested a lot of survey websites, and most of them either pay very little or kick you out after a few questions.

the only one i’ve kept using is paidviewpoint because:

* you never get disqualified after ",50,$15 m,,2026-04-02 16:51:40,FALSE
reddit_comment,r/beermoney,https://reddit.com/r/beermoney/comments/1samu2h/paidviewpoint_is_a_survey_platform_that_pays/,[comment] Paidviewpoint is one my favorites. They don't waste people time. ,warning, paidviewpoint is one my favorites. they don't waste people time. ,24,,,2026-04-02 16:51:40,FALSE
reddit,r/beermoney,https://reddit.com/r/beermoney/comments/1saxcl7/serpclix_anyone_else_not_getting_clicks_recently/,SerpClix – Anyone Else Not Getting Clicks Recently?,general,"serpclix – anyone else not getting clicks recently? i’ve been using serpclix since december 2022, and up until recently i was getting a steady flow of clicks. however, starting around march 2026, my clicks have completely dropped off.

i’m wondering if it could be related to the current serpclix ver",26,,google,2026-04-02 23:31:27,FALSE
reddit,r/beermoney,https://reddit.com/r/beermoney/comments/1s9lyc5/very_grateful_for_this_subreddit/,very grateful for this subreddit,pricing,"very grateful for this subreddit i'm disabled and not able to find work in this market. i know surveys aren't enough to pay the bills, but since i live with my bf, i want to contribute any way i can. the money i make from surveys is enough for small grocery runs or enough to treat him to a coffee at",38,,reddit,2026-04-01 14:20:48,FALSE
reddit,r/beermoney,https://reddit.com/r/beermoney/comments/1s84owa/lastpass_class_action_lawsuit/,Lastpass Class Action lawsuit,revenue,"i had the free account, so i'll likely only get $25 but i think paid users or those who had some crypto dealings with them (i skimmed, since those didn't apply to me) could get as much as $300",43,$25; $300,,2026-03-30 21:56:48,FALSE
reddit_comment,r/beermoney,https://reddit.com/r/beermoney/comments/1s84owa/lastpass_class_action_lawsuit/,"[comment] I got $80 from a walmart class action suit last year, it's worth a shot",revenue,"i got $80 from a walmart class action suit last year, it's worth a shot",28,$80,,2026-03-30 21:56:48,FALSE
reddit,r/beermoney,https://reddit.com/r/beermoney/comments/1s891sm/zombie_apocalypse_doomsday_z_offer_guide_tips/,"Zombie Apocalypse: Doomsday – Z Offer Guide | Tips, Tricks & Max Payout Strategy (US, CA, UK, DE, FR)",revenue,i signed up to cashinstyle through beermoney to earn an extra $2 on my first $10 earnings,61,$2; $10; $159.43; $236.99; $12,instagram; android,2026-03-31 01:01:12,FALSE
reddit,r/beermoney,https://reddit.com/r/beermoney/comments/1s891sm/zombie_apocalypse_doomsday_z_offer_guide_tips/,"Zombie Apocalypse: Doomsday – Z Offer Guide | Tips, Tricks & Max Payout Strategy (US, CA, UK, DE, FR)",pricing,"zombie apocalypse: doomsday – z offer guide | tips, tricks & max payout strategy (us, ca, uk, de, fr) this is a fairly simple game to get hold of. it is simply a first-person shooter game with various waves of zombies. i decided to complete this on cashinstyle as they were paying the highest at the ",59,$2; $10; $159.43; $236.99; $12,instagram; android,2026-03-31 01:01:12,FALSE
reddit,r/beermoney,https://reddit.com/r/beermoney/comments/1s7r9x3/comparison_of_passive_walking_apps/,Comparison of (passive) walking apps?,pricing,"comparison of (passive) walking apps? apologies if this is in the wiki, i couldn't find anything about step counters. i also searched the sub but the posts were quite old. i'm using cash walk right now, and starting to try some others. what's the best setup? my priorities are low interaction, and hi",19,,instagram; youtube,2026-03-30 13:55:28,FALSE
reddit_comment,r/beermoney,https://reddit.com/r/beermoney/comments/1s7r9x3/comparison_of_passive_walking_apps/,[comment] I use Weward. I can make $55 every two months if you combine a few of their surveys with the steps.,revenue,i can make $55 every two months if you combine a few of their surveys with the steps,32,$55,,2026-03-30 13:55:28,FALSE
reddit,r/beermoney,https://reddit.com/r/beermoney/comments/1s74o66/cashsurveys_opinion_rewards/,Cashsurveys: opinion rewards,revenue,"she said she was up $100 on surveys after about 2 hours, which set off my alarms",52,"$100; $175,; $5; 99%",instagram; youtube; google,2026-03-29 19:36:42,FALSE
reddit,r/beermoney,https://reddit.com/r/beermoney/comments/1s74o66/cashsurveys_opinion_rewards/,Cashsurveys: opinion rewards,revenue,"she also said she can only cash out above $175, which set off more alarms for me",52,"$100; $175,; $5; 99%",instagram; youtube; google,2026-03-29 19:36:42,FALSE
reddit,r/beermoney,https://reddit.com/r/beermoney/comments/1s74o66/cashsurveys_opinion_rewards/,Cashsurveys: opinion rewards,warning,"cashsurveys: opinion rewards hey everyone, 
i've been doing surveys on very legit sites with no problems. today my friend, who is new to surveys, has been  on cashsurveys: opinion rewards. she said she was up $100 on surveys after about 2 hours, which set off my alarms. she also said she can only ca",52,"$100; $175,; $5; 99%",instagram; youtube; google,2026-03-29 19:36:42,FALSE
reddit,r/beermoney,https://reddit.com/r/beermoney/comments/1s634gv/does_anyone_know_any_apps_or_sites_that_reward/,Does anyone know any apps or sites that reward Greggs gift cards?,general,"does anyone know any apps or sites that reward greggs gift cards? i know it's mad specific but yk, nothing like a free sausage roll and a coffee",17,,,2026-03-28 15:19:20,FALSE
reddit,r/beermoney,https://reddit.com/r/beermoney/comments/1s62z68/tide_150_bonus_does_anyone_know_of_any/,Tide £150 bonus: Does anyone know of any transactions eligible excl.. spending £500?,general,"tide £150 bonus: does anyone know of any transactions eligible excl.. spending £500? to achieve the bonus you need to make £500 in purchases within 3 months. 

paypal and t212 funding doesn’t seem to do the job.

does anyone have any other workarounds? ",19,,instagram,2026-03-28 15:13:41,FALSE
reddit,r/beermoney,https://reddit.com/r/beermoney/comments/1s5h2lg/warning_luelai_yc_w26_wage_theft_73_retroactive/,[WARNING] Luel.ai (YC W26) Wage Theft: 73% Retroactive Pay Cut & Support Bot-Looping,revenue,"the bait-and-switch:
we agreed on a rate of $15/hr",65,"$15; $4.20; $15; $33; $33,; $3,300; 73%; 100%; 73%",instagram; twitter; stripe,2026-03-27 21:22:44,FALSE
reddit,r/beermoney,https://reddit.com/r/beermoney/comments/1s5h2lg/warning_luelai_yc_w26_wage_theft_73_retroactive/,[WARNING] Luel.ai (YC W26) Wage Theft: 73% Retroactive Pay Cut & Support Bot-Looping,revenue,"after i delivered the specialized engineering files, they retroactively slashed the pay to $4",65,"$15; $4.20; $15; $33; $33,; $3,300; 73%; 100%; 73%",instagram; twitter; stripe,2026-03-27 21:22:44,FALSE
reddit,r/beermoney,https://reddit.com/r/beermoney/comments/1s5h2lg/warning_luelai_yc_w26_wage_theft_73_retroactive/,[WARNING] Luel.ai (YC W26) Wage Theft: 73% Retroactive Pay Cut & Support Bot-Looping,warning,"[warning] luel.ai (yc w26) wage theft: 73% retroactive pay cut & support bot-looping i am an electrical engineering student. i recently performed 132 minutes of expert proteus design suite simulations for luel.ai (yc w26).
the bait-and-switch:
we agreed on a rate of $15/hr. after i delivered the spe",65,"$15; $4.20; $15; $33; $33,; $3,300; 73%; 100%; 73%",instagram; twitter; stripe,2026-03-27 21:22:44,FALSE
reddit_comment,r/beermoney,https://reddit.com/r/beermoney/comments/1s5h2lg/warning_luelai_yc_w26_wage_theft_73_retroactive/,"[comment] Is this one of those companies where you are paid to make training data for the ai? If so, this is e",warning," is this one of those companies where you are paid to make training data for the ai? if so, this is exactly why i would never do work for them. they are all as sus as it gets",22,,,2026-03-27 21:22:44,FALSE
reddit,r/beermoney,https://reddit.com/r/beermoney/comments/1s5kiii/i_have_2852_visa_prepaid_cards_from_beermoney/,I have $28.52 visa prepaid cards from beermoney that I can only use online. What’s a good place to spend this? I like pretty much everything but I’m having a dry year for health reasons.,revenue,i have $28,39,$28.52,instagram; youtube; apple,2026-03-27 23:39:15,FALSE
reddit,r/beermoney,https://reddit.com/r/beermoney/comments/1s5753o/shopkick_shut_down/,Shopkick shut down,warning,"shopkick shut down looks like shopkick has shut down. it's no longer on the app store, their website goes to a 404 error page, and [one of their employees made a post about it.](https://www.linkedin.com/posts/joshua-lovejoy-b7333215b_opentowork-growthmarketing-performancemarketing-activity-744298136",32,,linkedin; apple,2026-03-27 15:21:19,FALSE
reddit,r/AppBusiness,https://reddit.com/r/AppBusiness/comments/1se4vwq/enfin_trouvé_le_meilleur_fournisseur_iptv_en/,"Enfin trouvé le meilleur fournisseur IPTV en Belgique qui assure vraiment (Meilleur Avis Reddit IPTV 2026) Ceci est mon avis honnête sur la manière d'obtenir un abonnement IPTV fiable et stable en Belgique en 2026, sans payer les prix exorbitants de Proximus ou Telenet.",general,"enfin trouvé le meilleur fournisseur iptv en belgique qui assure vraiment (meilleur avis reddit iptv 2026) ceci est mon avis honnête sur la manière d'obtenir un abonnement iptv fiable et stable en belgique en 2026, sans payer les prix exorbitants de proximus ou telenet. ",40,,reddit,2026-04-06 17:08:50,FALSE
