source,subreddit_or_community,post_url,title,signal_type,signal_text,score,extracted_numbers,platform_mentioned,timestamp,processed
reddit,r/EntrepreneurRideAlong,https://reddit.com/r/EntrepreneurRideAlong/comments/1sdfodw/building_a_product_health_scoring_platform_with/,"Building a product health scoring platform with my wife while working full time. 2 months in, $400 spent, first affiliate revenue just hit!",revenue,"2 months in, $400 spent, first affiliate revenue just hit! we built partiqule (partiqule",65,$400; $3.99; $5.84; $400; $3.99; $100k; 76%; 152%; 87%; 100k,instagram; youtube; amazon; apple; vercel,2026-04-05 21:29:35,FALSE
reddit,r/EntrepreneurRideAlong,https://reddit.com/r/EntrepreneurRideAlong/comments/1sdfodw/building_a_product_health_scoring_platform_with/,"Building a product health scoring platform with my wife while working full time. 2 months in, $400 spent, first affiliate revenue just hit!",revenue,now unit economics work at $3,65,$400; $3.99; $5.84; $400; $3.99; $100k; 76%; 152%; 87%; 100k,instagram; youtube; amazon; apple; vercel,2026-04-05 21:29:35,FALSE
reddit,r/EntrepreneurRideAlong,https://reddit.com/r/EntrepreneurRideAlong/comments/1sd1c2t/i_tracked_the_hours_i_worked_for_a_month/,I tracked the hours I worked for a month,warning,"i tracked the hours i worked for a month i started time tracking last month to figure out where my day actually and i thought i was being productive, but i was wrong.

so i logged 160 hours of work, which were divided into these tasks: 

 \- 52 hours in meetings that could have been emails, that's a",44,15%; 60%,instagram,2026-04-05 11:34:08,FALSE
reddit,r/EntrepreneurRideAlong,https://reddit.com/r/EntrepreneurRideAlong/comments/1sctj3e/ive_spent_6_months_building_a_saas_in_a_vacuum/,ive spent 6 months building a saas in a vacuum and watching solo devs compress the whole startup timeline into 48 hours just gave me a massive reality check,platform_change,"ive spent 6 months building a saas in a vacuum and watching solo devs compress the whole startup timeline into 48 hours just gave me a massive reality check ive spent the last 6 months treating my saas like a traditional startup. you know the drill. obsessing over the perfect tech stack, mapping out",59,,instagram,2026-04-05 03:53:58,FALSE
reddit_comment,r/EntrepreneurRideAlong,https://reddit.com/r/EntrepreneurRideAlong/comments/1sctj3e/ive_spent_6_months_building_a_saas_in_a_vacuum/,[comment] I built 15 products in a few months with AI. Mass produced them honestly. None of them made it to la,warning," i built 15 products in a few months with ai. mass produced them honestly. none of them made it to launch - bugs, defects, stuff half working. the ones that got close, i had no idea how to actually get them in front of anyone. but that's the thing - now i know exactly where the gaps are. building, s",35,,,2026-04-05 03:53:58,FALSE
reddit_comment,r/EntrepreneurRideAlong,https://reddit.com/r/EntrepreneurRideAlong/comments/1sctj3e/ive_spent_6_months_building_a_saas_in_a_vacuum/,"[comment] You're probably getting further than you think in the time, and the hackathon lot don't achieve anyw",warning," you're probably getting further than you think in the time, and the hackathon lot don't achieve anywhere as much as you think.


very rarely are things really at the extremes. there's nuance.",25,,,2026-04-05 03:53:58,FALSE
reddit,r/EntrepreneurRideAlong,https://reddit.com/r/EntrepreneurRideAlong/comments/1scqt3x/can_the_mods_actually_start_banning_ai_on_this/,Can the mods actually start banning AI on this subreddit?,platform_change,can the mods actually start banning ai on this subreddit? half of the posts here are written with ai. probably 5/6s of the posts are written by people promoting a product or service in a spammy fashion (posting the same post onto multiple subreddits). it would be relatively easy to get rid of both o,32,,reddit,2026-04-05 01:37:30,FALSE
reddit_comment,r/EntrepreneurRideAlong,https://reddit.com/r/EntrepreneurRideAlong/comments/1scqt3x/can_the_mods_actually_start_banning_ai_on_this/,"[comment] Hello! I say it every time - people have to report posts/comments for them to get removed. 

I have ",platform_change," hello! i say it every time - people have to report posts/comments for them to get removed. 

i have a standing post stickied here looking for moderators and out of the hundreds that have applied not a single one of them wasn't actively trying to become a moderator to sell/promote something.",24,,,2026-04-05 01:37:30,FALSE
reddit,r/EntrepreneurRideAlong,https://reddit.com/r/EntrepreneurRideAlong/comments/1scw2n9/whats_the_one_skill_you_didnt_expect_to_need_as_a/,whats the one skill you didnt expect to need as a founder that ended up being the most important?,general,whats the one skill you didnt expect to need as a founder that ended up being the most important? for me it was learning how to build systems. i thought the hard part was getting customers but the real challenge was keeping everything running without me personally doing every task. the day i stopped,34,,youtube,2026-04-05 06:11:17,FALSE
reddit,r/Affiliatemarketing,https://reddit.com/r/Affiliatemarketing/comments/osqd49/affiliate_guide_click_here_to_get_started/,⭐Affiliate Guide - Click here to get started⭐,general,⭐affiliate guide - click here to get started⭐ ,23,,,2021-07-27 16:37:31,FALSE
reddit,r/Affiliatemarketing,https://reddit.com/r/Affiliatemarketing/comments/1o3kezb/affiliate_marketing_offers_mega_thread_all/,$AFFILIATE MARKETING OFFERS MEGA THREAD$ (All affiliate offers MUST be placed in this thread),platform_change,"$affiliate marketing offers mega thread$ (all affiliate offers must be placed in this thread) if you want to post your affiliate offer for marketers to consider, this is the place for you. please follow all sub-rules, including the requirement to join the sub to post. this post will be cleaned out o",19,,instagram,2025-10-11 02:44:32,FALSE
reddit_comment,r/Affiliatemarketing,https://reddit.com/r/Affiliatemarketing/comments/1o3kezb/affiliate_marketing_offers_mega_thread_all/,[comment] 80-100% commission of profit OFFER! Recently released a self-improvement and positive habit-building,growth_tactic," 80-100% commission of profit offer! recently released a self-improvement and positive habit-building application called veer on the google play store. (link - [https://play.google.com/store/apps/details?id=com.veer.app](https://play.google.com/store/apps/details?id=com.veer.app) )

to help promote ",21,100%; 100%; 80%,google; android,2025-10-11 02:44:32,FALSE
reddit,r/Affiliatemarketing,https://reddit.com/r/Affiliatemarketing/comments/1se29et/adult_ai_affiliate_program_paying_upto_65_cpa/,Adult AI affiliate program paying up-to $65 CPA — highest I've seen in this niche right now,revenue,adult ai affiliate program paying up-to $65 cpa — highest i've seen in this niche right now just got access to an affiliate program paying up to $65 cpa in the adult ai space,64,$65; $65; $50; $55; $65; 40%; 50%,instagram,2026-04-06 15:34:44,FALSE
reddit,r/Affiliatemarketing,https://reddit.com/r/Affiliatemarketing/comments/1sdzzek/the_stake_marketing_phenomenon_part_2/,"The Stake Marketing Phenomenon, part 2",revenue,"promotions

$50k weekly challenge, btc giveaways, biggest multiplier contests, rake races",52,$50K; 50K,instagram; reddit,2026-04-06 14:11:39,FALSE
reddit,r/Affiliatemarketing,https://reddit.com/r/Affiliatemarketing/comments/1sdzzek/the_stake_marketing_phenomenon_part_2/,"The Stake Marketing Phenomenon, part 2",platform_change,"the stake marketing phenomenon, part 2 hello, affiliates!

  
you can read my first part of this post here:

[https://www.reddit.com/r/affiliatemarketing/comments/1sc8dm3/the\_stake\_marketing\_phenomenon\_part\_1/](https://www.reddit.com/r/affiliatemarketing/comments/1sc8dm3/the_stake_marketing_phe",51,$50K; 50K,instagram; reddit,2026-04-06 14:11:39,FALSE
reddit,r/Affiliatemarketing,https://reddit.com/r/Affiliatemarketing/comments/1sdtx2u/why_your_brand_doesnt_show_up_in_chatgpt_and_how/,Why your brand doesn’t show up in ChatGPT (and how to fix it),tool,"why your brand doesn’t show up in chatgpt (and how to fix it) been testing this on a few affiliate + local projects because we weren’t showing up in ai answers at all.

after a couple months, here’s what actually changed things:

1. “seo content” alone does nothing  
had pages ranking in google but ",33,,instagram; youtube; google; reddit,2026-04-06 09:22:36,FALSE
reddit,r/Affiliatemarketing,https://reddit.com/r/Affiliatemarketing/comments/1sdxttn/ive_been_to_6_igaming_conferences_in_3_years_and/,I’ve been to 6 iGaming conferences in 3 years and here’s what I noticed,competition,"i’ve been to 6 igaming conferences in 3 years and here’s what i noticed i’ve attended 6 igaming conferences in 3 years, and i wanted to share what makes a difference in these events. a lot of people end up wasting time at these conferences, thinking they’ll come away with deals, but it’s not that si",34,,instagram,2026-04-06 12:44:19,FALSE
reddit,r/Affiliatemarketing,https://reddit.com/r/Affiliatemarketing/comments/1sda3e4/get_free_keywords_scans_looking_for_test_users/,"Get free keywords scans, looking for test users",competition,"get free keywords scans, looking for test users hey! 

i am a developer of an app that helps affiliates find competitors google ads by scanning keywords, live scans with screenshots, not historical/archived data. if you're interested comment below, thanks.",22,,google,2026-04-05 17:49:13,FALSE
reddit,r/Affiliatemarketing,https://reddit.com/r/Affiliatemarketing/comments/1sd9f6f/ai_customer_support_would_this_work_as_an/,AI Customer Support: Would this work as an affiliate program?,revenue,subscriptions then start at $30/month,47,$30,instagram; stripe,2026-04-05 17:23:20,FALSE
reddit,r/Affiliatemarketing,https://reddit.com/r/Affiliatemarketing/comments/1sd9f6f/ai_customer_support_would_this_work_as_an/,AI Customer Support: Would this work as an affiliate program?,pricing,"ai customer support: would this work as an affiliate program? i developed an ai customer support and lead platform, which i won't link to as there's a rule against promotion. anyway, it doesn't have an affiliate program, and i'm currently stuck for marketing because that's not my strong suit. i want",45,$30,instagram; stripe,2026-04-05 17:23:20,FALSE
reddit,r/Affiliatemarketing,https://reddit.com/r/Affiliatemarketing/comments/1scznby/did_anyone_try_discord_giveaways/,Did anyone try discord giveaways?,general,"did anyone try discord giveaways? hello ive been thinking lately of making a discord giveaway for 5$ or 10$ gift card with the only requirement to sign up through my referral link, would this work out and do giveaway servers allow it?",24,,instagram,2026-04-05 09:53:29,FALSE
reddit,r/Affiliatemarketing,https://reddit.com/r/Affiliatemarketing/comments/1sd0gxj/working_on_an_affiliate_page_for_my_product_and/,working on an affiliate page for my product and would love some honest feedback,revenue,"com/affiliate)

main offer is:  
40% lifetime commission  
$48 upfront on annual referrals  
monthly payouts  
60-day cookie

especially curious about:

* clarity
* trust
* anything missing before launch",55,$48; 40%,youtube,2026-04-05 10:44:07,FALSE
reddit,r/Affiliatemarketing,https://reddit.com/r/Affiliatemarketing/comments/1scgju5/10kmonth_after_3_years_here_is_my_simple_strategy/,$10k/Month after 3 Years: Here Is my Simple Strategy,revenue,"$10k/month after 3 years: here is my simple strategy for me, it’s time to move on from affiliate marketing",65,$10k; 10k,instagram; amazon; google,2026-04-04 18:19:28,FALSE
reddit,r/Affiliatemarketing,https://reddit.com/r/Affiliatemarketing/comments/1scgju5/10kmonth_after_3_years_here_is_my_simple_strategy/,$10k/Month after 3 Years: Here Is my Simple Strategy,pricing,"$10k/month after 3 years: here is my simple strategy for me, it’s time to move on from affiliate marketing. not because it completely stopped working. more because i’m just tired of it. i did well, made enough money to start something new, and i don’t really feel like grinding this game forever. but",63,$10k; 10k,instagram; amazon; google,2026-04-04 18:19:28,FALSE
reddit,r/Affiliatemarketing,https://reddit.com/r/Affiliatemarketing/comments/1sco78c/anyone_else_spend_hours_digging_through_reddit/,anyone else spend hours digging through reddit for affiliate opportunities?,tool,"anyone else spend hours digging through reddit for affiliate opportunities? i swear half my time used to be just scrolling for people asking about products i could link. found a tool called leadsfromurl that actually finds those conversations for me, which has been pretty wild for commissions this p",33,,instagram; reddit,2026-04-04 23:34:43,FALSE
reddit,r/Affiliatemarketing,https://reddit.com/r/Affiliatemarketing/comments/1sckime/too_much_grind_and_no_gain/,Too much grind and no gain,platform_change,"too much grind and no gain hello, i was hired by a platform that pays people for clipping content, they pay me for advertising the platform through a referral link and told me to promote it on reddit posts, the issue here is that the platform is legit and my posts are legit but the strategy looks sc",34,,instagram; reddit,2026-04-04 20:57:25,FALSE
reddit,r/Affiliatemarketing,https://reddit.com/r/Affiliatemarketing/comments/1sc6lm8/over_500_clicks_but_no_purchase_help/,Over 500 clicks but no purchase. Help!,general,"over 500 clicks but no purchase. help! hi everyone, i started amazon affiliate marketing on a facebook page. most of my audience are women in their 50’s. i tried to use ai to get suggestions of products that will sell. 

however, there are days that i will get over 500 clicks but no sale. i have bee",31,,amazon; facebook,2026-04-04 11:15:43,FALSE
reddit_comment,r/Affiliatemarketing,https://reddit.com/r/Affiliatemarketing/comments/1sc6lm8/over_500_clicks_but_no_purchase_help/,"[comment] Oh yes, it happens. Affiliate marketing is a numbers game even if you're able to laser-target potent",warning," oh yes, it happens. affiliate marketing is a numbers game even if you're able to laser-target potential customers.  don't give up. keep trying and the small numbers will eventually grow. remember to also keep tweaking your niche. ai doesn't always get it right you know.",25,,instagram,2026-04-04 11:15:43,FALSE
reddit_comment,r/Affiliatemarketing,https://reddit.com/r/Affiliatemarketing/comments/1sc6lm8/over_500_clicks_but_no_purchase_help/,"[comment] Man, that 500 click mark is like the classic affiliate ""valley of death"" lol. Honestly, if you're ge",platform_change," man, that 500 click mark is like the classic affiliate ""valley of death"" lol. honestly, if you're getting the clicks but zero sales, it's almost never the traffic it's the handoff. i'd check two things immediately: first, make sure you aren't bidding on ""how to"" or diy keywords where people just wa",40,,,2026-04-04 11:15:43,FALSE
reddit,r/Affiliatemarketing,https://reddit.com/r/Affiliatemarketing/comments/1scalw2/is_it_just_me_or_are_affiliate_payouts_really/,Is it just me or are affiliate payouts really unpredictable with brands?,tool,"is it just me or are affiliate payouts really unpredictable with brands? i’ve been trying affiliate marketing recently, and one thing that’s been bothering me is payouts.

when working directly with brands, things don’t always feel reliable…

sometimes payments get delayed, sometimes tracking isn’t ",23,,,2026-04-04 14:26:13,FALSE
reddit,r/Affiliatemarketing,https://reddit.com/r/Affiliatemarketing/comments/1sc8dm3/the_stake_marketing_phenomenon_part_1/,"The Stake Marketing Phenomenon, part 1",revenue,we’ll explore how two guys built a $2,52,$2,instagram,2026-04-04 12:48:02,FALSE
reddit,r/Affiliatemarketing,https://reddit.com/r/Affiliatemarketing/comments/1sc8dm3/the_stake_marketing_phenomenon_part_1/,"The Stake Marketing Phenomenon, part 1",platform_change,"the stake marketing phenomenon, part 1 hello, affiliates!  
  
recently i made some research on how the crypto casino stake became a global brand and one of the most recognizable brands in the igaming and web3 worlds. my research consists of five parts; there may be more, but for now, there are five",51,$2,instagram,2026-04-04 12:48:02,FALSE
reddit,r/Affiliatemarketing,https://reddit.com/r/Affiliatemarketing/comments/1sbuli1/30_for_each_users/,30$ for each users,general,30$ for each users i have an affiliate program which give 30$ for each premium user you bring easy to promote,31,,,2026-04-04 00:24:55,FALSE
reddit,r/Affiliatemarketing,https://reddit.com/r/Affiliatemarketing/comments/1sbu2r9/where_to_find_affiliates_for_my_affiliate_program/,Where to find affiliates for my affiliate program?,tool,"where to find affiliates for my affiliate program? hi everyone,

title says it all, but i recently launched an affiliate program for my business (ai software related) and was looking for places to basically tell people about it/look for affiliates to join the program. but honestly i can't find anywh",27,,reddit,2026-04-04 00:01:47,FALSE
reddit,r/Affiliatemarketing,https://reddit.com/r/Affiliatemarketing/comments/1sbh5oo/amazon_affiliate_on_site_offsite/,Amazon affiliate on site off-site ?,tool,"amazon affiliate on site off-site ? 

i been with amazon associate for many years.

lately i am unable to see anything from the reports: no data, no tag, no product, i feel like i am in the dark.

can someone from the amazon please explain what's going on ? 

and what's happening with the onsite or ",18,,youtube; amazon,2026-04-03 15:44:38,FALSE
reddit,r/Affiliatemarketing,https://reddit.com/r/Affiliatemarketing/comments/1sasq8u/the_unglamorous_side_of_affiliate_marketing_what/,The unglamorous side of affiliate marketing: What is your biggest daily bottleneck?,general,"the unglamorous side of affiliate marketing: what is your biggest daily bottleneck? the industry loves to highlight the big wins, but i want to talk about the grind. if you could wave a magic wand and fix one part of your daily workflow, what would it be?

* finding uncrowded, quality offers?
* deal",24,,instagram,2026-04-02 20:27:20,FALSE
reddit_comment,r/Affiliatemarketing,https://reddit.com/r/Affiliatemarketing/comments/1sasq8u/the_unglamorous_side_of_affiliate_marketing_what/,"[comment] real talk, the ""passive income"" dream is such a trap lol. Most people don't realize it’s basically j",warning," real talk, the ""passive income"" dream is such a trap lol. most people don't realize it’s basically just becoming a full-time content machine and data nerd. i spend way more time troubleshooting broken links and testing hooks than actually ""relaxing"". honestly, it’s a lot of shipping content that fl",20,,,2026-04-02 20:27:20,FALSE
reddit,r/dropship,https://reddit.com/r/dropship/comments/1bp2b9f/attention_report_scammers_solicitors_spammers/,"#Attention - Report Scammers, Solicitors, Spammers!",warning,"#attention - report scammers, solicitors, spammers! please use the report function to report posts from scammers, people soliciting private messages, and spam!

help keep this subreddit safe from the trash. 

recap of what should not be posted, please report these type of post.

post a link to a ser",15,,instagram; youtube; reddit,2024-03-27 13:48:32,FALSE
reddit,r/dropship,https://reddit.com/r/dropship/comments/1se1b9n/outsourced_fulfillment_services_that_handle_china/,Outsourced fulfillment services that handle china to customer shipping?,warning,"outsourced fulfillment services that handle china to customer shipping? trying to find a fulfillment provider that can ship from china directly to our customers, not bulk to a warehouse. scaling a dtc store alongside my fba business and getting to the point where i don't want to do the whole contain",30,,instagram; shopify; amazon; facebook,2026-04-06 15:00:27,FALSE
reddit,r/dropship,https://reddit.com/r/dropship/comments/1se7sw1/need_some_suggestion_on_starting_dropshipping/,Need some suggestion on starting dropshipping business,revenue,"here's my current setup:

🏪 business setup

→ niche: home décor & kitchen 

→ platform: shopify

→ target market: usa (specifically women/moms aged 28–45)

→ budget: around $1,200 usd to start

→ marketing plan: facebook & instagram ads

💳 payment setup

→ planning to use paypal business + payoneer
",57,"$1,200; $3K; $1,000; 3K; 5K",instagram; youtube; shopify; facebook,2026-04-06 18:52:48,FALSE
reddit,r/dropship,https://reddit.com/r/dropship/comments/1se7sw1/need_some_suggestion_on_starting_dropshipping/,Need some suggestion on starting dropshipping business,platform_change,"need some suggestion on starting dropshipping business need some suggestions regarding dropshipping

hey everyone! 👋

i'm an indian entrepreneur planning to start a dropshipping business targeting us customers and would love some guidance from people who've actually done this.

here's my current set",56,"$1,200; $3K; $1,000; 3K; 5K",instagram; youtube; shopify; facebook,2026-04-06 18:52:48,FALSE
reddit,r/dropship,https://reddit.com/r/dropship/comments/1sdpe7g/how_are_you_tracking_facebook_ad_conversions_with/,How are you tracking Facebook ad conversions with all the iOS privacy changes?,tool,"how are you tracking facebook ad conversions with all the ios privacy changes? running into a situation where facebook is clearly not seeing all the conversions from our store. compared actual orders to what facebook reports, and there's a pretty big gap.  
from what i understand, this is mostly ios",28,,instagram; facebook; apple,2026-04-06 04:54:18,FALSE
reddit,r/dropship,https://reddit.com/r/dropship/comments/1sd609r/why_many_dropshippers_fail_to_scale_beyond_the/,Why Many Dropshippers Fail to Scale Beyond the Dropshipping Model,warning,"why many dropshippers fail to scale beyond the dropshipping model a pattern i’ve seen many times is dropshippers getting stuck — not because their product fails, but because their model never evolves.

most people start with platforms like aliexpress. it’s easy to launch, low risk, and perfect for t",25,,,2026-04-05 15:08:28,FALSE
reddit,r/dropship,https://reddit.com/r/dropship/comments/1sbs1q0/does_zendrop_have_a_3pl_program/,Does Zendrop have a 3pl program?,general,"does zendrop have a 3pl program? lookin into setting up a 3pl for my store to handle inventory as my store is growing. while searching i saw something about zendrop having a 3pl setup, first time i'm hearing about them having this. is this an actual thing? if anyone’s used it would you recommend it?",24,,,2026-04-03 22:34:56,FALSE
reddit,r/dropship,https://reddit.com/r/dropship/comments/1sbo1jk/whats_the_fastest_way_to_analyze_multiple_shopify/,What’s the fastest way to analyze multiple Shopify stores?,warning,"what’s the fastest way to analyze multiple shopify stores? i’ve been trying to speed up my product research lately, but this specific part seems to be slowing me down the most.

whenever i find a shopify store that i’m interested in, i typically open up 10 different tabs to check out the products th",36,,instagram; shopify,2026-04-03 19:58:25,FALSE
reddit,r/dropship,https://reddit.com/r/dropship/comments/1sbgbwg/whats_actually_working_for_you_guys_right_now/,What's actually working for you guys right now?,general,"what's actually working for you guys right now? i’ve been browsing this sub for a while and honestly, it feels like the ""standard"" advice is getting a bit outdated. i see people still pushing the same generic tiktok organic strategies that worked two years ago, but the competition is way higher now.",19,,tiktok; instagram; facebook,2026-04-03 15:14:08,FALSE
reddit,r/dropship,https://reddit.com/r/dropship/comments/1sbjvhk/how_you_can_be_profitable_with_dropshipping_let/,How you can be profitable with dropshipping? Let me explain...,platform_change,"how you can be profitable with dropshipping? let me explain... **honestly guys, can someone tell me how you can be profitable with dropshipping?**

here’s what i mean. when looking at a business, you want to look into the macro environment and the costs associated with the business model.

**macro e",30,,tiktok; instagram; shopify; amazon; stripe,2026-04-03 17:24:30,FALSE
reddit,r/dropship,https://reddit.com/r/dropship/comments/1sb96n6/would_this_actually_be_useful_for_dropshipping_or/,Would this actually be useful for dropshipping or am I overengineering?,warning,"would this actually be useful for dropshipping or am i overengineering? i’m building a small saas and trying to validate if this is actually useful or just sounds cool in my head.

the idea is pretty simple:

you paste a product link (aliexpress, amazon, etc.) and it generates:

* a ready-to-use pro",20,,instagram; amazon,2026-04-03 09:50:17,FALSE
reddit,r/dropship,https://reddit.com/r/dropship/comments/1sbf1r3/ai_dropshipping_in_2026/,AI Dropshipping in 2026,pricing,"ai dropshipping in 2026 the ""hustle culture"" in dropshipping is broken. you spend hours writing product descriptions, manually comparing supplier prices, and struggling to design ads. by the time you launch a product, and start marketing, the trend is over or the product is saturated. in 2026, manua",33,1%,instagram,2026-04-03 14:25:04,FALSE
reddit,r/dropship,https://reddit.com/r/dropship/comments/1sap309/how_long_did_it_take_for_your_store_to_become/,How long did it take for your store to become profitable?,general,"how long did it take for your store to become profitable? i’m just getting into dropshipping and still figuring things out, haven’t even picked a niche yet.   
i know it depends on a bunch of stuff like ads, product, creatives and all that, but i want to know how long it ususally takes for people to",19,,instagram,2026-04-02 18:12:11,FALSE
