date,subreddit,title,url,score,comments,pain_categories,opportunity_score,top_pattern,selftext_preview
2026-02-19,GetDisciplined,Struggling with motivation,https://reddit.com/r/getdisciplined/comments/1r8tgti/struggling_with_motivation/,1,1,need_help,60,need_help,"I feel like I’m at a bit of a crossroads in my life and I’m not sure if I’m overthinking this or not.

I’m 32 and a former semi pro rugby player. I re"
2026-02-19,AppIdeas,3 Real Problems People Are Actively Struggling With (Feb 18 Scan),https://reddit.com/r/AppIdeas/comments/1r8u9ys/3_real_problems_people_are_actively_struggling/,2,0,need_help,51,need_help,"**1️⃣ “How risky is this… actually?”**

Health-conscious people are overwhelmed by conflicting info about toxins, pollution, habits, etc.

They don’t "
2026-02-19,GetStudying,I need help with genetics,https://reddit.com/r/GetStudying/comments/1r8mpg5/i_need_help_with_genetics/,1,0,need_help,51,need_help,"Hello everyone! Probably you've read this question a million times, but how do you study genetics? I fumbled my first exam and I need to past this sec"
2026-02-19,GetDisciplined,Where to begin,https://reddit.com/r/getdisciplined/comments/1r89e10/where_to_begin/,1,0,need_help,51,need_help,Hello!! I (F23) am struggling with where to begin. I moved out of an abusive household back in August and am currently staying with other family membe
2026-02-19,ecommerce,Website UX Review - Tell us what you think,https://reddit.com/r/ecommerce/comments/1r8hnwp/website_ux_review_tell_us_what_you_think/,3,1,feature_request,50,feature_request,"Hi, all.

I'm working on improving our website. We're a small stationary store in Australia with only two items (for now) and we're looking to improve"
2026-02-19,ecommerce,Does anyone have a system for resizing product photos for multiple platforms at once?,https://reddit.com/r/ecommerce/comments/1r9268q/does_anyone_have_a_system_for_resizing_product/,5,12,looking_for,92,looking_for,Hoping someone has figured this out already. I usually have 5-10 items I list to multiple marketplaces. Etsy/Amazon/Shopify etc. Every platform has di
2026-02-19,productivity,Productivity app for autistic + ADHD freelancer? I’m overwhelmed with multitasking,https://reddit.com/r/productivity/comments/1r9642z/productivity_app_for_autistic_adhd_freelancer_im/,3,3,looking_for,80,looking_for,"Hi everyone,

I’m a 27-year-old autistic guy with ADHD. I have a stable remote job and also work with freelance clients.

My main struggle is organiza"
2026-02-19,EntrepreneurRideAlong,I got 200 signups from one Reddit comment,https://reddit.com/r/EntrepreneurRideAlong/comments/1r8zsun/i_got_200_signups_from_one_reddit_comment/,0,4,looking_for,80,looking_for,"I got 200 signups from one Reddit comment. 

No ads. No following.  

Here's exactly what I wrote:  

The post was asking ""what tool do you use for X?"
2026-02-19,ecommerce,"Out-of stock refunds, need help!",https://reddit.com/r/ecommerce/comments/1r86if9/outof_stock_refunds_need_help/,2,7,looking_for,80,looking_for,"Hi everyone!

  
Im looking for a solution to notify our clients when the reason of refund is the item being out of stock. Unfortunately this happens "
2026-02-19,Entrepreneur,Stop trying to educate your customers. It is a massive waste of money.,https://reddit.com/r/Entrepreneur/comments/1r95xtb/stop_trying_to_educate_your_customers_it_is_a/,3,7,frustrated_with,70,frustrated_with,"If your business model relies on educating the market,you are probably going to run out of cash before you make a profit.

I know some first time foun"
2026-02-19,digitalminimalism,Cut out social media one year ago but YouTube is driving me crazy and I can’t let it go,https://reddit.com/r/digitalminimalism/comments/1r8cqo6/cut_out_social_media_one_year_ago_but_youtube_is/,8,7,need_help,69,need_help,"I can’t delete YouTube, don’t know why. Feels like my escape, my true relax moment. Or when I’m bored. I know it’s bad but what can I do with only 5 m"
2026-02-19,loseit,Calorie deficit. I need help!,https://reddit.com/r/loseit/comments/1r99win/calorie_deficit_i_need_help/,3,10,need_help,69,need_help,I am a 31 year old female. I’m 5’8 and 177 pounds. I started my journey back in August of last year after I had my son. Was strict for a few months an
2026-02-19,AppIdeas,got 200 signups from one Reddit comment,https://reddit.com/r/AppIdeas/comments/1r90x4s/got_200_signups_from_one_reddit_comment/,0,1,looking_for,68,looking_for,"I got 200 signups from one Reddit comment. 

No ads. No following.  

Here's exactly what I wrote:  

The post was asking ""what tool do you use for X?"
2026-02-19,GetStudying,Need help with studying,https://reddit.com/r/GetStudying/comments/1r9dlx7/need_help_with_studying/,2,2,need_help,60,need_help,"Hello, I am studying for a med entrance exam which is in 4 months but I genuinely cannot focus for longer than 1-2 hours. My thoughts are all over the"
2026-02-19,GetDisciplined,Overwhelmed and can’t focus on classwork,https://reddit.com/r/getdisciplined/comments/1r96ywd/overwhelmed_and_cant_focus_on_classwork/,1,1,need_help,60,need_help,"This week I’ve been really struggling with my classwork and Im not sure how to get back on track.

I’m currently doing Running Start and all my classe"
2026-02-19,smallbusiness,Clothing Model for ecommerce cloth store,https://reddit.com/r/smallbusiness/comments/1r9byr0/clothing_model_for_ecommerce_cloth_store/,1,3,need_help,60,need_help,My parents sells clothes and I'm helping them setup their online cloth stores. I went on fiverr to get model to get picture of clothes but it was floo
2026-02-19,AppIdeas,3 Real Problems People Are Actively Struggling With (Feb 18 Scan),https://reddit.com/r/AppIdeas/comments/1r8u9ys/3_real_problems_people_are_actively_struggling/,1,0,need_help,51,need_help,"**1️⃣ “How risky is this… actually?”**

Health-conscious people are overwhelmed by conflicting info about toxins, pollution, habits, etc.

They don’t "
2026-02-19,productivity,Protecting deep work flow from intrusive screen-sharing/monitoring,https://reddit.com/r/productivity/comments/1r93c9x/protecting_deep_work_flow_from_intrusive/,1,0,need_help,51,need_help,"I've been struggling with a weird productivity block lately. My job involves a lot of unscheduled screen sharing and background monitoring (Hubstaff),"
2026-02-19,microsaas,Transitioning a completely free app to SaaS: Should I add an Enterprise version?,https://reddit.com/r/microsaas/comments/1r9edyi/transitioning_a_completely_free_app_to_saas/,1,3,feature_request,50,feature_request,"Hey everyone,



I built OpenReq. It's a lightweight alternative for testing APIs.

  
[https://openreq.app](https://openreq.app)

Here is the thing: "
2026-02-19,Affiliatemarketing,Tripadvisor Affiliate time for application?,https://reddit.com/r/Affiliatemarketing/comments/1r9aqzz/tripadvisor_affiliate_time_for_application/,1,2,feature_request,50,feature_request,"Hi 
Has anyone enrolled onto the tripadvisor affiliate programme recently on cj junction?
I applied over a week ago and not heard back.
Any recent app"
2026-02-19,ecommerce,Website UX Review - Tell us what you think,https://reddit.com/r/ecommerce/comments/1r8hnwp/website_ux_review_tell_us_what_you_think/,3,3,feature_request,50,feature_request,"Hi, all.

I'm working on improving our website. We're a small stationary store in Australia with only two items (for now) and we're looking to improve"
2026-02-20,ecommerce,Does anyone have a system for resizing product photos for multiple platforms at once?,https://reddit.com/r/ecommerce/comments/1r9268q/does_anyone_have_a_system_for_resizing_product/,5,13,looking_for,92,looking_for,Hoping someone has figured this out already. I usually have 5-10 items I list to multiple marketplaces. Etsy/Amazon/Shopify etc. Every platform has di
2026-02-20,Christianity,to all the non-christians in this subreddit,https://reddit.com/r/Christianity/comments/1r9rk03/to_all_the_nonchristians_in_this_subreddit/,0,38,frustrated_with,91,frustrated_with,i thought we are a waste of time..? like if we are all stupid in your opinion just dont agree with us and dont call us names yknow. i feel like if you
2026-02-20,SaaS,I have great whitepapers and I want to improve my LinkedIn,https://reddit.com/r/SaaS/comments/1r9s9ve/i_have_great_whitepapers_and_i_want_to_improve_my/,1,2,looking_for,80,looking_for,"We produce high-level technical whitepapers (AI/Crypto infrastructure). I know I should be posting thought leadership on LinkedIn, but I’m a dev, not "
2026-02-20,productivity,Productivity app for autistic + ADHD freelancer? I’m overwhelmed with multitasking,https://reddit.com/r/productivity/comments/1r9642z/productivity_app_for_autistic_adhd_freelancer_im/,4,4,looking_for,80,looking_for,"Hi everyone,

I’m a 27-year-old autistic guy with ADHD. I have a stable remote job and also work with freelance clients.

My main struggle is organiza"
2026-02-20,islam,Is there an app like Muslim pro without all the ads ?,https://reddit.com/r/islam/comments/1r9rrmf/is_there_an_app_like_muslim_pro_without_all_the/,1,6,looking_for,80,looking_for,Please i can’t pay for the pro and also can’t stand those ads anymore 
2026-02-20,productivity,Im gojng crazy w out social media,https://reddit.com/r/productivity/comments/1r9k5ur/im_gojng_crazy_w_out_social_media/,4,21,need_help,69,need_help,Any advice for me since i deleted social media for lent and live alone i need help to spend time i feel like im going crazy
2026-02-20,Biohackers,"To anyone thinking about starting peptides, do it",https://reddit.com/r/Biohackers/comments/1r9sj7d/to_anyone_thinking_about_starting_peptides_do_it/,2,13,need_help,69,need_help,"Over the past year I have continuously noticed that my mother is struggling with pain in her hip from her arthritis, taking medicine to help deal with"
2026-02-20,AppIdeas,got 200 signups from one Reddit comment,https://reddit.com/r/AppIdeas/comments/1r90x4s/got_200_signups_from_one_reddit_comment/,0,1,looking_for,68,looking_for,"I got 200 signups from one Reddit comment. 

No ads. No following.  

Here's exactly what I wrote:  

The post was asking ""what tool do you use for X?"
2026-02-20,microsaas,Struggling with user studies on a product that should be a godsend to many people,https://reddit.com/r/microsaas/comments/1r9pc54/struggling_with_user_studies_on_a_product_that/,1,3,need_help,60,need_help,"I built a ""people search"" platform where a user can enter in a query like, ""I am looking for investors who focus on climate-focused tech startups and "
2026-02-20,GetStudying,How do I start understanding material,https://reddit.com/r/GetStudying/comments/1r9i36k/how_do_i_start_understanding_material/,1,5,need_help,60,need_help,Hi all Im new to this sub and just started a TAFE course (australia) a few weeks ago. I did ATAR in highschool which was really difficult and I just b
2026-02-20,loseit,Struggling with recent weight gain,https://reddit.com/r/loseit/comments/1r9hk9w/struggling_with_recent_weight_gain/,2,2,need_help,60,need_help,"I reached a new low weight - 163 lbs - in January, and was pretty excited because I’ve been wanting to lose weight for many, many years now. this was "
2026-02-20,ecommerce,Shopware + Google: Product pages are indexable but don’t rank — what am I missing?,https://reddit.com/r/ecommerce/comments/1r9qogq/shopware_google_product_pages_are_indexable_but/,1,1,need_help,60,need_help,"Hi everyone,

We run a Shopware-based webshop (Switzerland) and we’re struggling with organic Google visibility.

Our product pages are publicly acces"
2026-02-20,SideProject,Does anyone in the UK need an Idea?,https://reddit.com/r/SideProject/comments/1r9s92m/does_anyone_in_the_uk_need_an_idea/,0,0,need_help,51,need_help,"I have an Idea I know i'll do nothing with as i'm way too busy on other projects.

Here's the issue... 

Older people are the most likely to require d"
2026-02-20,AppIdeas,3 Real Problems People Are Actively Struggling With (Feb 18 Scan),https://reddit.com/r/AppIdeas/comments/1r8u9ys/3_real_problems_people_are_actively_struggling/,1,0,need_help,51,need_help,"**1️⃣ “How risky is this… actually?”**

Health-conscious people are overwhelmed by conflicting info about toxins, pollution, habits, etc.

They don’t "
2026-02-20,productivity,Protecting deep work flow from intrusive screen-sharing/monitoring,https://reddit.com/r/productivity/comments/1r93c9x/protecting_deep_work_flow_from_intrusive/,1,0,need_help,51,need_help,"I've been struggling with a weird productivity block lately. My job involves a lot of unscheduled screen sharing and background monitoring (Hubstaff),"
2026-02-20,Affiliatemarketing,Tripadvisor Affiliate time for application?,https://reddit.com/r/Affiliatemarketing/comments/1r9aqzz/tripadvisor_affiliate_time_for_application/,1,2,feature_request,50,feature_request,"Hi 
Has anyone enrolled onto the tripadvisor affiliate programme recently on cj junction?
I applied over a week ago and not heard back.
Any recent app"
2026-02-20,ecommerce,Website UX Review - Tell us what you think,https://reddit.com/r/ecommerce/comments/1r8hnwp/website_ux_review_tell_us_what_you_think/,3,3,feature_request,50,feature_request,"Hi, all.

I'm working on improving our website. We're a small stationary store in Australia with only two items (for now) and we're looking to improve"
2026-02-21,ecommerce,Does anyone have a system for resizing product photos for multiple platforms at once?,https://reddit.com/r/ecommerce/comments/1r9268q/does_anyone_have_a_system_for_resizing_product/,6,21,looking_for,92,looking_for,Hoping someone has figured this out already. I usually have 5-10 items I list to multiple marketplaces. Etsy/Amazon/Shopify etc. Every platform has di
2026-02-21,nosurf,Does anyone know an app that will permanently shut off my phone/ apps for a set amount of time that doesn’t have any loo,https://reddit.com/r/nosurf/comments/1raajpg/does_anyone_know_an_app_that_will_permanently/,2,3,looking_for,80,looking_for,
2026-02-21,islam,Quran and Hadis App,https://reddit.com/r/islam/comments/1ram9m1/quran_and_hadis_app/,1,1,looking_for,80,looking_for,I'm looking for an app (android) where i can read the Quran and the famous books of Hadis in english translation. For the Quran the app must have the 
2026-02-21,smallbusiness,How do I invoice people with my official tax numbers? (Canada),https://reddit.com/r/smallbusiness/comments/1rafse2/how_do_i_invoice_people_with_my_official_tax/,3,3,looking_for,80,looking_for,"A potential client wants to buy a product from us. It's our first time making a sale.

We registered and have tax numbers in Canada. We don't have any"
2026-02-21,smallbusiness,What software do you use to keep track of Orders/Sales/clients?,https://reddit.com/r/smallbusiness/comments/1rafs0x/what_software_do_you_use_to_keep_track_of/,1,8,looking_for,80,looking_for,"Hi everyone, I was wondering what software do you use to keep track of orders, sales, clients ? My wife is thinking about starting a food services bus"
2026-02-21,SideProject,"I built a 100% client-side AI toolkit (OCR, Invoices, Photos) because I was tired of forced signups.",https://reddit.com/r/SideProject/comments/1ranbjd/i_built_a_100_clientside_ai_toolkit_ocr_invoices/,4,0,frustrated_with,70,frustrated_with,"Hi everyone,

I was tired of using ""free"" AI tools that forced me to create an account just to remove a background or extract text from an image. Even"
2026-02-21,productivity,Anyone else hate when schedules only come as PDFs?,https://reddit.com/r/productivity/comments/1raixud/anyone_else_hate_when_schedules_only_come_as_pdfs/,1,3,frustrated_with,70,frustrated_with,"My school keeps sending out timetables as PDFs and it drives me nuts. I live out of Google Calendar, so every time I get one of these I end up retypin"
2026-02-21,Affiliatemarketing,"affiliate traffic sources that build faster than SEO, what actually works",https://reddit.com/r/Affiliatemarketing/comments/1raoakx/affiliate_traffic_sources_that_build_faster_than/,1,2,frustrated_with,70,frustrated_with,"9 months grinding SEO, traffic barely moving, need something faster or I'm going to run out of money before this works what channels are you using for"
2026-02-21,ecommerce,High ATC and Reached Checkout numbers but no conversions?,https://reddit.com/r/ecommerce/comments/1r9w35t/high_atc_and_reached_checkout_numbers_but_no/,4,17,need_help,69,need_help,"Hey everyone,  
I'm trying to move my store over from Etsy to Shopify, but I'm having trouble with people actually converting. I'm getting decent orga"
2026-02-21,AppIdeas,got 200 signups from one Reddit comment,https://reddit.com/r/AppIdeas/comments/1r90x4s/got_200_signups_from_one_reddit_comment/,0,1,looking_for,68,looking_for,"I got 200 signups from one Reddit comment. 

No ads. No following.  

Here's exactly what I wrote:  

The post was asking ""what tool do you use for X?"
2026-02-21,AppIdeas,3 Real Problems People Are Actively Struggling With (Feb 18 Scan),https://reddit.com/r/AppIdeas/comments/1r8u9ys/3_real_problems_people_are_actively_struggling/,2,1,need_help,60,need_help,"**1️⃣ “How risky is this… actually?”**

Health-conscious people are overwhelmed by conflicting info about toxins, pollution, habits, etc.

They don’t "
2026-02-21,productivity,Need help for my many to dos at work,https://reddit.com/r/productivity/comments/1ralvxy/need_help_for_my_many_to_dos_at_work/,3,4,need_help,60,need_help,I have a lot of to dos at work as operations manager in different areas. What’s an easy Methode to everything visible and easy to reach my daily weekl
2026-02-21,productivity,minimising procrastination and boosting productivity.,https://reddit.com/r/productivity/comments/1ra2dyw/minimising_procrastination_and_boosting/,1,7,need_help,60,need_help,"so for starters, im 18 and im preparing for a highly competitive medical entrance examination. ive been functioning on a serious autopilot mode and ha"
2026-02-21,ADHD,Why Can’t I Just Start Studying?,https://reddit.com/r/ADHD/comments/1ral33u/why_cant_i_just_start_studying/,1,5,need_help,60,need_help,"I’ve been struggling with procrastination for a long time, and I’ve realized it’s not really “laziness.” I wake up at 7 a.m., but I don’t actually sta"
2026-02-21,loseit,Struggling with slower deficit,https://reddit.com/r/loseit/comments/1racmdh/struggling_with_slower_deficit/,0,2,need_help,60,need_help,I’ve yo yo dieted for years and a few years ago my highest weight was 225lbs I finally got to my goal weight of 130lbs but I was working out 5x a week
2026-02-21,sleep,sleep and depression,https://reddit.com/r/sleep/comments/1raoj31/sleep_and_depression/,2,2,need_help,60,need_help,"Hello, I'm currently battling depression and I'm in therapy for depression. However, I'm struggling with sleep, in fact I'm getting too much of it. I "
2026-02-21,islam,a muslim trying to better himself,https://reddit.com/r/islam/comments/1rakcog/a_muslim_trying_to_better_himself/,8,6,need_help,60,need_help,assalam aalaykom brothers i really wanted help in something that ive been struggling with and its masterbation ive been addicted to it for a year and 
2026-02-21,islam,Need help with prayer,https://reddit.com/r/islam/comments/1rakawe/need_help_with_prayer/,12,2,need_help,60,need_help,I use a app to help me pray since I don’t know it off my heart but after salawat it tells me to do a dua then give Salam Is this normal ? 
2026-02-21,EntrepreneurRideAlong,"[Day 11] 30,000 Twitter impressions every single day with $0 ads. How I finally killed the friction that was ruining my ",https://reddit.com/r/EntrepreneurRideAlong/comments/1r9w56c/day_11_30000_twitter_impressions_every_single_day/,1,2,need_help,60,need_help,"Hey everyone, Vadim here again. It’s been about a week since my last update, and the ""messy startup"" phase is officially turning into a real product j"
2026-02-21,ecommerce,Shopware + Google: Product pages are indexable but don’t rank — what am I missing?,https://reddit.com/r/ecommerce/comments/1r9qogq/shopware_google_product_pages_are_indexable_but/,2,3,need_help,60,need_help,"Hi everyone,

We run a Shopware-based webshop (Switzerland) and we’re struggling with organic Google visibility.

Our product pages are publicly acces"
2026-02-21,Affiliatemarketing,Tripadvisor Affiliate time for application?,https://reddit.com/r/Affiliatemarketing/comments/1r9aqzz/tripadvisor_affiliate_time_for_application/,1,2,feature_request,50,feature_request,"Hi 
Has anyone enrolled onto the tripadvisor affiliate programme recently on cj junction?
I applied over a week ago and not heard back.
Any recent app"
2026-02-21,ecommerce,Website UX Review - Tell us what you think,https://reddit.com/r/ecommerce/comments/1r8hnwp/website_ux_review_tell_us_what_you_think/,3,3,feature_request,50,feature_request,"Hi, all.

I'm working on improving our website. We're a small stationary store in Australia with only two items (for now) and we're looking to improve"
2026-02-23,GetStudying,I'm in ICanStudy but don't really know if I'm properly doing things...,https://reddit.com/r/GetStudying/comments/1rc77h3/im_in_icanstudy_but_dont_really_know_if_im/,1,1,wish_existed,90,wish_existed,"I'm in the course now and working through it all, but it all feels a bit convoluted and confusing. Like sure, I can ""think"" I am applying the techniqu"
2026-02-23,Affiliatemarketing,"affiliate traffic sources that build faster than SEO, what actually works",https://reddit.com/r/Affiliatemarketing/comments/1raoakx/affiliate_traffic_sources_that_build_faster_than/,8,13,frustrated_with,80,frustrated_with,"9 months grinding SEO, traffic barely moving, need something faster or I'm going to run out of money before this works what channels are you using for"
2026-02-23,Entrepreneur,"How can I streamline our sales process? Struggling with efficiency, any tips?",https://reddit.com/r/Entrepreneur/comments/1rc9ty2/how_can_i_streamline_our_sales_process_struggling/,20,14,need_help,69,need_help,"Hey everyone,

I’m looking for advice on how to streamline our sales process. Our small team is growing, but we’re facing inefficiencies that are slow"
2026-02-23,webdev,help with the project,https://reddit.com/r/webdev/comments/1rc7ih9/help_with_the_project/,0,6,need_help,60,need_help,"hi guys iam a begginer level dev i tried to make discord+reddit style of messaging system also private chat rooms with encrypted id and passwords ,  
"
2026-02-23,GetStudying,How to stay motivated?,https://reddit.com/r/GetStudying/comments/1rccks1/how_to_stay_motivated/,4,6,need_help,60,need_help,"I don’t know if this is the right subreddit but I need help. I’m currently attending Sixth Form in the UK (doing Law, Psychology and History), but I d"
2026-02-23,digitalminimalism,For a while i was having trouble finding a way to block snap and insta reals,https://reddit.com/r/digitalminimalism/comments/1rbuj2a/for_a_while_i_was_having_trouble_finding_a_way_to/,1,1,need_help,60,need_help,I just came across a really promising advertisement for a way to block these features and just wanted to share the name since I have seen many post wo
2026-02-23,Christianity,Struggling with salvation,https://reddit.com/r/Christianity/comments/1rcemaj/struggling_with_salvation/,2,3,need_help,60,need_help,"I’m a 23M who’s been struggling with a p\*rn addiction for over a decade, back when I was a teenager it was really bad (I didn’t bother praying for fo"
2026-02-23,Christianity,my faith is weak,https://reddit.com/r/Christianity/comments/1rcd1sg/my_faith_is_weak/,1,6,need_help,60,need_help,"i’ve been struggling with religion quite a bit recently, especially the concept of blind faith..

can someone give me undeniable proof that christiani"
2026-02-23,Christianity,"struggling with eating disorder, losing hope",https://reddit.com/r/Christianity/comments/1rccvj7/struggling_with_eating_disorder_losing_hope/,1,3,need_help,60,need_help,(((okay so first of all apologies for the incoherent mess - I'm writing this to distract myself from binge eating so I'm not exactly in the best state
2026-02-23,islam,my faith is weak,https://reddit.com/r/islam/comments/1rcd0pr/my_faith_is_weak/,3,7,need_help,60,need_help,"Im struggling with my faith alot 

My parents are not open to any doubtful questions, they immediately shut it down like asking questions is going to "
2026-02-23,Affiliatemarketing,Tripadvisor Affiliate time for application?,https://reddit.com/r/Affiliatemarketing/comments/1r9aqzz/tripadvisor_affiliate_time_for_application/,2,3,feature_request,50,feature_request,"Hi 
Has anyone enrolled onto the tripadvisor affiliate programme recently on cj junction?
I applied over a week ago and not heard back.
Any recent app"
2026-02-24,productivity,Which image color palette generator is best for designers?,https://reddit.com/r/productivity/comments/1rcujaj/which_image_color_palette_generator_is_best_for/,1,1,looking_for,80,looking_for,I have been looking for a tool that can generate a color palette from a photo easily for UI and branding work. Most of the usual tools like Coolors or
2026-02-24,digitalminimalism,Download all photos from instagram?,https://reddit.com/r/digitalminimalism/comments/1rd3oao/download_all_photos_from_instagram/,2,1,looking_for,80,looking_for,Is there a service or website or something that can help me download all my pictures from instagram? Or make a photo book? The final frontier before I
2026-02-24,islam,Listening to the Quran in English,https://reddit.com/r/islam/comments/1rda9f3/listening_to_the_quran_in_english/,3,2,looking_for,80,looking_for,"Hi

Is there an app where I can listen to the Quran in English?

I would like to listen to the Quran without listening to it on YouTube as it uses so "
