date,subreddit,title,url,score,comments,pain_categories,opportunity_score,top_pattern,selftext_preview
2026-02-15,smallbusiness,Sourcing Clothing Manufacturers,https://reddit.com/r/smallbusiness/comments/1r5ay7a/sourcing_clothing_manufacturers/,2,1,willing_to_pay|need_help,80,willing_to_pay,"I need help with sourcing clothing manufacturers for my new clothing brand focused on womens apparel, both tailor made and ready to wear. I have been "
2026-02-15,GetDisciplined,"I didn’t expect fasting to reduce my addictions, but it did",https://reddit.com/r/getdisciplined/comments/1r4ngah/i_didnt_expect_fasting_to_reduce_my_addictions/,92,19,need_help,78,need_help,"TL;DR-I was struggling with p\*rn addiction, lack of focus, and overthinking. Yoga and meditation helped, but urges remained. After I started fasting "
2026-02-15,Affiliatemarketing,Monetizing a fantasy basketball stats site + blog,https://reddit.com/r/Affiliatemarketing/comments/1r4epvk/monetizing_a_fantasy_basketball_stats_site_blog/,1,14,need_help,69,need_help,"Hi guys,

I've got a project I've been working on. It is a fantasy basketball website where I provide both content and statistics to people in that ni"
2026-02-15,webdev,need help with the project review,https://reddit.com/r/webdev/comments/1r56xpq/need_help_with_the_project_review/,0,3,need_help,60,need_help,"VERCEL : [https://e-commerce2-rust.vercel.app/](https://e-commerce2-rust.vercel.app/)  
git hub: [https://github.com/shaikazeem2001/E-commerce](https:"
2026-02-15,ADHD,I’m doing better with most ADHD symptoms but still struggling with binge eating.,https://reddit.com/r/ADHD/comments/1r57dsv/im_doing_better_with_most_adhd_symptoms_but_still/,1,3,need_help,60,need_help,Hi all I’ve been bingeing as long as I can remember and am currently on 30mg of XR Adderall. I feel overall happier and more content on it and have be
2026-02-15,GetStudying,Anxiety is killing me when i try to take a test,https://reddit.com/r/GetStudying/comments/1r5auhw/anxiety_is_killing_me_when_i_try_to_take_a_test/,2,0,need_help,51,need_help,"i have been struggling with tests alot lately, when it comes to something conceptual, i can get it easily most of the time. but when it comes to other"
2026-02-15,sleep,Do any supplements actually help with insomnia and hyper-alert sleep?,https://reddit.com/r/sleep/comments/1r59mvn/do_any_supplements_actually_help_with_insomnia/,1,0,need_help,51,need_help,"I’m struggling with insomnia, mainly difficulty falling asleep and staying asleep.

When I do fall asleep, it feels like I’m in a hyper-active or aler"
2026-02-15,digitalminimalism,Do app blocker really work?,https://reddit.com/r/digitalminimalism/comments/1r5cas4/do_app_blocker_really_work/,2,1,willing_to_pay,100,willing_to_pay,"I was making an app (RepsForReels) to stop doomscrolling were you have to do physical exercise  to use your addictive app, and wanted to know if peopl"
2026-02-15,smallbusiness,Sourcing Clothing Manufacturers,https://reddit.com/r/smallbusiness/comments/1r5ay7a/sourcing_clothing_manufacturers/,1,1,willing_to_pay|need_help,80,willing_to_pay,"I need help with sourcing clothing manufacturers for my new clothing brand focused on womens apparel, both tailor made and ready to wear. I have been "
2026-02-15,GetDisciplined,"I didn’t expect fasting to reduce my addictions, but it did",https://reddit.com/r/getdisciplined/comments/1r4ngah/i_didnt_expect_fasting_to_reduce_my_addictions/,98,19,need_help,78,need_help,"TL;DR-I was struggling with p\*rn addiction, lack of focus, and overthinking. Yoga and meditation helped, but urges remained. After I started fasting "
2026-02-15,Affiliatemarketing,Monetizing a fantasy basketball stats site + blog,https://reddit.com/r/Affiliatemarketing/comments/1r4epvk/monetizing_a_fantasy_basketball_stats_site_blog/,1,14,need_help,69,need_help,"Hi guys,

I've got a project I've been working on. It is a fantasy basketball website where I provide both content and statistics to people in that ni"
2026-02-15,webdev,need help with the project review,https://reddit.com/r/webdev/comments/1r56xpq/need_help_with_the_project_review/,0,3,need_help,60,need_help,"VERCEL : [https://e-commerce2-rust.vercel.app/](https://e-commerce2-rust.vercel.app/)  
git hub: [https://github.com/shaikazeem2001/E-commerce](https:"
2026-02-15,ADHD,I’m doing better with most ADHD symptoms but still struggling with binge eating.,https://reddit.com/r/ADHD/comments/1r57dsv/im_doing_better_with_most_adhd_symptoms_but_still/,1,3,need_help,60,need_help,Hi all I’ve been bingeing as long as I can remember and am currently on 30mg of XR Adderall. I feel overall happier and more content on it and have be
2026-02-15,SaaS,How to get early testing users for your product,https://reddit.com/r/SaaS/comments/1r5ca5z/how_to_get_early_testing_users_for_your_product/,1,0,need_help,51,need_help,He folks. I have created a product but struggling with finding users to perform interface testing and overall product experience interviews. What’s yo
2026-02-15,GetStudying,Anxiety is killing me when i try to take a test,https://reddit.com/r/GetStudying/comments/1r5auhw/anxiety_is_killing_me_when_i_try_to_take_a_test/,2,0,need_help,51,need_help,"i have been struggling with tests alot lately, when it comes to something conceptual, i can get it easily most of the time. but when it comes to other"
2026-02-15,sleep,Do any supplements actually help with insomnia and hyper-alert sleep?,https://reddit.com/r/sleep/comments/1r59mvn/do_any_supplements_actually_help_with_insomnia/,1,0,need_help,51,need_help,"I’m struggling with insomnia, mainly difficulty falling asleep and staying asleep.

When I do fall asleep, it feels like I’m in a hyper-active or aler"
2026-02-15,SideProject,Made a fun little discord alternative,https://reddit.com/r/SideProject/comments/1r5cc6s/made_a_fun_little_discord_alternative/,1,0,feature_request,42,feature_request,What's a fun feature that I should try and add ? I think next step is some sort of auto mod alternative since so much shady stuff happens on discord a
2026-02-16,smallbusiness,Group bookings with conflicting schedules are a headache,https://reddit.com/r/smallbusiness/comments/1r64vf8/group_bookings_with_conflicting_schedules_are_a/,3,4,wish_existed,90,wish_existed,I run a small agency in london and recently booked a 12 person group tour in greece half of them wanted early morning excursions the other half prefer
2026-02-16,Biohackers,"To the collagen users here, are you actually seeing measurable differences?",https://reddit.com/r/Biohackers/comments/1r5ul7t/to_the_collagen_users_here_are_you_actually/,48,60,need_help,78,need_help,Hi everyone. I have been looking into the benefits of collagen for a while now (and actually just bought recently to test it) because I am starting to
2026-02-16,GetDisciplined,I quit smoking weed after 17 years!,https://reddit.com/r/getdisciplined/comments/1r6271s/i_quit_smoking_weed_after_17_years/,27,15,need_help,78,need_help,Just wanted to post this here quickly incase someone else is having trouble with stopping smoking or anything like that and could offer some light at 
2026-02-16,Entrepreneur,Need help with a project I am making,https://reddit.com/r/Entrepreneur/comments/1r63qgy/need_help_with_a_project_i_am_making/,2,13,need_help,69,need_help,"Hi i need help with my project. I need your honest opinion on languages and translations.

The Questions:

1. Where did you go?
2. Did you face diffic"
2026-02-16,webdev,Need help for my neocities site,https://reddit.com/r/webdev/comments/1r5s44d/need_help_for_my_neocities_site/,6,8,need_help,69,need_help,I'm struggling with using the grid property to get my site to look like the sketch I drew out. Does anyone know how I can use the grid to get the layo
2026-02-16,digitalminimalism,I am struggling to break my phone addiction. I still need my phone for work and communication with family/friends but wa,https://reddit.com/r/digitalminimalism/comments/1r5iixw/i_am_struggling_to_break_my_phone_addiction_i/,11,12,need_help,69,need_help,"TL;DR - Struggling with phone addiction, have tried some tactics but still find myself constantly reaching for my phone and wasting time on it without"
2026-02-16,ADHD,ADHD and work,https://reddit.com/r/ADHD/comments/1r617u4/adhd_and_work/,17,8,need_help,69,need_help,"Hi all!

I'm 29 and i've been a medicated ADHD female now since October 2024.

I started the process as I was struggling with work. I'd been through a"
2026-02-16,Affiliatemarketing,Monetizing a fantasy basketball stats site + blog,https://reddit.com/r/Affiliatemarketing/comments/1r4epvk/monetizing_a_fantasy_basketball_stats_site_blog/,1,14,need_help,69,need_help,"Hi guys,

I've got a project I've been working on. It is a fantasy basketball website where I provide both content and statistics to people in that ni"
2026-02-16,Entrepreneur,"Trying to sound “useful” online made things harder, not easier",https://reddit.com/r/Entrepreneur/comments/1r63gn4/trying_to_sound_useful_online_made_things_harder/,1,2,need_help,60,need_help,"On other platforms, I always felt pressure to teach or explain something.

Here, just sharing what I’m noticing or struggling with seems to land bette"
2026-02-16,GetStudying,Highschool/college students please help me,https://reddit.com/r/GetStudying/comments/1r61fm9/highschoolcollege_students_please_help_me/,2,1,need_help,60,need_help,"17M

I’ve been struggling with depression for the past few months, and honestly, it’s getting really hard to keep up. A few weeks ago, things got very"
2026-02-16,loseit,Trying to lose weight but struggling with high protein meals,https://reddit.com/r/loseit/comments/1r63puk/trying_to_lose_weight_but_struggling_with_high/,0,6,need_help,60,need_help,I am 158 pounds and 5’5 and am trying to lose like 40 pounds. I love cereal so I have that every morning and choose a protein cereal however it’s not 
2026-02-16,Biohackers,Struggling with low energy any metabolism support supplements that help?,https://reddit.com/r/Biohackers/comments/1r65699/struggling_with_low_energy_any_metabolism_support/,5,7,need_help,60,need_help,"Hi everyone, my energy has been all over the place lately, making it hard to stick to workouts and meals. I started a metabolism support supplement re"
2026-02-16,GetDisciplined,"Like a stampede, this cannot be stopped but I need help with her.",https://reddit.com/r/getdisciplined/comments/1r60f6p/like_a_stampede_this_cannot_be_stopped_but_i_need/,2,8,need_help,60,need_help,"tldr I don't want to hurt anyone with my art. but it needs to be violent. it's slowing me down. my progress.

I am posting this in getdisciplined beca"
2026-02-16,GetDisciplined,Building a community around focus + discipline. Would love your honest feedback,https://reddit.com/r/getdisciplined/comments/1r5dtth/building_a_community_around_focus_discipline/,0,10,need_help,60,need_help,"Hey everyone,

I’ve started making videos around productivity, focus, discipline, and mental clarity, but my goal isn’t just to post content into the "
2026-02-16,ecommerce,MBA or Ecom Business?-24M,https://reddit.com/r/ecommerce/comments/1r65mv2/mba_or_ecom_business24m/,2,4,need_help,60,need_help,I have been struggling with this decision mentally that should i do a full-time Mba from Tier-2 brands like Sibm or leave everything and start my own 
2026-02-16,AppIdeas,5 App Ideas From Real User Frustrations (Scanned This Week),https://reddit.com/r/AppIdeas/comments/1r64y7p/5_app_ideas_from_real_user_frustrations_scanned/,0,0,need_help,51,need_help,I’ve been building a small project called [Problem Miner](https://problem-miner-landing.vercel.app/feed) that scans forums for recurring frustrations.
2026-02-16,sleep,Is this normal for a 16 year old?,https://reddit.com/r/sleep/comments/1r5w18g/is_this_normal_for_a_16_year_old/,1,0,need_help,51,need_help,"Hi everyone! I (16M) had been struggling with sleep ever since I was a kid, my sleep was super inconsistent, some days I slept for 6 hours some day I "
2026-02-16,SaaS,What are you building this week? Let’s pitch,https://reddit.com/r/SaaS/comments/1r673tm/what_are_you_building_this_week_lets_pitch/,1,1,feature_request,50,feature_request,"Hey founders 👋

I’m working on [**Postzio.com**](http://Postzio.com), a small experiment to help businesses manage and optimize their social media pos"
2026-02-16,webdev,Best backend stack for E-Comm for a JS Dev? (Vendure vs MedusaJS),https://reddit.com/r/webdev/comments/1r5tr30/best_backend_stack_for_ecomm_for_a_js_dev_vendure/,3,8,feature_request,50,feature_request,Anyone here that have used both MedusaJS and Vendure? Would love to get some input and hear what your experiences have been. I have a client that want
2026-02-17,GetStudying,Best apps / platforms for clear university level math explanations and practice ?,https://reddit.com/r/GetStudying/comments/1r6ru7r/best_apps_platforms_for_clear_university_level/,2,0,willing_to_pay,85,willing_to_pay,"I’m going to uni in august but first I need to go through this very difficult exam, I bought a course in my town but the maths tutor is horrible. 

Ba"
2026-02-17,productivity,Task Management software for small teams with gmail accounts,https://reddit.com/r/productivity/comments/1r6917r/task_management_software_for_small_teams_with/,7,6,looking_for,80,looking_for,"So, we're a small business, growing rapidly in the field of Industrial Automation.

Currently, the biggest hurdle we're facing in our growth is, task "
2026-02-17,smallbusiness,New to SCorp- urgent help,https://reddit.com/r/smallbusiness/comments/1r72d22/new_to_scorp_urgent_help/,1,1,looking_for,80,looking_for,"Hi,

I am new to 1099 work. I would like to set up scorp and payroll for 2026. I’m the only employee and I’m projected to make 180k with 50k expenses."
2026-02-17,digitalminimalism,Ditched Spotify - enjoying music more than ever,https://reddit.com/r/digitalminimalism/comments/1r6ghya/ditched_spotify_enjoying_music_more_than_ever/,104,18,need_help,78,need_help,"I finally found the will to rid myself of music streaming after waking up to find a huge AI ""beta testing"" search bar in the middle of my screen on my"
2026-02-17,nosurf,It's not the phone (for me),https://reddit.com/r/nosurf/comments/1r67p5n/its_not_the_phone_for_me/,6,10,need_help,69,need_help,"Hi!

I have this very frustrating situation in which IU had no problem changing to a dumb phone but I am really struggling with not being online on my"
2026-02-17,Affiliatemarketing,Monetizing a fantasy basketball stats site + blog,https://reddit.com/r/Affiliatemarketing/comments/1r4epvk/monetizing_a_fantasy_basketball_stats_site_blog/,1,14,need_help,69,need_help,"Hi guys,

I've got a project I've been working on. It is a fantasy basketball website where I provide both content and statistics to people in that ni"
2026-02-17,ecommerce,MBA or Ecom Business?-24M,https://reddit.com/r/ecommerce/comments/1r65mv2/mba_or_ecom_business24m/,3,19,need_help,69,need_help,I have been struggling with this decision mentally that should i do a full-time Mba from Tier-2 brands like Sibm or leave everything and start my own 
2026-02-17,productivity,Instagram ad break backfires and helps me stop doomscroling,https://reddit.com/r/productivity/comments/1r72sck/instagram_ad_break_backfires_and_helps_me_stop/,5,2,need_help,60,need_help,"Recently Instagram started stopping my scrolling with 5 second mandatory ad breaks (you literally can't scroll down past them), due to me not allowing"
2026-02-17,ADHD,Need some help &amp; guidance from ADHD vets,https://reddit.com/r/ADHD/comments/1r6zz95/need_some_help_guidance_from_adhd_vets/,2,3,need_help,60,need_help,"To keep it brief. Suicidal ideation since age 9. difficulty with internet use, self-esteem. Hyperfocused on youtube, then video games, then psychedeli"
2026-02-17,loseit,Hunger pangs at night,https://reddit.com/r/loseit/comments/1r6y0lv/hunger_pangs_at_night/,1,7,need_help,60,need_help,"For a few months now I have been struggling with night time hunger after I get into bed, and having eaten a good balanced meal at a reasonable hour. I"
2026-02-17,sleep,Spent 2 Years Fixing My Insomnia. Here Is My Honest Tier List of Supplements.,https://reddit.com/r/sleep/comments/1r72ehx/spent_2_years_fixing_my_insomnia_here_is_my/,1,0,frustrated_with,60,frustrated_with,"I've had the ""exhausted but brain won't shut off"" insomnia for about 3 years. Tried everything from Amazon bestsellers to obscure stuff people recomme"
2026-02-17,Christianity,"Struggling to overcome masturbation, just some advice would help",https://reddit.com/r/Christianity/comments/1r72jyn/struggling_to_overcome_masturbation_just_some/,0,3,need_help,60,need_help,I keep falling over and over to lust and I feel like I can't stop it. If this is against the rules the mods can just take this down I just really need
2026-02-17,islam,New to praying 5x a day and struggling with consistency feeling overwhelmed,https://reddit.com/r/islam/comments/1r6rv29/new_to_praying_5x_a_day_and_struggling_with/,11,4,need_help,60,need_help,I’ve recently been trying to get closer to my faith after some difficult times mentally and physically. My imam gave me a treatment plan and advised m
2026-02-17,smallbusiness,"Starting my first business soon, struggling with contradiction between believing and not believing enough.",https://reddit.com/r/smallbusiness/comments/1r72ye0/starting_my_first_business_soon_struggling_with/,1,7,need_help,60,need_help,"Hello everyone, I'm 20 years old and will be starting my first business soon. I'll be introducing a new gym tool used for optimazing training efficenc"
2026-02-17,GetStudying,Struggling with Balancing Academics + Extracurriculars,https://reddit.com/r/GetStudying/comments/1r736td/struggling_with_balancing_academics/,2,0,need_help,51,need_help,"Hi everyone, I’m currently in Grade 10 and will be moving into Grade 11 in a few months. Academically, I’m doing fairly well: I’m in the top 10% of my"
2026-02-17,GetDisciplined,How do you stay disciplined when life didn’t turn out how you imagined?,https://reddit.com/r/getdisciplined/comments/1r73iql/how_do_you_stay_disciplined_when_life_didnt_turn/,1,0,need_help,51,need_help,"I’m struggling with something I don’t see talked about much in discipline spaces.
I have a young son with developmental challenges, especially with la"
2026-02-18,AppIdeas,i tracked 700+ Reddit complaints for 3 months. here are 7 app ideas people are literally begging someone to build,https://reddit.com/r/AppIdeas/comments/1r73tui/i_tracked_700_reddit_complaints_for_3_months_here/,143,47,willing_to_pay,100,willing_to_pay,"i got tired of seeing app ideas based on vibes. ""wouldn't it be cool if..."" — cool for who? who's paying?

so i tried something different. spent 3 mon"
2026-02-18,microsaas,I just hit $3500 in total revenue with my app. AMA,https://reddit.com/r/microsaas/comments/1r7ym9b/i_just_hit_3500_in_total_revenue_with_my_app_ama/,17,18,frustrated_with,91,frustrated_with,"Just hit $3,500 in total revenue with my app today. I launched it back in September and honestly spent the first month just staring at a zero balance."
2026-02-18,digitalminimalism,Ditched Spotify - enjoying music more than ever,https://reddit.com/r/digitalminimalism/comments/1r6ghya/ditched_spotify_enjoying_music_more_than_ever/,167,49,need_help,78,need_help,"I finally found the will to rid myself of music streaming after waking up to find a huge AI ""beta testing"" search bar in the middle of my screen on my"
2026-02-18,sleep,Does sleep psychology actually work?,https://reddit.com/r/sleep/comments/1r7shiw/does_sleep_psychology_actually_work/,3,6,frustrated_with,70,frustrated_with,"Went to a sleep specialist because I have horrible insomnia. Did a sleep test, physically everything is fine. Apparently its called initiation insomni"
2026-02-18,productivity,Instagram ad break backfires and helps me stop doomscroling,https://reddit.com/r/productivity/comments/1r72sck/instagram_ad_break_backfires_and_helps_me_stop/,29,8,need_help,69,need_help,"Recently Instagram started stopping my scrolling with 5 second mandatory ad breaks (you literally can't scroll down past them), due to me not allowing"
2026-02-18,AppIdeas,What small everyday problem do you wish a mobile app could solve? Or is there an app you wish existed that doesn’t?,https://reddit.com/r/AppIdeas/comments/1r7ijno/what_small_everyday_problem_do_you_wish_a_mobile/,0,0,looking_for,68,looking_for,
2026-02-18,loseit,Struggling with eating too much,https://reddit.com/r/loseit/comments/1r7uzc4/struggling_with_eating_too_much/,5,6,need_help,60,need_help,"Hi all, I am looking for advice for those with similar struggles. I am 28\[F\], and since 2022 I’ve been going to the gym on and off, having lost 20 p"
2026-02-18,sleep,Sleep question,https://reddit.com/r/sleep/comments/1r7z4cu/sleep_question/,2,1,need_help,60,need_help,"22 year old male, been struggling with insomnia for over a year. My sleep went from: Can’t sleep at all, to Falling asleep but waking up 2-3 hours int"
2026-02-18,sleep,Looking for advice and sleep habits to STOP sleeping!!,https://reddit.com/r/sleep/comments/1r7rjvr/looking_for_advice_and_sleep_habits_to_stop/,2,2,need_help,60,need_help,"**TL;DR - I can't stay awake. Have slept more than 12+hours and was still sleepy. Any small task I do makes me need to nap. Can work, but once I am ho"
2026-02-18,GetDisciplined,I’m 16 and I don’t feel like I’m even living,https://reddit.com/r/getdisciplined/comments/1r798xk/im_16_and_i_dont_feel_like_im_even_living/,0,5,need_help,60,need_help,am a 16 year old trans guy. I have been struggling with anxiety (generalized/social) as well as gender dysphoria ever since i was 9-10. I have attempt
2026-02-18,sleep,Overthinking at Night? You’re Not Alone.,https://reddit.com/r/sleep/comments/1r7xrul/overthinking_at_night_youre_not_alone/,1,0,need_help,51,need_help,"Do you lie in bed exhausted… but your brain just won’t switch off?
Overthinking. Anxiety. Random thoughts. Replaying conversations. Planning tomorrow "
2026-02-18,sleep,"20M, Asperger’s - Chronic Insomnia and Sleep Starts after SSRI/SNRI Withdrawal (Prozac, Effexor, Abizol)",https://reddit.com/r/sleep/comments/1r7tm92/20m_aspergers_chronic_insomnia_and_sleep_starts/,1,0,need_help,51,need_help,"Hi everyone, I’m a 20-year-old male with Asperger’s Syndrome. I’ve been on psychiatric medication since I was 8. I’m currently struggling with severe "
2026-02-18,GetDisciplined,"I need help with school, especially mentally and what I can do from this point on",https://reddit.com/r/getdisciplined/comments/1r7o2we/i_need_help_with_school_especially_mentally_and/,2,0,need_help,51,need_help,"I'm currently a high school Junior with a GPA of 3.2, and aspirations of doing something with my life.

I had all A's until I started high school. Fre"
2026-02-18,ecommerce,MBA or Ecom Business?-24M,https://reddit.com/r/ecommerce/comments/1r65mv2/mba_or_ecom_business24m/,3,21,need_help,69,need_help,I have been struggling with this decision mentally that should i do a full-time Mba from Tier-2 brands like Sibm or leave everything and start my own 
2026-02-19,microsaas,got 200 signups from one Reddit comment,https://reddit.com/r/microsaas/comments/1r8wepi/got_200_signups_from_one_reddit_comment/,1,1,looking_for,80,looking_for,"I got 200 signups from one Reddit comment. 

No ads. No following.  

Here's exactly what I wrote:  

The post was asking ""what tool do you use for X?"
2026-02-19,productivity,App for school organization/teachers and substitutes?,https://reddit.com/r/productivity/comments/1r8tr96/app_for_school_organizationteachers_and/,2,1,looking_for,80,looking_for,"I apologize if my english isn’t perfect. I’m in Germany. 

I work as a school assistant at a school with absolutely no organization. 

I‘m looking for"
2026-02-19,ecommerce,"Out-of stock refunds, need help!",https://reddit.com/r/ecommerce/comments/1r86if9/outof_stock_refunds_need_help/,3,5,looking_for,80,looking_for,"Hi everyone!

  
Im looking for a solution to notify our clients when the reason of refund is the item being out of stock. Unfortunately this happens "
2026-02-19,GetDisciplined,[Question] How do you automate your life to have free time instead of catching up on chores?,https://reddit.com/r/getdisciplined/comments/1r8h23b/question_how_do_you_automate_your_life_to_have/,28,17,need_help,78,need_help,I work in consulting in LA which means long hours and an unpredictable schedule and I'm trying to figure out how to claw back some personal time by au
2026-02-19,webdev,Struggling with subscription metrics across multiple platforms—any solutions?,https://reddit.com/r/webdev/comments/1r8ppol/struggling_with_subscription_metrics_across/,0,4,need_help,60,need_help,"Hey all,

I noticed in another thread that many people have issues consolidating subscription data across different platforms. I’m curious—how do you "
2026-02-19,digitalminimalism,Cut out social media one year ago but YouTube is driving me crazy and I can’t let it go,https://reddit.com/r/digitalminimalism/comments/1r8cqo6/cut_out_social_media_one_year_ago_but_youtube_is/,5,3,need_help,60,need_help,"I can’t delete YouTube, don’t know why. Feels like my escape, my true relax moment. Or when I’m bored. I know it’s bad but what can I do with only 5 m"
2026-02-19,ADHD,Long release vs short release,https://reddit.com/r/ADHD/comments/1r8uabm/long_release_vs_short_release/,0,4,need_help,60,need_help,"Just out of interest, for those who tried both long release and short release meds which did you prefer? Or what was your experience with both- pros a"
