id,subreddit,category,title,score,comments,url,money_signal,preview,scraped_at
1rgfovi,indiehackers,indie,[Selling] 4 pre-revenue sites with great potential,11,37,https://reddit.com/r/indiehackers/comments/1rgfovi/selling_4_prerevenue_sites_with_great_potential/,revenue,"I have a few sites that I'd like to let go:  1. The first site, the domain is an exact match of a ke",2026-03-09T20:31:15.417427
1rg0kix,indiehackers,indie,Have you ever done anything offline to get your startup off the ground?,21,108,https://reddit.com/r/indiehackers/comments/1rg0kix/have_you_ever_done_anything_offline_to_get_your/,launch,Recently I’ve been building a launch platform for early-stage founders. It’s still small but growing,2026-03-09T20:31:15.417427
1rop6e5,Entrepreneur,biz,How do I price a client who left me for a larger company?,209,171,https://reddit.com/r/Entrepreneur/comments/1rop6e5/how_do_i_price_a_client_who_left_me_for_a_larger/,,"So this is a pretty classic story. I had a client, now an ex-client, who worked with me when his roo",2026-03-09T20:31:15.417427
1rovl0j,Entrepreneur,biz,What’s the wildest marketing growth hack that actually worked for you?,62,57,https://reddit.com/r/Entrepreneur/comments/1rovl0j/whats_the_wildest_marketing_growth_hack_that/,,I’ve seen a lot of growth hacks that sound genius on Twitter but fall apart in real life. But every ,2026-03-09T20:31:15.417427
1rpcnmv,Entrepreneur,biz,how would you actually sell this if you had to get the first client fast?,6,12,https://reddit.com/r/Entrepreneur/comments/1rpcnmv/how_would_you_actually_sell_this_if_you_had_to/,sale,i’m trying to figure out the sales side of something and i feel like i might be overcomplicating it.,2026-03-09T20:31:15.417427
1rpcqsm,Entrepreneur,biz,How I use MCP servers as a data layer in my GTM workflows,3,6,https://reddit.com/r/Entrepreneur/comments/1rpcqsm/how_i_use_mcp_servers_as_a_data_layer_in_my_gtm/,sale,I build GTM workflows for our sales team and wanted to share an architecture pattern I've been using,2026-03-09T20:31:15.417427
1roh20f,Entrepreneur,biz,How can I train my mind to become more entrepreneurial?,128,160,https://reddit.com/r/Entrepreneur/comments/1roh20f/how_can_i_train_my_mind_to_become_more/,,"I’m 26, and I’ve always wanted to be an entrepreneur. Trouble is, I’ve also always known that I’m ju",2026-03-09T20:31:15.417427
1rpfotw,Entrepreneur,biz,Made $400 in revenue in my first month on Meta Ads with niche apparel brand. Looking for suggestions / resources.,1,6,https://reddit.com/r/Entrepreneur/comments/1rpfotw/made_400_in_revenue_in_my_first_month_on_meta_ads/,revenue|launch|$|made,"Basically as the title suggests. I launched an apparel brand in late January (think Johnny Cupcakes,",2026-03-09T20:31:15.417427
1rp45nd,Entrepreneur,biz,A few weeks ago I asked this sub how to price my SaaS. I launched it. Here's where I stand,3,17,https://reddit.com/r/Entrepreneur/comments/1rp45nd/a_few_weeks_ago_i_asked_this_sub_how_to_price_my/,launch,"A while back, I posted here asking whether I should charge a subscription or a one-time fee for a to",2026-03-09T20:31:15.417427
1roqp0f,Entrepreneur,biz,"I'm building a social platform for students, how do I get my first real users?",15,65,https://reddit.com/r/Entrepreneur/comments/1roqp0f/im_building_a_social_platform_for_students_how_do/,users,**The Backstory:**  I'm a 17 year old guy who is highly introverted. I quit traditional studying rou,2026-03-09T20:31:15.417427
1rovets,Entrepreneur,biz,Sketched out an app with base44 unsure of next steps,4,13,https://reddit.com/r/Entrepreneur/comments/1rovets/sketched_out_an_app_with_base44_unsure_of_next/,made,"Hi, so I made a rough prototype of a social media matching type app on base44. Every page is built a",2026-03-09T20:31:15.417427
1robu8f,Entrepreneur,biz,"First and only client left because results were too good, looking for encouragement",18,45,https://reddit.com/r/Entrepreneur/comments/1robu8f/first_and_only_client_left_because_results_were/,revenue,Marketing agency business here with a recurring payments business model.    I'm back to 0 revenue. M,2026-03-09T20:31:15.417427
1rnfgee,Entrepreneur,biz,The real AI gold rush isn’t in building. It’s in babysitting.,380,183,https://reddit.com/r/Entrepreneur/comments/1rnfgee/the_real_ai_gold_rush_isnt_in_building_its_in/,,Times have changed quickly...  I was reading about a developer on Reddit shut down his funded startu,2026-03-09T20:31:15.417427
1rnyv5u,Entrepreneur,biz,"we edited 200+ reels last month with a team of 8, but we’re still around $4k/month. looking for some advice.",23,70,https://reddit.com/r/Entrepreneur/comments/1rnyv5u/we_edited_200_reels_last_month_with_a_team_of_8/,$|k/mo|k/month,I want to be a bit raw here and ask for some honest advice from people who have been in this positio,2026-03-09T20:31:15.417427
1rnrizp,Entrepreneur,biz,1 Year Into My Business and My Brain Keeps Saying “Quit”,41,71,https://reddit.com/r/Entrepreneur/comments/1rnrizp/1_year_into_my_business_and_my_brain_keeps_saying/,launch,"How do you handle the moments when you feel like you’re not cut out for this?  Hey everyone, first t",2026-03-09T20:31:15.417427
1rm7ktk,Entrepreneur,biz,What is a skill you can learn within 30 days that can actually make money?,727,584,https://reddit.com/r/Entrepreneur/comments/1rm7ktk/what_is_a_skill_you_can_learn_within_30_days_that/,,"If someone had 30 days to learn one skill from the internet and start making money with it, what wou",2026-03-09T20:31:15.417427
1rlcjh8,Entrepreneur,biz,8 companies ate $73 billion. You’re still begging for scraps.,381,103,https://reddit.com/r/Entrepreneur/comments/1rlcjh8/8_companies_ate_73_billion_youre_still_begging/,$,Rockefeller and Carnegie owned everything in the 1890s. Rest of America worked 16 hour days in their,2026-03-09T20:31:15.417427
1rjqlol,Entrepreneur,biz,tripled revenue by raising prices. lost some clients. no regrets,167,79,https://reddit.com/r/Entrepreneur/comments/1rjqlol/tripled_revenue_by_raising_prices_lost_some/,revenue,was undercharging for 2 years. afraid of losing clients....finally raised prices. 2x for new clients,2026-03-09T20:31:15.417427
1rm9so0,Entrepreneur,biz,Took a 10-day vacation and nothing broke. That scared me more than if it had.,127,59,https://reddit.com/r/Entrepreneur/comments/1rm9so0/took_a_10day_vacation_and_nothing_broke_that/,sale,first real vacation in 3 years. left my restaurant with my sous chef in charge. phone on silent. tol,2026-03-09T20:31:15.417427
1rkgv0h,Entrepreneur,biz,I stopped promising results in my copy and started explaining why things fail response rate doubled,124,65,https://reddit.com/r/Entrepreneur/comments/1rkgv0h/i_stopped_promising_results_in_my_copy_and/,$|k/mo|k/month,For like 8 months I was writing copy the way everyone teaches it. Lead with the benefit. Make the pr,2026-03-09T20:31:15.417427
1rl61fg,Entrepreneur,biz,My dad lacks purpose - need advice,110,140,https://reddit.com/r/Entrepreneur/comments/1rl61fg/my_dad_lacks_purpose_need_advice/,,"Hey everyone, hope all is well.  My dad is a serial entrepreneur who's been involved in a ton of bus",2026-03-09T20:31:15.417427
1rk7mjf,Entrepreneur,biz,Am I stupid or is this the only way? Here’s how I lost $15k.,58,74,https://reddit.com/r/Entrepreneur/comments/1rk7mjf/am_i_stupid_or_is_this_the_only_way_heres_how_i/,$,"**My story:**  I don’t code and trust me I tried. I bought the courses online, watched the YouTube t",2026-03-09T20:31:15.417427
1rlchnl,Entrepreneur,biz,"Lessons From $1,360,402.41 In Sales With $497,649.41 Ad Spend In February.",43,44,https://reddit.com/r/Entrepreneur/comments/1rlchnl/lessons_from_136040241_in_sales_with_49764941_ad/,sale|$,"Good day!  Last month, my DTC brand did $1.36M in sales with $497k in ad spend. In this post I will ",2026-03-09T20:31:15.417427
1rkp5wi,Entrepreneur,biz,In how much time have you got your first  1/10/100 users / clients ?,40,59,https://reddit.com/r/Entrepreneur/comments/1rkp5wi/in_how_much_time_have_you_got_your_first_110100/,users,"To give an idea of the timeline beginners can expect, describe your product / service and how much t",2026-03-09T20:31:15.417427
1rmw58w,Entrepreneur,biz,Took a two-week vacation. Nothing broke. That was more terrifying than if it had.,25,40,https://reddit.com/r/Entrepreneur/comments/1rmw58w/took_a_twoweek_vacation_nothing_broke_that_was/,revenue,"Just got back from properly unplugging for the first time in three years. No Slack on phone. No ""qui",2026-03-09T20:31:15.417427
1rjktlh,Entrepreneur,biz,Your free users aren’t customers.,23,46,https://reddit.com/r/Entrepreneur/comments/1rjktlh/your_free_users_arent_customers/,users,"Restaurants don’t survive on people who come in, drink water, use the bathroom, and leave.  But some",2026-03-09T20:31:15.417427
1rp3pj7,SocialMediaMarketing,smm,Built a Telegram bot for SMMA content ideas,1,4,https://reddit.com/r/SocialMediaMarketing/comments/1rp3pj7/built_a_telegram_bot_for_smma_content_ideas/,earning,"Hey guys, myself Ahnaf. I hope you are doing good. I have been learning automations for the last cou",2026-03-09T20:31:15.417427
1ror0wn,SocialMediaMarketing,smm,Am i shadowbanned on TikTok??,1,2,https://reddit.com/r/SocialMediaMarketing/comments/1ror0wn/am_i_shadowbanned_on_tiktok/,made,"I recently made a new account just because i wanted a fresh start, and i posted 3 videos at first an",2026-03-09T20:31:15.417427
1robnpq,SocialMediaMarketing,smm,How I finally started getting replies with LinkedIn outreach automation,6,6,https://reddit.com/r/SocialMediaMarketing/comments/1robnpq/how_i_finally_started_getting_replies_with/,sale,I work in sales and business development and for many months my LinkedIn messages got almost no repl,2026-03-09T20:31:15.417427
1rmi6fx,SocialMediaMarketing,smm,I am so tired of linking my personal cell phone to every new client's social accounts.,68,10,https://reddit.com/r/SocialMediaMarketing/comments/1rmi6fx/i_am_so_tired_of_linking_my_personal_cell_phone/,,"Seriously, how are you guys managing this in 2026?  Every time we onboard a new brand and need to se",2026-03-09T20:31:15.417427
1rl6jcs,SocialMediaMarketing,smm,"I'm tired, I am actually tired.",14,31,https://reddit.com/r/SocialMediaMarketing/comments/1rl6jcs/im_tired_i_am_actually_tired/,earning,So 2 years ago I decided to start learning Digital Marketing and Social Media Management.  I finishe,2026-03-09T20:31:15.417427
176fe1v,nocode,nocode,Product Launch Post,136,597,https://reddit.com/r/nocode/comments/176fe1v/product_launch_post/,launch,Post about all your upcoming product launches here!,2026-03-09T20:31:15.417427
1rpbe19,nocode,nocode,My 3rd mobile app!,2,3,https://reddit.com/r/nocode/comments/1rpbe19/my_3rd_mobile_app/,launch,"After success of Cal Ai and myself using of Yazio, I want to build my calorie tracking app. Excited ",2026-03-09T20:31:15.417427
1rpda0c,nocode,nocode,How I replaced my $50/mo AI writing subscription with a local Python script (Gemini 2.5 Pro),1,3,https://reddit.com/r/nocode/comments/1rpda0c/how_i_replaced_my_50mo_ai_writing_subscription/,$,I wanted to share a workflow I’ve been using to kill the 'SaaS tax' on my content creation. ​Most AI,2026-03-09T20:31:15.417427
1roylsy,nocode,nocode,"We built a no-code Privacy First AI platform, looking out for pilot users",1,1,https://reddit.com/r/nocode/comments/1roylsy/we_built_a_nocode_privacy_first_ai_platform/,users,I recently helped a startup build their own Privacy-First AI assistant for their HR department. They,2026-03-09T20:31:15.417427
1rorvxg,nocode,nocode,How are you guys creating your branded video player? Well we found out two ways to do so.,2,2,https://reddit.com/r/nocode/comments/1rorvxg/how_are_you_guys_creating_your_branded_video/,made,"Hey all, quick question!  How are you guys creating a branded video player for your website?  We jus",2026-03-09T20:31:15.417427
1ro2tmu,nocode,nocode,I rescue no-code apps for a living. The same 5 things break every single one.,14,16,https://reddit.com/r/nocode/comments/1ro2tmu/i_rescue_nocode_apps_for_a_living_the_same_5/,made,Not hating on no-code. I've built 60+ production apps with it and I still use it. But after rescuing,2026-03-09T20:31:15.417427
1rocm50,nocode,nocode,WEB,1,2,https://reddit.com/r/nocode/comments/1rocm50/web/,launch," launched my Flutter web app on a hosting service and even paid for a domain, but why doesn’t it app",2026-03-09T20:31:15.417427
1rn7huq,nocode,nocode,"If You Had to Build a Startup Today Using Only No-Code, What Would You Build?",12,20,https://reddit.com/r/nocode/comments/1rn7huq/if_you_had_to_build_a_startup_today_using_only/,launch,Imagine you had to launch a startup using only no-code tools.  What would you build?  Something simp,2026-03-09T20:31:15.417427
1rld2gc,nocode,nocode,post your app/projects on these subreddits,9,3,https://reddit.com/r/nocode/comments/1rld2gc/post_your_appprojects_on_these_subreddits/,passive|income,post your app/projects on these subreddits  r/InternetIsBeautiful (17M)  r/Entrepreneur (4.8M)  r/pr,2026-03-09T20:31:15.417427
1rkk9ow,nocode,nocode,You Don’t Need 7 AI Agents,6,34,https://reddit.com/r/nocode/comments/1rkk9ow/you_dont_need_7_ai_agents/,sale,"I see lots of talk about building multiple AI agents for sales and marketing.   * Lead gen,  * outre",2026-03-09T20:31:15.417427
1rkdlc7,nocode,nocode,One single prompt to opus 4.6,8,2,https://reddit.com/r/nocode/comments/1rkdlc7/one_single_prompt_to_opus_46/,app store,Greetings r/nocode 👋      I'm the creator of [Screenshot Otter](https://screenshototter.com)! A tool,2026-03-09T20:31:15.417427
1rm0g64,nocode,nocode,Looking for a database/tool to manage non-profit people served/programs,5,11,https://reddit.com/r/nocode/comments/1rm0g64/looking_for_a_databasetool_to_manage_nonprofit/,profit,I’m helping a nonprofit set up a better system to manage several programs we run throughout the year,2026-03-09T20:31:15.417427
1rl0xn1,nocode,nocode,I made a tool to help identify if you are paying for a streaming service that you get for free with other paid services.  US only for now,6,4,https://reddit.com/r/nocode/comments/1rl0xn1/i_made_a_tool_to_help_identify_if_you_are_paying/,made,,2026-03-09T20:31:15.417427
1rjxps4,nocode,nocode,AI learning platform that generates personalized roadmaps,4,2,https://reddit.com/r/nocode/comments/1rjxps4/ai_learning_platform_that_generates_personalized/,earning,,2026-03-09T20:31:15.417427
1rnw16q,nocode,nocode,Best tools for turning screenshots into professional annotated images — I tested 7 of them,5,2,https://reddit.com/r/nocode/comments/1rnw16q/best_tools_for_turning_screenshots_into/,app store,"I've been looking for a good way to make polished annotated screenshots for app store listings, land",2026-03-09T20:31:15.417427
1rp4xlc,AppStore,apps,How many days can it take on App Store resubmitted app,1,2,https://reddit.com/r/Appstore/comments/1rp4xlc/how_many_days_can_it_take_on_app_store/,app store,I submitted my app after feedback on Thursday. Generally the response comes within 48 hours. How man,2026-03-09T20:31:15.417427
1rnoz87,AppStore,apps,"App Store Connect bug: Infinite loading on ""Business Contact Information"" compliance modal. Anyone else?",1,0,https://reddit.com/r/Appstore/comments/1rnoz87/app_store_connect_bug_infinite_loading_on/,app store,"Hey everyone,  I'm trying to update my compliance requirements in App Store Connect (specifically th",2026-03-09T20:31:15.417427
1rneclc,AppStore,apps,[iOS][FREE for all (Continue without Signing in)]-AI Rep Counter On-Device:Workout Tracker &amp; Form Coach,1,0,https://reddit.com/r/Appstore/comments/1rneclc/iosfree_for_all_continue_without_signing_inai_rep/,earning,This app keeps you motivated with gamified home workout experience with form feedback and automatic ,2026-03-09T20:31:15.417427
1rm61hv,AppStore,apps,"[iOS] [Free] Voxu AI - Video &amp; Vlog Editor: 2K Export, AI Background Removal, and Local English Captions (No Watermark)",2,2,https://reddit.com/r/Appstore/comments/1rm61hv/ios_free_voxu_ai_video_vlog_editor_2k_export_ai/,made,I’m an independent developer with over 20 years of experience. I wanted to build a powerful yet intu,2026-03-09T20:31:15.417427
1rm62u4,AppStore,apps,Out of the blue - charged for unused app,1,0,https://reddit.com/r/Appstore/comments/1rm62u4/out_of_the_blue_charged_for_unused_app/,app store,"Hi everyone,  Have you ever been charged a subscription via app store, out of the blue for an app th",2026-03-09T20:31:15.417427
1rlohfs,AppStore,apps,Toggl Track users — wish you could see your timer on the lock screen?,1,2,https://reddit.com/r/Appstore/comments/1rlohfs/toggl_track_users_wish_you_could_see_your_timer/,users,"I’ve been using Toggl for a while to track work/study sessions, but it always felt a bit inefficient",2026-03-09T20:31:15.417427
1rlh1ug,AppStore,apps,"I made a ""one-shot"" daily puzzle where everyone gets the same level",1,1,https://reddit.com/r/Appstore/comments/1rlh1ug/i_made_a_oneshot_daily_puzzle_where_everyone_gets/,launch|made,I’m a solo dev and I’ve been working on a minimalist physics-based puzzle called **TILT**.  The conc,2026-03-09T20:31:15.417427
1rjze1n,AppStore,apps,A question about apps spike in visibility.,2,0,https://reddit.com/r/Appstore/comments/1rjze1n/a_question_about_apps_spike_in_visibility/,downloads,"Hello, I uploaded this media editor app approximately 3 weeks ago, and over the past 2 days I've not",2026-03-09T20:31:15.417427
1ricf0b,AppStore,apps,I shipped my first iOS wellness app and need honest feedback on first-time experience,1,3,https://reddit.com/r/Appstore/comments/1ricf0b/i_shipped_my_first_ios_wellness_app_and_need/,launch,"I just launched my first iOS app, Selu. It helps with daily mood check-ins, private journaling, and ",2026-03-09T20:31:15.417427
1rhh4z6,AppStore,apps,"IndyCRM — Native iOS CRM for freelancers. Free to try, $4.99 lifetime",1,0,https://reddit.com/r/Appstore/comments/1rhh4z6/indycrm_native_ios_crm_for_freelancers_free_to/,$,"Just shipped IndyCRM, a native iOS CRM for   freelancers and independent workers.    Free to downloa",2026-03-09T20:31:15.417427
1rh32pp,AppStore,apps,RevenueCat paywall not fetching offerings — Paid Apps Agreement “Pending User Info”,1,1,https://reddit.com/r/Appstore/comments/1rh32pp/revenuecat_paywall_not_fetching_offerings_paid/,revenue|app store,"My iOS app uses RevenueCat, but the paywall is not fetching offerings (returns empty).  In App Store",2026-03-09T20:31:15.417427
1rgrjyd,AppStore,apps,I built a simple free product scanner for pregnancy / nursing,1,0,https://reddit.com/r/Appstore/comments/1rgrjyd/i_built_a_simple_free_product_scanner_for/,launch,"Hey following my wife request, I just launched BabynMamaSafe – a completely free product Scanner for",2026-03-09T20:31:15.417427
1rg2d2k,AppStore,apps,Dockee : Disponible sur l'App Store,2,0,https://reddit.com/r/Appstore/comments/1rg2d2k/dockee_disponible_sur_lapp_store/,app store,,2026-03-09T20:31:15.417427
1rfsqaj,AppStore,apps,Is there any free TV remote app on app store.,1,0,https://reddit.com/r/Appstore/comments/1rfsqaj/is_there_any_free_tv_remote_app_on_app_store/,app store,"Just spent a hour looking for my remote im tired, they all seem to cost alot of money. I have a TCL ",2026-03-09T20:31:15.417427
1rfqmd8,AppStore,apps,Looking for feedback,1,0,https://reddit.com/r/Appstore/comments/1rfqmd8/looking_for_feedback/,made,"Hi guys.   I have made WTFog, where you unlock the fog by exploring.   Hoping that someone wants to ",2026-03-09T20:31:15.417427
