date,subreddit,title,url,score,comments,pain_categories,opportunity_score,top_pattern,selftext_preview
2026-02-24,Affiliatemarketing,"affiliate traffic sources that build faster than SEO, what actually works",https://reddit.com/r/Affiliatemarketing/comments/1raoakx/affiliate_traffic_sources_that_build_faster_than/,9,18,frustrated_with,80,frustrated_with,"9 months grinding SEO, traffic barely moving, need something faster or I'm going to run out of money before this works what channels are you using for"
2026-02-24,GetStudying,How to effectively study and prepare for exams,https://reddit.com/r/GetStudying/comments/1rdatye/how_to_effectively_study_and_prepare_for_exams/,39,24,need_help,78,need_help,"Hello everyone,

I’m a university student and for a while I was really struggling with studying effectively. I just couldn’t concentrate. Even small n"
2026-02-24,ADHD,How to deflate my ego?,https://reddit.com/r/ADHD/comments/1rd9k75/how_to_deflate_my_ego/,14,12,need_help,69,need_help," I’m a student struggling with a toxic mental habit, and I’m looking for some blunt advice or CBT-based strategies to break it.

 A few years ago, I w"
2026-02-24,loseit,Having trouble with my diet,https://reddit.com/r/loseit/comments/1rd9ze6/having_trouble_with_my_diet/,2,11,need_help,69,need_help,"Basically the title. I can stick to a workout plan just PERFECTLY, but when it comes to eating? I can not eat sugar or junk for a week tops and then I"
2026-02-24,SaaS,How a personal frustration turned into a SaaS built on tens of thousands of lines of code,https://reddit.com/r/SaaS/comments/1rdd7po/how_a_personal_frustration_turned_into_a_saas/,1,0,frustrated_with,60,frustrated_with,"It all started from a personal frustration. I consume a lot of YouTube content, mainly for learning (Self-learning, university lectures, and conferenc"
2026-02-24,SideProject,Side project: tool that detects explicit hiring posts in real time,https://reddit.com/r/SideProject/comments/1rdc9dn/side_project_tool_that_detects_explicit_hiring/,3,3,need_help,60,need_help,"I started by manually searching for freelancers who needed clients.

Instead of job boards, I looked for people publicly posting:

“Hiring Content Wri"
2026-02-24,Entrepreneur,"Moving from ""Basics"" to ""Business"": How do you validate a niche and find your first overseas buyer?",https://reddit.com/r/Entrepreneur/comments/1rd1vqk/moving_from_basics_to_business_how_do_you/,2,2,need_help,60,need_help,"Hi everyone,

I’ve spent the last few months diving deep into the fundamentals of export (Incoterms, documentation, logistics), but I’m hitting a wall"
2026-02-24,productivity,What works well helping you recover 🧠 exhaustion after a stressful workday?,https://reddit.com/r/productivity/comments/1rdc8x3/what_works_well_helping_you_recover_exhaustion/,4,2,need_help,60,need_help,"I'm struggling with this these days, tho my career is of my choosing and I feel satisfied, sometimes I push myself (coz it Req me) too much that

I fe"
2026-02-24,ADHD,How can I reduce stress with ADHD?,https://reddit.com/r/ADHD/comments/1rdbiot/how_can_i_reduce_stress_with_adhd/,3,6,need_help,60,need_help,"What do you do to reduce stress? 

All my life I (late 20s, F) am struggling with health issues: diarrhea out of nervosity, depressions since childhoo"
2026-02-24,ADHD,"Struggling with focus and procrastination on cognitive tasks, but fine with physical work",https://reddit.com/r/ADHD/comments/1rdahc1/struggling_with_focus_and_procrastination_on/,3,2,need_help,60,need_help,"Hi everyone,

I’m 42 and have had a problem with focus and procrastination for about 10 years. I notice:

* I procrastinate and then feel guilty
* Whe"
2026-02-24,Christianity,venting/ i feel like im broken beyond repair,https://reddit.com/r/Christianity/comments/1rdcx26/venting_i_feel_like_im_broken_beyond_repair/,2,1,need_help,60,need_help,"yeah that’s it

i’ve been doing everything 

nothing works

i’m even on antidepressants and it doesn’t do anything 

i’m so tired

why does he never a"
2026-02-24,GetDisciplined,"Struggling with focus and procrastination on cognitive tasks, but fine with physical work",https://reddit.com/r/getdisciplined/comments/1rdal81/struggling_with_focus_and_procrastination_on/,1,2,need_help,60,need_help,"Hi everyone,

I’m 42 and have had a problem with focus and procrastination for about 10 years. I notice:

* I procrastinate and then feel guilty
* Whe"
2026-02-24,GetDisciplined,I would like to get in shape but it seems impossible,https://reddit.com/r/getdisciplined/comments/1rd5esa/i_would_like_to_get_in_shape_but_it_seems/,2,2,need_help,60,need_help,"Hello, here’s my situation: I’ve been struggling with my body and my eating habits for several years now. I really love food, especially sweets. I don"
2026-02-24,GetDisciplined,Struggling with consistency — structure vs motivation (what actually worked for you?),https://reddit.com/r/getdisciplined/comments/1rcy9i4/struggling_with_consistency_structure_vs/,0,5,need_help,60,need_help,"I’ve noticed a repeating cycle in myself over the past few years.

When I’m motivated, I go all in. I’ll set up habit trackers, plan routines, downloa"
2026-02-24,SaaS,What's the most overhyped SaaS tool in our industry?,https://reddit.com/r/SaaS/comments/1rddm5x/whats_the_most_overhyped_saas_tool_in_our_industry/,2,0,need_help,51,need_help,Honestly I reckon Notion has to be up there. Everyone acts like it's the holy grail but half the time I see teams struggling with it because it's just
2026-02-28,startups,Has anyone had any luck with YC co-founder matching? Or is it all dev-shop scammers (I will not promote),https://reddit.com/r/startups/comments/1rg1rrn/has_anyone_had_any_luck_with_yc_cofounder/,43,61,frustrated_with,91,frustrated_with,"This past couple week I've met with 3 others on co-founder matching. Damn all the dev-shop people to hell, it's a waste of time each match. It's all d"
2026-02-28,Entrepreneur,"Feedback Friday! - February 27, 2026",https://reddit.com/r/Entrepreneur/comments/1rg2ob4/feedback_friday_february_27_2026/,10,50,need_help,78,need_help,"Need help with your website or portfolio? Want advice from other entrepreneurs on what you could improve?

Share your stuff here and get feedback from"
2026-02-28,Christianity,Struggling with what’s going to happen to my boyfriend after he took his life,https://reddit.com/r/Christianity/comments/1rgyoq0/struggling_with_whats_going_to_happen_to_my/,4,11,need_help,69,need_help,My boyfriend recently took his life. Someone said to me he is in hell and o cannot cope with the thought of that. He was such a sweet boy who went thr
2026-02-28,smallbusiness,Founders of service businesses - what actually worked for getting your first clients?,https://reddit.com/r/smallbusiness/comments/1rgulh5/founders_of_service_businesses_what_actually/,4,17,need_help,69,need_help,"I’m trying to get a small B2B service business off the ground alongside a full-time job and struggling with the “first client” problem.

The service i"
2026-02-28,GetStudying,This tool is amazing while learning and studying on YouTube,https://reddit.com/r/GetStudying/comments/1rgrsih/this_tool_is_amazing_while_learning_and_studying/,2,0,looking_for,68,looking_for,"I'm a student and coder, so I constantly learn about new technologies from online sources like stackoverflow, w3schools, etc,. I mainly spend most of "
2026-02-28,digitalminimalism,Algorithmless Reelless Instagram (Android),https://reddit.com/r/digitalminimalism/comments/1rgjmbk/algorithmless_reelless_instagram_android/,0,1,looking_for,68,looking_for,"I'm a pretty social guy so I can't really avoid using apps like Instagram to keep up with friends, but I've been annoyed with both the algorithm and t"
2026-02-28,productivity,Need advice for continuing college,https://reddit.com/r/productivity/comments/1rg8im1/need_advice_for_continuing_college/,5,5,need_help,60,need_help,"Hello , 25 M
It's been 3 years since I took a break from college.
Because of addiction and depression.
Right now it's that i am 28 days sober and stru"
2026-02-28,islam,OCD salah and wudu please help,https://reddit.com/r/islam/comments/1rgzegs/ocd_salah_and_wudu_please_help/,1,1,need_help,60,need_help,Salam. I’m not sure when this happened but for the last year I’ve been struggling with salah to the point where I over analyze everything. I think I h
2026-02-28,GetDisciplined,Building an app that schedules my day and hold me accountable for what i did and what i missed. More or less like a pers,https://reddit.com/r/getdisciplined/comments/1rgwiey/building_an_app_that_schedules_my_day_and_hold_me/,1,5,need_help,60,need_help,"Currently I am thinking, every night the app starts ringing (say 10/11 pm) and it won't stop ringing till I start journaling so that i am forced to st"
2026-02-28,ecommerce,Need help with my PPC ads on a new start up,https://reddit.com/r/ecommerce/comments/1rgna03/need_help_with_my_ppc_ads_on_a_new_start_up/,0,6,need_help,60,need_help,"Hello everyone, I am not new to running ads as I have ran very successful ads for my old business, but unfortunately due to internal conflict we had t"
2026-02-28,Affiliatemarketing,Amazon PA-API / Creators API Initial Access Timeframe,https://reddit.com/r/Affiliatemarketing/comments/1rglm20/amazon_paapi_creators_api_initial_access_timeframe/,3,3,feature_request,50,feature_request,Does anyone know how long it takes Amazon to give access to the API’s once you hit the 10 distinct sales in one month? It’s a lot harder for a mobile 
