id,subreddit,category,title,score,comments,url,money_signal,preview,scraped_at
1hskrut,indiegaming,apps,Best of Indie Games 2024: What were some of your favorite indie games?,88,203,https://reddit.com/r/IndieGaming/comments/1hskrut/best_of_indie_games_2024_what_were_some_of_your/,,Last year's thread:   https://old.reddit.com/r/IndieGaming/comments/18wnukv/best_of_indie_games_2023,2026-03-09T20:31:15.417427
1rowqu5,indiegaming,apps,1-bit lighthouse animation,420,15,https://reddit.com/r/IndieGaming/comments/1rowqu5/1bit_lighthouse_animation/,made,Hey!    I made GlagStone—a city builder in a 1-bit style,2026-03-09T20:31:15.417427
1rpergf,indiegaming,apps,THYSIASTERY IS OUT NOW!!! - a roguelike Dungeon Crawler RPG that makes you feel nostalgic. Play it on Steam!,38,2,https://reddit.com/r/IndieGaming/comments/1rpergf/thysiastery_is_out_now_a_roguelike_dungeon/,launch,"Heyyy everyone, the day has come!      **THYSIASTERY, our debut title, is finally out.**      So... ",2026-03-09T20:31:15.417427
1rp83ue,indiegaming,apps,I’m an indie developer working on a survival horror game called BECROWNED. Just wanted to share some new screenshots and get your thoughts!,65,17,https://reddit.com/r/IndieGaming/comments/1rp83ue/im_an_indie_developer_working_on_a_survival/,arr,Hey everyone! I’m an indie dev working on a survival horror game called BECROWNED. It mixes dark fan,2026-03-09T20:31:15.417427
1rp9jae,indiegaming,apps,I spent 6 months making my first Steam game and honestly… it’s not that good,27,11,https://reddit.com/r/IndieGaming/comments/1rp9jae/i_spent_6_months_making_my_first_steam_game_and/,made,Hi everyone.  I spent about 6 months making my first Steam game mostly solo.  During development I m,2026-03-09T20:31:15.417427
1rooqbn,indiegaming,apps,"First attempt at game development: be honest, would you play this?",374,88,https://reddit.com/r/IndieGaming/comments/1rooqbn/first_attempt_at_game_development_be_honest_would/,,hand-drawn and musically scored by a single dev who is probably a masochist. When All Things End - 月,2026-03-09T20:31:15.417427
1rp28vg,indiegaming,apps,"I've heard you: The price for Randomice has gone down, and I've made updates to the Steam page!",20,2,https://reddit.com/r/IndieGaming/comments/1rp28vg/ive_heard_you_the_price_for_randomice_has_gone/,$|made,"A few weeks ago, you were many (many (many)) to give me feedback on Randomice and its steam page.  W",2026-03-09T20:31:15.417427
1rp82ju,indiegaming,apps,"After a year of hand-animating every single boss, our narrative deckbuilder where you stack cards in sequence finally has a reveal trailer!",10,6,https://reddit.com/r/IndieGaming/comments/1rp82ju/after_a_year_of_handanimating_every_single_boss/,arr,"Hi everyone! We are a team of two from France, and we are so proud to finally share the official tra",2026-03-09T20:31:15.417427
1rpegch,indiegaming,apps,Tomorrow I'll launch the game I've been working on for 4 years. Hades meets Domekeeper with friends.,5,2,https://reddit.com/r/IndieGaming/comments/1rpegch/tomorrow_ill_launch_the_game_ive_been_working_on/,launch,Hello everyone!  I'm Bastien and I've been working on Kritter: Defend Together for more than 4 years,2026-03-09T20:31:15.417427
1rpfr84,indiegaming,apps,I made a Sudoku game for my son using animals instead of numbers,3,2,https://reddit.com/r/IndieGaming/comments/1rpfr84/i_made_a_sudoku_game_for_my_son_using_animals/,made,"let me know your thoughts. If you are willing to try it, I can invite you to early access",2026-03-09T20:31:15.417427
1rop2gg,indiegaming,apps,Does my bullet grazing effect look satisfying enough?,110,43,https://reddit.com/r/IndieGaming/comments/1rop2gg/does_my_bullet_grazing_effect_look_satisfying/,,"I am making a bullet hell roguelike where where the main gimmick is that you get ""energy"" from letti",2026-03-09T20:31:15.417427
1rpep0g,indiegaming,apps,"I have no friends in real life, so I made a game where you find and fire 100 buddies at enemy waves. Would you play [100FRIENDS]?",3,2,https://reddit.com/r/IndieGaming/comments/1rpep0g/i_have_no_friends_in_real_life_so_i_made_a_game/,made,,2026-03-09T20:31:15.417427
1rp0kzk,indiegaming,apps,We are developing a game in which you sell handmade furniture by shooting it into a nearby town. Do you have any other distribution ideas?,10,1,https://reddit.com/r/IndieGaming/comments/1rp0kzk/we_are_developing_a_game_in_which_you_sell/,made,"You can also use a drone to sell your stuff, but we think using a big cannon in late game is more fu",2026-03-09T20:31:15.417427
1rp2pe8,indiegaming,apps,I made a GenZ version of my trailer to appeal to the younger generations,7,1,https://reddit.com/r/IndieGaming/comments/1rp2pe8/i_made_a_genz_version_of_my_trailer_to_appeal_to/,made,,2026-03-09T20:31:15.417427
1ros4g4,indiegaming,apps,I’m making a trailer for my first game. Would you like it if you see it on Steam?,38,22,https://reddit.com/r/IndieGaming/comments/1ros4g4/im_making_a_trailer_for_my_first_game_would_you/,made,I made this trailer for the game I have been working on for 7 years. I gathered some feedback from R,2026-03-09T20:31:15.417427
1rogmt8,indiegaming,apps,A quick look at our enemy dodging and counter-attack system. (Early Development),159,15,https://reddit.com/r/IndieGaming/comments/1rogmt8/a_quick_look_at_our_enemy_dodging_and/,,Hey everyone! This is a quick clip from our upcoming indie game. We just dropped our new devlog expl,2026-03-09T20:31:15.417427
1rniq82,indiegaming,apps,"I'm making a roguelike but each time you die, time skips forward 10 years. Do you think this concept works?",3834,261,https://reddit.com/r/IndieGaming/comments/1rniq82/im_making_a_roguelike_but_each_time_you_die_time/,,"Hello! We are making [Erosion](https://store.steampowered.com/app/3211720/Erosion/), a voxel rogueli",2026-03-09T20:31:15.417427
1rjo5ne,indiegaming,apps,Made a game where you play as Karen and destroy a mall. Steam page just went live.,3342,233,https://reddit.com/r/IndieGaming/comments/1rjo5ne/made_a_game_where_you_play_as_karen_and_destroy_a/,made,Steam: [https://store.steampowered.com/app/4374950/KAREN/](https://store.steampowered.com/app/437495,2026-03-09T20:31:15.417427
1rml2nv,indiegaming,apps,We're building a survival RPG where Orcs rebuild their civilization. Thoughts?,1170,184,https://reddit.com/r/IndieGaming/comments/1rml2nv/were_building_a_survival_rpg_where_orcs_rebuild/,,,2026-03-09T20:31:15.417427
1rlt3xg,indiegaming,apps,Oh My Doug!,913,57,https://reddit.com/r/IndieGaming/comments/1rlt3xg/oh_my_doug/,,"Created by Oddmenin  &gt;Indie Studio creating an immersive hand-drawn 2D, '90s cartoon style Metroi",2026-03-09T20:31:15.417427
1rkhf1j,indiegaming,apps,Realizing my game won't make millions and I'll have to find a job,887,241,https://reddit.com/r/IndieGaming/comments/1rkhf1j/realizing_my_game_wont_make_millions_and_ill_have/,,"If you want to wishlist the game on Steam, it would encourage me to keep developing, the link is bel",2026-03-09T20:31:15.417427
1rle0il,indiegaming,apps,I spent 2 years making a first-person point-and-click adventure set in a mysterious post-apocalyptic swamp. It released yesterday on Steam.,615,65,https://reddit.com/r/IndieGaming/comments/1rle0il/i_spent_2_years_making_a_firstperson/,,"Hi everyone,  I just released Back in the Swamp, a first-person point-and-click exploration adventur",2026-03-09T20:31:15.417427
1rl374c,indiegaming,apps,Using the Parallax Method for distance estimation in my archaeology game. How do you feel about this 'Analog' onboarding?,523,81,https://reddit.com/r/IndieGaming/comments/1rl374c/using_the_parallax_method_for_distance_estimation/,,"Hi everyone! I’m currently refining the player onboarding for my historical exploration game, Silenc",2026-03-09T20:31:15.417427
1rnbpe4,indiegaming,apps,"I’m working on a dystopian insurance sim called 'Denied'. As you deny claims to meet your quota, the patients visually decay into featureless mannequins and their data gets less readable.",439,73,https://reddit.com/r/IndieGaming/comments/1rnbpe4/im_working_on_a_dystopian_insurance_sim_called/,,"Hey everyone!  I'm a solo dev currently working on my first Steam game, ***Denied***. It's a story-r",2026-03-09T20:31:15.417427
1rjwigm,indiegaming,apps,today we announced our release date and that we're coming to Nintendo switch 2! our game is pretty much if jet set radio had a baby with Tony Hawk's pro skater lol,415,25,https://reddit.com/r/IndieGaming/comments/1rjwigm/today_we_announced_our_release_date_and_that_were/,,,2026-03-09T20:31:15.417427
1rmkzg7,indiegaming,apps,A Soulslike Without Combat — Unsound Love Demo Out Now,329,296,https://reddit.com/r/IndieGaming/comments/1rmkzg7/a_soulslike_without_combat_unsound_love_demo_out/,,UPDATED TEXT - CLEARLY EXPLAINING - WHY AND HOW SOULSLIKE IS IN THE GAME. :)      *Unsound Love* sta,2026-03-09T20:31:15.417427
1rntzv8,indiegaming,apps,What if you could move portals?,323,47,https://reddit.com/r/IndieGaming/comments/1rntzv8/what_if_you_could_move_portals/,,"This is just a teaser of [Paradoxical](https://store.steampowered.com/app/4040750/Paradoxical/), a g",2026-03-09T20:31:15.417427
1rmmq06,indiegaming,apps,Using Substance Painter to create these golden frescoes.,293,14,https://reddit.com/r/IndieGaming/comments/1rmmq06/using_substance_painter_to_create_these_golden/,,FRESCO on Steam,2026-03-09T20:31:15.417427
1rlboqk,indiegaming,apps,Our hidden object game launches tomorrow on Steam. Thanks for helping us reach 200k wishlists,272,50,https://reddit.com/r/IndieGaming/comments/1rlboqk/our_hidden_object_game_launches_tomorrow_on_steam/,launch,[Lost and Found Co.](https://store.steampowered.com/app/2101390/Lost_and_Found_Co/) launches on Stea,2026-03-09T20:31:15.417427
1rjl99d,indiegaming,apps,"Makeing Survival-Horror  ""Scarlet Path"" about ""Red Riding Hood"" (RE2/SH2 like). Could this be of interest to players?",235,43,https://reddit.com/r/IndieGaming/comments/1rjl99d/makeing_survivalhorror_scarlet_path_about_red/,,,2026-03-09T20:31:15.417427
1rmgkdt,indiegaming,apps,We just released our spooky forest survival game on Steam!,205,27,https://reddit.com/r/IndieGaming/comments/1rmgkdt/we_just_released_our_spooky_forest_survival_game/,,,2026-03-09T20:31:15.417427
1rnd89i,indiegaming,apps,Playing around with physics in my first game,195,34,https://reddit.com/r/IndieGaming/comments/1rnd89i/playing_around_with_physics_in_my_first_game/,,"The game is called Barely Breathing, it's a 3D Physics-based Puzzle / Platformer where you play as a",2026-03-09T20:31:15.417427
1rnlgg5,indiegaming,apps,How we made our 2D sprites actually 'fit' in a 3D world. It’s all about vertex bending.,191,4,https://reddit.com/r/IndieGaming/comments/1rnlgg5/how_we_made_our_2d_sprites_actually_fit_in_a_3d/,made,,2026-03-09T20:31:15.417427
1rkemsm,indiegaming,apps,We’re making a co-op driving + horror open-world game,166,19,https://reddit.com/r/IndieGaming/comments/1rkemsm/were_making_a_coop_driving_horror_openworld_game/,launch,"Last night we just launched our first trailer! The game is called ""The Road"", coming to Steam.  It’s",2026-03-09T20:31:15.417427
1rjca9p,indiegaming,apps,We made this trailer to launch our demo on Steam,138,25,https://reddit.com/r/IndieGaming/comments/1rjca9p/we_made_this_trailer_to_launch_our_demo_on_steam/,launch|made,Box Knight is an action brawler roguelite set in a Corporate work tower. It's South Park meets The O,2026-03-09T20:31:15.417427
1rk8wy6,indiegaming,apps,Are there other games out there dedicated to dropping stuff into holes?,137,65,https://reddit.com/r/IndieGaming/comments/1rk8wy6/are_there_other_games_out_there_dedicated_to/,,Has anyone found any more games like these based around things falling into holes? Watching a bunch ,2026-03-09T20:31:15.417427
1ro8iu7,indiegaming,apps,We're making a post apocalyptic hot dog diner simulator that's also an FPS. What do you think?,128,30,https://reddit.com/r/IndieGaming/comments/1ro8iu7/were_making_a_post_apocalyptic_hot_dog_diner/,,"Our game is called Doomsday Diner, and we just went live with a demo. Come on over! We just threw so",2026-03-09T20:31:15.417427
1rmrhzt,indiegaming,apps,Everybody told us not to make a psychological horror vn game cause it won't sell... We just released it! Pink Noise is like an indie version of The Quarry x Scarlet Hollow set in a Stranger Things-esque world,127,4,https://reddit.com/r/IndieGaming/comments/1rmrhzt/everybody_told_us_not_to_make_a_psychological/,arr,"When we started working on our game, a lot of people told us the same thing:  *""Psychological horror",2026-03-09T20:31:15.417427
1ppr6gh,SideProject,saas,As the year wraps up: what’s the project you’re most proud of building and why?,60,373,https://reddit.com/r/SideProject/comments/1ppr6gh/as_the_year_wraps_up_whats_the_project_youre_most/,made,"Like the title says, instead of what you built or how much money it made, I’m curious what project y",2026-03-09T20:31:15.417427
1oaq2kx,SideProject,saas,Share your ***Not-AI*** projects,614,1519,https://reddit.com/r/SideProject/comments/1oaq2kx/share_your_notai_projects/,,I miss seeing original ideas that aren’t just another AI wrapper.  If you’re building something in 2,2026-03-09T20:31:15.417427
1rouhw7,SideProject,saas,I'm not a big tech company. I spent 3 years and everything I had building a portable dual-monitor. It just won an iF Design Award.,598,84,https://reddit.com/r/SideProject/comments/1rouhw7/im_not_a_big_tech_company_i_spent_3_years_and/,,"Hey everyone, I'm Ruben 👋  Been lurking here for a while, seeing all the amazing projects you guys s",2026-03-09T20:31:15.417427
1rpap7p,SideProject,saas,I built a drum machine that runs entirely in your browser,50,19,https://reddit.com/r/SideProject/comments/1rpap7p/i_built_a_drum_machine_that_runs_entirely_in_your/,,"TLDR, play Drumhaus live: [drumha.us](https://drumha.us/)  Hi everyone, I'm Max. I'm a software engi",2026-03-09T20:31:15.417427
1rp0wxk,SideProject,saas,I localised my app into 6 languages &amp; the Downloads went up by 340%,26,21,https://reddit.com/r/SideProject/comments/1rp0wxk/i_localised_my_app_into_6_languages_the_downloads/,app store|downloads,I localised my app into 6 languages with AI. I wanted to experiment if it benefits my app or not.  T,2026-03-09T20:31:15.417427
1rpg8pl,SideProject,saas,Made a tool to help people buy GPUs,4,2,https://reddit.com/r/SideProject/comments/1rpg8pl/made_a_tool_to_help_people_buy_gpus/,made,"Hello, a friend and I built a side project called pickGPU ([pickGPU.com](https://pickgpu.com/)).   T",2026-03-09T20:31:15.417427
1rpd6kb,SideProject,saas,I made an LLM frontend for learning and researching various topics using AI,4,2,https://reddit.com/r/SideProject/comments/1rpd6kb/i_made_an_llm_frontend_for_learning_and/,earning|made,"Hi everyone,  The idea came from a problem I often run into when researching or learning about a top",2026-03-09T20:31:15.417427
1rp2hkv,SideProject,saas,"My side project got 3,000 signups in 2 weeks without a single paid ad. Here's the exact sequence I used.",9,22,https://reddit.com/r/SideProject/comments/1rp2hkv/my_side_project_got_3000_signups_in_2_weeks/,launch,I almost didn't launch it.  It felt too simple. A free AI tool that solved one small specific proble,2026-03-09T20:31:15.417427
1ropvmz,SideProject,saas,Depth Perception Blender Add-on,68,7,https://reddit.com/r/SideProject/comments/1ropvmz/depth_perception_blender_addon/,,I’m a computer science student exploring Blender and Computer Vision.  I built a Blender add-on that,2026-03-09T20:31:15.417427
1rp9c1y,SideProject,saas,I built a real typewriter for your iPad,3,3,https://reddit.com/r/SideProject/comments/1rp9c1y/i_built_a_real_typewriter_for_your_ipad/,arr,"I built Retrotype to feel as close to a real typewriter as possible. The paper scrolls, the carriage",2026-03-09T20:31:15.417427
1rp871g,SideProject,saas,I built AI Women Wellness Companion and launched on Women’s day,5,1,https://reddit.com/r/SideProject/comments/1rp871g/i_built_ai_women_wellness_companion_and_launched/,launch,It was exciting to launch my app after months of work. I hope it will get some attention.,2026-03-09T20:31:15.417427
1rluzt2,SideProject,saas,"Training a custom neural network to erase the cage from fight footage – still rough, but promising",3439,179,https://reddit.com/r/SideProject/comments/1rluzt2/training_a_custom_neural_network_to_erase_the/,,"EDIT: by popular demand, a newsletter for future updates: [https://www.mma-defence.com/](https://www",2026-03-09T20:31:15.417427
1rmt78d,SideProject,saas,"I built TerraInk, an open-source tool for instant and fully customizable map posters rendering",796,70,https://reddit.com/r/SideProject/comments/1rmt78d/i_built_terraink_an_opensource_tool_for_instant/,,I’ve been building r/terraink as a side project to make map-based design accessible without requirin,2026-03-09T20:31:15.417427
1ro5qyx,SideProject,saas,I built an app to blur everything except the active window so I can stop getting distracted,470,78,https://reddit.com/r/SideProject/comments/1ro5qyx/i_built_an_app_to_blur_everything_except_the/,,"Hey everyone,      I always have multiple apps in my mac open. Even if I use spaces or full screen a",2026-03-09T20:31:15.417427
1rkfs19,SideProject,saas,An app for small home parties - turn all phones at party into sync art vizualization,241,71,https://reddit.com/r/SideProject/comments/1rkfs19/an_app_for_small_home_parties_turn_all_phones_at/,,Hello fellow creators! I have created an app SyncGlow where you can host an art vizualization and ev,2026-03-09T20:31:15.417427
1rnwmsw,SideProject,saas,My Most Favorite Project is Finally Out ❤️,228,45,https://reddit.com/r/SideProject/comments/1rnwmsw/my_most_favorite_project_is_finally_out/,,Hey everyone 👋  I originally built this as a tiny side project for my girlfriend and me.  We were in,2026-03-09T20:31:15.417427
1rji8w2,SideProject,saas,A physical time tracker for your apps,197,56,https://reddit.com/r/SideProject/comments/1rji8w2/a_physical_time_tracker_for_your_apps/,made,"I have a love-hate relationship with time tracking.   It's repetitive and time-consuming, but it hel",2026-03-09T20:31:15.417427
1roggx6,SideProject,saas,public access to all government cctv feeds globally,175,63,https://reddit.com/r/SideProject/comments/1roggx6/public_access_to_all_government_cctv_feeds/,,,2026-03-09T20:31:15.417427
1rlkq7z,SideProject,saas,"Built a web tool to edit PDF text without ruining the original fonts. 100% local, zero paywalls",162,94,https://reddit.com/r/SideProject/comments/1rlkq7z/built_a_web_tool_to_edit_pdf_text_without_ruining/,,"Hey everyone,  The top Google results for PDF editors always pull the same crap: they let you do all",2026-03-09T20:31:15.417427
1rl7q1j,SideProject,saas,I built an open source command center for AI agent teams because managing 20 agents from the terminal and through discord was chaos,157,64,https://reddit.com/r/SideProject/comments/1rl7q1j/i_built_an_open_source_command_center_for_ai/,,"I run a team of Claude Code agents using openclaw. An orchestrator, researchers, writers, an SEO tea",2026-03-09T20:31:15.417427
1rle82w,SideProject,saas,Expeditione : The Interactive 3D Encyclopedia.,118,33,https://reddit.com/r/SideProject/comments/1rle82w/expeditione_the_interactive_3d_encyclopedia/,,"Greetings everyone,   We are drowning in low-effort, low-quality content, and AI is accelerating tha",2026-03-09T20:31:15.417427
1rmuggo,SideProject,saas,I built an app with my son so we're not always late getting out the door,112,55,https://reddit.com/r/SideProject/comments/1rmuggo/i_built_an_app_with_my_son_so_were_not_always/,,"I'll be honest, mornings in our house can be a little chaotic. So over the last break my son and I b",2026-03-09T20:31:15.417427
1rkmujr,SideProject,saas,How my side project freed me from a frustrating job and became my main source of income,113,66,https://reddit.com/r/SideProject/comments/1rkmujr/how_my_side_project_freed_me_from_a_frustrating/,income,After graduating I was working in two different jobs that taught me a lot (software + business devel,2026-03-09T20:31:15.417427
1rjt0on,SideProject,saas,"I got tired of sleep apps charging monthly fees for white noise, so I built my first iOS app (a native Box Fan). Looking for TestFlight feedback!",107,44,https://reddit.com/r/SideProject/comments/1rjt0on/i_got_tired_of_sleep_apps_charging_monthly_fees/,,"Hey everyone,  Like a lot of people, I physically cannot sleep without a fan running. But almost eve",2026-03-09T20:31:15.417427
1rod5x1,SideProject,saas,"I created an 100% local, private &amp; open source audio transcription &amp; diarization app - TranscriptionSuite",99,45,https://reddit.com/r/SideProject/comments/1rod5x1/i_created_an_100_local_private_open_source_audio/,,"Hi! This is a short presentation for my hobby project, [TranscriptionSuite](https://github.com/homel",2026-03-09T20:31:15.417427
1rngnvl,SideProject,saas,What are you building right now? Drop your project below 👇,91,400,https://reddit.com/r/SideProject/comments/1rngnvl/what_are_you_building_right_now_drop_your_project/,,"Curious what everyone here is working on lately.  If you're building a SaaS, tool, AI project or sid",2026-03-09T20:31:15.417427
1rnuo5c,SideProject,saas,CLI Progress Bar,78,16,https://reddit.com/r/SideProject/comments/1rnuo5c/cli_progress_bar/,,Most terminal progress bars look like this:  downloading... 60%  So I built one that looks like this,2026-03-09T20:31:15.417427
1rjybmz,SideProject,saas,Dubai is the safest city in the world  lol,79,10,https://reddit.com/r/SideProject/comments/1rjybmz/dubai_is_the_safest_city_in_the_world_lol/,made,I made a tiny arcade game where apparently Dubai is the safest city in the world now.  The whole def,2026-03-09T20:31:15.417427
1rnbni9,SideProject,saas,I made a pixel-art interface for OpenClaw,71,16,https://reddit.com/r/SideProject/comments/1rnbni9/i_made_a_pixelart_interface_for_openclaw/,made,"Normal AI dashboards are boring, so I turned OpenClaw agents into pixel-art office workers.  Built w",2026-03-09T20:31:15.417427
1rodfyn,SideProject,saas,Why does it feel like nobody builds desktop software anymore?,65,62,https://reddit.com/r/SideProject/comments/1rodfyn/why_does_it_feel_like_nobody_builds_desktop/,,I’m curious about something as an indie developer.  Why does it feel like almost nobody builds deskt,2026-03-09T20:31:15.417427
1rlujx1,SideProject,saas,"Every time I run a race, my friends have to track me through a clunky app. I'm building a better one!",56,27,https://reddit.com/r/SideProject/comments/1rlujx1/every_time_i_run_a_race_my_friends_have_to_track/,,I'm running CPH Marathon soon and want my friends to follow and engage with me. Building two things:,2026-03-09T20:31:15.417427
1rmjd68,SideProject,saas,Feels unreal but I think my project got viral!,51,29,https://reddit.com/r/SideProject/comments/1rmjd68/feels_unreal_but_i_think_my_project_got_viral/,,I built an avatar generation platform [https://clawvatar.com](https://clawvatar.com) with a medieval,2026-03-09T20:31:15.417427
1pj44es,indiehackers,indie,NEW RULES for the IndieHackers subreddit. - Getting the quality back.,94,61,https://reddit.com/r/indiehackers/comments/1pj44es/new_rules_for_the_indiehackers_subreddit_getting/,,"Howdy.  We had some internal talks, and after looking at the current state of subreddits in the soft",2026-03-09T20:31:15.417427
1ropp8u,indiehackers,indie,I was lonely to building tools that helps others- my journey as a single mom and a founder,30,57,https://reddit.com/r/indiehackers/comments/1ropp8u/i_was_lonely_to_building_tools_that_helps_others/,$,"I went from a lonely mom building an accountability app, to a divorce building saas to save $, to a ",2026-03-09T20:31:15.417427
1roc2mx,indiehackers,indie,Cut Churn by Automating your Cancel Flows - Looking for Beta Testers!,2,15,https://reddit.com/r/indiehackers/comments/1roc2mx/cut_churn_by_automating_your_cancel_flows_looking/,users,"**We were losing customers, and didn't know why.**  They would subscribe to our indie-SaaS but **whe",2026-03-09T20:31:15.417427
1rmbhep,indiehackers,indie,I built 8 email automations for my 322-user app  in one week. Personalized emails got 18% CTR vs 2.5% on generic ones. Here's the exact setup.,22,85,https://reddit.com/r/indiehackers/comments/1rmbhep/i_built_8_email_automations_for_my_322user_app_in/,users,"I'm a solo founder with a fintech app and \~300 users. No marketing team, no budget, just Brevo (fre",2026-03-09T20:31:15.417427
1rjtja0,indiehackers,indie,what I actually did in the first 10 days to make Google notice my product,58,114,https://reddit.com/r/indiehackers/comments/1rjtja0/what_i_actually_did_in_the_first_10_days_to_make/,launch,"When I launched my SaaS, I had:  * A brand-new domain * Zero backlinks * No blog/ No authority /No t",2026-03-09T20:31:15.417427
1riyr34,indiehackers,indie,"Went from $0 to $1k MRR. If I started my SaaS over, here's exactly what I'd do",53,202,https://reddit.com/r/indiehackers/comments/1riyr34/went_from_0_to_1k_mrr_if_i_started_my_saas_over/,mrr|$,"After going from $0 to $1K MRR, I've learned that what you focus on matters, but the order you focus",2026-03-09T20:31:15.417427
1ri0ux8,indiehackers,indie,The Language Arbitrage Playbook: $65K/month from French Market,19,41,https://reddit.com/r/indiehackers/comments/1ri0ux8/the_language_arbitrage_playbook_65kmonth_from/,$|k/mo|k/month,This is the playbook TeachEasy used:  **Phase 1: Pick Your Market (1 week)**  Questions:  * What lan,2026-03-09T20:31:15.417427
1rh6d0o,indiehackers,indie,Does anyone have a list of directories to launch a startup?,55,103,https://reddit.com/r/indiehackers/comments/1rh6d0o/does_anyone_have_a_list_of_directories_to_launch/,launch,I'm looking for alternatives to product hunt and indiehackers. I know that there are loads of platfo,2026-03-09T20:31:15.417427
