url,handle,author,text,timestamp,scraped_at,status
https://x.com/xivy0k/status/2013267462616228102,@xivy0k,Xivy,"Want to find winning digital products or info product to replicate?  Go to Facebook Ads Library and search these keywords:  Ebook Digital Download Instant PDF Printable Template Guide Course Planner Editable Tracker Worksheets Cheat Sheet  And you'll find winning digital products for free.  If they're paying for ads, they're making money.",2026-01-19T15:09:02.000Z,2026-01-20T02:03:26.611761,SUCCESS
https://x.com/tatealax/status/2013347648321753524,@tatealax,tateala,"this mf telling the truth but let me show you why 90% of apps fumble this opportunity  women pay more, women's apps do 5x the revenue, everyone sees these numbers  but here's what they're missing the cheat code isn't just building for women it's how you distribute the content  most apps see this data and think ""cool let me build a women's app and run some meta ads""  or they pay one influencer $40k for a single post and pray it converts  here's the problem with that  you're betting everything on one piece of content, you have no idea if the hook actually resonates, if it flops you just burned $40k, if it works you can't scale it cause that creator won't post daily  there's a better way instead of paying one creator $40k for one post, activate 400 faceless clippers who post content to their own accounts  pay them $1 per 1k views, performance based, zero risk now you have 400 creators testing different hooks simultaneously, massive content volume like 50-100 posts per day, only paying for what actually performs, real data on what messaging drives downloads  here's how it actually plays out women's fitness app comes to us, they tried influencer marketing, burned $80k, got 2k downloads  we spin up 300 clippers across tiktok, ig reels, youtube shorts  each creator tests different angles: ""this app changed my relationship with working out"" or ""pov you finally found a workout app that gets it"" or ""girls who struggled with gym anxiety need this"" or ""morning routine with the only app i actually use""  plus like 40 other hooks week 1 most content does okay, a few hit 500k-1m views  week 2 one angle absolutely rips, ""gym anxiety"" hook hits 8m views across 50 creators  week 3 we double down on that specific messaging, scale it across the entire network  result 43k downloads in 30 days, all organic, they spent $6k total on 6m views that converted  why this model prints: volume means you're not gambling on one post, you have hundreds of shots on goal daily  testing means the market literally tells you what works through views and downloads  zero risk means you only pay for views that happen, not upfront influencer fees  speed means we can activate 200 creators in 48 hours vs weeks of influencer negotiations  scale means when you find a winning hook, you can run it across 500 accounts immediately  the part everyone sleeps on this isn't just about downloads, it's about learning what messaging actually converts  after 30 days you know which pain points resonate most, what format drives action like storytime vs tutorial vs pov, what hooks stop the scroll, what ctas work  then you take that data and use it for your paid ads so creative isn't a guess, your app store copy cause you know what resonates, your product roadmap cause you know what features matter  so yeah building apps for women is a cheat code  but the real cheat code is activating 500 clippers to mass test content until you find the exact message that makes her stop scrolling and download  most apps are still paying $50k to one tiktoker with 2m followers and crossing their fingers  we're running 500 simultaneous experiments and knowing what works before we scale that's the difference between gambling and growth  if you want to distribute your content with volume, DM me",2026-01-19T16:41:03.000Z,2026-01-20T02:03:31.575461,SUCCESS
https://x.com/simonecanciello/status/2013290619313992028,@simonecanciello,Simone Canc,"he’s right, building an app for women is a cheat code in 2026.  men pay for apps too.  but women = more opportunities.  and the easiest hack is:  > take an app built for men > rebuild a women version  that’s the cheat code.",2026-01-18T16:54:46.000Z,2026-01-20T02:03:36.558661,SUCCESS
https://x.com/lottsnomad/status/2013281137234214961,@lottsnomad,Lotanna Ezeike (YC W26) ,how to scale any mobile app:  1. go to tiktok  tiktok is the organic platform by definition  it’s where hooks get tested for free and attention decides in seconds  2. save viral videos in your niche  high views strong comments saves  that’s the market telling you what it responds to  3. copy + add your own spin  same structure same core idea  different angle different face different context  4. post different versions to find what works  you need volume to find signal  same idea → 5 executions same video → 10 hooks same problem → 3 CTAs  when something hits that’s your signal  5. run ads  take the winning creatives and run them as paid traffic  at that point ads aren’t a gamble  they’re a distribution engine for something the market already validated for free  follow these 5 steps and you’ll scale any app you want  simple profitable,2026-01-19T16:03:22.000Z,2026-01-20T02:03:41.514985,SUCCESS
https://x.com/CEOLandshark/status/2012909226641993869,@CEOLandshark,Pyrate,"Easiest way to escape from the matrix completely (no job, no more than 20min/day+ work) is to find/build something that you can just set bidcap Meta ads with & forget. Can passively make $50-100k/mo with 50%+ margins if you're half decent at it.  If you build a second one the same way, can even get a summerhouse! Could even autistmaxx and build 50 of these for a mini index fund of digital products that print.  The problem is, if you were on a place to take advantage of this alpha, you'd be way more capable to do more with it. And obviously it's not as easy as it sounds (but pretty close to be fair). Thus, kinda useless. Kinda like a beginner-teaser. Enjoy",2026-01-18T15:25:32.000Z,2026-01-20T02:03:46.451768,SUCCESS
https://x.com/knoxtwts/status/2011358199144648836,@knoxtwts,KNOX,"why you're still broke while 19 year olds print $38k/month selling ugly pdfs | KEY INSIGHTS: 1) MATH: $30k/mo = 309 sales @ $97 = 11/day. Cold 1% conv = 1100 visitors needed. Warm 2.5% = 440. Hot 5% = 220. 2) MULTI-ACCOUNT: Run 5-17 accounts/niche. 5 accounts @ 3x/day = 450 posts/mo. One ban won't kill you. 3) ACCOUNT ANGLES: educational, story, controversy, results, memes. Same offer, different strategies. 4) TELEGRAM: Conversion layer. Nurture 7 days then sell. 5) EXAMPLE: 21yo Egypt made $38,400/mo selling AI prompts. Product took 6 hours. Converts 4.7%. 6) EXAMPLE: Lagos guy runs 17 TikToks, posts 10x/day, content is trash, clears $23,700/mo. 7) OFFER STACKING: Enter at $47, path to $997+. Speed > perfection. Ship broken day one.",2026-01-14T08:42:18.000Z,2026-01-20T02:03:51.470820,SUCCESS
https://x.com/knoxtwts/status/2012895519832518880,@knoxtwts,KNOX,"if you're selling digital products over $200 and don't have an email list you hate money. we've sent 15-30 days of pure value emails, zero pitching, then dropped one email with a flash sale and pulled $15-45k in 48 hours. no ads. no new traffic. just the list we'd been nurturing. then go back to giving value. now you have an asset you can cash out whenever you want. even with 200 email subscribers we've hit $10k+ drops this way. the list is the product, the course is just the monetization event.",2026-01-18T14:31:04.000Z,2026-01-20T02:03:56.417256,SUCCESS
https://x.com/wesocialgrowth/status/2012887735879565456,@wesocialgrowth,Social Growth Engineers,This format pushed a couples doodle app to 23.8M views.  “i haven’t heard from my BOYFRIEND in FOUR days and he just sent me this“  The format template + full story:  https:// socialgrowthengineers.com/the-ai-breakup -doodle-that-hit-23-8m-views …,2026-01-18T14:00:08.000Z,2026-01-20T02:04:01.345832,SUCCESS
https://x.com/gregisenberg/status/2012960814701949281,@gregisenberg,GREG ISENBERG,"Clearest path to $10M liquid: 1) Pick niche. 'AI workflows for solopreneurs' not 'business tips'. Riches in niches. 2) Hit 250k impressions/mo. Post daily. Be THE person. 3) Convert 0.5% to leads = 1250 organic leads/mo. Irresistible lead magnet. Use Claude Code to build 3+ tools/lead magnets per month. 4) Monetize leads immediately. $1/lead from affiliates/ads = $1250 to reinvest. 5) Buy more leads. $1250 on leads at $2 each = 625 additional. TikTok/X/Meta ads. 6) Total monthly leads: 1875. You're now a lead gen machine. 7) Nurture like crazy. Weekly newsletter. Give so much value they feel guilty not paying. 8) Ask community what to build. Prioritize painpoints. 9) Launch $30/mo offer. Aim $300+/customer annually. Find ideas on IdeaBrowser.com. 10) Convert 3% = 56 new customers/mo. 11) Year 1: 672 customers = $201,600 ARR. 12) Reinvest profits in lead buying. Turn funnel into vending machine. 13) Year 3: 5000 customers = $1.5M ARR. 14) Premium upsell 20% to $100/mo, 5% to $500/mo. New ARR: $2.7M. 15) 5yr growth 50% annual. Year 5 ARR: $9.11M. 16) Exit 3-5x ARR = $27M-$45M or keep cash cow. Build audience, build community, sell product. No VC required.",2026-01-18T18:50:31.000Z,2026-01-20T02:04:06.288119,SUCCESS
https://x.com/matteo_spada/status/2012917994364805177,@matteo_spada,Matteo Spada,"This app is making 50k installs monthly and an MRR of $350k!  But How?  citing medical sources (Harvard) → gives authority and trust  visualized goal timeline → concrete and realistic outcome  paywall with bright colors ""goals 4.2x faster"" → higher subscription rate",2026-01-18T16:00:22.000Z,2026-01-20T02:04:11.259465,SUCCESS
https://x.com/alexcooldev/status/2013002551587901555,@alexcooldev,Alex Nguyen,"Too many people keep asking me:  “Does using a VPN get you shadowbanned on TikTok?”  Short answer: No.  TikTok does not ban VPNs. But most people use them wrong.  A few things you must know:  > Don’t use cheap or low-quality VPNs shared by too many users → Imagine TikTok seeing 1,000 accounts on the same IP  > Always turn on your VPN before opening TikTok → You don’t want your IP jumping between continents  > To target US users, you don’t have to pick a US VPN → Countries in the same time zone like Canada work just fine  > The US has massive communities speaking Spanish and other languages → Try creating content in those languages → Less competition, easier reach  VPN ≠ shadowban Bad setup = problems",2026-01-18T17:03:38.000Z,2026-01-20T02:04:16.369020,SUCCESS
https://x.com/alexcooldev/status/2012466735862182002,@alexcooldev,Alex Nguyen,Update from me:  Build the app. Post daily. Use UGC campaigns. Market more than you build.  → Hit $100K MRR → Reinvest to $1M MRR with real profits  That’s how you buy financial freedom. Sell the startup later… or don’t. Your choice.  Keep shipping.,2026-01-16T21:28:00.000Z,2026-01-20T02:04:21.502019,SUCCESS
https://x.com/pipelineabuser/status/2012028804407980354,@pipelineabuser,caiden,"go to your competitor's linkedin page. click on ""people."" filter by ""customer success"" or ""account manager.""  now look at who those people are connected to. that's their book of business.  linkedin literally shows you their customer list through mutual connections if you know where to look.  cross reference with people who engage on their posts. even easier.",2026-01-16T05:07:03.000Z,2026-01-20T02:04:26.683632,SUCCESS
https://x.com/pipelineabuser/status/2011864820933673114,@pipelineabuser,caiden,"FOIA requests are the most underrated lead gen strategy for anyone selling to government  file a freedom of information request for vendor contracts in your space. costs nothing. takes 10 minutes  you'll get vendor names, total contract values, award dates, and who lost the bid. sometimes you can even request the winning proposal to see exactly how they positioned  USAspending .gov already shows you who won what and for how much. FOIA gets you the details they don't publish - the losing bidders, the evaluation criteria, the budget breakdowns  combine both and you know exactly who to call, what they're paying, when contracts renew, and who's hungry after losing  all public record. government has to respond. most people don't do this because it feels like too much work  it's literally a form lol",2026-01-15T18:15:26.000Z,2026-01-20T02:04:31.635881,SUCCESS
https://x.com/pipelineabuser/status/2009717466600206558,@pipelineabuser,caiden,"the biggest trap in business is being good at operations  you built the thing. you know how it works. you're fast at it. nobody can do it like you.  and that's exactly why you're stuck.  being good at ops makes you feel productive. inbox zero. tasks completed. fires put out. you go to bed tired thinking you did something.  but you didn't. you just maintained. you didn't grow anything. you didn't build anything new. you just kept the machine running.  the machine should run itself.  every hour you spend in operations is an hour you're not spending on strategy, sales, partnerships, content, or the stuff that actually compounds.  ops is linear. you do the work, you get the output. one to one.  leverage is exponential. you build the system once, it runs forever. one to infinity.  the goal is to make yourself irrelevant to daily operations as fast as possible.  two ways to do this:  1. systematize and delegate. document everything. build SOPs so detailed that anyone with a pulse could follow them. then hire someone and hand it off. your job becomes quality control, not execution.  2. automate completely. if a human doesn't need to make a judgment call, software should be doing it. workflows. triggers. automations. the robot doesn't sleep, doesn't complain, doesn't need management.  most founders stay in ops because it feels safe. it's comfortable. you know you're adding value because you can see the tasks getting done.  but you're not adding value. you're adding labor. and labor doesn't scale.  the businesses that win are the ones where the founder operates at the highest leverage point possible. vision. deals. relationships. capital allocation.  everything else is a system or a hire.  if you're still in the weeds 2 years in, you didn't build a business. you built yourself a job. and probably a worse job than the one you left.  get out of ops or stay small forever. those are the only two options.  master it. document it. hand it off or automate it. then never touch it again.  your job is to build the machine. not be the machine.  this is exactly what we help you solve at outboundwhales .com",2026-01-09T20:02:37.000Z,2026-01-20T02:04:36.695823,SUCCESS
https://x.com/seanb2b/status/2012977071279014342,@seanb2b,Sean,"Cold email in the right order:  1. Deliverability  2. Offer  3. Messaging (copy that matches the offer) 4. Process (reply handling, follow-ups) 5. Scale (volume, VA, automation)  Most people start at 5.  That's why it never works.",2026-01-18T19:55:07.000Z,2026-01-20T02:04:41.758637,SUCCESS
https://x.com/WorkflowWhisper/status/2012566082326868407,@WorkflowWhisper,Alton Syn,"n8n 2.0 just dropped and consultants are shitting themselves.  Here's why:  → Task runners now default to ON (enterprise-grade security) → Code nodes run in isolated sandboxes → SQLite driver is 10x faster than v1 → Publish/Save workflow = no more breaking production  This is the same infrastructure consultants charge $15K+ to ""configure securely"" for enterprise clients.  The catch? You still need to know how to build the workflows.  Unless you use Synta.  Describe what you want in plain English → get a production-ready workflow deployed directly to your n8n instance in under 60 seconds.  No debugging. No Stack Overflow rabbit holes. No $200/hr ""expert"" holding your hand.  synta(.)io  The $15K ""enterprise security setup"" is now a 47-second conversation with AI.  Consultants hate this. Your CFO will love it.",2026-01-17T16:42:00.000Z,2026-01-20T02:04:46.819436,SUCCESS
https://x.com/joelhooks/status/2012934260265816387,@joelhooks,joel ,forcing claude to review all of its fuck ups and create rules/skills to prevent them in the future,2026-01-18T17:05:00.000Z,2026-01-20T02:04:51.755208,SUCCESS
https://x.com/wannercashcow/status/2013182221512036821,@wannercashcow,wannercashcow,"Videos like this can be replicated with AI pretty easily now, the opportunities are actually insane",2026-01-19T09:30:19.000Z,2026-01-20T02:04:56.896718,SUCCESS
https://x.com/mattwelter/status/2013271008342659529,@mattwelter,Matt Welter,"found  @cluely  doing AI slideshows  362.1k views, 462.6k views, 492.1k views  4 accounts all pushing the same format:  > 100% AI girl selfie on hook image > same hook ""5 corporate hacks..."" > promotes cluely on last slide",2026-01-19T15:23:07.000Z,2026-01-20T02:05:02.087468,SUCCESS
https://x.com/Jahjiren/status/2013195696824827981,@Jahjiren,Jah Jiren,"It’s OBVIOUS why the biggest winners are extremely bullish on this B2C app idea  Everyone is chronically online Almost no one wants to be  That’s why screen-time blocker apps are quietly printing   @YoniSmolyar  ‘s Brainrot app was the first I saw doing it and he’s at $100k/mo  Opal: $600k/month  BePresent: $300k/month   @ErnestoSOFTWARE  &  @maubaron   Are scaling to $40k/month right now  with prayerlock  Solving the same problem within a focus on a specific niche:  → Pray to unlock → Walk to unlock → Workout to unlock → Complete a task to unlock  The list keeps growing  I just connected that API for my app built entirely  using  @rork_app  + Opus 4.5  It’s called “Flow State” I’ve been building it in public  FYI:   Pattern recognition is one of the most important skills you can have in business  Don’t just see the opportunity and do nothing, just try",2026-01-18T14:26:10.000Z,2026-01-20T02:05:07.181157,SUCCESS
https://x.com/purpdevvv/status/2013201984916980003,@purpdevvv,purp,"sniper setup for those asking:  -  @ozmosoftware  sniper  - VPS to run the software on; frankfurt is good location if using Jito  - private nodes are best (pay to win) but can rent from places like  @solvibestation , making sure node location matches VPS  build a strategy. split test. optimise. print solana",2026-01-17T08:32:42.000Z,2026-01-20T02:05:12.220812,SUCCESS
https://x.com/purpdevvv/status/2012442944947585410,@purpdevvv,purp,unlimited solana hack:  build an updating list of good devs  track fund movements and make a live deployer wallet whitelist  snipe every deploy in the list block0 with a fast node  farm the chart automatically using trailing stops while you smoke cigars  let the dev get abused for farming while you take top 1-10 traders privately  onto the next,2026-01-17T08:32:42.000Z,2026-01-20T02:05:17.214821,SUCCESS
