timestamp,score,source,signal,strength,signal_type,product_matches,seed_keyword,url,comments,age_hours
2026-02-12T05:05:02.914319,60,reddit/r/BuyItForLife,Jeans. God damn jeans.,504,quality_product,general,BuyItForLife,https://reddit.com/r/BuyItForLife/comments/1r2eqom/jeans_god_damn_jeans/,199,9.6
2026-02-12T05:05:02.914492,60,reddit/r/coolguides,A Cool Guide to the Various Health Benefits of a Banana at Different Stages of Ripeness,138,educational,"health_wellness,digital_product",coolguides,https://reddit.com/r/coolguides/comments/1r2j14q/a_cool_guide_to_the_various_health_benefits_of_a/,18,6.3
2026-03-16,BLUE_OCEAN,ramadan_app,0_paid_competitors,BUILD_NOW,cycle_53,HIGH_CONFIDENCE,app_factory,,,
2026-02-12T05:05:02.914836,50,reddit/r/Entrepreneur,What's the best facebook ad tool for a tiny startup team?,20,business_trend,"beauty_skincare,digital_product",Entrepreneur,https://reddit.com/r/Entrepreneur/comments/1r2e2of/whats_the_best_facebook_ad_tool_for_a_tiny/,21,10.1
2026-02-12T05:05:02.915172,50,reddit/r/tiktokgossip,Positively page...,68,tiktok_trend,general,tiktokgossip,https://reddit.com/r/tiktokgossip/comments/1r2esrv/positively_page/,36,9.6
2026-03-18T20:46:51.239456,45,reddit/r/shutupandtakemymoney,"Found a hardcover book that's just 799,999 M's and one hidden N",166,viral_product,general,shutupandtakemymoney,https://reddit.com/r/shutupandtakemymoney/comments/1pqxnil/found_a_hardcover_book_thats_just_799999_ms_and/,42,2138.7
2026-02-12T05:05:02.914887,45,reddit/r/ecommerce,Ecommerce revenue looks great on paper but all my cash is tied up in inventory and I feel like I'm running a warehouse n,15,ecom_trend,general,ecommerce,https://reddit.com/r/ecommerce/comments/1r2eq0u/ecommerce_revenue_looks_great_on_paper_but_all_my/,34,9.6
2026-02-12T05:05:02.915102,45,reddit/r/FulfillmentByAmazon,Hit 1M a Year,161,fba_trend,general,FulfillmentByAmazon,https://reddit.com/r/FulfillmentByAmazon/comments/1r179gy/hit_1m_a_year/,113,40.5
2026-02-12T05:05:02.914999,35,reddit/r/dropship,"stopped writing fake ""our story"" essays for new stores",11,dropship_trend,general,dropship,https://reddit.com/r/dropship/comments/1r1r61s/stopped_writing_fake_our_story_essays_for_new/,4,26.4
2026-03-11T04:01:19.812426,30,reddit/r/AmazonSeller,Anyone else's Seller Central completely bugging out right now?,17,amazon_trend,general,AmazonSeller,https://reddit.com/r/AmazonSeller/comments/1rlrb1e/anyone_elses_seller_central_completely_bugging/,20,132.4
2026-03-14T20:31:58.057791,55,reddit/r/SaaS,We're profitable at $40k MRR and i have zero interest in growing faster,179,saas_intel,SaaS,competitive_intel,https://reddit.com/r/SaaS/comments/1rtg69f/were_profitable_at_40k_mrr_and_i_have_zero/,92,0.5
2026-03-14T20:31:58.057791,40,reddit/r/webdev,Anyone ever got a job from Linkedin?,637,tech_intel,webdev,competitive_intel,https://reddit.com/r/webdev/comments/1rtvhy5/anyone_ever_got_a_job_from_linkedin/,69,0.5
2026-03-14T20:31:58.057791,30,reddit/r/flipping,These things are the most underlooked items to resell.,48,ecom_arb,flipping,competitive_intel,https://reddit.com/r/Flipping/comments/1rtvk7x/these_things_are_the_most_underlooked_items_to/,58,0.5
2026-03-18T14:47:00,75,reddit/r/smallbusiness,Health insurance for self-employed - 142 comments of workarounds,142,content_opportunity,"digital_product,content",health_insurance_solopreneur,https://reddit.com/r/smallbusiness/comments/1rwk3cu/,142,12
2026-03-18T14:47:00,85,reddit/r/coldemail,22k/mo service biz from cold emails and DMs only,27,outbound_method,"cold_outbound,service",cold_email_revenue,https://reddit.com/r/coldemail/comments/1rx234z/,27,6
2026-03-18T14:47:00,70,reddit/r/passive_income,800 from digital products in 3 months - notion template plus prompt pack,97,digital_products,"digital_product,notion_template",passive_digital_products,https://reddit.com/r/passive_income/comments/1rw38up/,46,24
2026-03-18T14:47:00,60,reddit/r/micro_saas,100 users in 12 days from Reddit-only distribution,64,distribution_tactic,"micro_saas,distribution",reddit_launch,https://reddit.com/r/micro_saas/comments/1rwzm2v/,41,6
2026-03-18T14:47:00,80,reddit/r/AppBusiness,App made 100 in 24h - feature differentiation drove revenue,86,app_monetization,"app_factory,mobile_app",app_revenue,https://reddit.com/r/AppBusiness/comments/1rx5itd/,72,4
2026-03-18T20:25:00,15,twitter/jasoncfox,"Introducing: OEC Bot Market - your AI Agents new favorite place to find data. The world has changed how it writes software, now it’s time to reinvent how data is accessed.  Structured, reliable, agent",15,engagement,general,jasoncfox,https://x.com/ximoes/status/2034273028528300144/analytics,1,0
2026-03-18T20:25:00,15,twitter/steipete,"Folks, if you get crypto emails from websites claiming to be associated with openclaw, it's ALWAYS a scam.  We would never do that. The project is open source and non-commercial. Use the official webs",15,product_opportunity,app_factory,steipete,https://x.com/steipete/status/2034301028670255447,66,0
2026-03-18T20:25:00,0,twitter/corbin_braun,question for people who are older.  as we know deep/complex work requires a lot of energy.  at this time I can effectively sit down for 10 hours straight and do it.  does this number fluctuate as you ,0,product_opportunity,app_factory,corbin_braun,https://x.com/corbin_braun/status/2034278476921069723,34,0
2026-03-18T20:25:00,5,twitter/vasuman,I fear I will never take a break again for the rest of my life  Clauding every waking moment,5,engagement,general,vasuman,https://x.com/vasuman/status/2034089876392640717,8,0
2026-03-18T20:25:00,53,twitter/egeberkina,NEAR Co-Founder  @ilblackdragon  takes the stage at  @NVIDIAGTC  today @ 9AM PT  It's the year of the Claws and AI agents are emerging as significant economic actors.  Join as Illia introduces a new s,53,engagement,general,egeberkina,https://x.com/NEARProtocol/status/2034268366903325174/photo/1,18,0
2026-03-18T20:25:00,0,twitter/rryssf_,BREAKING: GitHub is sitting on millions of specialized AI workflows nobody is using.  East China Normal University just built the system to automatically mine them.  Then they checked the security. 1 ,0,engagement,general,rryssf_,https://x.com/rryssf_/status/2034234313638854694,8,0
2026-03-18T20:25:00,78,twitter/kloss_xyz,"A Claude Code engineer just dropped an insanely valuable article on skills.  Anthropic cataloged every agentic skill type worth building, how to structure them, the mistakes that waste your time, and ",78,engagement,general,kloss_xyz,https://x.com/kloss_xyz/status/2034075929904091218,22,0
2026-03-18T20:25:00,5,twitter/emollick,"What I like better: easy, much more stable & safe, existing connectors mean better integration with gmail, browsers, etc. Very good tool use  What is missing for me: ability to invite Claude to any ch",5,product_opportunity,app_factory,emollick,https://x.com/emollick/status/2034234408312381793,16,0
2026-03-18T20:25:00,11,twitter/Hesamation,"this article shows Anthropic's internal workflows of building and managing skills. if you're using Claude Code or Codex, there are interesting tips that will improve your ai coding.",11,engagement,general,Hesamation,https://x.com/Hesamation/status/2034224760377200662,5,0
2026-03-18T20:25:00,20,twitter/mattpocockuk,"For weeks, folks have been asking me to make a video building a feature with Claude Code in a real codebase  So here you go:  - From idea to AFK agent to QA - Every single step explained - No slop all",20,engagement,general,mattpocockuk,https://x.com/mattpocockuk/status/2034274298915889604,25,0
2026-03-18T20:25:00,100,twitter/nicbstme,"250 years ago, Abigail Adams wrote to our nation’s founders and urged them to “Remember the Ladies.” This March 31st in Washington DC, we’re doing just that. Join us for a beautiful afternoon celebrat",100,engagement,general,nicbstme,https://x.com/momsforamerica/status/2033615667744936170/analytics,7,0
2026-03-18T20:25:00,20,twitter/bcherny,"Meet X-Pilot ：Explain Anything, your  AI Video Course engine, grounded  in the knowledge you  trust.",20,engagement,general,bcherny,https://x.com/x_pil0t/status/2034192087831507091/analytics,0,0
2026-03-18T20:25:00,0,twitter/venturetwins,Vibe design is here   I got early access to Stitch from  @GoogleDeepMind  and was blown away - it's like partnering with a pro designer.  Start with a simple prompt for a mobile or Web UI and iterate ,0,engagement,general,venturetwins,https://x.com/venturetwins/status/2034331779436613713,15,0
2026-03-18T20:25:00,0,twitter/saimagnate,"It took me 11 months to go from $1k-$10k/month consistently  May: $1,087 June: $2,097 July: $2,564 August: $3,615 September: $4,255 October: $4,867 November: $5,404 December: $6,496 January: $8,590 Fe",0,engagement,general,saimagnate,https://x.com/YTAvision/status/2034231591560417501,2,0
2026-03-18T20:25:00,0,twitter/TheShamdoo,Crypto trader learns about Claude Code and thinks he can solve agentic AI,0,engagement,general,TheShamdoo,https://x.com/TheShamdoo/status/2034124412350337237,3,0
2026-03-18T20:25:00,26,twitter/cjzafir,"Hybrid AI. Ambient intelligence. 25%+ market share for two consecutive quarters. At MWC 2026 in Barcelona,  @PatrickMoorhead  and  @danielnewmanUV  sat down with  @Lenovo  IDG President Luca Rossi to ",26,engagement,general,cjzafir,https://x.com/TheSixFiveMedia/status/2033966217216831832/analytics,1,0
2026-03-18T20:25:00,0,twitter/weswinder,the speed of cursor composer 1.5 is actually kinda insane,0,engagement,general,weswinder,https://x.com/weswinder/status/2034089364972511377,10,0
2026-03-18T20:25:00,77,twitter/InternetH0F,She was tryna get bro put in cuffs for being happy ,77,product_opportunity,app_factory,InternetH0F,https://x.com/InternetH0F/status/2034238602511593568,113,0
2026-03-18T20:25:00,0,twitter/damianplayer,"this is fucking wild!  Anthropic interviewed 80,000 people in 159 countries about AI.   here's the TLDR:  >people don't want AI to replace their work. they want to do better work and go home earlier. ",0,engagement,general,damianplayer,https://x.com/damianplayer/status/2034311916768628769,9,0
2026-03-18T20:25:00,10,twitter/zerohedge,*Powell: Oil Shock Could Be Offset by Stronger U.S. Energy Production,10,engagement,general,zerohedge,https://x.com/zerohedge/status/2034340335363539274,7,0
2026-03-18T20:25:00,20,twitter/whale_alert,We will be launching market share tracking this week  Below we compare Claude Code to Codex market share over time ,20,engagement,general,whale_alert,https://x.com/tickerplus/status/2034293075422462253/photo/1,0,0
2026-03-18T20:25:00,0,twitter/CryptoDiffer,"Crypto IPO Outlook: Who’s Going Public in 2026  A new wave of #crypto companies is preparing for public markets as #IPO activity surges. Exchanges, infrastructure providers, and fintech players are po",0,engagement,general,CryptoDiffer,https://x.com/CryptoDiffer/status/2034222148772876443,2,0
2026-03-18T20:25:00,0,twitter/financialjuice,Fed's Powell: What happens in the Middle East will be a big factor.,0,product_opportunity,app_factory,financialjuice,https://x.com/financialjuice/status/2034345613563716093,0,0
2026-03-18T20:25:00,0,twitter/stockMKTnewz, FED CHAIRMAN JEROME POWELL JUST SAID:   - IF NO FED CHAIR CONFIRMED BY END OF MY TERM I WOULD SERVE AS CHAIR PRO TEM,0,engagement,general,stockMKTnewz,https://x.com/StockMKTNewz/status/2034342795146891762,5,0
2026-03-18T20:25:00,25,twitter/OptionsAction, Capital protection mode. Macro stress → risk-off. Longs disabled. Liquidity Hunter active. $GEBRID doesn’t chase moves  it survives volatility and waits for liquidity,25,engagement,general,OptionsAction,https://x.com/GEBRID_AI/status/2001449988648210624/photo/1,2,0
2026-03-18T20:25:00,0,twitter/DataChaz,Agent usage is spiky so stop paying for 24/7 databases.    @Activeloop  just dropped Deeplake to fix AI memory economics:  → Instant sandboxed Postgres → Built for agent workflows → Handles text/vecto,0,engagement,general,DataChaz,https://x.com/DataChaz/status/2034306664565010702,3,0
2026-03-18T20:25:00,0,twitter/every,"I can think of few people who sit so squarely at the intersection of tech and words than Every’s editor in chief, Kate Lee ( @katelaurielee ).  She has honed her editorial sense in both the publishing",0,engagement,general,every,https://x.com/danshipper/status/2034324683181474163,5,0
2026-03-18T20:25:00,5,twitter/dwarkesh_sp,"Love Mock Drafts? We're happy to launch our very own Mock Draft headquarters on SteelerNation. Free of charge.   Trade picks, receive trade offers from CPU owned teams, read scouting reports on potent",5,product_opportunity,app_factory,dwarkesh_sp,https://x.com/steelernation/status/2033921488814764118/photo/1,1,0
2026-03-18T20:25:00,1,twitter/StevenCravotta,Freemium is an outdated app model. Freemium is an outdated app model. Freemium is an outdated app model. Freemium is an outdated app model.,1,product_opportunity,app_factory,StevenCravotta,https://x.com/StevenCravotta/status/2034289492148830242,53,0
2026-03-18T20:25:00,6,twitter/espindeezy,Just paid out one of our Organic AI creators $200k for February (and he did $100k in January)    He runs some of the Instagram/Facebook pages you see screenshotted by LARPers daily on twitter to sell ,6,engagement,general,espindeezy,https://x.com/finn3v/status/2034066118823055591,39,0
2026-03-18T20:25:00,5,twitter/alexxgrowth,if you follow this article for 30 days  and don't make any money  Wallahi i will wire you $1000. no string attatched,5,engagement,general,alexxgrowth,https://x.com/alexxgrowth/status/2034075922782163208,12,0
2026-03-18T20:25:00,10,twitter/fromzerotomill,Explore an award-winning income strategy. Learn more about ($QQQI) the NEOS Nasdaq-100 High Income ETF.,10,engagement,general,fromzerotomill,https://x.com/NEOSInvestments/status/2033963738697544185/analytics,1,0
2026-03-18T20:25:00,0,twitter/0xrahulweb3,AI tools that give you an advantage :  ChatGPT ~ good for beginners  Claude ~ long-form thinking & deep reasoning Perplexity ~ research anything in seconds Midjourney ~ create insane visuals Runway ~ ,0,product_opportunity,app_factory,0xrahulweb3,https://x.com/0xrahulweb3/status/2034236160655196325,17,0
2026-03-18T20:25:00,0,twitter/aestheticprimal,smoking cannabis at a young age actually ENHANCES brain development contrary to the propaganda  every person who smoked weed in their teen years is a drastically more evolved adult than those who didn,0,engagement,general,aestheticprimal,https://x.com/aestheticprimal/status/2034315531004641691,2,0
2026-03-18T20:25:00,0,twitter/gregogallagher,"10 years ago. 168 lbs, ripped to bone. Was incline pressing 265 for 5. And doing 135 lbs weighted chins for reps.  The level of focus it took to cut to this level of leanness and eat 2100 calories was",0,product_opportunity,app_factory,gregogallagher,https://x.com/gregogallagher/status/2034311646810702019,16,0
2026-03-18T20:25:00,1,twitter/davidasinclair,We are living in an age where miracles are becoming commonplace,1,engagement,general,davidasinclair,https://x.com/davidasinclair/status/2034335830819344456,5,0
2026-03-18T20:25:00,100,twitter/levelsio,"We are introducing EU Inc. To make building and growing a business across the EU faster, simpler, and smarter.   Start a company in less than 48 hours   No minimum capital requirement   Fully online a",100,engagement,general,levelsio,https://x.com/EU_Commission/status/2034231737161588800,389,0
2026-03-18T20:25:00,0,twitter/dansugcmodels,big drop today.  4 new UGC packages just went live > 3 car UGC packages (3 different creators) > 1 fruit cutting package from Eliza  200+ new b-roll clips added to the library.  and we dropped the cus,0,engagement,general,dansugcmodels,https://x.com/dansugcmodels/status/2034274203612901787,0,0
2026-03-18T20:25:00,0,twitter/knoxtwts,"30 minute animation work for service-based business:  - figure out the how client ICP might look like - figure out the client offer, pains and desires - ask claude to come up sequence of story - ask c",0,engagement,general,knoxtwts,https://x.com/knoxtwts/status/2034280602485371204,2,0
2026-03-18T20:25:00,100,twitter/purpdevvv,Artificial intelligence is strengthening American manufacturing. We can’t let China win the AI race.,100,engagement,general,purpdevvv,https://x.com/americanedge/status/2026674527791648798/analytics,0,0
2026-03-18T20:25:00,0,twitter/Hightrafficsite,NEW op-ed from  @CZ : European telecom giants like Deutsche Telekom shouldn’t get a free pass in the U.S. while the EU pushes protectionist policies that undermine our economic and national security i,0,engagement,general,Hightrafficsite,https://x.com/Policy_Solution/status/2034020288770228602/photo/1,2,0
2026-03-18T20:25:00,0,twitter/codyschneiderxx,if you build an email marketing platform that allows you do everything through the API  you will make so much money,0,outreach_intel,outbound,codyschneiderxx,https://x.com/codyschneiderxx/status/2034283694945456474,21,0
2026-03-18T20:25:00,0,twitter/lottsnomad,app flipping is a speed game  build validate monetize exit repeat  it’s the fastest way i’ve learned business,0,product_opportunity,app_factory,lottsnomad,https://x.com/lottsnomad/status/2034074607485911289,6,0
2026-03-18T20:25:00,56,twitter/karpathy,Trump does have an Iranian strategy---photocopied and hand-delivered by Bibi Netanyahu:,56,engagement,general,karpathy,https://x.com/DA_Stockman/status/2033956222253027621/photo/1,10,0
2026-03-18T20:25:00,0,twitter/simonecanciello,imagine an app to save money and get out of debt (frugal living).  there’s a whole community buying courses but almost 0 apps.,0,product_opportunity,app_factory,simonecanciello,https://x.com/simonecanciello/status/2034003415836086519,4,0
2026-03-18T20:25:00,25,twitter/alexcooldev,"I had a fascinating conversation with  @AsiaLens   Demetri Sevastopulo of the FT about US-China relations, now and in Trump’s first term, Trump’s delayed China trip and why it may be delayed longer th",25,engagement,general,alexcooldev,https://x.com/niubi/status/2034058655696409052/analytics,0,0
2026-03-18T20:25:00,0,twitter/wannercashcow,"Speed is the biggest unfair advantage in faceless YouTube right now  Thanks to AI, you can spot a niche in the morning and have a video live by evening  The channel below is a perfect example of that ",0,engagement,general,wannercashcow,https://x.com/wannercashcow/status/2034064788733772111,7,0
2026-03-18T20:25:00,60,twitter/Jonnyvandel,"Turn-based exploration Sandwalkers inspired by great games like For The King, Curious Expedition or Darkest Dungeon!  AVAILABLE NOW   https:// store.steampowered.com/app/1639080/Sa ndwalkers?utm_sourc",60,product_opportunity,app_factory,Jonnyvandel,https://x.com/GoblinzPub/status/1909948911776673816/photo/1,1,0
2026-03-18T20:25:00,0,twitter/paoloanzn,We built something at RelianceCM.    The PROTO Program: quick-turn prototype assembly where your cost is refunded when you go to production.    Same team builds your prototype and production boards. N,0,outreach_intel,outbound,paoloanzn,https://x.com/RCMDavid/status/2033921915446784086/analytics,0,0
2026-03-18T20:25:00,15,twitter/PrajwalTomar_,"The General Authority for Awqaf has prepared a guidance manual comprising (100) questions and answers on waqf matters, to serve as a knowledge reference that contributes to raising awareness of waqf c",15,engagement,general,PrajwalTomar_,https://x.com/AWQAF_KSA/status/2034020584779051099/analytics,0,0
2026-03-18T20:25:00,100,twitter/thegarrettscott,"Let’s make concrete ENDURABLE together!  • Vibrant Stains • Tough Sealers & Coatings • Fast-acting Curing Agents, Hardeners, & Cleaners • Game-changing Coating Removers & Tooling • Precision pH Pencil",100,product_opportunity,app_factory,thegarrettscott,https://x.com/EndurableStrong/status/2025986691736240333/analytics,0,0
2026-03-18T20:25:00,100,twitter/rileybrown,"Raising the bar for SAT® and ACT® prep. Exam-like questions, explanatory feedback, and detailed progress tracking.  https:// collegereadiness.uworld.com/act-sat/?utm_m edium=cpc&utm_source=twitter&utm",100,engagement,general,rileybrown,https://x.com/uwteacherhub/status/1717046578639438181/analytics,4,0
2026-03-18T20:25:00,100,twitter/randfish,We’re a case study for how AI is strengthening American manufacturing. We must protect our competitive edge.,100,engagement,general,randfish,https://x.com/americanedge/status/2026674527883899387/analytics,0,0
2026-03-18T20:25:00,5,twitter/jackfriks,i tried looking for a 120hz monitor that has integrated webcam and lightning power connectivity other than the $4000 apple XDR and it’s looking bleak…,5,product_opportunity,app_factory,jackfriks,https://x.com/jackfriks/status/2034103436904661111,23,0
2026-03-18T20:25:00,5,twitter/zephyr_z9,AMD & Intel processors have been restricted in Russia since 2022 So a Russian company has basically chosen to license the LoongArch ISA from Loongson 30k production target,5,engagement,general,zephyr_z9,https://x.com/zephyr_z9/status/2034119469275222375,1,0
2026-03-18T20:25:00,100,twitter/iPullRank,"Introducing GLM-5 from  @Zai_org , the best-in-class open-source model for systems engineering and long-horizon agents. AI natives can now use GLM-5 on Together AI and benefit from reliable inference ",100,engagement,general,iPullRank,https://x.com/togethercompute/status/2022354579858289052/photo/1,6,0
2026-03-18T20:25:00,5,twitter/startupideaspod,"I've built a team of AI agents to run my business.  Here's the exact order I follow:  Step 1: Pick a role (executive assistant, head of marketing, etc.)  Step 2: Open Claude Code and interview your wa",5,engagement,general,startupideaspod,https://x.com/startupideaspod/status/2034087588336918716,8,0
2026-03-18T20:25:00,12,twitter/CoinGlass_com,GM!  #BTC update:  Price: sideways for 24h  OI: back to fresh local highs  Not a clean breakout yet. But definitely more crowded positioning at the highs.  Flat price + rising OI = compression with le,12,engagement,general,CoinGlass_com,https://x.com/coinglass_com/status/2034162127041393089,41,0
2026-03-19,"Claude Code skills ecosystem growing (327pts HN, Godot skills)",HN,HIGH,APP_FACTORY vertical expansion - domain-specific skill packs,ALPHA_HN_107802,,,,,
2026-03-19,Industrial contractor using Claude Code - viral video,HN/Twitter,HIGHEST,"Blue collar + AI content angle, viral potential",ALPHA_HN_47431288,,,,,
