Date,Niche,Platform,Posts,Views,Clicks,Followers,Email_Subs,Leads,Revenue,Notes
2026-01-13,AI utilities,Twitter,5,12400,87,1247,23,2,0,"Week 1 baseline, mostly replies and quote tweets"
2026-01-14,AI utilities,Twitter,3,8200,45,1273,12,1,0,"Lower post volume, testing content types"
2026-01-15,Faith streak,Instagram,7,5600,34,892,31,0,0,"Story-heavy day, 1 reel performed well (2.1K views)"
2026-01-16,Fitness,Twitter,4,15300,156,2347,45,8,149,"Transformation post went viral, gained 89 followers, 2 coaching inquiries"
2026-01-16,Fitness,Instagram,5,9800,67,3124,18,3,0,"Cross-posted YouTube Short, good engagement"
2026-01-17,AI utilities,Twitter,6,10100,92,1289,19,3,97,"First paid template sale ($97), came from thread CTA"
2026-01-17,Faith streak,Instagram,4,6200,41,921,27,1,0,"Consistency post, steady growth"
2026-01-18,Fitness,YouTube,2,3400,89,412,34,5,0,"New channel, shorts driving traffic to IG"
2026-01-18,AI utilities,Twitter,4,9800,71,1302,15,2,0,"Engagement stable, testing new hook styles"
2026-01-19,Faith streak,Instagram,6,7100,53,964,38,2,27,"First app subscription ($27/mo), from 7-day challenge completer"