structure_id,content_type,structure_name,platform,hook_formula,body_structure,cta_type,cta_example,performance_tier,niche_fit,notes,source
CS026,Short Video,3-Second Hook Format,All Platforms,"Bold text statement OR Shocking stat OR Direct question OR Controversy",Hook (0-3s) → Value/Story (3-55s) → CTA (55-60s),Bio/Comment,Link in bio OR Comment keyword,HIGHEST,ALL,"Universal 2026 pattern. First 3s = everything. Zero intro fluff.",Algorithm research Jan 2026
CS027,Short Video,Original Audio Reels,Instagram,"[Custom voiceover or music]",Hook → Value → CTA with ORIGINAL audio (not trending),Bio/Comment,Link in bio,HIGHEST,ALL,"IG algo Jan 2026 prioritizes original audio > trending sounds.",Instagram algorithm update 2026
CS028,Multi-Platform,1-to-30 Multiplication,All,"[Same master content]","1 video → 10 platform variants + 10 text posts + 10 images",Multiple,Platform-specific CTAs,HIGHEST,ALL,"Template-based repurposing. Maximum distribution efficiency.",Content multiplication research
CS029,Short Video,Pre-Save Challenge,TikTok/Reels,"Drop [X] after [Y] pre-saves/saves",Hook → Challenge → Pre-save CTA → Algorithmic boost,Comment/Bio,"Comment GUIDE OR Save this post",HIGH,ALL,"Music industry tactic. Boosts algorithm + playlist placement.",@Majacktan_Son observation
CS030,Long-Form,Meditation/Sleep Evergreen,YouTube,"[Calming intro with nature sounds]","Nature b-roll (0-10min) + Calm music + AI guided meditation voiceover",Description,"Affiliate links + digital product",HIGHEST,ALL,"8-10min for mid-roll ads. $5-12 CPM. Evergreen compound views.",Niche research Jan 2026
CS031,Multi-Platform,Triple Monetization,All,"[Any proven format]","Video content + Description affiliates + Pinned comment digital product",Multiple,"Multiple revenue streams per viewer",HIGHEST,ALL,"Ads + Affiliates + Digital Product. Never rely on ads alone.",Monetization best practices 2026
