method_id,method_name,synergy_partners,synergy_type,synergy_score,cross_sell_products,shared_audience,automation_combo,revenue_multiplier,notes
MM001,APP_FACTORY,"AI005,CF007,MM002,MM009,MM017,MM019",Build app + influencer promo + info product + clipper network,95,"Fitness app -> fitness influencer promo, Course upsell, Network launch",Health-conscious 25-45,TRUE,2.5,"Stack: App for lead capture, influencer for traffic, course for monetization"
MM002,INFO_PRODUCTS,"AI001,MM006,MM007,MM015,MM030",Expert persona + content + outbound + newsletter,90,"Course -> coaching upsell, template bundle, newsletter premium",Self-improvers 20-40,TRUE,2.2,"Stack: Niche expert account builds authority, sells courses"
MM003,AFFILIATE_SITES,"CF008,CF009,MM002,MM015,MM038",Finance/tech content + SEO + products + newsletter + Pinterest,85,"Affiliate reviews -> course on same topic, newsletter monetization",Research buyers 25-55,TRUE,2.0,"Stack: SEO content drives affiliate, course converts warmest leads"
MM004,SAAS,"MM007,AI001,CF009,MM027,MM028",Cold outbound + expert positioning + tech content + AI wrappers,80,"SaaS -> consulting upsell, training, micro-SaaS bundle",B2B founders 25-50,FALSE,1.8,"Stack: Expert content builds trust, outbound closes deals"
MM005,AGENCY_SERVICES,"AI001,MM008,MM007,MM029,MM033",Expert account + UGC sourcing + outbound + local lead gen + white label,85,"Agency -> retainer, white-label services, local business clients",Brands SMBs 30-50,FALSE,2.0,"Stack: Niche expert shows portfolio, outbound generates leads"
MM006,CONTENT_FARM,"CF001-CF013,MM009,MM014,MM035,MM039",All content sub-methods + AI personas + YouTube,95,"Content -> affiliate, funnel to products, YouTube ad revenue",Mass audience 18-35,TRUE,2.3,Stack: Content accounts drive traffic to monetization methods
MM007,COLD_OUTBOUND,"MM004,MM005,AI001,MM015,MM029",SaaS/agency sales + expert positioning + newsletter + local lead gen,90,"Outbound -> SaaS demo, agency call, newsletter signup",B2B decision-makers 30-55,TRUE,2.1,"Stack: Expert account warms leads, outbound converts"
MM008,UGC_ARBITRAGE,"MM005,AI006,CF005,MM016,MM024",Agency fulfillment + lifestyle content + TikTok Shop + POD,80,"UGC -> agency upsell, brand partnerships, TikTok content",Brand marketers 25-45,FALSE,1.7,Stack: Cheap UGC sourcing supplies agency work
MM009,AI_INFLUENCER,"AI001-AI008,MM006,MM002,MM016,MM040",All AI personas + content + info products + TikTok Shop + X monetization,95,"Influencer -> course, coaching, affiliate, TikTok Shop sales",Niche followers 18-45,TRUE,2.5,"Stack: AI persona builds audience, monetizes via products"
MM010,STREAMER_CLIPS,"CF006,CF004,MM006,MM037,CF013",Clip channels + meme accounts + content + TikTok creativity + Shorts,90,"Clips -> creator fund, streamer partnerships, cross-platform views",Gamers 16-30,TRUE,2.2,"Stack: Clips drive views, memes expand reach"
MM011,ROBLOX_GAMES,"CF004,AI007,MM002,SWARM001",Meme content + gaming personas + courses + swarm promo,70,"Games -> Robux, dev courses, coordinated launch","Kids/teens 8-16, dev parents 25-45",FALSE,1.5,"Stack: Gaming content promotes games, courses teach dev"
MM012,ALGO_TRADING,"MM002,AI001,CF008,CF011,CF012,MM015",Trading + info products + finance expert + crypto + stocks + newsletter,85,"Trading signals -> courses, signal subscriptions, newsletter monetization",Traders investors 25-55,TRUE,2.3,Stack: Trade profitably + sell education + finance content builds authority
MM013,PAID_ADS,"MM001,MM002,MM003,MM016,MM022",Traffic to apps + courses + affiliate + TikTok Shop + dropship,80,"Paid traffic -> product sales, affiliate conversions, app installs",Buyers all demos,TRUE,2.0,Stack: Paid ads drive traffic to all monetization channels
MM014,YOUTUBE_LONGFORM,"MM002,MM003,AI001,MM035,MM039",Courses + affiliate + expert + automation + faceless,85,"YouTube -> course sales, affiliate revenue, sponsorships",Content consumers 25-45,TRUE,2.2,"Stack: YouTube builds trust, course/affiliate monetizes"
MM015,NEWSLETTER,"MM002,MM003,MM007,CF008,MM032",Info products + affiliate + outbound + finance content + premium,90,"Newsletter -> course sales, affiliate, premium tier, sponsorships",Info seekers 25-55,TRUE,2.4,"Stack: Newsletter nurtures, products monetize"
MM016,TIKTOK_SHOP,"MM006,MM009,MM013,MM022,MM024",Content farm + AI influencer + paid ads + dropship + POD,90,"TikTok Shop -> product sales, affiliate commissions, brand deals",Gen Z millennials 18-35,TRUE,2.5,Stack: Content drives TikTok Shop sales at scale
SWARM001,SWARM_PROMOTION,"CF004,CF006,AI007,MM011,MM001,MM017",Meme + clips + gaming persona + Roblox + apps + clipper network,95,All accounts funnel to single monetization point,Gen Z 13-25,TRUE,2.8,Stack: 10-20 coordinated accounts across platforms all funneling to Roblox game or app
CF001,RELAX_CHANNELS,"CF002,AI004,MM001,CF013",Sleep content + ASMR + sleep apps + YouTube Shorts,95,"Ambient -> sleep app affiliate, meditation products",Sleep-deprived 25-55,TRUE,2.2,Stack: Relax content -> ASMR crossover -> app affiliate
CF002,SLEEP_TIMER_ALARM,"CF001,AI004,MM001,CF013",Relax content + ASMR + productivity apps + Shorts,95,"Sleep tips -> alarm app affiliate, supplements",Sleep optimizers 25-50,TRUE,2.2,Stack: Sleep content -> app affiliate -> supplement affiliate
CF003,NEWS_SOCIALS,"CF008,CF009,MM003,MM015,CF011",Finance/tech news + affiliate sites + newsletter + crypto,85,"News -> newsletter, affiliate products, breaking news premium",News junkies 25-55,TRUE,2.0,"Stack: Breaking news builds following, newsletter monetizes"
CF004,MEME_CHANNELS,"CF006,CF010,MM010,SWARM001,CF013",Clips + sports + streamer content + swarm + Shorts,80,"Memes -> merch, creator fund, coordinated virality",Gen Z 16-30,TRUE,1.8,"Stack: Memes drive engagement, cross-promote other content"
CF005,WOMEN_APPRECIATION,"AI006,MM008,CF007,MM016",Lifestyle personas + UGC + motivation + TikTok Shop,75,"Fan page -> affiliate, sell ad space, TikTok Shop products",Men 18-45,TRUE,1.6,Stack: Fan page audience sells to other accounts
CF006,CLIP_CHANNELS,"MM010,CF004,AI007,CF013,MM037",Streamer clips + memes + gaming personas + Shorts + TikTok creativity,90,"Clips -> streamer deals, creator fund, cross-platform revenue",Gamers 16-30,TRUE,2.3,"Stack: Clips feed meme accounts, gaming personas"
CF007,MOTIVATION_QUOTES,"AI001,MM002,CF008,MM015",Niche experts + courses + finance content + newsletter,90,"Quotes -> course funnel, coaching, newsletter signup",Self-improvers 20-40,TRUE,2.1,Stack: Motivation content -> expert account -> course sale
CF008,FINANCE_NEWS,"MM003,CF003,AI001,MM012,CF011,CF012,MM015",Affiliate sites + news + finance expert + algo trading + crypto + stocks + newsletter,85,"Finance news -> course, affiliate products, trading signals",Finance bros 25-45,TRUE,2.2,Stack: Finance content -> newsletter -> course/affiliate
CF009,TECH_EXPLAINERS,"MM003,MM004,AI001,MM027,MM028",Affiliate + SaaS promo + tech expert + AI wrappers + micro-SaaS,85,"Tech content -> SaaS affiliate, courses, tool launches",Tech enthusiasts 25-45,TRUE,2.0,"Stack: Tech content drives SaaS trials, course sales"
CF010,SPORTS_HIGHLIGHTS,"CF004,MM003,AI007,CF013",Memes + betting affiliate + sports personas + Shorts,80,"Sports -> betting affiliate, merch, creator fund",Sports fans 18-45,TRUE,1.9,Stack: Sports clips -> betting affiliate -> merch
CF011,CRYPTO_NEWS,"CF008,MM012,MM015,AI001,MM034",Finance news + algo trading + newsletter + expert + memecoin,85,"Crypto content -> signals, newsletter, trading course, memecoin alpha",Crypto traders 20-45,TRUE,2.4,Stack: Crypto news -> trading signals -> premium newsletter
CF012,STOCK_RESEARCH,"CF008,MM012,MM015,AI001",Finance news + algo trading + newsletter + expert,80,"Stock research -> premium analysis, trading course, newsletter",Stock traders 25-55,TRUE,2.0,Stack: Stock content -> premium research -> course upsell
CF013,YOUTUBE_SHORTS,"CF001-CF012,MM006,MM035,MM037,MM039",All content farm + content farm core + YouTube automation + TikTok creativity + faceless,90,"Shorts -> long-form funnel, ad revenue, creator fund",All audiences 16-45,TRUE,2.3,"Stack: Shorts drive subs, long-form monetizes"
AI001,NICHE_EXPERTS,"MM002,MM005,MM007,MM015,MM020",Courses + agency + outbound + newsletter + X launch,95,"Expert -> course, consulting, coaching, newsletter, product launches",B2B/B2C 25-55,TRUE,2.6,Stack: Expert persona sells everything else
AI002,FINDOM,"AI003,MM002,AI006,MM031",Adult + courses + lifestyle + paid community,60,"Findom -> custom content, coaching, premium community",Niche fetish 25-55,FALSE,1.4,"Stack: Specialized audience, high-ticket"
AI003,ONLYFANS_FANSLY,"AI002,AI004,AI006,MM031",Findom + ASMR + lifestyle + paid community,70,"Adult -> PPV, custom, girlfriend experience, community",Adult consumers 18-45,FALSE,1.5,Stack: Multiple revenue per subscriber
AI004,ASMR,"CF001,CF002,AI006,CF013,MM031",Relax channels + sleep + lifestyle + Shorts + paid community,90,"ASMR -> Patreon, affiliate, app promo, community",Relaxation seekers 18-45,TRUE,2.2,"Stack: ASMR feeds relax channels, Patreon monetizes"
AI005,FITNESS_COACHES,"MM001,MM002,CF007,MM016,MM030",Fitness apps + courses + motivation + TikTok Shop + course platform,95,"Fitness persona -> app affiliate, program sales, TikTok Shop products",Fitness 20-45,TRUE,2.6,Stack: Fitness persona -> app promo -> program sale -> TikTok supplements
AI006,LIFESTYLE_CURATORS,"MM008,CF005,AI004,MM016,MM024",UGC + women accounts + ASMR + TikTok Shop + POD,80,"Lifestyle -> brand deals, affiliate, TikTok Shop, custom merch",Aspirational 20-40,TRUE,1.9,Stack: Lifestyle content -> brand partnerships -> TikTok Shop
AI007,GAMING_PERSONAS,"MM010,CF006,CF004,MM011,SWARM001",Clips + gaming clips + memes + Roblox + swarm,85,"Gaming -> sponsorships, merch, affiliate, Roblox promotion",Gamers 16-30,TRUE,2.1,"Stack: Gaming persona promotes clips, earns sponsorships"
AI008,RELATIONSHIP_ADVICE,"MM002,CF007,AI001,MM030,MM031",Courses + motivation + expert + course platform + community,90,"Dating persona -> course, coaching, paid community",Singles 18-45,TRUE,2.3,Stack: Dating content -> course -> coaching -> community upsell
MM017,MICRO_INFLUENCER_NETWORK,"MM001,MM006,MM008,MM009,MM019,SWARM001",Apps + content + UGC + AI personas + portfolio + swarm,95,"Clipper network launches all products at scale, coordinates swarm",All niches 16-45,TRUE,2.8,Stack: 500 clipper network tests hooks simultaneously. Launch apps via network.
MM018,PAYWALL_OPTIMIZATION_SERVICE,"MM001,MM005,AI001,MM019,MM004",App factory + agency + expert + portfolio + SaaS,85,"Optimize paywalls for own apps then sell service, SaaS tool potential",App developers B2B 25-45,FALSE,2.0,Stack: Optimize own apps first (case study). Sell as retainer + revenue share.
MM019,PORTFOLIO_APP_BUILDER,"MM017,MM018,MM006,MM009,MM020,MM001",Clipper network + paywall service + content + AI + X launch + apps,95,30-app portfolio - launch scale optimize repeat at volume,All app niches 18-55,TRUE,2.7,Stack: Build 2-3 apps/mo. Launch via MM017. Optimize via MM018.
MM020,X_LAUNCH_VIRAL,"MM001,MM002,MM004,AI001,MM019,MM015",Apps + info products + SaaS + expert + portfolio + newsletter,90,"Viral X launches convert to MRR without ads, newsletter captures leads",Tech enthusiasts creators 25-45,FALSE,2.4,Stack: Build 5-8k followers. Launch product via comment hook.
MM021,PERSONAL_BRAND_SEO,ALL_METHODS,Amplifies every other method - authority layer,100,Journey content builds authority and SEO asset across all methods,All audiences,FALSE,2.5,Stack: Build in public via @PRINTMAXXER. Google Jan 2026 favors authentic.
MM022,ECOM_DROPSHIP,"MM016,MM013,MM024,MM023",TikTok Shop + paid ads + POD + arbitrage,75,"Dropship -> TikTok Shop scaling, POD bundle, paid ads traffic",Ecom buyers 18-55,TRUE,1.8,"Stack: Find winners via arbitrage, scale via TikTok Shop + ads"
MM023,ECOM_ARB,"MM022,MM016,MM024,MM036",Dropship + TikTok Shop + POD + Etsy digital,80,Trending product arbitrage -> multiple platform listing,Bargain hunters 18-45,TRUE,1.9,"Stack: Find demand then source, list on multiple platforms"
MM024,PRINT_ON_DEMAND,"MM016,MM006,AI006,MM036",TikTok Shop + content farm + lifestyle + Etsy digital,70,"Custom merch -> TikTok Shop sales, content promotion, Etsy listings",Merch buyers 18-45,TRUE,1.6,"Stack: POD designs promoted via content, sold on multiple platforms"
MM025,DIGITAL_PRODUCTS,"MM002,MM015,MM036,MM026",Info products + newsletter + Etsy digital + KDP,80,"Notion templates -> email list -> course upsell, Etsy sales",Digital buyers 25-45,TRUE,2.0,Stack: Templates -> email capture -> course funnel
MM026,AMAZON_KDP,"MM025,MM002,MM036",Digital products + info products + Etsy digital,65,"Low content books -> template upsell, course upsell",Book buyers 30-55,TRUE,1.5,"Stack: KDP builds catalog, templates capture emails"
MM027,AI_WRAPPER,"MM004,CF009,MM028,AI001",SaaS + tech explainers + micro-SaaS + tech expert,75,"Quick wrappers -> SaaS bundle, expert content promotion",Tech users 25-45,FALSE,1.7,Stack: AI wrappers -> tech content promotes -> expert credibility
MM028,MICRO_SAAS,"MM004,MM027,CF009,AI001",SaaS + AI wrapper + tech explainers + expert,75,"Single-feature tools -> bundle upsell, enterprise version",B2B SaaS buyers 25-50,FALSE,1.8,Stack: Micro-SaaS -> content promotes -> enterprise upsell
MM029,LOCAL_LEAD_GEN,"MM005,MM007,MM033",Agency services + cold outbound + white label,80,"GMB optimization -> agency client acquisition, white label fulfillment",Local business owners 30-55,FALSE,1.9,Stack: Rank and rent -> agency services upsell
MM030,COURSE_CREATOR,"MM002,AI001,MM031,MM015",Info products + niche experts + paid community + newsletter,90,"Courses -> community upsell, coaching, newsletter nurture",Course buyers 25-55,TRUE,2.3,Stack: Course -> community -> coaching ladder
MM031,COMMUNITY_PAID,"MM030,AI001,MM002,MM015",Course creator + niche experts + info products + newsletter,85,"Paid community -> course bundle, coaching, newsletter referrals",Community members 25-55,FALSE,2.1,Stack: Community -> course -> coaching ecosystem
MM032,NEWSLETTER_PREMIUM,"MM015,MM002,MM003,AI001",Newsletter + info products + affiliate + expert,85,"Premium newsletter -> course upsell, affiliate revenue",Newsletter subscribers 25-55,TRUE,2.2,Stack: Free newsletter -> premium tier -> course upsell
MM033,WHITE_LABEL,"MM005,MM004,MM029",Agency services + SaaS + local lead gen,70,"Resell software -> agency fulfillment, local business clients",B2B service buyers 30-50,FALSE,1.6,Stack: White label tools for agency delivery
MM034,MEMECOIN_TRADING,"CF011,MM012,MM015",Crypto news + algo trading + newsletter,60,"Memecoin alpha -> premium signals, trading group",Crypto degens 20-40,FALSE,1.4,Stack: Memecoin research -> premium alpha signals (HIGH RISK)
MM035,YOUTUBE_AUTOMATION,"MM014,MM006,CF013,MM039",YouTube longform + content farm + Shorts + faceless,85,"Full channel management -> ad revenue, sponsorships, affiliate",Content consumers 25-45,TRUE,2.3,Stack: Automated YouTube -> ad revenue -> affiliate monetization
MM036,ETSY_DIGITAL,"MM025,MM024,MM026",Digital products + POD + KDP,75,"Etsy digital downloads -> multiple platform listing, email capture",Etsy buyers 25-45,TRUE,1.7,Stack: Etsy digital -> templates -> email funnel
MM037,TIKTOK_CREATIVITY,"CF006,MM010,CF013,MM016",Clip channels + streamer clips + Shorts + TikTok Shop,80,TikTok creativity program -> creator fund + TikTok Shop integration,Gen Z creators 18-30,TRUE,1.9,Stack: Creativity program revenue + TikTok Shop sales
MM038,PINTEREST_AFFILIATE,"MM003,MM025,MM036",Affiliate sites + digital products + Etsy digital,70,"Pinterest -> affiliate offers, digital product sales, Etsy traffic",Pinterest users 25-55,TRUE,1.6,Stack: Pinterest drives affiliate + digital product traffic
MM039,FACELESS_YOUTUBE,"MM035,MM014,CF013,MM006",YouTube automation + longform + Shorts + content farm,80,"AI narration channels -> ad revenue, affiliate, course promo",Content consumers 25-55,TRUE,2.0,Stack: Faceless YouTube -> ad revenue -> affiliate monetization
MM040,TWITTER_MONETIZATION,"AI001,MM020,MM015,MM002",Niche experts + X launch + newsletter + info products,75,X subscriptions + tips + newsletter funnel + product launches,X users 25-45,FALSE,1.7,Stack: Expert content -> X monetization -> newsletter -> products
MM041,DIRECTORY_LISTING_SITES,"MM003,MM004,AI001,MM044",Affiliate sites + SaaS + expert + rapid build,85,"Niche directories -> featured listings, premium placement, affiliate",B2B directory users 25-55,TRUE,2.2,Stack: Directory builds -> premium listings -> SEO authority
MM042,WAITLIST_PRESALE_SERVICE,"MM001,MM004,MM020,MM044",App factory + SaaS + X launch + rapid build,80,"Waitlist presales -> 25-85% conversion, validate before building",Founders B2B 25-45,FALSE,2.0,Stack: Presale validates -> only build winners -> rapid monetization
MM043,INFLUENCER_REVENUE_SHARE,"MM009,MM017,AI005,AI001",AI influencer + clipper network + fitness + expert,75,"Revenue share partnerships -> aligned incentives, long-term value",Creators brands 25-45,FALSE,1.8,Stack: Revenue share aligns creator incentives long-term
MM044,RAPID_BUILD_MONETIZATION,"MM041,MM042,MM001,MM028",Directory + waitlist + apps + micro-SaaS,90,48-hour builds -> rapid monetization -> scale winners,Indie hackers 25-45,TRUE,2.5,Stack: Build fast -> monetize fast -> iterate winners
MM045,YOUTUBE_COURSE_APP_FUNNEL,"MM006,MM002,MM001,MM014",YouTube content + course upsell + app affiliate + longform,90,YouTube -> course at 2-3x revenue + app promo -> SaaS trial,Course buyers 25-45,TRUE,2.4,"Stack: YouTube establishes credibility, course monetizes"
MM046,NEWSLETTER_DIGITAL_PRODUCTS,"MM003,MM002,MM006,MM015",Newsletter + courses + digital products + affiliate,95,Newsletter -> digital products 2-3x revenue + community engagement,Newsletter subscribers 25-55,TRUE,2.5,Stack: Newsletter audience -> digital products monetize
MM047,MULTI_AGENT_BUSINESS_AUTOMATION,"MM004,MM005,MM019,MM027",Multi-agent AI systems + SaaS + agency + portfolio + AI wrappers,85,"AI agent systems -> automation service, B2B consulting",B2B tech-forward 30-50,FALSE,2.1,Stack: Build agents for own ops -> sell automation consultancy
MM048,COMMUNITY_MULTIPLE_REVENUE,"MM002,MM003,MM005,MM007,MM031",Community + courses + sponsorships + services + outbound + paid community,90,Paid community -> training + recruiting + services + affiliate,B2B/B2C community members 25-55,FALSE,2.3,Stack: Community with multiple revenue drivers for scale
MM049,PORTFOLIO_DIVERSIFIED_APPS,"MM001,MM019,MM018,MM017",30-app portfolio + micro-SaaS + clipper network + paywall optimization,95,Portfolio spreads risk + consistent tech stack + performance scaling,All app niches 18-55,TRUE,2.7,Stack: Diversified portfolio -> clipper network launch -> paywall optimize
CH068,MEDIUM_DISTRIBUTION,"MM006,MM009,MM002,MM003,MM015,CF007,CF008,CF009,AI001",Content farm repurpose + AI influencer thought leadership + info product funnel + affiliate content + newsletter cross-post,90,Medium articles → course funnel + affiliate links + newsletter signups + app landing pages,Readers 25-55 all niches,TRUE,,Stack: Cross-post blog content to Medium for DA 95 SEO juice. Repurpose CONTENT_FARM posts as long-form articles. AI_INFLUENCER personas publish thought leadership. Affiliate content earns via Partner Program + affiliate links. Funnel readers to Substack newsletter. Submit to publications for 10-50x reach boost. Canonical URLs prevent duplicate content penalty.
CH012,SUBSTACK_DISTRIBUTION,"MM015,MM002,MM003,MM006,MM009,CF007,CF008,AI001,AI005",Newsletter + info products + affiliate + content farm + AI influencer + motivation + finance + niche experts + fitness,95,Substack newsletter → paid subs + course upsell + affiliate + community + recommendation network growth,Newsletter subscribers all niches 25-55,TRUE,,Stack: Free newsletter builds audience via recommendation network. Notes feature acts as social media layer. Paid tier $5-15/mo at 5-10% conversion. Upsell to courses (MM002). Embed affiliate links (MM003). Repurpose CONTENT_FARM posts. AI_INFLUENCER personas each run a Substack. Cross-recommend between own Substacks for compounding growth. Built-in discovery = free organic subscribers.
SYN001,PORTFOLIO_FLYWHEEL,"MM019,MM021,MM002",Portfolio app builder + personal brand SEO + info products,95,Apps become case studies → content → courses → consulting backend. 1 app = 4 revenue touchpoints,App developers creators 25-55,TRUE,,Stack: Build 30-app portfolio while documenting journey. Each app = blog post + YouTube tutorial + course template + consulting proof. $185k/mo apps + $17-32k/mo content/consulting = $202-217k total. ROI $1416-2666/hr. Apps provide infinite case studies at zero marginal cost. Personal brand warms ALL leads. 76% high-performing SaaS have 3+ streams - this provides 4 naturally.
SYN002,CONTENT_CASCADE_REPURPOSING,"MM006,CH068,CH012,MM003,MM002",Content farm + Medium + Substack + affiliates + info products,97,1 pillar piece → 6 platform cascade with monetization at each layer. 4.7-12.2x multiplier,All audiences 18-55,TRUE,,Stack: Create 1 deep research piece (4-6hrs) → cascade through Twitter thread (15min) → Medium article ($50-200/mo Partner Program) → Substack cross-post (paid sub funnel) → YouTube video (ads + affiliate) → newsletter (product CTA) → Gumroad PDF ($7-27). Total time 7.5hrs for 6 revenue touchpoints. Conservative ROI: $95-612 per piece vs $20-100 single platform = 4.7-6.1x. Organizations achieve 67% higher engagement + 89% better ROI with systematic repurposing.
SYN003,APP_TO_CONSULTING_ARBITRAGE,"MM001,MM005,AI001",App factory + agency services + niche expert persona,93,Apps are lead gen + case studies for 10-50x higher LTV consulting backend,B2B app users business owners 25-50,FALSE,,Stack: Free app download → business email collection → in-app survey 'Want help implementing?' → 1-3% convert to consulting leads → $500-2k per engagement. 1000 users → 10-30 warm consulting leads → $5-60k consulting revenue + $1.2-18k app subs = $6.2-78k total LTV vs $1.2-18k app-only = 5.1x multiplier. Use AI niche expert persona to warm leads. Target productivity/business apps (churches prayer programs $1.5-3k fitness trainers $500-2k AI implementation $2-5k). Consulting = 5-10 clients 2-5hrs each = sustainable.
SYN004,NEWSLETTER_APP_FUNNEL,"MM015,MM001,MM002",Newsletter + app factory + info products,90,Newsletter builds trust → free app lead magnet → Pro conversion → course backend,Newsletter subscribers app users 20-55,TRUE,,Stack: Free newsletter (50%+ open rate) → welcome email intro free app → drip campaign educates Pro features → 10-15% Pro conversion. At 5k subs: $1250/mo newsletter paid tier + $750/mo app Pro users + $416/mo info products + $416/mo consulting backend = $2832/mo vs $1250 newsletter-only = 2.26x multiplier. Newsletter builds trust WITHOUT selling. App provides value. Pro = obvious upgrade. Course teaches advanced. Consulting = natural next level. Each step helpful not salesy. CFP Land case study: 800 subs → app → 50%+ open rates.
SYN005,PLATFORM_ARBITRAGE_LIFECYCLE,MULTI_PLATFORM,TikTok Shop + Medium + Substack Notes + systematic repurposing,95,Exploit lifecycle arbitrage: early growth platforms = 10-35x better CAC. 1 content → 4 platform distribution,All niches 18-55,TRUE,,Stack: Create 1 Twitter thread (30min) → expand Medium article (30min) → cross-post Substack (5min) → film TikTok video (45min) = 1hr50min total. TikTok Shop early growth (10-50% commissions $500-2k/mo ROI $62-250/hr) + Medium Partner Program ($3-15/article compound) + Substack Notes (pre-monetization organic growth) + Twitter (engagement baseline). Conservative: $27-561 per piece vs $5-30 single platform = 5.4-18.7x multiplier. Threads launching monetization = first-mover advantage. Diversification = if 1 platform dies 3 remain.
SYN006,BUILD_ONCE_MONETIZE_4_WAYS,"MM001,MM017,MM002,MM005",App factory + clipper network + info products + agency services,92,Every app = 4 simultaneous revenue streams. Not just IAP - launch course agency backend,App developers aspiring builders B2B 20-55,TRUE,,Stack: Build app → Layer 1 IAP ($100-1500/mo) + Layer 2 clipper network launch ($6k = 43k downloads = $0.14/download vs $2-5 paid UA = 10-35x better CAC) + Layer 3 'How I Built' course ($500-2500/mo) + Layer 4 done-for-you service ($2-10k/project 2-5/yr = $333-4166/mo amortized). Clipper network = ambassador marketing (legal FTC compliant) not buying installs. Course market niche down: not 'build app' but 'build prayer app for churches' (specific TAM). Agency = fork same codebase rebrand.
SYN007,AI_PERSONA_ECOSYSTEM_MATRIX,"MM009,MM006,MM002,MM003",AI influencer + content farm + info products + affiliates,94,4 AI personas cross-promote in closed-loop attention economy. Quote tweets = algorithmic arbitrage,Multi-niche 18-55,TRUE,,Stack: Seraphina findom (X LoyalFans tributes) + Coach Max fitness (X TikTok affiliate coaching) + Grace faith (X IG courses Patreon) + The Stack tech (X YouTube affiliate courses). Each persona cross-promotes others naturally. Quote tweets between personas = mutual follower priority distribution (algorithm arbitrage). 4 personas $500/mo = $2k baseline. Cross-pollination +30-50% followers = $2.6-3k. Products add $3-5k = $5.6-8k total vs $2k = 2.8-4x multiplier. Each persona produces Content Farm content: Seraphina CF005 CF008 Max CF007 Grace CF007 Stack CF009. 4 personas 3 posts/day = 12 posts repurposed 2-3 CF accounts = 24-36 posts/day. Batch create: 2hrs/week images Scheduling 1hr Engagement 1hr = 5-6hrs/week for $5.6-8k/mo = $233-333/hr ROI.
