method_id,method_name,synergy_partners,synergy_type,synergy_score,cross_sell_products,shared_audience,automation_combo,revenue_multiplier,notes
SYN029,HARD_PAYWALL_MEGA_STACK_25X,"SYN009,SYN012,SYN013,MM001",Combined revenue multiplier: hard paywall (8x) x onboarding-is-product (1.6x ARPU lift) x annual-first pricing (2x LTV) = 25.6x vs naive freemium. The single highest revenue lever across all 1250 alpha entries. Zero capital required. Code already exists (MEGA_075). Applies to every app in Lock App portfolio.,98,Stack: SYN009 hard paywall + SYN012 onboarding optimization + SYN013 annual-first pricing applied simultaneously to every APP_FACTORY app. Implementation: 1-2 days per app. Hard paywall captures 1.7% of users at 8x ARPU. Onboarding personalization quiz adds 60% ARPU (Mojo case study). Annual-first with savings badge adds 2x LTV (FitnessAI case study). RevenueCat A/B tests 3 variants per app. This is NOT incremental optimization. This is 25.6x revenue multiplication for zero capital spend. biomaxx has paywall code shipped (MEGA_075). PrayerLock 85% complete. Every Lock App gets this stack on Day 1. Portfolio optimization analysis ranks this as the single most validated revenue lever in the entire alpha database.,Subscription app users all niches 18-55,TRUE,,Stack: Apply SYN009+SYN012+SYN013 to every app simultaneously. 25.6x multiplier vs freemium. biomaxx code ready. PrayerLock near-ready. Zero capital. 1-2 days per app. RevenueCat A/B testing mandatory.
SYN030,BARBELL_PORTFOLIO_STRATEGY,"MM046,MM025,MM001,SYN008,MM021",Optimal pre-revenue portfolio construction: 60% time on safe immediate revenue (digital products + content cascade + newsletter) + 30% time on asymmetric upside (Lock Apps + X Launch) + 10% time on zero-cost compounding (Reddit GEO + personal brand + FB Reels). Kelly Criterion validated allocation.,95,Stack: Portfolio optimization analysis reveals concentrated barbell beats parallel 11-lane execution at $200-$1500 capital level. Left barbell (safe): digital products $0 cost 60% success probability + content cascade 70% success + newsletter 35% success. Right barbell (asymmetric): Lock Apps 40% success but 25.6x revenue multiplier + X Launch 20% success but $10K MRR proven path. Background (free compounding): Reddit GEO compounds forever + personal brand amplifies everything (synergy 100) + FB Reels $4.40/1K views arbitrage. Kelly optimal: 40% digital products + 32.5% Lock Apps + 27.5% everything else. Bandwidth constraint: 3 methods executed well > 11 methods executed poorly. Sequential deployment with data feedback > parallel deployment without data. Exception: zero-cost activities always run in background.,All audiences,TRUE,,Stack: Barbell strategy for pre-revenue solopreneur. Safe side generates cash flow in 1-14 days. Asymmetric side provides 25x upside potential. Background activities compound at zero cost. Revenue from safe side funds asymmetric bets. Data from early revenue informs capital reallocation. Monthly rebalance based on actual numbers.
SYN031,OWNED_CHANNEL_FLOOR_X_PLATFORM_HEDGE,"MM007,MM015,MM046,MM025,SYN002,SYN011",Algorithm-resistant revenue floor: email outbound + newsletter + digital products + content cascade + entity SEO. Portfolio correlation analysis shows this cluster has 0.16 overall correlation (lowest in portfolio). Survives any single platform event including TikTok ban + Apple policy change + AI content penalty simultaneously.,94,"Stack: Owned channel cluster provides portfolio floor above $134.23/mo burn rate under ALL stress scenarios including maximum drawdown. Components: cold email (owned infrastructure), newsletter (owned list), digital products (multi-marketplace), content cascade (6 platforms), entity SEO (AI citation compounds). Platform correlation 0.16 = nearly independent. Revenue floor estimate: $200-$2000/mo even under maximum stress (all platforms simultaneously disrupted). Diversification rules: no method >40% revenue, no platform >50% traffic, owned channels >30% revenue. Portfolio beta for this cluster: 0.12 vs 0.45 for full portfolio. Build this floor FIRST then add high-beta positions. Insurance against catastrophic platform risk.",All audiences,TRUE,,Stack: Algorithm-proof revenue floor. Email + newsletter + digital products + SEO = survive anything. Build first deploy fast. $0 capital required. Correlation 0.16 with rest of portfolio. Revenue floor exceeds monthly burn under all stress tests.
SYN032,FB_REELS_RPM_ARBITRAGE_X_CONTENT_CASCADE,"SYN005,SYN002,MM006,CF001-CF013",**CORRECTION Day 5: FB Reels $0.02-$0.60/1K actual NOT $4.40. Still 2-10x YouTube Shorts but not 4-440x.** Cross-posting identical content to FB Reels = 2-10x revenue multiplier for ZERO additional effort. CMP transition deadline Aug 31 2026 = time-limited window. ALL short-form content should go FB Reels FIRST.,65,"**CORRECTED Day 5 REFLECTION:** FB Reels RPM debunked from $4.40/1K to $0.02-$0.60/1K average. Original claims were outlier data points not sustainable averages. Still 2-10x YouTube Shorts ($0.01-$0.06) and comparable to TikTok ($0.40-$1.00). Cross-posting still free so positive ROI but no longer the 4-440x arbitrage originally claimed. Demoted from 97 to 65 synergy score. Conservative revised: 10K views/week = $2-$60/mo (was $176). Not a primary revenue channel. Background activity only. CMP transition Aug 31 2026 may improve payouts. Do not prioritize content creation FOR Facebook specifically.",FB users 25-55 faith fitness motivation,TRUE,,Stack: Cross-post short-form to FB Reels as BACKGROUND activity. 2-10x YT Shorts RPM. Zero additional effort makes it positive ROI. NOT a primary revenue channel. Revised conservative $2-60/mo for 10K weekly views.
SYN033,TWO_CHANNEL_FOCUS_REVENUE_ENGINE,"MM007,MM046,MM001,MM015",Cody Schneider $1M ARR with ONLY 2 channels (paid ads + cold email). Contradicts 11-lane parallel. Optimal: master 2-3 revenue channels then add more. For PRINTMAXX: cold email + digital products as primary then add content + apps. Bandwidth constraint: 3 methods executed well > 11 executed poorly.,96,"Stack: Based on ALPHA972901 (Cody Schneider $1M ARR 2 channels) + ALPHA972902 (Instantly benchmark 3.43% reply <50 recipients 5.8%). Revenue-first approach: CHANNEL 1 cold email (legal + healthcare verticals 7-10% reply rate) + CHANNEL 2 digital products (Gumroad/Whop $0 startup 60% success probability). These two channels share zero infrastructure overlap = true diversification. Cold email generates immediate cash flow ($500-2K/client). Digital products compound over time (each sale = email capture = newsletter growth). Add CHANNEL 3 (Lock Apps) once channels 1-2 generate $2K+/mo. Background activities (Reddit GEO content posting) always running at zero cost. Resolves tension between parallel execution and focus by creating a 2+1+background model.",All B2B verticals + info seekers,TRUE,,Stack: 2-channel primary focus (cold email + digital products) + 1 asymmetric bet (Lock Apps) + background activities (Reddit GEO content). Master the primary channels first. $1M ARR proven with just 2 channels. Add channels only after primary ones generate $2K+/mo.
SYN034,HYBRID_MONETIZATION_SUBSCRIPTION_PLUS_LIFETIME,"MM001,MM046,SYN029",43% of top apps now offer hybrid monetization (subscription + lifetime purchase). Subscription fatigue real: avg consumer has 12 subscriptions up from 4.7. Lifetime purchase option captures subscription-resistant segment (20-30% of market). A/B test both for Lock Apps.,93,"Stack: Based on ALPHA972912 (subscription fatigue 43% hybrid monetization) + SYN029 (hard paywall 25.6x multiplier). Hybrid approach: PRIMARY = annual subscription ($29.99-59.99/yr per SYN029 pricing). SECONDARY = lifetime purchase ($99-149 one-time). RevenueCat supports both offerings in A/B test. Lifetime purchase captures: (1) subscription-resistant users who hate recurring charges (2) high-intent users willing to pay more upfront (3) users who do math and prefer lifetime if retention >2 years. Risk: lifetime cannibalizes subscription revenue. Mitigation: hide lifetime option behind 2+ paywall dismissals (show only to users who reject subscription twice). Price lifetime at 2.5-3x annual to maintain LTV parity. Expected result: 10-15% take lifetime option increasing total conversion 5-8%. Net revenue positive because these users would have churned or never converted under subscription-only.",Subscription-resistant app users,TRUE,,Stack: Hybrid subscription + lifetime for Lock Apps. Annual subscription primary. Lifetime option shown after 2+ subscription rejections. Price lifetime at 2.5-3x annual. RevenueCat A/B test required. Expected 5-8% total conversion increase from capturing subscription-resistant segment.
SYN035,AI_COLD_EMAIL_QUALITY_STACK,"MM007,MM051,SYN010",AI cold email now table stakes: 80% of research automated by AI agents. Differentiation = quality signals not volume. Instantly <50 recipients = 5.8% reply (69% higher than 100+ list). Smartlead 2.7x reply rate. Engagement quality > send volume for 2026.,94,"Stack: Based on ALPHA972911 (AI agents 80% research) + ALPHA972902 (Instantly <50 = 5.8% reply) + ALPHA972920 (Smartlead 2.7x Festi 3x). The 2026 cold email meta has shifted: AI handles research/personalization making volume approaches commodity. Quality signals differentiate: (1) Ultra-targeted lists <50 prospects (69% higher reply) (2) Deep personalization per ALPHA972911 (3) Multi-channel orchestration (LinkedIn + email + voice per SYN010) (4) Vertical specialization (legal 10% healthcare 7-8% vs generic 3.43%). Implementation: Clay for enrichment + Smartlead for delivery + AI agent for research. Budget: $310/mo Tier 1 stack. Expected: 8-12% reply rate on legal vertical (2-3x industry average). Compounds with SYN033 (cold email as primary revenue channel). Revenue per campaign: $2K-10K depending on deal size.",B2B legal healthcare real estate verticals,TRUE,,Stack: Quality-first cold email. <50 prospects per campaign. AI research agent + Clay enrichment + Smartlead delivery. Vertical specialization required. Legal 10% healthcare 7-8% reply rates. $310/mo Tier 1 budget. 2-3x industry average reply expected.
SYN036,ANTI_GURU_CONTENT_MOAT,"CF001-CF013,AI001,MM002,MM015",Anti-guru content angle gets 10x engagement per @eptwts. Calling out circular selling (selling courses about selling courses) resonates because audience is tired of guru BS. PRINTMAXXER voice naturally anti-guru. Authentic build-in-public > polished guru content.,88,"Stack: Based on ALPHA972909 (@eptwts anti-guru 10x engagement) + existing PRINTMAXXER voice (copy-style.md). The anti-guru angle is a CONTENT MOAT because: (1) It's authentic - we actually build things not just teach (2) It triggers engagement - people love seeing gurus called out (3) It differentiates from 95% of MMO content (4) It builds trust for product launches. Implementation: Every content piece includes subtle or explicit anti-guru framing. Examples: 'here are my actual numbers not some guru screenshot' or 'I built this in 14 days not in a $997 course'. Cross-pollination: anti-guru content on X (10x engagement) -> builds trust -> newsletter signups -> digital product sales (because we proved we build not just teach) -> app installs (because app is the proof). Compounds with SYN033 (2-channel focus generates real results to share).",MMO audience tired of gurus 18-45,TRUE,,Stack: Anti-guru content positioning across all channels. Authentic build-in-public > polished guru content. 10x engagement multiplier. Trust compounds into product sales. PRINTMAXXER voice is naturally anti-guru. Every piece shows real numbers not guru screenshots.
