method_id,method_name,synergy_partners,synergy_type,synergy_score,cross_sell_products,shared_audience,automation_combo,revenue_multiplier,notes
SYN008,REDDIT_GEO_DISTRIBUTION,ALL_METHODS,Reddit engagement + AI citation + GEO visibility across all methods,95,Reddit posts get cited by ChatGPT Claude Perplexity (14-38% of AI outputs). Free GEO visibility for every method.,All audiences 18-55,TRUE,,Stack: Post genuinely in niche subreddits (r/Christianity r/Fitness r/SideProject r/coldemail r/AppBusiness). Reddit = #2 Google traffic source. 450% AI citation growth. Every helpful Reddit post = potential AI citation = free organic traffic. No cost. Compounds over time. r/SideProject for app launches. r/Christianity for PrayerLock. r/Fitness for WalkToUnlock. r/coldemail for outbound credibility. Value-first not promotional. 30min/day Reddit engagement = multiplicative GEO benefit across all methods.
SYN009,HARD_PAYWALL_REVENUE_MULTIPLIER,"MM001,MM018,MM019",Hard paywall + onboarding optimization + RevenueCat A/B testing,98,Hard paywalls during onboarding = 8x revenue vs freemium. 80% of conversions happen during onboarding flow.,App users all niches 18-55,TRUE,,Stack: Implement hard paywall (appears during onboarding) across ALL APP_FACTORY apps. 8x revenue vs soft paywall proven. Only 1.7% users convert to paid BUT hard paywall captures them at peak motivation. Hybrid monetization (IAP + subs + rewarded ads) used by 60% of top apps. RevenueCat enables paywall A/B testing (test 3 variants: pricing anchoring feature gating trial length). Combined with excellent onboarding (3-5 screens max value demo): 8x baseline app revenue. Apply to biomaxx PrayerLock WalkToUnlock StudyLock.
SYN010,AI_PERSONALIZED_MULTICHANNEL_OUTBOUND,"MM007,MM004,AI001",AI cold email + LinkedIn voice + multi-channel orchestration,93,AI personalization = 35% reply rate (7x traditional). LinkedIn voice msgs = 18% reply. Multi-channel stacking = multiplicative effect.,B2B decision-makers 30-55,TRUE,,Stack: AI writes personalized 45-word emails (35% reply vs 3.43% traditional = 7x). LinkedIn voice messages add 18% reply rate channel. Phone VA follow-up closes. 0.1% Gmail complaint threshold (halved from 0.3%) means infrastructure IS the game. Target legal services first (10% reply = best vertical). Avoid software vertical (<1% reply = worst). Multi-channel orchestration: email Day 0 + LinkedIn Day 2 + phone Day 5. Each channel reinforces others.
SYN011,ENTITY_SEO_AGENT_READINESS,ALL_METHODS,Entity-based SEO + un-generatable content + AI crawler optimization,96,Build interactive tools calculators proprietary datasets that AI cant replicate. Entity SEO replaces keywords. AI crawlers = 1/3 of organic traffic.,All audiences,TRUE,,"Stack: Zero-click SEO crisis (58% no clicks). AI Overviews crash CTR 61%. Entity-based SEO replaces keyword-based optimization. Build content AI agents NEED but cant generate: interactive tools (ROI calculators stack generators), proprietary datasets (benchmarks surveys), structured comparison tables. Fast-loading plain-text structured content preferred by AI crawlers. JSON-LD schema mandatory. FAQ sections optimized for AI parsing. Every PRINTMAXX method gets un-generatable content asset: APP_FACTORY = app comparison tool, COLD_OUTBOUND = deliverability checker, NEWSLETTER = niche analyzer."
SYN012,ONBOARDING_IS_PRODUCT,"MM001,MM018,SYN009",Onboarding flow = the product experience. Hard paywall during onboarding captures peak motivation. Pre-paywall onboarding delivers enough value to justify purchase.,97,App onboarding that demonstrates value BEFORE paywall. Mojo 60% ARPU lift. FitnessAI 2x conversion with pre-onboarding assessment. 3-5 screens max value demo then paywall.,App users all niches 18-55,TRUE,,Stack: Treat onboarding as the product demo not a signup form. Pre-paywall: personalization quiz (name goals schedule) + value preview (show what they get) + social proof (X users improved Y%). THEN hard paywall at peak motivation. Mojo case study: 60% ARPU increase from onboarding optimization alone. FitnessAI: pre-onboarding fitness assessment doubles trial-to-paid. Animated paywalls 2.9x (ALPHA032). Personalized paywalls +17% (ALPHA035). Apply to ALL APP_FACTORY apps: biomaxx (health goals quiz) PrayerLock (prayer commitment screen) WalkToUnlock (step goal setting) StudyLock (study schedule). RevenueCat A/B test 3 onboarding variants per app. Compounds with SYN009 hard paywall.
SYN013,ANNUAL_FIRST_PRICING_PSYCHOLOGY,"MM001,MM018",Present annual plan first with monthly as comparison anchor. Annual-first framing increases LTV 40-60%. Savings percentage prominently displayed.,92,Annual subscription presented as default with monthly shown as expensive alternative. Psychology: loss aversion + anchoring + commitment.,Subscription app users 25-45,TRUE,,Stack: Default to annual plan display. Show monthly price CROSSED OUT or as per-month of annual. Savings badge (Save 58%). Most popular tag on annual. FitnessAI annual-first = 2x LTV vs monthly-first. Calm shows $69.99/yr ($5.83/mo) vs $14.99/mo = 61% savings. Headspace annual default. Apply to ALL PRINTMAXX apps with RevenueCat paywall experiments. Test: annual-first vs monthly-first vs lifetime option. Compounds with SYN009 (hard paywall) and SYN012 (onboarding-is-product).
SYN014,COMPETITOR_GAP_ARBITRAGE_PRAYERLOCK,"MM001,AI005,N001",PrayerLock has ZERO direct competitors in prayer-lock-screen niche. Hallow ($1M/mo) validates prayer app market but is meditation-focused not accountability-focused. Gap: accountability + community + lock mechanism.,90,PrayerLock occupies uncontested market position. Hallow is closest at $1M/mo but focuses on guided meditation/prayer not accountability. Pray.com is content-focused. No app locks screen until prayer completed. Differentiation: forced accountability (lock mechanism) + streak gamification + community prayers + church group features. First-mover advantage in prayer accountability niche. ASO: prayer lock prayer accountability prayer timer prayer habit all uncontested keywords. Cross-sell: faith content farm (CF007 motivation) + AI persona Grace (AI005) + faith newsletter. Apply SYN009 hard paywall + SYN012 onboarding-is-product + SYN013 annual-first pricing.,Faith community 25-55,TRUE,,Stack: Build PrayerLock with hard paywall during onboarding prayer commitment screen. Annual-first pricing $49.99/yr ($4.17/mo) vs $6.99/mo. Grace AI persona promotes on faith accounts. Newsletter cross-sell. Skool faith community. Zero direct competition = first-mover pricing power. Hallow at $1M/mo proves TAM. Target church groups for viral loop (group prayers). Apple Search Ads on prayer keywords (low CPC uncontested).
SYN015,PRAYERLOCK_CATEGORY_OF_ONE,"MM001,AI005,N001,CF007",PrayerLock is category-of-one: behavior enforcement not content consumption. Hallow ($51.4M/yr) and Pray.com ($11M/yr) validate TAM but compete on content library. PrayerLock competes on accountability mechanism. Zero overlap.,96,Spiritual wellness apps $2.16B (2024) -> $7.31B (2033) at 14.6% CAGR. Hallow raised $157M focuses on guided meditation. Pray.com 14M downloads podcast pivot. Neither enforces behavior. PrayerLock locks screen until prayer completed. Category-of-one positioning: dont compete with Hallow on content compete on accountability. ASO keywords uncontested: prayer lock prayer accountability prayer timer. Church group viral loop (group prayers shared accountability). Stack: SYN009 hard paywall + SYN012 onboarding (prayer commitment screen) + SYN013 annual-first ($29.99/yr). Grace AI persona (AI005) promotes. Faith content farm (CF007) feeds traffic. Newsletter cross-sell.,Faith community 25-55,TRUE,,Stack: PrayerLock occupies accountability niche no other app touches. Hallow proves market ($51.4M/yr revenue). Position as the app that makes you pray not just gives you prayers. Church group feature = built-in viral loop. Apple Search Ads on prayer keywords (low CPC zero competition). Cross-sell faith newsletter and Skool community. Grace AI persona drives awareness.
SYN016,SWEATCOIN_REFUGEE_CAPTURE,"MM001,N002","Sweatcoin collapsing: downloads -60% YoY, SWEAT token -83%, OKX delisted Dec 2025. 170M registered users looking for alternatives. WalkToUnlock captures this vacuum with simpler value prop (phone lock not crypto).",88,Sweatcoin $20M revenue declining rapidly. Token economy failed. Users want walking motivation without crypto complexity. WalkToUnlock differentiation: hard accountability (phone locked until steps met) vs Sweatcoin soft rewards (earn tokens maybe redeem someday). Cross-platform (Android + iOS) while competitors fragment: WalkLock iOS-only StepBloc iOS-only StepLock Android-only. Clinical backing: JAMA 2019 7500 steps 50-70% mortality reduction. Stack: SYN009 hard paywall + SYN012 onboarding (step goal assessment) + SYN013 annual-first ($39.99/yr). ASO: target sweatcoin alternative walking motivation step counter keywords.,Fitness enthusiasts 18-45,TRUE,,Stack: WalkToUnlock captures Sweatcoin refugees (170M registered users in decline). Position as simpler walking motivation without crypto. Cross-platform advantage over fragmented competitors. Clinical backing (JAMA study) adds credibility. Hard paywall during step goal onboarding. Fitness content farm feeds traffic. AI fitness persona promotes.
SYN017,FOREST_SUBSCRIPTION_VALIDATION,"MM001,MM018",Forest Plus subscription Dec 2025 validates recurring revenue for focus/lock apps. Forest $100K/mo 44M downloads 11-person bootstrapped team. Proves focus app category supports premium subscriptions not just one-time purchase.,91,Forest launched Forest Plus subscription tier Dec 2025 after years of one-time purchase model. This validates: users will pay recurring for focus apps. 44M downloads proves massive TAM. $100K/mo revenue with 11 people = highly profitable. Applies to ALL PRINTMAXX lock apps: PrayerLock StudyLock WalkToUnlock. Key insight: Forests shift from one-time to subscription proves the market accepts recurring billing for behavior-change apps. Our hard paywall approach (SYN009) is even MORE validated. Stack: Apply same subscription model but with hard paywall (Forest still offers free tier with limits). Our approach = higher ARPU per user.,App users all categories 18-45,TRUE,,Stack: Forest Plus validates subscription model for focus apps. Apply to all PRINTMAXX apps with HIGHER monetization (hard paywall vs Forests freemium). RevenueCat A/B test against Forest-style limited free tier. 44M downloads proves category demand. Annual-first pricing (SYN013). Focus on what Forest doesnt do: phone locking mechanism hard accountability streak consequences.
SYN018,REDDIT_GEO_NEWSLETTER_APP_CASCADE,ALL,"Reddit posts feed AI citations (Perplexity 3.2M 46.7%). AI citations drive discovery. Discovery drives newsletter signups (Beehiiv 67% via recommendations). Newsletter drives app installs (15%+ of list). App installs convert to subscriptions (28-40% with hard paywall). Full cascade: one Reddit post can generate $30-3,750 in revenue.",97,Stack: Reddit post (value-first 90/10 rule) -> Google indexes -> AI models cite -> user discovers via AI search -> clicks to landing page -> email capture (20-30% rate) -> Beehiiv welcome sequence (4 emails value-first) -> app install CTA email 3 -> onboarding -> hard paywall -> subscription. 24 content pieces per week from 3 Reddit posts (8 outputs per cascade). Per-niche subreddit strategy: faith (r/Christianity r/TrueChristian r/Prayer r/nosurf) fitness (r/loseit r/getdisciplined r/walking r/nosurf) tech (r/SideProject r/indiehackers r/startups). Beehiiv monetization stack: ad network + boosts ($1-3/sub) + sponsored posts + app CTAs + Gumroad links. Compounds with SYN008 (Reddit GEO) SYN009 (hard paywall) SYN011 (entity SEO) SYN012 (onboarding-is-product).,All audiences 18-55,TRUE,,Stack: Full revenue cascade from free Reddit posts to paid app subscriptions. Reddit warmup 14 days then 3 posts/week across 3 niches. Each post becomes 8 content pieces. Newsletter grows via Recommendations (67%) + Boosts (earn $1-3) + organic. App installs from email at 15%+ conversion. Hard paywall at 28-40% conversion. Revenue compounds across all channels.
SYN019,CROSS_NICHE_REDDIT_CONTENT_MULTIPLICATION,"MM006,MM015,ALL",Same core insight posted to different subreddits per niche. Phone lock concept works across r/Christianity (prayer) r/loseit (walking) r/getdisciplined (study) r/nosurf (general). 3 niches x 8-10 subreddits = 24-30 touchpoints per content cycle.,88,Stack: One content concept reframed for multiple niches and subreddits. Example: phone lock until goal met -> faith (prayer before phone) fitness (walk before phone) study (focus before phone) general (digital minimalism). Each subreddit seeds different AI citations for different query categories. Content cascade: 3 core posts -> 24 content pieces per week. Cross-subreddit overlap (r/nosurf serves all niches). Engagement threads generate 5-6 figure views. Reddit B2B CPC $0.50-2 vs LinkedIn $8-10+ for paid amplification. Tools: MediaFast SubredditSignals GummySearch for subreddit selection.,All audiences 18-55,TRUE,,Stack: Multiply content reach by adapting same core insight across niches. 3 Reddit accounts (1 per niche) each posting to 8-10 subreddits. Cross-niche concept: behavior enforcement via phone lock. Each niche account maintains separate identity and warmup. Content cascade produces 8 outputs per post. Scale to 15 posts/week across all niches by Month 2.
SYN020,LOCK_APP_PORTFOLIO_MOAT,"MM001,MM002,ALL",Lock app pattern creates reusable infrastructure across all niches. Same onboarding paywall analytics lock mechanism built once replicated across PrayerLock WalkToUnlock StudyLock SleepLock FastLock etc. First app 14 days subsequent apps 7 days. Cross-sell between apps. Lock apps becomes owned category.,94,"Stack: The Lock app pattern is the PRINTMAXX competitive moat. Every app follows same formula: lock phone until positive behavior completed. Shared components: onboarding framework (6 screens), RevenueCat paywall, Mixpanel analytics, phone lock mechanism, streak gamification, push notifications, App Store listing template. First app = 14 days build. Second = 10 days. Third+ = 7 days (shared infra). Cross-sell: PrayerLock user sees StudyLock recommendation. Lock apps becomes owned category with first-mover advantage. Content multiplication: one lock concept x 10 niches x 8 outputs = 80 content pieces. Revenue: 24 apps at $1-2K MRR each = $24-48K MRR portfolio. Kill losers at Month 3 scale winners with Facebook ads. Compounds with SYN009 SYN012 SYN015 SYN018 SYN019.",All audiences 18-55,TRUE,,Stack: Build once reuse everything. 14-day cycle for first app then 7-day for subsequent. Portfolio of 24 Lock apps in Year 1. Cross-sell network between apps. Category ownership. Content multiplication across niches. Revenue compounds with each launch. Connor Burd $185K/mo validates portfolio approach. Max $22K MRR 30 apps validates volume strategy.
SYN021,MULTI_PLATFORM_ALGORITHM_HEDGING,"CF001-CF013,AI001-AI008,MM006,MM015",Every platform algorithm shifting differently in 2026. TikTok follower-first + Oracle transition = volatile. Instagram sends-first. X 2-3x payouts. LinkedIn penalizes links -60%. YouTube Shorts RPM still low. No single platform safe. Multi-platform diversification MORE validated.,93,Stack: Algorithm hedging requires platform-specific content optimization not just cross-posting. TikTok: 1min+ video follower-first engagement velocity. Instagram: sendable content saves carousels. X: reply bait threads Premium targeting. LinkedIn: PDF carousels text-only no links. YouTube: Shorts for discovery long-form for revenue. Reddit: value-first GEO. Each platform serves different role: TikTok/YT=discovery Instagram=community X=revenue LinkedIn=B2B Reddit=SEO. Diversification rule: no platform >50% traffic no method >40% revenue. Content adaptation not duplication. Platform-specific formatting hooks and CTAs.,All audiences,TRUE,,Stack: Multi-platform hedge across 6+ platforms. Each serves different role. Content adapted per algorithm. Revenue diversified. No single platform dependency. TikTok volatile during Oracle transition = reduce allocation. X payouts increasing = increase allocation. Reddit free GEO = maintain. LinkedIn for cold outbound authority only.
SYN022,X_PREMIUM_REPLY_BAIT_FLYWHEEL,"MM006,CF003,AI001,MM015",X 2026 pays based on Premium subscriber engagement. PRINTMAXX reply bait strategy (withhold full method drive replies) directly maximizes Premium user interactions. Reply bait + Premium account + threads = maximum algorithm weight AND revenue. Copy-style.md voice EXACTLY what X rewards.,95,Stack: X monetization model pays 25% of Premium subscriber engagement. Premium users carry 10x algorithmic weight. PRINTMAXX copy style (consequence-first hooks + reply bait CTAs + specific numbers) is EXACTLY what drives Premium engagement. Reply bait ('reply ALGO for breakdown') generates: 1) algorithm signal (replies boost 10x) 2) lead qualification (warm leads) 3) revenue (Premium engagement $ directly). Threads weighted higher than single tweets. Articles eligible for $1M prize (1000+ words). Build-in-public content resonates with Premium audience (builders). Stack: SYN018 Reddit cascade feeds X content ideas. SYN019 cross-niche multiplies X content. SYN020 Lock app builds provide build-in-public material.,Tech builders solopreneurs 25-45,TRUE,,Stack: Our exact content style = X's ideal revenue driver. Reply bait formula generates algorithm signal + leads + direct revenue. Premium subscription required (10x impressions). 2K verified followers threshold. Articles for $1M prize. Threads > tweets. Build-in-public material from Lock app development. Cross-pollinate with Reddit content (same intel different format).
SYN023,MCP_APPS_X_APP_FACTORY_X_MICRO_SAAS,"MM050,MM001,MM028,MM027",MCP Apps enable tools inside AI conversations. Build niche MCP servers (faith community manager fitness tracker content scheduler) that live inside Claude/ChatGPT. Same code serves 3 revenue channels: MCP marketplace standalone app SaaS dashboard.,92,Stack: MM050 (MCP products) + MM001 (app factory for standalone) + MM028 (micro SaaS for recurring). MCP Apps launched Jan 2026 = UI rendering in conversation. Build vertical MCP servers for underserved niches. Revenue: freemium MCP + paid app + SaaS subscription. First-mover before marketplace gets crowded. W3C MCP-Identity April 2026 adds auth layer. Same underlying codebase serves all three channels. Compounds with SYN020 (Lock app infrastructure reuse) SYN025 (AI coding agents accelerate builds).,Solopreneurs developers 25-45,TRUE,,Stack: One codebase three revenue channels. MCP marketplace for AI-native users. Standalone app for traditional users. SaaS dashboard for power users. Build for faith/fitness/tech verticals. First-mover advantage critical. Revenue: $10-50/mo per user across channels.
SYN024,N8N_AUTOMATION_HUB_X_ALL_CONTENT_OUTBOUND,"MM006,MM007,MM015,CF001-CF013,AI001-AI008",n8n as self-hosted automation backbone connecting ALL content + outreach operations. Content generated -> n8n QA node -> approve -> fan out to 6+ platforms + email list + cold outreach. Self-hosted = no SaaS rate limits. MCP integration = AI agents trigger workflows directly.,96,Stack: n8n replaces Buffer + Publer + email scheduler + manual posting. Single automation hub. 169.6K GitHub stars. 1084 integration nodes. MCP Server Trigger Node enables AI agent -> n8n workflow triggering. Human-in-loop approval nodes for content QA. Self-hosted = no vendor lock no rate limits full control. Fair-code license (free self-host). AI agent nodes (LangChain-based) for autonomous multi-step workflows. Build: content posting workflow cold email workflow social monitoring workflow analytics aggregation workflow. All triggered by AI agents via MCP. Compounds with SYN018 (Reddit cascade automated) SYN022 (X posting automated) SYN023 (MCP integration).,All audiences,TRUE,,Stack: Central automation nervous system. n8n Docker self-hosted. Workflows: content generate -> QA -> approve -> post 6 platforms. Cold email: scrape -> enrich -> personalize -> send -> track. Social: monitor mentions -> alert -> respond. All AI-agent-triggered via MCP. Replaces $100-300/mo SaaS with free self-hosted. Scale without hitting API limits.
SYN025,AI_CODING_AGENT_PIPELINE_X_APP_FACTORY,"MM001,MM028,MM027",Devin $20/mo for boilerplate + Claude Code for complex logic + Windsurf for refactoring. Parallel builds: assign simple apps to Devin complex to Claude Code simultaneously. 14-day build cycle compresses to 7 days with agent delegation.,91,Stack: MM001 (app factory) + Devin ($20/mo) + Claude Code ($20-200/mo) + Expo. 92% US devs use AI coding daily (StackOverflow 2025). Vibe coding = Collins 2026 Word of Year. Devin handles: CRUD endpoints boilerplate components test writing simple features. Claude Code handles: architecture complex logic debugging optimization. Windsurf/Cascade for: multi-file refactoring migrations. Parallel builds: Devin on App A while Claude Code on App B. 2x app output per month = 2x potential revenue. Compounds with SYN020 (Lock app reusable infra + faster builds) SYN023 (MCP server builds).,All developers solopreneurs,TRUE,,Stack: AI coding agent team. Devin = junior dev ($20/mo). Claude Code = senior architect ($20-200/mo). Windsurf = refactoring specialist ($20/mo). Total: $60-240/mo for 3-developer equivalent. Parallel builds double APP_FACTORY output. 14-day -> 7-day build cycles. Revenue acceleration: more apps faster = more revenue sooner.
SYN026,DIGITAL_MINIMALISM_X_LOCK_APP_PORTFOLIO_X_GEN_Z,"MM001,CF007,MM006,ALL",Lock Apps = THE product for digital minimalism wave (18.2% CAGR to $19.44B). Gen Z primary audience (86% want to reduce 56% feel addicted). TikTok marketing irony: use addictive platform to sell the cure. SEO/GEO play across all digital detox queries.,97,"Stack: MM001 (app factory) + MM006 (content farm) + CF007 (motivation). Lock Apps ride three simultaneous markets: digital minimalism 18.2% CAGR, spiritual wellness 11.4% CAGR, fitness accountability $100B+. Gen Z = primary audience AND most addicted AND most motivated to change. TikTok organic + Reels for Gen Z (ironic phone addiction content). SEO longtails: phone lock app + digital minimalism app + reduce screen time + dumb phone alternative. GEO: AI assistants answering how to reduce screen time should cite Lock Apps. No competitor locks phones (all are trackers/timers/blockers). Retention moat: lock mechanism = cant abandon. Cross-sell between Lock Apps. Dumbphone market $10.6B = ADJACENT demand. Compounds with SYN020 SYN022 SYN018 all existing synergies.",Gen Z millennials 16-35,TRUE,,Stack: Lock App portfolio as digital minimalism solution. ASO target digital detox keywords. GEO target screen time AI queries. TikTok Gen Z marketing. Cross-sell portfolio. Retention built into mechanism. $19.44B TAM by 2032 for digital detox alone. Add spiritual wellness + fitness = triple TAM.
SYN027,MULTI_FAITH_LOCK_X_GEOGRAPHIC_EXPANSION,"MM001,N001_faith",PrayerLock currently Christian. Muslim 1.8B and Hindu 1.2B markets have ZERO behavior enforcement apps. Same lock mechanism with multi-faith modes. APAC fastest growing spiritual tech market. Geographic pricing arbitrage.,93,Stack: MM001 (app factory) + Lock App infrastructure (SYN020). PrayerLock core = phone lock until prayer. Christian mode exists. Muslim Salah mode: 5 daily prayer time locks (Fajr Dhuhr Asr Maghrib Isha) triggered by calculated prayer times. Hindu puja mode: daily practice reminders + lock. Jewish mode: Shacharit/Mincha/Maariv + Shabbat mode. Buddhist meditation lock. Same app core different prayer schedules = minimal engineering per faith. Muslim Pro has 100M+ downloads but is UTILITY only (prayer times Qibla). Zero behavior enforcement. APAC = fastest growth. India leading Spirit-Tech. Brazil Philippines Indonesia = deeply religious + digitally growing. Geographic pricing: $2.99/mo APAC vs $4.99/mo US. Compounds with SYN020 (reusable infra) SYN026 (digital minimalism wave).,All faiths globally 18-55,TRUE,,Stack: Multi-faith PrayerLock expansion. Muslim mode = 1.8B TAM. Hindu mode = 1.2B TAM. Same core app different prayer schedules. APAC geographic expansion with localized pricing. Institutional sales: church/mosque/temple plans. Muslim Pro competitor gap: utility not accountability.
SYN028,DIGITAL_PRODUCTS_BARRAGE_X_EMAIL_CAPTURE,"MM046,MM025,MM002,MM015",Digital products on Gumroad/Whop/Etsy capture buyer emails automatically. Each sale = newsletter subscriber. Newsletter drives repeat purchases + app installs. Highest Sharpe ratio position in entire portfolio (2.8). Zero capital. 1-7 days to first dollar.,96,Stack: List 5 Notion templates ($5-27) + 3 research PDFs ($7-27) + 1 comprehensive guide ($47) across Gumroad Whop Etsy. Each buyer email captured into Beehiiv welcome sequence. Email 3 = app install CTA. Email 5 = upsell to premium guide. Revenue multiplier 2.0x from email capture alone. Whop 5.7% fees vs Gumroad 13-14% = 7% margin advantage. Cross-list reduces platform risk to near zero. Compounds with SYN002 (content cascade produces the products) SYN004 (newsletter app funnel) SYN018 (Reddit drives traffic). Portfolio optimization analysis shows this is the MOST CAPITAL EFFICIENT position: $0 investment highest probability of revenue (60%) fastest time to first dollar (1-7 days).,Info seekers creators solopreneurs 20-55,TRUE,,Stack: Digital product barrage = portfolio's highest risk-adjusted return. Zero capital. Each sale = email capture = newsletter growth = app install funnel. Whop preferred for lower fees. Cross-list on 3 marketplaces. Kill criteria: <$50/mo after 60 days.
