idea_id,idea_name,problem,target_customer,pricing_estimate,competition,build_complexity,distribution,validation_notes,category,priority,applies_to_niches
MSAAS001,Paywall A/B Testing Dashboard,"App developers don't know optimal paywall design. RevenueCat Experiments is hidden in docs. 2.9x conversion boost proven but most devs don't test.","Indie app developers with 10k-100k MAU","$49-149/mo retainer + 10% revenue share on lift","Low - most devs don't offer this as service","Medium - integrates RevenueCat/Adapty APIs",Cold outreach to app devs on X + case study content,"ALPHA032 RevenueCat: 2.9x conversion boost from animated paywalls. ALPHA035: 17% lift from name personalization. Proven ROI.",API_WRAPPER,HIGH,"AI,Faith,Fitness"
MSAAS002,Intent Signal Tracker (Clay Alternative),"Clay is $250+/mo. Solopreneurs need job change + funding signals but can't afford enterprise pricing.","Solopreneurs and small sales teams under 10 people","$29-49/mo","Medium - Clay dominant but expensive","Medium - LinkedIn + Crunchbase API scraping","X content + cold email to indie founders","EDGE006: Clay pricing creates gap. Focus on 2 signals only: job change + funding. Simple wins.",API_WRAPPER,MEDIUM,AI
MSAAS003,Clipper Marketplace,"Clippers need streamers. Streamers need clippers. No efficient matching platform. r/TwitchClippers and r/YouTubeClippers show demand.","Streamers wanting promotion + clippers wanting deals","$9.99/mo creator + 15% transaction fee","Low - fragmented Reddit/Discord communities","Medium - marketplace platform with escrow","Reddit communities + X gaming accounts","EDGE034: Active subreddits prove demand. SRC118-119 clipper communities. MM010 STREAMER_CLIPS synergy.",NICHE_TOOL,MEDIUM,AI
MSAAS004,Church Management Lite,"Existing church software (Planning Center, Church Community Builder) is bloated and expensive. Small churches <200 members need simple tools.","Small churches under 200 members pastors and admins","$19-49/mo","Medium - big players ignore small churches","Medium - basic CRUD with member/event/giving","Facebook groups for small church pastors + cold email","LEDGER shows faith niche underserved. Vertical SaaS shrink pattern AFM006. $50-100/mo savings vs alternatives.",NICHE_TOOL,HIGH,Faith
MSAAS005,Trainer Client Management,"Personal trainers use spreadsheets or expensive apps. Need simple workout assignment + progress tracking + payments.","Independent personal trainers and coaches","$29-49/mo","Medium - Trainerize expensive Exercise.com complex","Easy - CRUD with workout builder + Stripe","IG fitness influencers + gym Facebook groups,"Cross-pollination with AI005 FITNESS_COACHES. Fitness apps need B2B companion tools.",NICHE_TOOL,HIGH,Fitness
MSAAS006,Sermon Clip Generator,"Pastors want to share sermon clips on social but editing is tedious. AI can auto-identify emotional peaks + add captions.","Churches and pastors wanting social media presence","$19-39/mo","Low - no focused solution exists","Medium - audio analysis + video editing automation","Church Facebook groups + pastor Twitter accounts,"Faith niche + STREAMER_CLIPS pattern MM010. Same tech as game clips adapted for sermons.",AI_ENHANCEMENT,HIGH,Faith
MSAAS007,AI Prayer Journal,"Daily devotion apps exist but lack AI personalization. Generate personalized prayers based on user's situation + scripture.","Christians wanting guided prayer practice","$9.99/mo subscription","Low - Hallow focuses meditation not journaling","Easy - GPT wrapper with prayer prompts + journal","Christian TikTok + church partnerships,"ALPHA001 IdeaBrowser signals faith apps. Cross with Loop Habit Tracker MIT repo. PrayerLock audience overlap.",AI_ENHANCEMENT,HIGH,Faith
MSAAS008,Nutrition Plan Generator,"Trainers spend hours creating meal plans. AI can generate based on client goals + restrictions + preferences.","Personal trainers and nutrition coaches","$29-49/mo","Medium - generic meal apps don't serve B2B","Medium - AI generation + PDF export + client sharing","Fitness influencer partnerships + trainer communities,"Pairs with MSAAS005 trainer management. Fitness B2B stack. Cross-sell opportunity.",AI_ENHANCEMENT,HIGH,Fitness
MSAAS009,Content Repurposing Tool,"Creators make long content but don't repurpose. Tool that takes 1 piece and creates 10+ variants for all platforms.","Content creators and solopreneurs","$29-79/mo","Medium - Repurpose.io exists but complex","Medium - AI rewriting + platform formatting","X content creators + Product Hunt launch,"ALPHA063 Reddit AMA repurposing. ALPHA065 atomic essay pipeline. One input many outputs.",AUTOMATION,MEDIUM,"AI,Faith,Fitness"
MSAAS010,App Store Screenshot Generator,"ASO screenshots are crucial but designing them is tedious. Generate 50+ A/B test variants in minutes.","Indie app developers testing ASO","$19-49/mo","Low - Canva templates don't solve this","Easy - template system + AI text generation","App dev X accounts + r/iOSProgramming,"ALPHA079 Apple 35 custom product pages. Screenshot A/B testing is underused. Simple automation.",AUTOMATION,MEDIUM,AI
MSAAS011,LinkedIn Voice Note CRM,"Voice notes get 3x response rate. Tool to record send and track voice note outreach at scale.","SDRs and founders doing outbound","$49-99/mo","Low - no focused solution","Medium - LinkedIn integration + audio recording + CRM","Sales Twitter + cold outreach to SDR managers,"EDGE026: LinkedIn voice notes 3x response. EDGE035: Multi-channel 2.5x reply. Clear problem.",AUTOMATION,HIGH,AI
MSAAS012,Review Response Automator,"App developers ignore reviews losing ASO signal. AI drafts personalized responses maintaining voice.","Indie app developers with 100+ reviews","$19-39/mo","Low - generic review tools don't help apps","Easy - App Store Connect API + GPT","App dev communities + ASO content,"ALPHA040: Review response boosts ASO. Developers know but don't do it. Automation solves.",AUTOMATION,MEDIUM,AI
MSAAS013,Testimonial Collection System,"FTC fake review ban means authentic testimonials are valuable. Most devs have no system to collect.","SaaS founders and app developers","$19-49/mo","Medium - Testimonial.to exists but complex","Easy - request flow + social proof widgets","Indie Hackers + SaaS Twitter,"EDGE037: FTC $53k/violation for fake reviews. Authentic testimonials become competitive advantage.",NICHE_TOOL,MEDIUM,AI
MSAAS014,Push Notification Optimizer,"1 push = 3x retention but 78% say irrelevant notifications are dealbreaker. AI optimizes timing + content.","App developers wanting to improve retention","$29-59/mo","Medium - OneSignal has features but complex","Medium - ML for timing + AI for content","App dev communities + retention content,"ALPHA042: Single push 3x retention. ALPHA043: 14-day inactivity = 40% churn. Clear value prop.",AI_ENHANCEMENT,HIGH,AI
MSAAS015,Workout Video Hosting,"Trainers need to host workout videos but YouTube is public. Simple private hosting + client access.","Personal trainers with video content","$19-39/mo","Low - generic video hosting not optimized","Easy - video hosting + access control","Trainer communities + fitness influencers,"Pairs with MSAAS005 + MSAAS008 for full trainer stack. Bundling opportunity.",NICHE_TOOL,MEDIUM,Fitness
MSAAS016,Senior App Template Kit,"Senior/boomer apps make $200k/mo (tai chi example). Template kit for building senior-friendly apps fast.","Developers wanting to build senior apps","$97-197 one-time or $29/mo","Low - no focused templates","Medium - UI kit + accessibility patterns","Developer communities + Product Hunt,"EDGE007: Senior apps massively underserved. ALPHA2C29A7 tai chi $200k/mo. Large fonts simple UI.",DATA_TOOL,HIGH,AI
MSAAS017,Islamic App Starter Kit,"6 Christian apps make $30k-$2M/mo. Islamic market 1.8B Muslims underserved. Template for Islamic apps.","Developers wanting Islamic market apps","$97-197 one-time or $29/mo","Low - Christian templates don't exist either","Medium - Islamic UI patterns + prayer API","Muslim developer communities + Ramadan timing,"EDGE008: Ramadan 30 days away. ALPHA9CA482 Christian app revenue proof. Timing is perfect.",DATA_TOOL,HIGH,Faith
MSAAS018,Study App Content Generator,"Study apps Gauth $1.2M/mo Knowunity $460k/mo use slideshows. Tool to generate educational slideshows at scale.","EdTech companies and education content creators","$49-99/mo","Low - no focused tool","Medium - AI content generation + slideshow formatting","EdTech Twitter + education communities,"EDGE009: Study niche easiest to crack. 50M views/mo from informational slideshows. No UGC needed.",AI_ENHANCEMENT,MEDIUM,AI
MSAAS019,TikTok Trend to App Validator,"appkittie shows app movers but doesn't correlate with TikTok trends. Tool that connects trending content to app opportunities.","Indie app developers doing market research","$29-49/mo","Low - no one connects these data sources","Medium - TikTok API + App Store data + matching logic","App dev X accounts + indie hacker communities,"ALPHA046: TikTok trend research for apps. Connor Burd $185k/mo from research workflow. Data integration.",DATA_TOOL,HIGH,AI
MSAAS020,Veo 3.1 Animation Wrapper,"Google Veo 3.1 animates static images to talking clips. Complex API needs simple UI for creators.","AI influencer creators and content makers","$29-49/mo","Low - no wrapper exists yet","Medium - Veo API integration + simple UI","AI influencer Twitter + creator communities,"EDGE004: Veo wrapper opportunity. ALPHA055 tool alpha. First mover advantage on new API.",API_WRAPPER,HIGH,AI
MSAAS021,Kling Dance Wrapper,"Kling Motion Control creates dance animations. Complex UI needs simplification for TikTok creators.","TikTok creators wanting AI dance content","$19-39/mo","Low - Kling UI is complex","Medium - Kling API + template dances","TikTok creator communities + AI content accounts,"EDGE005: Kling wrapper opportunity. ALPHA056 tool alpha. Dance is proven TikTok format.",API_WRAPPER,MEDIUM,AI
MSAAS022,Nano Banana Character Consistency Tool,"AI influencer creators struggle with consistent character across images. Nano Banana solves but needs better UX.","AI influencer creators needing character consistency","$29-49/mo","Low - fragmented workflow currently","Medium - Nano Banana integration + angle generation","AI influencer communities + content creator accounts,"EDGE045: Character consistency pain point. ALPHA053 Nano Banana tool. Pinterest reference workflow.",API_WRAPPER,MEDIUM,AI
MSAAS023,n8n Template Marketplace,"n8n is powerful but templates are scattered. Curated templates for common solopreneur workflows.","Solopreneurs using n8n for automation","$9-19/mo or $49 one-time per template","Low - no organized marketplace","Easy - template curation + documentation","n8n community + automation Twitter,"EDGE012: n8n replaces Zapier at 10x scale. Templates solve cold start problem. $20/mo server saves thousands.",DATA_TOOL,MEDIUM,AI
MSAAS024,Cold Email Sequence Analyzer,"Instantly and Apollo show metrics but don't diagnose why sequences fail. AI analyzes and suggests improvements.","SDRs and founders running cold outreach","$39-79/mo","Medium - tools have basic analytics","Medium - email parsing + AI analysis + suggestions","Sales Twitter + cold email communities,"ALPHA003: Elite cold email 10%+ reply. ALPHA059: Clay+Instantly+Apollo stack. Diagnosis gap.",AI_ENHANCEMENT,HIGH,AI
MSAAS025,Affiliate Link Manager for Apps,"iOS now allows external payment links. Developers need to manage affiliate links across app flows.","App developers using affiliate monetization","$19-39/mo","Low - no app-focused solution","Easy - link management + click tracking + A/B test","App dev communities + ASO content,"EDGE001: TikTok Shop affiliate in apps. iOS policy change. New monetization channel for apps.",NICHE_TOOL,MEDIUM,AI
MSAAS026,Gamification Engine SDK,"Duolingo 55% retention via gamification. SDK to add streaks points levels to any app without custom code.","App developers wanting gamification","$49-99/mo","Medium - Firebase has basics but limited","Hard - SDK development + dashboard","App dev communities + Product Hunt,"ALPHA038: Gamification 55% 7-day retention. EDGE050 Duolingo pattern. Most devs know but don't implement.",INTEGRATION,HIGH,AI
MSAAS027,RevenueCat Analytics Dashboard,"RevenueCat data is powerful but dashboard is basic. Better visualization + cohort analysis + predictions.","Subscription app developers with 1k+ subscribers","$29-59/mo","Low - RevenueCat dashboard is minimal","Medium - RevenueCat API + analytics visualization","App dev communities + subscription app accounts,"ALPHA071: RevenueCat Experiments. Developers want better analytics. Simple dashboard improvement.",DATA_TOOL,MEDIUM,AI
MSAAS028,Church Giving Analytics,"Churches use multiple giving platforms. Consolidated analytics showing giving patterns + donor insights.","Church administrators and pastors","$29-49/mo","Low - giving platforms don't cross-analyze","Medium - API integrations + analytics dashboard","Church administrator communities + pastor networks,"Faith niche. Pairs with MSAAS004 church management. Giving data is valuable for planning.",DATA_TOOL,MEDIUM,Faith
MSAAS029,Fitness Challenge Platform,"Izzy Samuel 25-day Pilates challenge viral. Platform to create and monetize fitness challenges.","Fitness influencers wanting to monetize challenges","$49-99/mo","Medium - generic course platforms exist","Medium - challenge structure + progress tracking + community","Fitness influencer partnerships + IG outreach,"APP_CLONE row 22: Izzy Samuel viral Jan 2026. Challenge format proven. Productize the trend.",NICHE_TOOL,HIGH,Fitness
MSAAS030,Onboarding Flow Builder,"77% drop apps in 3 days. Visual builder for mobile app onboarding flows with A/B testing.","App developers optimizing retention","$39-79/mo","Medium - Appcues expensive Userpilot complex","Hard - SDK + visual builder + analytics","App dev communities + retention content,"ALPHA037: 77% drop in 3 days. ALPHA039: DoorDash friction shift pattern. Onboarding is make or break.",NICHE_TOOL,HIGH,AI
MSAAS031,Prayer Request Manager,"Churches collect prayer requests but tracking is manual. Simple system for submission tracking and follow-up.","Churches and prayer ministries","$9-29/mo","Low - churches use spreadsheets","Easy - form builder + tracking + notifications","Church Facebook groups + pastor networks,"Faith niche vertical. Simple CRUD with church-specific features. Low competition.",NICHE_TOOL,MEDIUM,Faith
MSAAS032,Client Transformation Tracker,"Trainers want before/after proof but collection is messy. Systematic photo collection + timeline + sharing.","Personal trainers and transformation coaches","$19-39/mo","Low - trainers use phone photos","Easy - photo upload + timeline + client sharing","Trainer communities + fitness influencers,"Pairs with full trainer stack MSAAS005/008/015. Testimonial collection for fitness.",NICHE_TOOL,MEDIUM,Fitness
MSAAS033,Bulk App Localization Tool,"Apps that localize see 30%+ revenue boost. Most devs don't because translation is tedious. AI bulk translation.","Indie app developers wanting international markets","$29-49/mo or $2 per 1000 strings","Medium - generic translation expensive","Medium - AI translation + App Store format + validation","App dev communities + ASO content,"AFM004: Locale Adaptation method. ALPHA1E8576: India payment for quit gooning. International = untapped.",AUTOMATION,MEDIUM,AI
MSAAS034,Competitor Price Monitor for Apps,"Apps change pricing but monitoring is manual. Track competitor IAP changes and get alerts.","Indie app developers in competitive categories","$19-39/mo","Low - no focused app price tracker","Medium - App Store scraping + alerting","App dev communities + ASO accounts,"ALPHA pipeline uses visualping for web. Same concept for App Store. Competitive intel.",DATA_TOOL,MEDIUM,AI
MSAAS035,AI Workout Form Checker,"Users do exercises wrong. AI analyzes video and provides form feedback. Can be white-labeled to fitness apps.","Fitness app developers wanting form checking","$99-199/mo white-label or $9.99/mo consumer","Medium - Form.ai and others exist","Hard - computer vision + feedback system","Fitness app dev companies + B2B outreach,"High technical complexity but high value. $200k/mo fitness apps would pay for this.",AI_ENHANCEMENT,LOW,Fitness
MSAAS036,X Bookmark to Alpha Extractor,"Solopreneurs save X bookmarks but extraction is manual. Auto-extract actionable alpha from saved tweets.","Solopreneurs and researchers","$19-29/mo","Low - no focused tool","Medium - X API + AI extraction + categorization","Solopreneur Twitter + Product Hunt,"CLAUDE.md documents bookmark extraction workflow. Automate what we do manually.",AUTOMATION,MEDIUM,AI
MSAAS037,Longtail Page Generator,"Programmatic SEO requires thousands of pages. Tool to generate longtail pages from templates + data.","Content marketers and SEO practitioners","$49-99/mo","Medium - generic SEO tools exist","Medium - template system + data import + generation","SEO Twitter + content marketing communities,"ALPHA069: Programmatic SEO for apps. LEDGER has 300 longtail slugs. Automate generation.",AUTOMATION,MEDIUM,AI
MSAAS038,App Review to Feature Backlog,"App reviews contain feature requests but extracting them is tedious. AI categorizes and prioritizes requests.","App developers wanting user feedback analysis","$29-49/mo","Low - no focused solution","Easy - App Store API + NLP categorization","App dev communities + product Twitter,"AFM003: Review Mining method. Turn complaints into roadmap. Simple extraction.",AI_ENHANCEMENT,MEDIUM,AI
MSAAS039,Vision Board App with Accountability,"365 Buttons format viral. Daily check-in + vision board + accountability features.","Goal-setters and productivity enthusiasts","$4.99-9.99/mo subscription","Medium - generic vision board apps exist","Easy - image upload + daily checkin + streak tracking","Productivity TikTok + New Year content","APP_CLONE row 28: 365 Buttons viral Jan 2026. Systems not outcomes trend. Simple build.",NICHE_TOOL,HIGH,AI
MSAAS040,Multi-Account Social Poster,"@Jonnyvandel runs 200 accounts 600 posts/day. Tool to manage mass posting across accounts safely.","Content farm operators and agencies","$99-299/mo","Medium - Publer Buffer exist but limited accounts","Hard - proxy rotation + scheduling + analytics","Content farm operators + agency networks,"SWARM001 strategy requires multi-account management. High value for serious operators.",AUTOMATION,MEDIUM,AI
