account_id,account_name,handle,platform,niche,category,purpose,bio_snippet,status,priority,brand_file,notes
ACC001,PRINTMAXXER,@PRINTMAXXER,Twitter/X,Tech/Solopreneur,PERSONAL_BRAND,Building in public - 11 revenue streams in parallel,"building 11 revenue streams in parallel. $0 → ? shipping daily. apps, AI, content",NOT_CREATED,P1,PRINTMAXXER_BRAND_IDENTITY.md,Primary brand account. Terminal aesthetic. 5-6 posts/day.
ACC002,PRINTMAXXER,@PRINTMAXXER,Instagram,Tech/Solopreneur,PERSONAL_BRAND,Visual content - carousels and reels of building in public,"building 11 revenue streams from $0. shipping apps + AI + content daily. solopreneur.",NOT_CREATED,P2,PRINTMAXXER_BRAND_IDENTITY.md,3-4 posts/week. Terminal-styled carousel slides.
ACC003,PRINTMAXXER,@PRINTMAXXER,TikTok,Tech/Solopreneur,PERSONAL_BRAND,Short-form video content about building businesses,"building 11 businesses at once from $0. solo. no funding. daily updates.",NOT_CREATED,P2,PRINTMAXXER_BRAND_IDENTITY.md,1-2 posts/day. Screen recordings with voiceover.
ACC004,PRINTMAXXER,@PRINTMAXXER,LinkedIn,Tech/Solopreneur,PERSONAL_BRAND,Professional solopreneur content and cold outbound,"solo operator building parallel revenue streams | apps, AI content, automation",NOT_CREATED,P2,PRINTMAXXER_BRAND_IDENTITY.md,2-3 posts/week. More polished than Twitter.
ACC005,PRINTMAXXER,@PRINTMAXXER,YouTube,Tech/Solopreneur,PERSONAL_BRAND,Weekly videos - tool deep dives and method breakdowns,"building 11 internet revenue streams from $0 as a solo operator. no funding, no te",NOT_CREATED,P2,PRINTMAXXER_BRAND_IDENTITY.md,1 video/week minimum. No face cam required.
ACC006,PRINTMAXXER,@PRINTMAXXER,Reddit,Tech/Solopreneur,PERSONAL_BRAND,Community contribution and signal gathering,"solopreneur. building stuff. lurking for signal.",NOT_CREATED,P3,PRINTMAXXER_BRAND_IDENTITY.md,No self-promotion. Contribute to communities first.
ACC007,Goddess Aria,@GoddessAriaAI,Twitter/X,Findom/Adult,FINDOM,Luxury findom persona - cold elegant dominance,"Goddess Aria. AI-Generated Persona. 18+ Only. Not a real person. You don't deser",NOT_CREATED,P1,FINDOM_PERSONAS.md,Launch FIRST among findom personas. Simplest aesthetic.
ACC008,Goddess Aria,@GoddessAriaAI,Fanvue,Findom/Adult,FINDOM,Primary subscription platform - tiered content $19.99-$499.99/mo,"DISCLOSURE: Goddess Aria is a 100% AI-generated persona. I am not a real person.",NOT_CREATED,P1,FINDOM_PERSONAS.md,FREE to OBSIDIAN tiers. Fanvue allows AI explicitly.
ACC009,Goddess Aria,@GoddessAriaAI,Fansly,Findom/Adult,FINDOM,Secondary subscription platform - luxury findom content,"AI-GENERATED PERSONA. Not a real person. 18+ only. Goddess Aria. Luxury. Dominan",NOT_CREATED,P1,FINDOM_PERSONAS.md,Tiers from $19.99 to $499.99.
ACC010,Goddess Aria,@TheGoddessAria,Reddit,Findom/Adult,FINDOM,Community engagement in findom subreddits,"AI-generated findom persona. 18+. Not a real person. Luxury aesthetic. High stand",NOT_CREATED,P2,FINDOM_PERSONAS.md,u/GoddessAriaAI or u/TheGoddessAria.
ACC011,Goddess Aria,@GoddessAriaAI,FetLife,Findom/Adult,FINDOM,Kink community presence - luxury findom profile,"Goddess Aria | AI-Generated Persona | Not a Real Person. Luxury findom. I don't",NOT_CREATED,P2,FINDOM_PERSONAS.md,Interests: financial domination luxury worship wallet drain.
ACC012,Goddess Aria,@GoddessAriaVIP,Telegram,Findom/Adult,FINDOM,VIP channel for OBSIDIAN tier subscribers,"Goddess Aria VIP channel. OBSIDIAN tier exclusive content and commands.",NOT_CREATED,P2,FINDOM_PERSONAS.md,Private Telegram for $499.99/mo OBSIDIAN tier.
ACC013,Mistress Nova,@MistressNovaAI,Twitter/X,Findom/Adult,FINDOM,Bratty findom persona - playful spoiled princess energy,"Mistress Nova. AI-Generated Persona. Not a real person. 18+ only. bratty. spoile",NOT_CREATED,P2,FINDOM_PERSONAS.md,Launch 5-7 days after Goddess Aria.
ACC014,Mistress Nova,@MistressNovaAI,Fanvue,Findom/Adult,FINDOM,Primary subscription platform - bratty content $14.99-$349.99/mo,"DISCLOSURE: Mistress Nova is a 100% AI-generated persona. I am not a real person",NOT_CREATED,P2,FINDOM_PERSONAS.md,FREE to PAYPIG tiers. Volume tips + mid-tier subs.
ACC015,Mistress Nova,@MistressNovaAI,Fansly,Findom/Adult,FINDOM,Secondary subscription platform - bratty findom content,"AI-GENERATED PERSONA. not a real person. 18+ only. mistress nova. bratty princes",NOT_CREATED,P2,FINDOM_PERSONAS.md,Tiers start at $14.99.
ACC016,Mistress Nova,@MissNovaFindom,Reddit,Findom/Adult,FINDOM,Community engagement in findom and bratty domme subreddits,"AI persona. not real. 18+. bratty findom content. pink everything. links in prof",NOT_CREATED,P2,FINDOM_PERSONAS.md,u/MistressNovaAI or u/MissNovaFindom.
ACC017,Mistress Nova,@MistressNovaAI,FetLife,Findom/Adult,FINDOM,Kink community presence - bratty domme profile,"Mistress Nova | AI-Generated Persona | Not a Real Person. bratty findom princess",NOT_CREATED,P2,FINDOM_PERSONAS.md,Interests: financial domination bratty domme humiliation.
ACC018,Mistress Nova,@NovaBrattyVIP,Telegram,Findom/Adult,FINDOM,VIP channel for OWNED tier subscribers,"Mistress Nova VIP channel. OWNED tier exclusive bratty content.",NOT_CREATED,P3,FINDOM_PERSONAS.md,Private Telegram for $149.99/mo+ tiers.
ACC019,Empress Lilith,@EmpressLilithAI,Twitter/X,Findom/Adult,FINDOM,Dark occult findom persona - mysterious sovereign energy,"Empress Lilith. AI-Generated Persona. Not a real person. 18+ Only. Dark sovereig",NOT_CREATED,P2,FINDOM_PERSONAS.md,Launch 5-7 days after Mistress Nova. Most complex aesthetic.
ACC020,Empress Lilith,@EmpressLilithAI,Fanvue,Findom/Adult,FINDOM,Primary subscription platform - dark ritual content $24.99-$499.99/mo,"DISCLOSURE: Empress Lilith is a 100% AI-generated persona. I am not a real perso",NOT_CREATED,P2,FINDOM_PERSONAS.md,WITNESS (free) to VESSEL ($499.99) tiers.
ACC021,Empress Lilith,@EmpressLilithAI,LoyalFans,Findom/Adult,FINDOM,Additional subscription platform - dark findom content,"Empress Lilith. Dark findom. Occult aesthetic. Your offerings sustain me.",NOT_CREATED,P3,FINDOM_PERSONAS.md,LoyalFans as third platform for Lilith specifically.
ACC022,Empress Lilith,@EmpressLilithAI,Fansly,Findom/Adult,FINDOM,Secondary subscription platform - occult findom content,"AI-GENERATED PERSONA. Not a real person. 18+ only. Empress Lilith. Dark findom.",NOT_CREATED,P3,FINDOM_PERSONAS.md,Occult aesthetic content.
ACC023,Empress Lilith,@DarkEmpressLilith,Reddit,Findom/Adult,FINDOM,Community engagement in dark findom and occult subreddits,"AI-generated dark findom persona. Not a real person. 18+. Occult aesthetic. Ritua",NOT_CREATED,P3,FINDOM_PERSONAS.md,u/EmpressLilithAI or u/DarkEmpressLilith.
ACC024,Empress Lilith,@EmpressLilithAI,FetLife,Findom/Adult,FINDOM,Kink community presence - dark occult domme profile,"Empress Lilith | AI-Generated Persona | Not a Real Person. Dark findom. Occult d",NOT_CREATED,P3,FINDOM_PERSONAS.md,Interests: financial domination gothic domme occult play.
ACC025,Empress Lilith,@EmpressLilithVIP,Telegram,Findom/Adult,FINDOM,VIP channel for VESSEL tier subscribers,"Empress Lilith VIP communion. VESSEL tier exclusive ritual content.",NOT_CREATED,P3,FINDOM_PERSONAS.md,Private Telegram for $499.99/mo VESSEL tier.
ACC026,PrayerLock App,@PrayerLockApp,Twitter/X,Faith,FAITH,Promote PrayerLock app - prayer streak tracker for Christians,"Daily prayer streaks for Christians who want consistency, not perfection. Track y",NOT_CREATED,P1,FAITH_ACCOUNTS.md,Text-first. Product-forward. Feature highlights.
ACC027,PrayerLock App,@PrayerLockApp,Instagram,Faith,FAITH,Visual content for PrayerLock app promotion,"Your daily prayer streak starts here. Devotionals, accountability, habit trackin",NOT_CREATED,P2,FAITH_ACCOUNTS.md,Clean UI mockups streak screenshots feature carousels.
ACC028,PrayerLock App,@PrayerLockApp,TikTok,Faith,FAITH,Short-form video content for PrayerLock app,"Prayer streaks + daily devotionals. Faith meets your phone.",NOT_CREATED,P2,FAITH_ACCOUNTS.md,App demos and prayer streak day-in-the-life content.
ACC029,PrayerLock App,@PrayerLockApp,YouTube,Faith,FAITH,Long-form PrayerLock tutorials and user stories,"PrayerLock is a daily prayer tracker built for Christians aged 18-35 who want a r",NOT_CREATED,P3,FAITH_ACCOUNTS.md,App walkthroughs and prayer habit tutorials.
ACC030,Grace Over Grind,@GraceOverGrind,Twitter/X,Faith,FAITH,Broader faith community - engagement farming and devotionals,"Grace over grind. Daily faith for Christians who are tired of performing and read",NOT_CREATED,P2,FAITH_ACCOUNTS.md,Conversation-heavy. Prayer threads. Quote tweets.
ACC031,Grace Over Grind,@GraceOverGrind,Instagram,Faith,FAITH,Visual faith content - quote cards and devotional Reels,"Daily encouragement for Christians who show up imperfect. Scripture, prayer, real",NOT_CREATED,P2,FAITH_ACCOUNTS.md,Warm quote cards. Nature imagery. Voiceover devotional Reels.
ACC032,Grace Over Grind,@GraceOverGrind,TikTok,Faith,FAITH,Short-form faith content - devotionals and relatable skits,"Faith content for tired Christians. Grace > grind.",NOT_CREATED,P3,FAITH_ACCOUNTS.md,Talking head devotionals. Faith skits. Trending audio twists.
ACC033,Grace Over Grind,@GraceOverGrind,YouTube,Faith,FAITH,Long-form devotionals and verse breakdowns,"Grace Over Grind is daily faith content for Christians aged 18-45 who are done w",NOT_CREATED,P3,FAITH_ACCOUNTS.md,3-5 min devotionals. Prayer livestreams.
ACC034,WalkToUnlock,@WalkToUnlock,Twitter/X,Fitness,FITNESS,Promote WalkToUnlock app - gamified walking to unlock phone,"your phone is locked until you walk. 10,000 steps = full access. 0 steps = brick",NOT_CREATED,P1,FITNESS_ACCOUNTS.md,Lock screen moments and step streak content.
ACC035,WalkToUnlock,@WalkToUnlock,Instagram,Fitness,FITNESS,Visual content for WalkToUnlock app promotion,"Walk to unlock your phone. Literally. Step streaks. Walking challenges. No excus",NOT_CREATED,P2,FITNESS_ACCOUNTS.md,Phone mockups. Locked/unlocked state visuals.
ACC036,WalkToUnlock,@WalkToUnlock,TikTok,Fitness,FITNESS,Short-form video content for WalkToUnlock app,"Your phone is a brick until you walk. 10K steps or scroll nothing. Download the",NOT_CREATED,P2,FITNESS_ACCOUNTS.md,Screen recordings of lock states. Step counter overlays.
ACC037,WalkToUnlock,@WalkToUnlock,YouTube,Fitness,FITNESS,Long-form WalkToUnlock tutorials and walking science,"WalkToUnlock turns your phone into a walking coach. 0 steps = locked screen. No",NOT_CREATED,P3,FITNESS_ACCOUNTS.md,Walking challenges. App feature deep dives.
ACC038,IronWalkFit,@IronWalkFit,Twitter/X,Fitness,FITNESS,Fitness motivation content - walk more lift heavy eat protein,"walk 10K steps. lift 3x/week. eat protein. sleep 8 hours. that's the whole prog",NOT_CREATED,P2,FITNESS_ACCOUNTS.md,2-3 hashtags max. Cross-promotes WalkToUnlock.
ACC039,IronWalkFit,@IronWalkFit,Instagram,Fitness,FITNESS,Visual fitness content - dark gym aesthetic and walking results,"No coach. No supplements. No BS. Walk. Lift. Eat. Sleep. Repeat. Free plans in",NOT_CREATED,P2,FITNESS_ACCOUNTS.md,10-15 hashtags per post. Grainy film textures.
ACC040,IronWalkFit,@IronWalkFit,TikTok,Fitness,FITNESS,Short-form fitness content - walking and lifting tips,"fitness without the overcomplicated garbage. walk 10K. lift heavy. eat protein.",NOT_CREATED,P3,FITNESS_ACCOUNTS.md,3-5 hashtags per video. Phonk music aesthetic.
ACC041,IronWalkFit,@IronWalkFit,YouTube,Fitness,FITNESS,Long-form fitness content - programs and transformation stories,"Simple fitness for men who overthink everything. Walk more. Lift 3x/week. Eat 1",NOT_CREATED,P3,FITNESS_ACCOUNTS.md,Full workout programs. 90-day walking challenge guides.
ACC042,Deploy and Pray,@deployandpray,Twitter/X,Tech/Programming,MEME,Tech meme account - developer humor and programming jokes,"shipping broken code since 2019. if it works, don't ask why. mass DMs open for m",NOT_CREATED,P2,MEME_ACCOUNTS.md,4-6 posts/day. Dev life pain + framework wars.
ACC043,Deploy and Pray,@deployandpray,Instagram,Tech/Programming,MEME,Visual tech memes - carousels and reels,"code memes for people who mass-google error messages at 3am. mass DM for submiss",NOT_CREATED,P3,MEME_ACCOUNTS.md,1-2 reels/day + 1 carousel/day.
ACC044,Deploy and Pray,@deployandpray,TikTok,Tech/Programming,MEME,Short-form tech meme videos,"dev memes. mass crying in production. mass submissions welcome.",NOT_CREATED,P3,MEME_ACCOUNTS.md,1-2 videos/day. Highest per-follower monetization.
ACC045,Exit Scam Lord,@exitscamlord,Twitter/X,Hustle/Business,MEME,Hustle culture meme account - self-aware sigma grindset humor,"posting about money until i have some. side hustle brainrot. not financial advic",NOT_CREATED,P1,MEME_ACCOUNTS.md,5-8 posts/day. Overlaps with PRINTMAXX brand.
ACC046,Exit Scam Lord,@exitscamlord,Instagram,Hustle/Business,MEME,Visual hustle memes - reels and carousels,"quit my job in my head 47 times today. mass hustle memes for the delusional and",NOT_CREATED,P2,MEME_ACCOUNTS.md,2 reels/day + 1 carousel. 50% original memes.
ACC047,Exit Scam Lord,@exitscamlord,TikTok,Hustle/Business,MEME,Short-form hustle meme videos,"sigma grindset but self-aware. mass side hustles. mass delusion. mass occasional",NOT_CREATED,P2,MEME_ACCOUNTS.md,2-3 videos/day. Hustle audience is terminally online.
ACC048,Mass Posting,@massposting,Twitter/X,General/Viral,MEME,Pure engagement farming - maximum reach and impressions,"posting through it. mass opinions. mass polls. mass takes. mass follow for timel",NOT_CREATED,P2,MEME_ACCOUNTS.md,8-12 posts/day. Volume is king. Fastest growth.
ACC049,Mass Posting,@massposting,Instagram,General/Viral,MEME,Visual viral content - reels and engagement posts,"the account your mass-explore page keeps mass-showing you. mass relatable. mass s",NOT_CREATED,P3,MEME_ACCOUNTS.md,3-4 reels/day + 2 stories. General viral content.
ACC050,Mass Posting,@massposting,TikTok,General/Viral,MEME,Short-form viral content farming,"mass content. mass takes. mass relatable. mass you're welcome.",NOT_CREATED,P3,MEME_ACCOUNTS.md,3-5 videos/day. Widest TAM.
ACC051,Signal Ops,@SignalOps,Twitter/X,AI Automation/B2B,BUSINESS,AI automation agency - local business clients,"Signal Ops | AI systems for local businesses. We build AI voice agents, chatbots",NOT_CREATED,P2,BUSINESS_ACCOUNTS.md,Pin client result thread. DM automate to talk.
ACC052,Signal Ops,@SignalOps,Instagram,AI Automation/B2B,BUSINESS,Visual content for AI automation service demos,"Signal Ops. AI automation for local businesses. Voice agents that book appointme",NOT_CREATED,P3,BUSINESS_ACCOUNTS.md,Before/after automation demos. Client results.
ACC053,Signal Ops,@SignalOps,LinkedIn,AI Automation/B2B,BUSINESS,Primary lead gen platform for AI automation services,"Signal Ops builds AI automation systems for local businesses and SMBs. We replac",NOT_CREATED,P2,BUSINESS_ACCOUNTS.md,Case studies + cold DMs. 10 DMs/day.
ACC054,Signal Ops,Signal Ops,Google Business,AI Automation/B2B,BUSINESS,Local SEO presence for AI automation services,"Signal Ops provides AI automation services for local businesses. AI voice agents,",NOT_CREATED,P3,BUSINESS_ACCOUNTS.md,Local SEO from day 1. Free automation audit CTA.
ACC055,Basecamp Sites,@BasecampSites,Twitter/X,Web Design/B2B,BUSINESS,Web design service account - local business clients,"Basecamp Sites | Websites for local businesses. We build sites that actually bri",NOT_CREATED,P2,BUSINESS_ACCOUNTS.md,Pin before/after site transformation. DM site.
ACC056,Basecamp Sites,@BasecampSites,Instagram,Web Design/B2B,BUSINESS,Visual portfolio for web design service,"Basecamp Sites. Websites that get local businesses found online. Landing pages |",NOT_CREATED,P3,BUSINESS_ACCOUNTS.md,Before/after comparisons. Portfolio grid.
ACC057,Basecamp Sites,@BasecampSites,LinkedIn,Web Design/B2B,BUSINESS,Primary lead gen platform for web design services,"Basecamp Sites builds websites for local service businesses. Fast load times, cl",NOT_CREATED,P2,BUSINESS_ACCOUNTS.md,Free site audit lead magnet. 10 DMs/day.
ACC058,Basecamp Sites,Basecamp Sites,Google Business,Web Design/B2B,BUSINESS,Local SEO presence for web design services,"Basecamp Sites is a web design service specializing in websites for local busine",NOT_CREATED,P3,BUSINESS_ACCOUNTS.md,Check trademark conflict with Basecamp PM tool.
ACC059,SleepSphere,SleepSphere,YouTube,Sleep/Ambient,CONTENT_FARM,Faceless sleep/ambient YouTube channel - 8-10hr loops,"Fall asleep faster. Sleep deeper. Wake up rested. SleepSphere publishes long-for",NOT_CREATED,P3,CONTENT_FARM_CHANNELS.md,3x/week. Highest passive income potential. Videos compound.
ACC060,ClipVortex,ClipVortex,YouTube,Viral/Compilations,CONTENT_FARM,Faceless clip compilation YouTube channel - daily uploads,"The internet's best clips organized and served fresh. Satisfying videos viral mo",NOT_CREATED,P3,CONTENT_FARM_CHANNELS.md,Daily uploads. Most labor-intensive. Launch last.
ACC061,NeuralDrop,@NeuralDrop,TikTok,AI/Tech Education,CONTENT_FARM,AI facts and education TikTok - daily knowledge drops,"AI is changing everything. Here's what you need to know. New drops daily.",NOT_CREATED,P3,CONTENT_FARM_CHANNELS.md,7-10 posts/week. Fastest growth potential. AI trending.
ACC062,MindForge,@MindForge,Instagram,Motivation/Mindset,CONTENT_FARM,Motivation and quotes Instagram - daily mental edge content,"Your daily mental edge. Quotes, mindset, real strategies. No fluff. Follow if yo",NOT_CREATED,P3,CONTENT_FARM_CHANNELS.md,7 feed posts/week + daily Stories. Carousels get most saves.
ACC063,ToolStack,@ToolStack,Pinterest,Tech/Productivity,CONTENT_FARM,Tech tips and tool comparisons Pinterest - affiliate driven,"Tech tips, tool comparisons, and productivity shortcuts. Saving you hours every",NOT_CREATED,P3,CONTENT_FARM_CHANNELS.md,15-25 pins/week. Affiliate links directly on pins.
ACC064,STACKPRINT,STACKPRINT,Beehiiv,Tech/Solopreneur,NEWSLETTER,Tech solopreneur newsletter - real numbers from real builds,"Real numbers from real builds. No guru fluff. Every week: exact tools, tactics, a",NOT_CREATED,P1,NEWSLETTER_BRANDS.md,Tue main issue + Thu quick-hit + occasional Sat deep dive.
ACC065,MORNING MANNA,MORNING MANNA,Beehiiv,Faith/Wellness,NEWSLETTER,Daily faith devotional newsletter - 5 min morning anchor,"5 minutes with God before the world gets loud. Daily verse, reflection, prayer, j",NOT_CREATED,P2,NEWSLETTER_BRANDS.md,Weekday daily at 6am + Sunday longer devotional.
ACC066,SAUCE LETTER,SAUCE LETTER,Beehiiv,Hustle/Money,NEWSLETTER,Weekly money methods newsletter - verified side hustle breakdowns,"One money method per week. Real numbers. No course pitch. Tuesday method drop + F",NOT_CREATED,P2,NEWSLETTER_BRANDS.md,Tue method drop + Fri quick hits. Verify all numbers.
ACC067,MORNING MANNA,@morningmanna,Instagram,Faith/Wellness,NEWSLETTER,Social feed for Morning Manna newsletter - verse graphics,"Single-verse graphics with full devotional in bio link. Pinterest cross-post.",NOT_CREATED,P3,NEWSLETTER_BRANDS.md,Growth channel for newsletter. Verse graphics.
ACC068,Goddess Aria,GoddessAriaAI,Throne.me,Findom/Adult,FINDOM,Wishlist and tribute platform for Goddess Aria persona,"Goddess Aria wishlist. Luxury items. Tributes and gifts accepted.",NOT_CREATED,P2,FINDOM_PERSONAS.md,Linked from all Aria profiles. Wishlist items in shots.
