alpha_id,source,source_url,category,tactic,roi_potential,priority,status,applicable_methods,applicable_niches,synergy_score,reviewer_notes,quality_issues,engagement_authenticity,earnings_verified,extracted_method,compliance_notes,date_added
ALPHA10540,r/Entrepreneur + newsletter comparison,https://www.beehiiv.com/blog/substack-monetization,MONETIZATION,"Beehiiv vs Substack: Beehiiv 0% revenue fee (just Stripe fees) vs Substack 10% cut. At $10K/mo revenue: save $1000/mo on Beehiiv. Beehiiv Boosts pay $1-$3+ per referred subscriber. Some placements pay up to $1K per send.",HIGHEST,NOW,PENDING_REVIEW,MM015_NEWSLETTER,N003_tech|N001_faith|N002_fitness,88,"Beehiiv saves $1K per $10K revenue vs Substack. Boosts = paid subscriber acquisition (others pay YOU to recommend their newsletter). $1-3 per referral. Up to $1K per sponsored send. Triple monetization: subscriptions + boosts + sponsors.",None,AUTHENTIC,N/A,"Use Beehiiv not Substack (0% vs 10% fee). Monetize 3 ways: paid subscriptions + Boost referrals ($1-3/sub) + sponsored sends (up to $1K each). Save $1K/mo at $10K revenue vs Substack.",None,2026-02-05
ALPHA10541,r/affiliatemarketing + Printful analysis,https://www.printful.com/blog/is-etsy-print-on-demand-profitable,MONETIZATION,"Etsy POD margins: 15-50% (most aim 25-50%). Top sellers: $5K-$15K/mo. Etsy 6.5% transaction fee vs Redbubble 20% commission. Key success: design originality + SEO + niche focus. AI for design generation = cost advantage.",HIGH,NOW,PENDING_REVIEW,MM023_PRINT_ON_DEMAND|MM069_AI_GENERATED_MERCH,N003_tech|N002_fitness|N001_faith,78,"Etsy POD validated at $5-15K/mo top end. 25-50% margins. Etsy much better than Redbubble on fees (6.5% vs 20%). AI design generation = massive cost reduction. Niche + SEO = discovery.",None,AUTHENTIC,FALSE,"Launch Etsy POD store. AI-generated designs (Leonardo/Midjourney). Target 25-50% margins. Niche focus (faith/fitness/tech). Optimize Etsy SEO. Price to clear $5+ profit per item.",None,2026-02-05
ALPHA10542,r/SideProject + Reddit as launch platform,https://jonathanrintala.com/blog/reddit-growth-hacking-guide-b2b-saas/,GROWTH_HACK,"Reddit B2B SaaS growth: 1M+ views from Reddit posts. Reddit cost-per-click 50-70% lower than FB/IG. Key: genuine value-first posts not promotion. 10-20 highly relevant communities > wide spray.",HIGH,NOW,PENDING_REVIEW,MM001_APP_FACTORY|MM027_MICRO_SAAS|CF001_CONTENT_FARM,N003_tech,80,"1M+ views achievable on Reddit with genuine content. Focus on 10-20 subreddits not hundreds. Reddit = cheapest qualified traffic available. Must be value-first not promotional.",None,AUTHENTIC,FALSE,"Identify 10-20 target subreddits for each product. Post 1 genuinely valuable piece per week per subreddit. No promotion in post. Link in profile. Track signups from Reddit referrals.",None,2026-02-05
ALPHA10543,r/SaaS + no-code SaaS builder,https://blog.startupstash.com/how-i-built-a-3-200-month-micro-saas-without-writing-a-single-line-of-code-38bd6996347b,SAAS_TACTICS,"$3200/mo micro SaaS built with no code. First month: $87 from 3 paying customers. Grew through content marketing + ProductHunt. No-code tools = faster time to market = test more ideas faster.",HIGH,NOW,PENDING_REVIEW,MM027_MICRO_SAAS|MM001_APP_FACTORY,N003_tech,75,"No-code to $3.2K/mo is validated path. Even $87 first month proves willingness to pay. Speed matters: no-code = test 3 ideas in time it takes to code 1. AI vibe-coding is even faster than no-code now.",None,AUTHENTIC,SCREENSHOT,"Use AI vibe-coding (faster than no-code) to prototype micro SaaS in days. Validate with $87 first month. Scale with content marketing. Test 3-5 ideas rapid fire.",None,2026-02-05
ALPHA10544,r/passive_income + Medium micro SaaS guide,https://medium.com/@princekumar161999/from-side-project-to-5k-month-my-step-by-step-guide-to-building-profitable-micro-saas-as-a-solo-676771a10c25,SAAS_TACTICS,"Side project to $5K/mo: two micro SaaS tools brought in $48K combined in 2025. Solo developer building portfolio approach. Key: solve boring specific problems not sexy general ones.",HIGH,SOON,PENDING_REVIEW,MM027_MICRO_SAAS|MM001_APP_FACTORY,N003_tech,78,"$48K from 2 tools in one year = $24K each = $2K/mo average per tool. Portfolio approach validated: multiple small wins > one big bet. Boring problems = less competition + stickier customers.",None,AUTHENTIC,CLAIMED,"Build portfolio of 2-5 micro SaaS tools. Target boring specific problems (billing/scheduling/tracking). $2-5K/mo per tool. Combined = $10-25K/mo. AI reduces build time to weeks.",None,2026-02-05
ALPHA10545,r/Entrepreneur + virtual influencer market,https://autofaceless.ai/blog/faceless-content-creator-statistics-2026,PLATFORM_ARBITRAGE,"Virtual influencer market: $9.75B (2024) growing to $154.83B by 2032 at 41.29% CAGR. Creator economy: $127.65B to $528.39B by 2030. AI-generated content is fastest growing segment.",HIGHEST,BACKLOG,PENDING_REVIEW,AI001_NICHE_EXPERTS|AI002_FINDOM|CF001_CONTENT_FARM,N003_tech|N016_content_creators,88,"$9.75B to $154.83B = 15x growth in 8 years for virtual influencers. PRINTMAXX AI influencer strategy is riding massive secular trend. Early mover advantage still available.",None,AUTHENTIC,N/A,"AI influencer personas are riding $154B market growth. Launch AI personas NOW to capture early mover advantage. Virtual influencer market growing 41% CAGR.",None,2026-02-05
ALPHA10546,r/SideProject + Reddit analysis app demand,https://nomusica.com/reddit-analysis-reveals-what-users-really-want-from-new-apps-and-saas-tools-in-2026/,APP_FACTORY,"Reddit app demand signals: Monday/Tuesday = peak frustration (best time to post solutions). Finance tools have 193 'pay signals' (highest willingness to pay). Developer tools have longest posts (229 chars avg = highest frustration). Privacy-first offline-first = 640 requests (7% of total).",HIGH,NOW,PENDING_REVIEW,MM001_APP_FACTORY|MM027_MICRO_SAAS,N003_tech|N005_finance,82,"Timing insight: post product launches Monday/Tuesday when frustration peaks. Finance = build first (pay signals). Developer tools = pain is highest. Privacy-first = underserved niche.",None,AUTHENTIC,N/A,"Post product launches Monday/Tuesday (peak user frustration). Build finance tools first (highest pay signals). Privacy-first offline-first positioning = differentiation. Developer tools = high frustration = high willingness to pay.",None,2026-02-05
ALPHA10547,r/Solopreneur + SaaS idea gen from Reddit,https://teo-miscia.medium.com/i-built-a-saas-idea-generator-by-analyzing-the-entirety-of-reddit-2025-9de42bcddb27,TOOL_ALPHA,"SaaS idea generator built by analyzing all of Reddit. Uses Python MVP. Identifies pain points from Reddit posts and comments. Meta-tool: the research process itself is the product.",HIGH,SOON,PENDING_REVIEW,MM027_MICRO_SAAS|MM058_CURATED_DATA_PRODUCTS,N003_tech,75,"Meta-insight: the PROCESS of analyzing Reddit for ideas IS a product. We already do this research. Package the methodology as a tool. Reddit pain point analysis = validated demand signal.",None,AUTHENTIC,N/A,"Build Reddit pain point analyzer tool. Scrape subreddits for complaints/requests. Score by frequency + willingness to pay signals. Sell as SaaS or one-time data product.",None,2026-02-05
ALPHA10548,r/coldemail + Breakcold analysis,https://www.breakcold.com/blog/cold-email-reply-rate,COLD_OUTBOUND,"Personalized cold emails get 32% higher response rate. Customized subject lines improve open rates by 50%. Average cold email open rate: 27.7-44% depending on optimization. 16.9% of cold emails never reach inbox (deliverability gap).",HIGH,NOW,PENDING_REVIEW,MM007_COLD_OUTBOUND,N003_tech|N004_agencies,80,"32% lift from personalization and 50% lift from custom subjects are huge. 16.9% inbox failure rate means deliverability infrastructure is non-negotiable. Pre-warmed inboxes critical.",None,AUTHENTIC,N/A,"Personalize every cold email (32% higher response). Custom subject lines (50% higher open rate). Use pre-warmed inboxes (16.9% never reach inbox otherwise). A/B test subject lines weekly.",None,2026-02-05
