alpha_id,source,source_url,category,tactic,roi_potential,priority,status,applicable_methods,applicable_niches,synergy_score,reviewer_notes,quality_issues,engagement_authenticity,earnings_verified,extracted_method,compliance_notes,date_added
ALPHA10510,r/microsaas + Greensighter analysis,https://www.greensighter.com/blog/micro-saas-ideas,SAAS_TACTICS,"Clickpilot (YouTube thumbnail A/B testing SaaS) hit $1600 MRR in 5 months. Niche: creator tools. Validates YouTube thumbnail testing as viable micro SaaS.",HIGH,NOW,PENDING_REVIEW,MM001_APP_FACTORY|MM027_MICRO_SAAS,N003_tech|N016_content_creators,82,"Validated MRR with timeline. Creator tools niche growing. Could clone with AI twist (auto-generate thumbnails + test).",None,AUTHENTIC,SCREENSHOT,"Build YouTube thumbnail A/B tester. Use Claude API for thumbnail generation suggestions. Charge $19-49/mo. Target YouTube creators via Reddit/Twitter.",None,2026-02-05
ALPHA10511,r/microsaas + Greensighter analysis,https://www.greensighter.com/blog/micro-saas-ideas,SAAS_TACTICS,"GrowthPanels (word-of-mouth reward engine) hit $2000 MRR in 2 months. Fastest ramp among tracked micro SaaS. Automates referral tracking + discount codes.",HIGHEST,NOW,PENDING_REVIEW,MM001_APP_FACTORY|MM027_MICRO_SAAS|MM024_DIGITAL_PRODUCTS,N003_tech|N001_ecommerce,88,"$2K MRR in 2 months is exceptional velocity. Referral/viral loop tooling is evergreen demand. Could build competitor or white-label version.",None,AUTHENTIC,SCREENSHOT,"Build referral reward SaaS for e-commerce. Automate discount code generation + referral tracking. Stripe integration. Charge $29-99/mo.",None,2026-02-05
ALPHA10512,r/microsaas + Greensighter analysis,https://www.greensighter.com/blog/micro-saas-ideas,SAAS_TACTICS,"Famewall (testimonial collector widget) reached $1000 MRR in 12 months. Converts customer feedback into embeddable website widgets. Low churn recurring SaaS.",HIGH,SOON,PENDING_REVIEW,MM001_APP_FACTORY|MM027_MICRO_SAAS,N003_tech|N001_ecommerce,75,"Proven demand for social proof widgets. Slower ramp (12 months) but sticky product. Could build as feature of larger GTM tool.",None,AUTHENTIC,SCREENSHOT,"Build embeddable testimonial widget SaaS. Scrape reviews from Google/G2/Trustpilot and display on client sites. $19-49/mo.",None,2026-02-05
ALPHA10513,r/SaaS + Medium StartupInsider,https://medium.com/startup-insider-edge/the-100k-mrr-illusion-5-micro-saas-founders-proving-its-possible-and-how-they-did-it-c3571dd336b3,SAAS_TACTICS,"70% of micro SaaS businesses generate under $1000 MRR. Median reaches $1K-$3K in first 6 months. Top quartile hits 80% margins. Realistic benchmark for solo builders.",HIGH,NOW,PENDING_REVIEW,MM001_APP_FACTORY|MM027_MICRO_SAAS,N003_tech,70,"Important reality check. Most micro SaaS under $1K/mo. Plan for portfolio of 3-5 micro SaaS products to hit $5K+ combined. 80% margins at top quartile is excellent.",None,AUTHENTIC,N/A,"Build portfolio of 3-5 micro SaaS products targeting $1-3K MRR each. 80% margins solo. Use AI to reduce build time to 1-2 weeks per product.",None,2026-02-05
ALPHA10514,r/SaaS + Pieter Levels case study,https://solopreneurpage.com/blog/micro-saas-ideas-successful-examples-solo-founders,SAAS_TACTICS,"Pieter Levels Photo AI: $132K MRR 18 months after launch. Nomad List: $1.5M ARR solo with no employees. AI wrapper SaaS with focused niche = massive solo founder revenue.",HIGHEST,BACKLOG,PENDING_REVIEW,MM001_APP_FACTORY|MM027_MICRO_SAAS|MM026_AI_WRAPPER,N003_tech,90,"Levels is proven case study but hard to replicate at his scale. Key insight: AI wrapper + focused niche + existing audience. Photo AI specifically targeted AI headshots.",earnings_verified for Photo AI likely inflated in aggregation but Levels is public about numbers,AUTHENTIC,SCREENSHOT,"AI wrapper SaaS in focused niche. Photo AI model: charge per generation ($5-20). Build on top of open source models to reduce API costs. Focus on one specific use case.",None,2026-02-05
ALPHA10515,Instantly.ai Benchmark Report,https://instantly.ai/cold-email-benchmark-report-2026,COLD_OUTBOUND,"2026 cold email benchmarks: avg reply rate 3.43%. Top performers 10.7%+. Optimal: under 80 words first touch. 4-7 email sequence. Monday launch Wednesday peak. First email gets 58% of all replies.",HIGHEST,NOW,PENDING_REVIEW,MM007_COLD_OUTBOUND|MM051_AI_AUTOMATION_AGENCY,N003_tech|N001_ecommerce|N004_agencies,95,"Institutional-grade data from Instantly (millions of emails analyzed). Directly actionable for our cold email sequences. Under 80 words is KEY insight. 4-7 sequence length is optimal.",None,AUTHENTIC,N/A,"Cold email: under 80 words first touch. 4-7 email sequence total. 3-4 day spacing between follow-ups. Single clear CTA. Problem-first positioning. Launch Monday. A/B test weekly.",None,2026-02-05
ALPHA10516,Instantly.ai Benchmark Report,https://instantly.ai/cold-email-benchmark-report-2026,COLD_OUTBOUND,"Follow-up emails capture 42% of replies. Teams with stable domain health see 15-20% higher reply rates. Space follow-ups 3-4 days apart. Wednesday has highest reply rates.",HIGH,NOW,PENDING_REVIEW,MM007_COLD_OUTBOUND,N003_tech|N004_agencies,85,"Critical: 42% of replies come from follow-ups not first email. Never send just one email. Domain health = reply rate directly. Wednesday peak = schedule our sends accordingly.",None,AUTHENTIC,N/A,"Always send 4-7 email sequence. 42% of replies come from follow-up emails. Maintain domain health (SPF/DKIM/DMARC). Schedule peak sends for Wednesday.",None,2026-02-05
ALPHA10517,r/coldemail + StartupSpells,https://startupspells.com/p/how-i-accidentally-generated-6-leads-to-a-cold-email-agency-from-reddit,GROWTH_HACK,"Generated 6 leads for cold email agency accidentally from single Reddit post. Valuable content post on r/coldemail became top post of all time. Content-led lead gen on Reddit = free qualified leads.",HIGH,NOW,PENDING_REVIEW,MM007_COLD_OUTBOUND|MM028_LOCAL_LEAD_GEN|CF001_CONTENT_FARM,N003_tech|N004_agencies,80,"Reddit content marketing for lead gen. Write genuinely valuable posts on relevant subreddits. Leads come to you. 90/10 rule: 90% value / 10% business. Works for ANY service business.",None,AUTHENTIC,FALSE,"Write 1 genuinely valuable post per week on r/coldemail r/SaaS r/Entrepreneur. Include real data/case studies. Bio links to service page. Let leads come inbound. Zero ad spend.",None,2026-02-05
ALPHA10518,r/growthhacking + SingleGrain,https://www.singlegrain.com/search-everywhere-optimization/reddit-growth-hacking-strategies-that-drive-real-revenue/,GROWTH_HACK,"Reddit CPC 50-70% lower than Facebook/Instagram for qualified leads. 489K website visits in single month from Reddit growth hacking. 74% of Reddit users say platform influences purchases.",HIGHEST,NOW,PENDING_REVIEW,MM007_COLD_OUTBOUND|CF001_CONTENT_FARM|MM028_LOCAL_LEAD_GEN,N003_tech|N001_ecommerce,92,"Reddit as marketing channel is massively underpriced. 50-70% lower CPC than Meta. Organic posts can drive hundreds of thousands of visits. Must be genuine value not spam.",None,AUTHENTIC,FALSE,"Post valuable content on 10-20 target subreddits. Focus on problems our products solve. 90% value 10% promotion. Track CPC vs Meta ads. Expected 50-70% lower CAC.",None,2026-02-05
ALPHA10519,r/startups + SubredditSignals,https://www.subredditsignals.com/blog/reddit-marketing-strategies-for-startups-2025-2026-how-to-find-high-intent-threads-and-turn-them-into-product-demos-without-getting-downvoted,GROWTH_HACK,"Reddit demo plays for startups: 120 leads and $1800 revenue in 45 days from Reddit referrals. 150% signup lift. 35% conversion rate. Models roasted in threads converted 22% better with 37 days from mockery to $10k/mo.",HIGH,NOW,PENDING_REVIEW,MM001_APP_FACTORY|MM027_MICRO_SAAS|CF001_CONTENT_FARM,N003_tech,78,"Specific conversion numbers from Reddit marketing. 35% conversion from Reddit referrals is exceptional (vs 2-3% typical web). Even negative Reddit attention converts. $1800 in 45 days is real.",None,AUTHENTIC,SCREENSHOT,"Monitor subreddits for pain point discussions. Offer demo/solution in comments (genuine not spammy). Target: 120 leads / 45 days. 35% conversion rate achievable with Reddit traffic.",None,2026-02-05
ALPHA10520,r/passive_income + Shopify analysis,https://www.shopify.com/blog/passive-income-ideas,MONETIZATION,"Notion template creators on Gumroad earn $5K-$20K/mo (top). Average: $500-$1K/mo with 3-5 solid templates. $50M+ annual market across platforms. Lowest barrier digital product.",HIGHEST,NOW,PENDING_REVIEW,MM024_DIGITAL_PRODUCTS|MM025_AMAZON_KDP,N003_tech|N001_ecommerce,88,"Notion templates = fastest path to first dollar. $500-1K/mo realistic with 3-5 templates. $0 to create. Gumroad = free until sale. Can launch today. Top creators at $20K/mo proves scale potential.",None,AUTHENTIC,FALSE,"Create 5 Notion templates this week. List on Gumroad ($0 cost). Target: productivity solopreneurs fitness trackers content calendars. Price $7-$19 each. Promote via Reddit + Twitter.",None,2026-02-05
ALPHA10521,r/passive_income + Medium analysis,https://simplifiedbusinesscoach.medium.com/26-uncommon-passive-income-ideas-for-2026-ef5a6012e918,MONETIZATION,"Online courses earn $1K-$10K/mo. One marketer's Freelance Writing 101 course on Teachable earns $3K/mo after 6 months promotion. 3-12 months intensive then 2-5 hrs/week maintenance.",HIGH,SOON,PENDING_REVIEW,MM024_DIGITAL_PRODUCTS|MM002_INFO_PRODUCTS,N003_tech|N002_fitness|N001_faith,75,"Course creation is high-effort upfront but true passive after. $3K/mo from single course is validated. Could create courses from our existing playbooks/methods. Teachable or Whop as platform.",None,AUTHENTIC,FALSE,"Package existing PRINTMAXX methods into course. Teachable or Whop platform. Price $47-$97. Target: solopreneurs. Promote via Twitter build-in-public + Reddit.",None,2026-02-05
ALPHA10522,r/affiliatemarketing + various,https://thunderbit.com/blog/affiliate-marketing-stats,AFFILIATE,"Affiliate marketing average income $8038/mo. Top niche: education/e-learning at $15551/mo average. SEO drives 78% of affiliate traffic. AI tools used by 80% of affiliates for content. Industry growing 15.2% CAGR to $20B+ in 2026.",HIGH,SOON,PENDING_REVIEW,MM003_AFFILIATE_SITES|MM024_DIGITAL_PRODUCTS,N003_tech|N002_fitness|N005_finance,80,"Education niche highest earning for affiliates. Our content (playbooks/courses) could include affiliate links for tools mentioned. SEO + AI content = scalable affiliate revenue.",None,AUTHENTIC,FALSE,"Add affiliate links to all tool recommendations in playbooks/content. Focus on education/tech niche. Use AI for SEO content generation. Target $500-$1K/mo affiliate in 6 months.",None,2026-02-05
ALPHA10523,r/juststart + OnlineMediaMasters,https://onlinemediamasters.com/how-to-make-money-with-affiliate-marketing/,AFFILIATE,"One affiliate marketer grew from $267/mo to $21853/mo over 19 months. Strategy: specific niche + high-quality SEO content. Some r/juststart posters making six figures/year.",HIGHEST,SOON,PENDING_REVIEW,MM003_AFFILIATE_SITES|MM029_FACELESS_YOUTUBE,N003_tech|N005_finance,85,"$267 to $21.8K in 19 months is exceptional growth. SEO content in specific niche is the method. Could replicate with AI-generated content at scale. r/juststart community has proven case studies.",earnings claim from single source - typical for affiliate space,AUTHENTIC,SCREENSHOT,"Pick 1 niche. Create 50+ SEO articles with AI assistance. Target long-tail keywords. Monetize with affiliate links. Timeline: 6-19 months to $5K+/mo.",None,2026-02-05
ALPHA10524,r/AppBusiness + BusinessOfApps,https://www.businessofapps.com/data/reddit-statistics/,APP_FACTORY,"Global app revenue projected $613B by 2026. Top 5% of apps earn 90% of revenue. Hybrid monetization (IAP + ads) increases ARPU 20-40%. 70% of users churn within 3 days.",HIGH,NOW,PENDING_REVIEW,MM001_APP_FACTORY,N003_tech|N002_fitness|N001_faith,78,"Key insight: hybrid monetization is 20-40% more revenue than single model. Hard paywall alone leaves money on table. Must add ads + IAP + subscriptions. 70% 3-day churn means onboarding is critical.",None,AUTHENTIC,N/A,"Implement hybrid monetization in all apps: subscriptions + ads + IAP. Focus on reducing 3-day churn with strong onboarding. Target ARPU lift of 20-40% vs subscription-only.",None,2026-02-05
ALPHA10525,r/AppBusiness + nomusica Reddit analysis,https://nomusica.com/reddit-analysis-reveals-what-users-really-want-from-new-apps-and-saas-tools-in-2026/,APP_FACTORY,"Reddit app demand analysis: Productivity (1231 requests) > Education (698) > Business Tools (696) > Health (656). Finance has strongest willingness to pay (193 pay signals). Privacy-first offline-first apps = 640+ requests (7% of total).",HIGHEST,NOW,PENDING_REVIEW,MM001_APP_FACTORY|MM027_MICRO_SAAS,N003_tech|N002_fitness|N005_finance,90,"Data-backed demand signals. Finance tools = most likely to convert to paying users. Privacy-first offline-first is underserved gap. 1231 productivity requests = massive demand. Build for finance first (pay signal) then productivity.",None,AUTHENTIC,N/A,"Build finance tracking app (highest willingness to pay). Privacy-first offline-first positioning. Productivity second. Target Reddit communities for launch. Monday/Tuesday posts get most engagement.",None,2026-02-05
ALPHA10526,r/Entrepreneur + Reddit analysis,https://medium.com/startup-insider-edge/reddits-most-upvoted-business-models-of-2026-with-profit-analysis-13cc065e2c8b,MONETIZATION,"Most upvoted Reddit business models 2026: lowest barrier to entry + immediately profitable wins. Reddit users want cash flow and location independence not disruption. EntrepreneurRideAlong: detailed case studies with real revenue screenshots + traffic stats.",HIGH,NOW,PENDING_REVIEW,MM024_DIGITAL_PRODUCTS|MM002_INFO_PRODUCTS|MM027_MICRO_SAAS,N003_tech,72,"Reddit community values practical low-barrier businesses over moonshots. Align PRINTMAXX messaging: cash flow first not scale first. Use r/EntrepreneurRideAlong for case study launches.",None,AUTHENTIC,N/A,"Post case studies with real numbers to r/EntrepreneurRideAlong. Focus on low-barrier cash-flow businesses. Revenue screenshots + traffic stats increase credibility and engagement.",None,2026-02-05
ALPHA10527,r/growthhacking + Martal analysis,https://martal.ca/linkedin-outreach-lb/,COLD_OUTBOUND,"LinkedIn cold outreach 2026: 20-55% connection acceptance rate with personalization + 2nd degree contacts. 48.14% positive reply ratio on optimized campaigns. 25% meeting rate. Multichannel (LinkedIn + email + calls) = 287% higher response vs single channel.",HIGHEST,NOW,PENDING_REVIEW,MM007_COLD_OUTBOUND|MM051_AI_AUTOMATION_AGENCY,N003_tech|N004_agencies,92,"287% higher response with multichannel is the key number. LinkedIn + email + cold call combined. 25% meeting rate is very high. Our cold outbound should be multichannel from day 1.",None,AUTHENTIC,FALSE,"Run multichannel outreach: LinkedIn DM + cold email + cold call via VA. Expected 287% lift vs email alone. Personalize with 2nd-degree connections. Target 25% meeting booking rate.",None,2026-02-05
ALPHA10528,r/Solopreneur + various,https://prometai.app/blog/solopreneur-tech-stack-2026,TOOL_ALPHA,"Solopreneur tech stack 2026: Make.com ($9/mo for 10K ops) beats Zapier ($20/mo for 750 tasks) for automation. n8n ($24/mo) for complex workflows. One case study: $1M reclaimed revenue + 282 workdays saved/year from automation.",HIGHEST,NOW,PENDING_REVIEW,MM051_AI_AUTOMATION_AGENCY|MM027_MICRO_SAAS,N003_tech,85,"Make.com at $9/mo for 10K operations is massive value vs Zapier $20 for 750. Switch PRINTMAXX automation to Make.com. Also: selling automation services (n8n/Make setups) to businesses = $2K-8K/mo retainer per client.",None,AUTHENTIC,FALSE,"Use Make.com for all PRINTMAXX automation ($9/mo). Sell n8n/Make automation setup as service at $2K-8K/mo retainer. One case study shows $1M revenue impact.",None,2026-02-05
ALPHA10529,r/buildinpublic + various,https://nealschaffer.com/how-to-make-money-on-twitter/,CONTENT_FORMAT,"X/Twitter build-in-public community: 180K+ members. 10K followers achievable in 3-6 months with 2-3 hrs/day. Post 3-5x daily engage 20+ accounts. Educational threads = highest performing format. Mid-tier (10-50K followers) = few hundred $/mo from ads. Brand deals = biggest revenue.",HIGH,NOW,PENDING_REVIEW,CF001_CONTENT_FARM|MM002_INFO_PRODUCTS|AI001_NICHE_EXPERTS,N003_tech|N016_content_creators,80,"Build-in-public on X is free customer acquisition channel. 10K followers in 3-6 months is realistic with consistent effort. Revenue from ads low at that level but brand deals + product sales are real.",None,AUTHENTIC,FALSE,"Post 3-5x daily on X. Engage 20+ accounts. Educational threads. Build to 10K in 3-6 months. Monetize via products (Gumroad) not ad revenue. Brand deals at 10K+.",None,2026-02-05
ALPHA10530,r/passive_income + faceless stats,https://autofaceless.ai/blog/faceless-content-creator-statistics-2026,CONTENT_FORMAT,"Faceless channels = 38% of new creator ventures (up from 12% in 2022). Top earners $80K+/mo. Production costs 58% lower than face-based. BUT requires 39% more uploads to hit monetization. Daily Dose of Internet: $138K-$388K/mo ad revenue.",HIGHEST,NOW,PENDING_REVIEW,MM029_FACELESS_YOUTUBE|CF001_CONTENT_FARM|AI001_NICHE_EXPERTS,N003_tech|N002_fitness|N001_faith|N016_content_creators,90,"Faceless content is 3x faster growing than face-based (12% to 38%). 58% lower production costs is key for solo ops. $80K/mo top end. BUT 39% more uploads needed = must automate production pipeline.",Daily Dose numbers likely at extreme end,AUTHENTIC,FALSE,"Launch 3 faceless channels (faith/fitness/tech). Automate with AI: script generation + voiceover + video assembly. 15-20 videos/month per channel. 58% lower cost than face-based.",None,2026-02-05
ALPHA10531,r/passive_income + faceless stats,https://autofaceless.ai/blog/faceless-content-creator-statistics-2026,CONTENT_FORMAT,"86% of consumers perceive faceless content as MORE authentic. 72% of Gen Z prioritize content quality over creator visibility. Pinterest content lasts 7 days vs TikTok 48 hours. Pinterest CPM $8.40+ with 53% higher engagement for tutorials.",HIGH,SOON,PENDING_REVIEW,CF001_CONTENT_FARM|MM029_FACELESS_YOUTUBE,N003_tech|N002_fitness|N001_faith,78,"Pinterest is massively undervalued: 7 day content lifespan vs 48 hour TikTok. $8.40 CPM. Tutorial content 53% higher engagement. Add Pinterest to content distribution.",None,AUTHENTIC,N/A,"Add Pinterest to content distribution. Create tutorial pins from existing content. 7-day lifespan (vs 48hr TikTok). $8.40 CPM. 53% higher engagement for tutorials.",None,2026-02-05
ALPHA10532,r/SaaS + AI wrapper analysis,https://mktclarity.com/blogs/news/ai-tools-top,SAAS_TACTICS,"AI wrapper revenue spectrum: Magai $100K/mo (32 months to $1M ARR). EasyGen $41.5K/mo (hit in first year). Textero $20K/mo (under 1 year). Bolt.new $3.3M/mo in 5 months. Key: deep workflow integration not thin wrapper.",HIGHEST,SOON,PENDING_REVIEW,MM026_AI_WRAPPER|MM027_MICRO_SAAS|MM001_APP_FACTORY,N003_tech,88,"AI wrappers printing money when integrated into workflows. Thin wrappers die. Deep integration survives. Magai 6 pricing tiers ($19-$249) = classic SaaS upsell. Speed to market critical (Bolt.new 5mo to $3.3M).",Some numbers may be peak not sustained,AUTHENTIC,SCREENSHOT,"Build AI wrapper deeply integrated into specific workflow (not general chatbot). Multiple pricing tiers ($19-$249). Target vertical-specific use case. Speed to market = advantage.",None,2026-02-05
ALPHA10533,r/SaaS + AI wrapper analysis,https://www.getmonetizely.com/blogs/the-economics-of-ai-first-b2b-saas-in-2026,SAAS_TACTICS,"AI SaaS economics: if AI deeply integrated domain-specific features then AI cost is only 20% of perceived value. Customers pay for solution not API wrapper. Hybrid pricing (project $2.5K-$15K + monthly $2K-$8K) working for AI agencies.",HIGH,NOW,PENDING_REVIEW,MM051_AI_AUTOMATION_AGENCY|MM026_AI_WRAPPER|MM027_MICRO_SAAS,N003_tech|N004_agencies,82,"Key pricing insight: AI cost = 20% of value when deeply integrated. Charge for outcome not API calls. Hybrid pricing model working. Setup fee + monthly retainer.",None,AUTHENTIC,N/A,"Price AI services on outcome not API cost. Setup $2.5K-$15K + retainer $2K-$8K/mo. AI cost is 20% of customer-perceived value. Deep integration into workflows.",None,2026-02-05
ALPHA10534,r/Entrepreneur + AI agency Reddit success,https://callin.io/ai-automation-agency-reddit/,MONETIZATION,"AI automation agency: Reddit success story - former call center supervisor to 27 clients and $40K MRR in 18 months (AI voice assistants for FAQ). Another: AI sales pitch gen for real estate agents scaled to $25K/mo with 1 VA.",HIGHEST,NOW,PENDING_REVIEW,MM051_AI_AUTOMATION_AGENCY|MM062_FRACTIONAL_EXEC_SERVICE,N003_tech|N004_agencies,90,"Two validated case studies. $40K MRR from AI voice assistants (niche: FAQ handling). $25K/mo from AI sales pitch gen for real estate (1 VA only). Both demonstrate: pick ONE industry become expert.",Reddit success stories may be embellished,AUTHENTIC,FALSE,"Pick one niche for AI automation agency. Build demo video of automation solving their problem. Send unsolicited demo videos (not cold calls). Target $2K-8K/mo per client retainer.",None,2026-02-05
ALPHA10535,r/growthhacking + Reddit/AI SEO,https://koanthic.com/en/reddit-ai-search-complete-seo-optimization-guide-2026/,SEO_GEO_ASO,"Reddit citations in AI overviews surged from 1.3% to 7.15% in 3 months. Some categories show Reddit cited 14-38% of the time by AI. Reddit is now critical for GEO (Generative Engine Optimization).",HIGHEST,NOW,PENDING_REVIEW,CF001_CONTENT_FARM|MM003_AFFILIATE_SITES,N003_tech,92,"Reddit's share of AI citations is growing exponentially. 1.3% to 7.15% in 3 months. Being cited on Reddit = being cited by ChatGPT/Perplexity/Gemini. Reddit GEO is alpha.",None,AUTHENTIC,N/A,"Post authoritative content on Reddit. Reddit is cited by AI 7-38% of time depending on category. Reddit posts = GEO optimization = free AI referral traffic. Target high-authority subreddits.",None,2026-02-05
ALPHA10536,r/juststart + SEO evolution,https://vertu.com/lifestyle/seo-is-evolving-the-definitive-guide-to-aio-geo-and-aeo-in-2026/,SEO_GEO_ASO,"SEO evolved into 3 pillars: SEO (Google ranking) + AEO (AI answer optimization) + GEO (generative engine optimization). E-E-A-T is now critical across all three. First-hand experience + specific data = what AI cites.",HIGH,NOW,PENDING_REVIEW,CF001_CONTENT_FARM|MM003_AFFILIATE_SITES|MM024_DIGITAL_PRODUCTS,N003_tech,80,"Must optimize for all three: traditional SEO + AI answers + generative AI. First-hand experience and specific numbers are what AI models cite. Our build-in-public content naturally has E-E-A-T signals.",None,AUTHENTIC,N/A,"Optimize all content for SEO + AEO + GEO. Include first-hand experience and specific numbers. E-E-A-T compliance. Reddit posts count toward GEO. Structure content for AI citation.",None,2026-02-05
ALPHA10537,r/Solopreneur + email marketing ROI,https://entrepreneurloop.com/solopreneur-guide-to-scaling-2026/,GROWTH_HACK,"Email marketing ROI: $1 invested = $44 return (4400% ROI). Exit-intent popups linked to lead magnets = fastest list growth. Strongest solo companies behave like media businesses first product businesses second.",HIGH,NOW,PENDING_REVIEW,MM015_NEWSLETTER|MM002_INFO_PRODUCTS|CF001_CONTENT_FARM,N003_tech|N001_ecommerce,85,"$44 return per $1 invested in email is massive. Must prioritize email list building across all channels. Exit-intent popup on every landing page. Media-first approach aligns with PRINTMAXX model.",None,AUTHENTIC,N/A,"Add exit-intent popup to all landing pages. Lead magnet = free template/checklist. Build email list. $44 ROI per $1 invested. Media company first product company second.",None,2026-02-05
ALPHA10538,r/indiehackers + Product Hunt launch,https://www.indiehackers.com/post/idea-to-first-sale-in-4-weeks-my-solopreneurship-story-5c18a9db31,GROWTH_HACK,"Idea to first sale in 4 weeks: ShipThat.App. 24 waitlist signups from landing page. Launched on Product Hunt from train in Italy. 5 sales on Black Friday weekend. Key: focused visuals for PH launch + X engagement with 70 followers.",HIGH,NOW,PENDING_REVIEW,MM001_APP_FACTORY|MM024_DIGITAL_PRODUCTS,N003_tech,72,"4 weeks idea to sale is rapid timeline. Product Hunt still works for launches. Even 70 Twitter followers can drive sales with good content. Waitlist validates before building. PH + Twitter + email = launch stack.",None,AUTHENTIC,CLAIMED,"Launch on Product Hunt + X/Twitter simultaneously. Build waitlist first (validate demand). 4-week sprint from idea to sale. Focus on visuals for PH. Email waitlist on launch day.",None,2026-02-05
ALPHA10539,r/passive_income + Gumroad/Whop,https://whop.com/blog/best-digital-products-to-sell/,MONETIZATION,"Whop creators sold $2B+ total. Best sellers: courses/coaching ($100-thousands per client) > templates/toolkits > personal finance products > wellness guides > 3D models. Digital products market projected $416B by 2030.",HIGH,NOW,PENDING_REVIEW,MM024_DIGITAL_PRODUCTS|MM002_INFO_PRODUCTS,N003_tech|N002_fitness|N001_faith|N005_finance,82,"Whop $2B+ in creator sales validates platform. Courses/coaching highest per-customer revenue. Templates lowest barrier. Our stack: templates first (quick wins) then courses (higher revenue).",None,AUTHENTIC,N/A,"Start with Gumroad templates ($7-19). Graduate to Whop courses ($47-97). Package existing PRINTMAXX methods. Target solopreneur audience. Templates > courses > coaching ladder.",None,2026-02-05
