alpha_id,source,source_url,category,tactic,roi_potential,priority,status,applicable_methods,applicable_niches,synergy_score,reviewer_notes,quality_issues,engagement_authenticity,earnings_verified,extracted_method,compliance_notes,date_added
ALPHA10560,@levelsio,https://x.com/levelsio/status/1899596115210891751,APP_FACTORY,"Vibe-coded flight simulator (fly.pieter.com) hit $0 to $1M ARR in 17 days. Built in 3 hours with Cursor. Monetized via in-game ad blimps ($1K each) + F16 plane sales ($29.99). 320K players. Free-to-play browser MMO.",HIGHEST,NOW,PENDING_REVIEW,"MM001_APP_FACTORY,MM027_MICRO_SAAS,MM050_MCP_SERVER_PRODUCTS","N003_tech,N016_gaming",92,"Verified revenue via public tweets. Model: vibe-code a game in hours then monetize via virtual goods + sponsor ad placements. Replicable pattern for any niche game.",None,AUTHENTIC,SCREENSHOT,"Build browser games with AI coding tools (Cursor/Claude Code) in hours. Monetize with virtual goods ($29.99 planes) + sponsor blimps ($1K each). Free-to-play drives volume.",None,2026-02-05
ALPHA10561,@levelsio,https://x.com/levelsio/status/1961611241908044048,MONETIZATION,"X/Twitter creator program paying $11.5K/mo: $7870 ad rev share + $2683 X subs revenue. Record month. Consistent $9-11K range across multiple months.",HIGH,SOON,PENDING_REVIEW,"CF001_CONTENT_FARM,MM015_NEWSLETTER,AI001_NICHE_EXPERTS","N003_tech,N001_ai_utilities",78,"Verified across multiple monthly reports. Requires large following (600K+). Still shows X monetization is real and scaling. Good benchmark for content accounts.",None,AUTHENTIC,SCREENSHOT,"Build X following to 100K+. Apply for X creator program. Post consistently (daily). Revenue scales with impressions. Ad rev share + subscription model stacks.",None,2026-02-05
ALPHA10562,@levelsio,https://x.com/levelsio/status/1837707857372106992,MONETIZATION,"$420K/mo revenue portfolio breakdown: PhotoAI $161K + ReadMAKE $93K + Nomads $61K + InteriorAI $43K + merch/X $34K + RemoteOK $29K. 80% profit margin. Zero employees.",HIGHEST,BACKLOG,PENDING_REVIEW,"MM001_APP_FACTORY,MM027_MICRO_SAAS,MM025_DIGITAL_PRODUCTS","N001_ai_utilities,N003_tech",95,"Peak was post-Lex Fridman appearance (2.5x spike). Normal run rate ~$140K/mo. Still proves: portfolio of 6 small products > 1 big product. 80% margins because solo + minimal infra.",None,AUTHENTIC,SCREENSHOT,"Portfolio model: 5-7 products each earning $20-60K/mo. Solo operation. Shared VPS infrastructure ($500/mo total). AI products have 99%+ margins (GPU cost ~$200/mo for 21K designs). Scale via media appearances.",None,2026-02-05
ALPHA10563,@levelsio,https://x.com/levelsio/status/1773443837320380759,APP_FACTORY,"Interior AI: 99%+ profit margins. GPU bill $200/mo for 21000 designs/mo = $0.01/render. Hosted on shared VPS ~$50/mo. 1000+ recurring customers at $40K MRR.",HIGHEST,NOW,PENDING_REVIEW,"MM001_APP_FACTORY,MM027_MICRO_SAAS,MM026_AI_WRAPPER","N001_ai_utilities,N020_lifestyle",90,"Verified cost structure. Key insight: AI image generation is nearly free at scale. Use open-source models on cheap GPUs. Shared infrastructure across products slashes per-product cost to near zero.",None,AUTHENTIC,SCREENSHOT,"Build AI wrapper tool for specific niche (interior design). Open-source SD models keep GPU costs at $0.01/render. Shared VPS across products. Subscription model for recurring revenue. 99% margins achievable.",None,2026-02-05
ALPHA10564,@gregisenberg,https://x.com/gregisenberg/status/2006382073418752250,GROWTH_HACK,"20 mega shifts making 2026 best startup era in 30 years: (1) Open-source AI on cheap robots (2) SaaS imploding as AI replicates $500K software for pennies (3) Outcome-based pricing eating subscriptions (4) Claude Code killed engineering bottleneck (5) App recombination era.",HIGHEST,NOW,PENDING_REVIEW,"MM001_APP_FACTORY,MM027_MICRO_SAAS,MM051_AI_AUTOMATION_AGENCY,MM056_AI_WORKFLOW_MARKETPLACE","N001_ai_utilities,N003_tech",88,"Greg sold 3 startups and backed seed-to-unicorn companies. These are directional signals not tactics. Key actionable: build vertical AI workflows by recombining 3-4 existing AI tools. Outcome-based pricing = new SaaS model.",None,AUTHENTIC,N/A,"Build vertical AI tools by recombining existing AI APIs. Price on outcomes not subscriptions. Use Claude Code/Cursor to ship MVP same day. Target specific industry workflows (legal/finance/marketing).",None,2026-02-05
ALPHA10565,@gregisenberg,https://x.com/gregisenberg/status/2005317303370486015,APP_FACTORY,"How to build mobile apps with AI in 2026: (1) Claude Code/Rork/Vibecode for MVP same day (2) Claude Code for edge cases (3) Design core interaction for 10-second screen recording (4) Use short-form video as live feedback channel (5) Ship-demo-observe-tighten-charge-repeat.",HIGH,NOW,PENDING_REVIEW,"MM001_APP_FACTORY,MM027_MICRO_SAAS,MM069_AI_GENERATED_MERCH","N001_ai_utilities,N003_tech,N002_fitness,N004_faith",85,"Specific 31-point framework. Key insight: paste TikTok/Reels comments into Claude Code to cluster feedback into product changes. Demo video IS the marketing. Ship smallest change that makes demo clearer then re-record same day.",None,AUTHENTIC,N/A,"MVP same day with Claude Code/Rork/Vibecode. Record 10-sec demo. Post to short-form platforms. Read comments. Paste into Claude Code for product iteration. Re-record. Charge when momentum compounds. Video = feedback channel not just marketing.",None,2026-02-05
ALPHA10566,@gregisenberg,https://x.com/gregisenberg/status/1984641062527197234,GROWTH_HACK,"What's coming: (1) AI kills 9-5 for millions (2) Livestreaming explodes 100x as only way to prove you're real (3) Portfolio of agent-assisted micro-businesses replaces jobs (4) Most valuable 2026 skill: knowing when NOT to use AI. Human touch trades at 20x premium.",HIGH,SOON,PENDING_REVIEW,"MM001_APP_FACTORY,CF001_CONTENT_FARM,MM062_FRACTIONAL_EXEC_SERVICE","N003_tech,N001_ai_utilities",80,"Directional signal. Actionable: (a) Build tools for the 'forced freelancer' wave (b) Livestreaming infrastructure/tools (c) Position human-touch services at premium pricing (d) AI agent portfolio management tools.",None,AUTHENTIC,N/A,"Position for forced-freelancer wave. Build agent-assisted micro-business tools. Invest in livestreaming (proof-of-human). Offer human-touch premium services alongside AI automation. Portfolio of small AI apps model.",None,2026-02-05
ALPHA10567,@gregisenberg,https://x.com/gregisenberg/status/1993309765426962612,TOOL_ALPHA,"2026 AI predictions: (1) SaaS and agents merge completely (2) Google crushes it while OpenAI pivots social (3) AI companions $50B market (4) Voice-first interfaces dominate (5) Micro-companies of 1-3 people replace traditional businesses.",HIGH,SOON,PENDING_REVIEW,"MM001_APP_FACTORY,MM056_AI_WORKFLOW_MARKETPLACE,MM051_AI_AUTOMATION_AGENCY","N001_ai_utilities,N003_tech",82,"43 total predictions. Key actionable: every SaaS must become agent platform. AI companion apps are massive (check app store rankings at 2am). Voice interfaces = next UI paradigm. Micro-company tools = infrastructure play.",None,AUTHENTIC,N/A,"Build SaaS with agent capabilities built in. AI companion/relationship apps = $50B TAM. Voice-first interfaces for specific verticals. Tools for micro-companies (1-3 person businesses running AI agents).",None,2026-02-05
ALPHA10568,@gregisenberg,https://x.com/gregisenberg/status/2019090260697767970,GROWTH_HACK,"SaaS stock correction coming. AI productivity gains lead to 100K+ SaaS layoffs in 2026. Laid-off workers become founders. 'Portfolio of apps' becomes common phrase. Massive supply of technical talent entering indie hacking.",HIGH,SOON,PENDING_REVIEW,"MM001_APP_FACTORY,MM027_MICRO_SAAS,MM025_DIGITAL_PRODUCTS","N001_ai_utilities,N003_tech",75,"Directional signal. Actionable: (a) Build for the wave of new founders (tools/templates/courses) (b) Hire from the talent surplus (c) Position now before competition floods in (d) Info products teaching 'portfolio of apps' model.",None,AUTHENTIC,N/A,"Build tools/templates for incoming wave of laid-off-turned-founders. Info products on 'portfolio of apps' model. Hire technical talent at discount during surplus. Move fast before flood of new competitors.",None,2026-02-05
ALPHA10569,@gregisenberg,https://x.com/gregisenberg/status/2018679347717025920,APP_FACTORY,"YC Spring 2026 Request for Startups breakdown: (1) Cursor for product managers (AI decides what to build not just how) (2) AI-native systems synthesizing customer feedback into product requirements (3) Agents that ship features autonomously.",HIGH,BACKLOG,PENDING_REVIEW,"MM001_APP_FACTORY,MM056_AI_WORKFLOW_MARKETPLACE,MM051_AI_AUTOMATION_AGENCY","N001_ai_utilities,N003_tech",80,"YC signals = where VC money flows. Cursor-for-X architecture = default for knowledge work. Build AI PM tools that take customer calls + usage data and output 'build this next' + tasks. Vertical applications of this pattern.",None,AUTHENTIC,N/A,"Build 'Cursor for X' tools for non-engineering knowledge work (legal/finance/marketing/sales/ops). AI PM tool that ingests customer feedback and outputs prioritized features + agent-executable tasks.",None,2026-02-05
ALPHA10570,@marc_louvion,https://x.com/marc_louvion/status/1982837690379960445,APP_FACTORY,"Day 375 growing SaaS to $1M. 40% MoM growth. $94.8K/mo across portfolio: CodeFast $73.8K + ShipFast $31.5K + IndiePage $2K + DataFast $1.7K + 7 other micro-products. Strategy: launch many small products and share results publicly.",HIGHEST,NOW,PENDING_REVIEW,"MM001_APP_FACTORY,MM025_DIGITAL_PRODUCTS,MM027_MICRO_SAAS","N003_tech,N001_ai_utilities",88,"Feb 2025 revenue breakdown verified via public tweet. CodeFast is an info product (coding course) not SaaS. Key insight: info products 10x easier to sell than SaaS. Portfolio of 12 products diversifies risk. 40% MoM growth on flagship.",None,AUTHENTIC,SCREENSHOT,"Portfolio approach: 12 micro-products. Info products (courses) outsell SaaS 10x. Share revenue publicly to build audience. Use audience to launch next product. Flywheel: launch-share-grow-launch.",None,2026-02-05
ALPHA10571,@marc_louvion,https://x.com/marc_louvion/status/1919409762653065670,GROWTH_HACK,"Grew Twitter to 170K followers with 3 steps: (1) Launch tiny startups (2) Share results (3) Repeat. Built DataFast analytics tool to share your metrics with a public link. Audience grows when you start winning publicly.",HIGH,NOW,PENDING_REVIEW,"CF001_CONTENT_FARM,MM025_DIGITAL_PRODUCTS,MM015_NEWSLETTER","N003_tech,N001_ai_utilities",82,"Verified follower count. Simple but effective: build-in-public as distribution strategy. DataFast tool makes sharing analytics frictionless. Each product launch = content event = follower growth = next product audience.",None,AUTHENTIC,N/A,"Build in public. Every product launch = content event. Share real numbers (revenue/users/growth). Build tools that make sharing results frictionless (DataFast-style). Audience from Product A becomes customers for Product B.",None,2026-02-05
ALPHA10572,@marc_louvion,https://x.com/marc_louvion/status/1863133982885573118,MONETIZATION,"Info products 10x easier to sell than SaaS. CodeFast course made $92K in 2 days at launch. 3 reasons: (1) Universal problem (everyone wants to learn to code) (2) Lots of social proof from building in public (3) Built-in audience from prior products.",HIGHEST,NOW,PENDING_REVIEW,"MM002_INFO_PRODUCTS,MM025_DIGITAL_PRODUCTS","N003_tech,N001_ai_utilities",85,"Verified $92K in 2 days. Key: course priced at $169. Universal pain point + existing audience + social proof = explosive launch. Replicable for any skill where you have proven results.",None,AUTHENTIC,SCREENSHOT,"Info products > SaaS for initial revenue. Price at $99-199 range. Target universal problems. Build audience first via building in public. Use social proof from real products. Launch to existing audience for explosive day-1 revenue.",None,2026-02-05
ALPHA10573,@dvassallo,https://x.com/dvassallo/status/1912506861552869409,MONETIZATION,"Sold Small Bets community to Gumroad for $3.6M. Deal: 50% cash ($1.8M) + 50% stock options. Community had 6692 lifetime members. Vassallo continues running it as autonomous subsidiary. Open-sourced the Campfire platform.",HIGHEST,BACKLOG,PENDING_REVIEW,"MM002_INFO_PRODUCTS,MM025_DIGITAL_PRODUCTS,MM069_AI_GENERATED_MERCH","N003_tech,N001_ai_utilities",80,"Verified via multiple sources. Key insight: communities are acquirable assets. $3.6M / 6692 members = $537/member lifetime value. Build community + course + open-source platform = triple asset value. Gumroad acquiring communities to become education platform.",None,AUTHENTIC,VERIFIED,"Build paid community around a methodology (small bets/portfolio approach). Open-source the platform to add enterprise value. Position for acquisition by larger platform. $537/member = benchmark for community valuation.",None,2026-02-05
ALPHA10574,@dvassallo,https://x.com/dvassallo/status/1970489062185185497,TOOL_ALPHA,"Small Bets platform open-sourced (modified Campfire). GitHub bounties for contributors. Community-driven development. Strategy: open-source your platform adds enterprise value and creates ecosystem around your brand.",HIGH,BACKLOG,PENDING_REVIEW,"MM001_APP_FACTORY,MM027_MICRO_SAAS","N003_tech,N001_ai_utilities",70,"Open-source strategy contributed to acquisition value. Campfire fork = purpose-built community platform. Bounties attract developers. Open-source creates lock-in paradoxically because community builds on your platform.",None,AUTHENTIC,N/A,"Open-source your community platform. Use GitHub bounties to attract contributors. Modified Campfire = custom community experience. Open-source adds enterprise value for potential acquirers.",None,2026-02-05
ALPHA10575,Instantly.ai Benchmark Report,https://instantly.ai/cold-email-benchmark-report-2026,OUTBOUND,"2026 Cold Email Benchmarks from billions of emails analyzed: avg reply rate 3.43%. Top performers >10%. Top quartile 5.5%. Key success factors: micro-segmentation + problem-focused messaging + frequent A/B testing + smart automation (auto-triaging replies + auto-scheduling follow-ups).",HIGHEST,NOW,PENDING_REVIEW,"MM007_COLD_OUTBOUND,MM029_LOCAL_LEAD_GEN,MM063_LEAD_LIST_CURATION","N003_tech,N001_ai_utilities,N004_faith",90,"Industry benchmark report from Instantly (major cold email platform). Data from billions of emails. Actionable: target 5.5%+ reply rate. Must use micro-segmentation. Problem-first messaging. A/B test constantly. Auto-triage replies.",None,AUTHENTIC,N/A,"Cold email 2026: start new domains at 5-10 emails/day. Ramp over 4-6 weeks. Micro-segment lists. Problem-first messaging under 80 words. Single CTA. Frequent A/B testing. Auto-triage replies. Target 5.5% reply rate (top quartile).",None,2026-02-05
ALPHA10576,@alxberman,https://www.alxberman.com/sales-page1721143358150,OUTBOUND,"The Baking Method: year-long cold email follow-up sequence. Automated 12-month nurture. Key insight: most deals close in follow-up months 3-12 not initial send. Prevents getting ghosted. Proven across manufacturing to tech services.",HIGH,SOON,PENDING_REVIEW,"MM007_COLD_OUTBOUND,MM029_LOCAL_LEAD_GEN,MM051_AI_AUTOMATION_AGENCY","N003_tech,N001_ai_utilities",75,"Alex Berman has 100K+ YouTube subscribers and 14K+ agencies trained. Method sold at $497. Key: most cold emailers give up after 3-5 follow-ups. 12-month sequence captures deals competitors abandon. Automation makes this zero-effort after setup.",Selling to cold email audience so method claims need verification,AUTHENTIC,FALSE,"Build 12-month automated follow-up sequence. Most deals close months 3-12 not on first email. Use Instantly/Smartlead for automation. Set up once then forget. Captures deals competitors abandon after week 2.",None,2026-02-05
ALPHA10577,@dickiebush,https://www.ship30for30.com/,CONTENT_FORMAT,"Ship 30 for 30: daily writing challenge turned into $5M+ business. Started at $50/cohort in 2021 now $999/cohort ($1999 premium). 326K Twitter followers in 30 months. Framework: everything starts as tweet then expand to atomic essay then long-form.",HIGHEST,BACKLOG,PENDING_REVIEW,"MM002_INFO_PRODUCTS,MM025_DIGITAL_PRODUCTS,MM015_NEWSLETTER","N003_tech,N001_ai_utilities",78,"$5M from single digital product verified via multiple interviews. Pricing evolution from $50 to $999 = 20x increase as audience grew. Key: cohort model creates urgency + community + accountability. Lean writing system: tweet-first then expand.",Selling course about making money from courses. Earnings claim HIGH but verified via multiple sources,AUTHENTIC,SCREENSHOT,"Cohort-based writing course model. Start at low price ($50) build social proof then raise (now $999). Everything starts as tweet. Lean writing: tweet > atomic essay > long-form. Daily publishing builds audience. 326K followers in 30 months via consistent daily shipping.",None,2026-02-05
ALPHA10578,@BLUECOW009,https://github.com/NeoVertex1/SuperPrompt,TOOL_ALPHA,"SuperPrompt: open-source XML agent prompt that makes Claude generate novel ideas. Uses XML tags + mathematical/philosophical concepts to explore areas of the model usually unexplored. Forces out-of-the-box thinking via structured prompt engineering.",HIGH,NOW,PENDING_REVIEW,"MM001_APP_FACTORY,MM033_PROMPT_ENGINEERING,MM066_CUSTOM_GPT_BUSINESS","N001_ai_utilities,N003_tech",72,"GitHub repo (NeoVertex1/SuperPrompt). Technical tool for prompt engineering. Can be used to generate novel product ideas or content angles. Works best with Claude. Practical application: use as system prompt for brainstorming sessions.",None,AUTHENTIC,N/A,"Use SuperPrompt (open-source XML agent) as system prompt for Claude brainstorming sessions. Forces LLM into novel reasoning patterns. Apply to: product ideation + content angle generation + problem-solving. Free tool on GitHub.",None,2026-02-05
ALPHA10579,@zephyr_z9,https://x.com/zephyr_z9/status/2003157047987315149,GROWTH_HACK,"2026 sector calls: (1) Solar energy stocks up 50-60% already (2) Testing and packaging equipment suppliers up (3) Google CAPEX $111B in 2026 (+29% YoY) (4) DRAM demand from OpenAI 900K WPM by 2029 (5) SanDisk won Google eSSD contract ramping 1H 2026.",MEDIUM,BACKLOG,PENDING_REVIEW,"MM012_ALGO_TRADING,MM064_DEPIN_NODE_OPERATOR","N014_stocks,N013_crypto",65,"Technical semiconductor analysis. Not directly actionable for solopreneur ops but relevant for: (a) investment portfolio allocation (b) understanding AI infrastructure buildout trajectory (c) content creation for finance niche accounts.",None,AUTHENTIC,N/A,"Sector investing signals: solar energy + testing/packaging equipment + DRAM suppliers benefiting from AI infrastructure buildout. Google CAPEX $111B in 2026. Use for stock/crypto content creation and personal portfolio allocation.",None,2026-02-05
ALPHA10580,@dannypostmaa,https://x.com/dannypostmaa/status/1819566233450434853,APP_FACTORY,"Comfyflows marketplace for ComfyUI workflows. Built and launched in 26 hours. Features: find/share/sell workflows + run as API. ComfyUI rebuilt their Python pipeline to be 2x faster. Marketplace model = other people create the product you just provide the platform.",HIGH,SOON,PENDING_REVIEW,"MM001_APP_FACTORY,MM056_AI_WORKFLOW_MARKETPLACE,MM027_MICRO_SAAS","N001_ai_utilities,N003_tech",80,"Danny Postma (HeadshotPro founder) built marketplace in 26 hours. Key insight: marketplace model where community creates content/workflows and you take a cut. ComfyUI is dominant open-source AI image pipeline. Workflow marketplace = sell pickaxes in gold rush.",None,AUTHENTIC,N/A,"Build marketplace for AI tool workflows/templates (ComfyUI/n8n/Make). 26-hour build. Community creates the product. You take platform cut. Sell pickaxes in AI gold rush. Target: creators who want to monetize their workflows.",None,2026-02-05
ALPHA10581,@dannypostmaa,https://x.com/dannypostmaa/status/1926128390127472651,GROWTH_HACK,"Transition from solopreneur to team. Key learning: shadowing other remote team structures before hiring. Scaling from solo to team is the hardest transition. HeadshotPro growth required hiring but the mindset shift is what matters most.",MEDIUM,BACKLOG,PENDING_REVIEW,"MM001_APP_FACTORY,MM051_AI_AUTOMATION_AGENCY","N003_tech,N001_ai_utilities",60,"Honest about difficulties scaling. Not a tactical framework but a directional signal: when to hire and how to transition. Relevant for PRINTMAXX when scaling past solo capacity.",None,AUTHENTIC,N/A,"When scaling past solo capacity: shadow other remote teams before hiring your own. Study their structures. Mindset shift matters more than process. Start with contractors before full-time.",None,2026-02-05
ALPHA10582,@godofprompt,https://www.godofprompt.ai/prompt-engineering-guide,TOOL_ALPHA,"God of Prompt platform: curated prompt engineering products with lifetime updates. Structured prompt engineering boosts AI model accuracy by up to 25%. Key prediction: 60% of Fortune 500 will integrate prompt engineering into AI strategies by 2026.",MEDIUM,BACKLOG,PENDING_REVIEW,"MM033_PROMPT_ENGINEERING,MM066_CUSTOM_GPT_BUSINESS,MM025_DIGITAL_PRODUCTS","N001_ai_utilities,N003_tech",68,"Platform selling prompt bundles. 25% accuracy improvement stat from blockchain.news (needs verification). Actionable: prompt engineering products (templates/guides/courses) remain viable digital product category. Enterprise demand growing.",Quality of 25% claim unclear - sourced from blockchain.news aggregator,AUTHENTIC,FALSE,"Sell prompt engineering products (bundles/guides/templates). Enterprise demand growing. Structured prompts boost accuracy ~25%. Package as Gumroad digital products at $27-97 range. Lifetime updates model creates recurring value perception.",None,2026-02-05
ALPHA10583,@thesamparr,https://x.com/thesamparr,MONETIZATION,"Sam Parr model: sold The Hustle to HubSpot. Now co-founded Hampton (high-end entrepreneur community). My First Million podcast drives deal flow. Pattern: media company > exit > high-ticket community > podcast flywheel.",HIGH,BACKLOG,PENDING_REVIEW,"MM002_INFO_PRODUCTS,MM015_NEWSLETTER,MM061_PODCAST_LEAD_ENGINE","N003_tech,N001_ai_utilities",75,"Verified exit (HubSpot acquisition of The Hustle). Hampton = vetted membership community for entrepreneurs/founders/CEOs. Pattern: build audience via newsletter > exit > reinvest into premium community > use podcast for deal flow and authority.",None,AUTHENTIC,VERIFIED,"Newsletter-to-exit pipeline: build newsletter audience > monetize > exit to larger company > reinvest into premium community ($5K+/yr membership). Use podcast as deal flow + authority engine. Media company = startup with built-in distribution.",None,2026-02-05
ALPHA10584,@gregisenberg,https://x.com/gregisenberg/status/1906697683089101113,APP_FACTORY,"ChatGPT 4o image gen is as big as the ChatGPT launch itself. Will birth 1000+ businesses doing $1-100M/year in vertical software. We're in the 'MP3 Napster era' of content. Millions of creators don't realize their back catalog is being consumed by AI.",HIGHEST,NOW,PENDING_REVIEW,"MM001_APP_FACTORY,MM026_AI_WRAPPER,MM056_AI_WORKFLOW_MARKETPLACE,MM069_AI_GENERATED_MERCH","N001_ai_utilities,N003_tech,N020_lifestyle",88,"Two distinct insights: (1) Image gen = massive vertical software opportunity (build niche image tools like levelsio's InteriorAI) (2) Creator content being consumed by AI = new rights/licensing business opportunity. Both are HIGHEST ROI.",None,AUTHENTIC,N/A,"Build vertical image generation tools for specific niches (interior design/real estate/fashion/food). ChatGPT 4o image gen = platform shift. Also: creator content licensing/protection tools = emerging market. 1000+ $1-100M businesses to be built.",None,2026-02-05
