alpha_id,source,source_url,category,tactic,roi_potential,priority,status,applicable_methods,applicable_niches,synergy_score,reviewer_notes,quality_issues,engagement_authenticity,earnings_verified,extracted_method,compliance_notes,date_added
ALPHA1419,@levelsio,https://x.com/levelsio/status/1899596115210891751,APP_FACTORY,"fly.pieter.com went from $0 to $1M ARR ($87K MRR) in just 17 days. First project ever to go up this fast. 320K people played in first 17 days. Speed to market + viral mechanics + public building = rapid scaling.",HIGHEST,IMMEDIATE,PENDING_REVIEW,MM001 MM006,ALL,98,Verified revenue from levelsio public dashboard. Fastest product launch in indie hacking history.,,AUTHENTIC,TRUE,Build fast ship public add viral mechanics (leaderboard) let users compete,,2026-02-04
ALPHA1420,@levelsio,https://x.com/levelsio/status/1837707857372106992,MONETIZATION,"$420K/mo total revenue at ~80% profit. Portfolio: PhotoAI $161K/m RemoteOK $93K/m NomadList $61K/m Interior AI $43K/m other $34K/m. Zero employees. One-person portfolio approach proven at scale.",HIGHEST,IMMEDIATE,PENDING_REVIEW,MM001 MM002,ALL,96,Verified from public revenue dashboard. 80% margins = $336K/mo profit solo. Portfolio diversification works.,,AUTHENTIC,TRUE,Build multiple products each solving one problem well compound portfolio over time,,2026-02-04
ALPHA1421,@gregisenberg,https://x.com/gregisenberg/status/2006382073418752250,PLATFORM_ARBITRAGE,"20 mega shifts making 2026 best time to build: 1) Hardware+AI unlocked 2) SaaS imploding (AI replicates $500K software for pennies) 3) Outcome-based pricing eating subscriptions 4) Community-first software-second 5) Prototyping instant (MVP 1x/week) 6) Superniche is new niche (costs 1/100th).",HIGHEST,IMMEDIATE,PENDING_REVIEW,ALL,ALL,95,Greg Isenberg sold 3 startups advised Reddit/TikTok. Framework for 2026 strategy.,,AUTHENTIC,N/A,Superniche targeting + community-first + outcome-based pricing + rapid prototyping,,2026-02-04
ALPHA1422,@gregisenberg,https://www.gregisenberg.com/,TOOL_ALPHA,"Ideabrowser.com community signals feature scans Reddit Facebook Groups and thousands of internet communities using AI agents to find startup ideas with high likelihood of success. Pipeline of validated problems with frustrated customers already lined up.",HIGH,THIS_WEEK,PENDING_REVIEW,MM001 MM002 MM004,ALL,88,Tool for validating market demand before building. Reduces build risk.,,AUTHENTIC,N/A,Use community signal tools to validate demand before building,,2026-02-04
ALPHA1423,Instantly.ai 2026 Benchmark,https://instantly.ai/cold-email-benchmark-report-2026,COLD_OUTBOUND,"Timeline hooks get 9.91-10.67% reply rate vs problem hooks 3.90-4.77%. Structure emails around compressed achievement windows. Example: Got 3 demos in 48 hours vs Struggling with low reply rates?",HIGHEST,IMMEDIATE,PENDING_REVIEW,MM007,ALL,94,Based on billions of emails analyzed. 2.5x improvement from hook change alone.,,AUTHENTIC,TRUE,Lead with timeline + specific result not problem statement,,2026-02-04
ALPHA1424,Instantly.ai 2026 Benchmark,https://instantly.ai/cold-email-benchmark-report-2026,COLD_OUTBOUND,"Smaller targeted campaigns (50 or fewer recipients) average 5.8% reply rate vs 2.1% for larger lists. Personalization depth + hyper-targeting = 2.76x better replies. Volume is dead precision wins.",HIGHEST,IMMEDIATE,PENDING_REVIEW,MM007,ALL,92,Validates micro-cohort approach. 50 hyper-targeted > 1000 generic.,,AUTHENTIC,TRUE,Segment into cohorts of 50 or fewer with deep personalization,,2026-02-04
ALPHA1425,Industry Consensus,https://instantly.ai/cold-email-benchmark-report-2026,COLD_OUTBOUND,"Email warming timeline increased to 14-21 days in 2026 (up from 7-14). Start 5-10/day then increase over 4-6 weeks. ESPs now weight engagement depth not just opens. Erratic volume = spam flag.",HIGH,IMMEDIATE,PENDING_REVIEW,MM007,ALL,85,Update all warmup documentation. Pre-warmed inbox services (DeliverOn/EmailBison) skip this.,,AUTHENTIC,N/A,14-21 day warmup minimum 5-10/day start 4-6 week ramp,,2026-02-04
ALPHA1426,Smartlead,https://www.smartlead.ai/blog/ai-messaging-with-clay-smartlead,COLD_OUTBOUND,"Clay (150+ data providers for enrichment) + Smartlead (deliverability + scale) = AI personalization at scale. Top performers seeing 6x higher response rates. AI-driven reply detection categorizes and tailors follow-ups automatically.",HIGHEST,IMMEDIATE,PENDING_REVIEW,MM007,ALL,93,Enterprise-grade personalization for solo ops. 6x response rate improvement documented.,,AUTHENTIC,FALSE,Clay for enrichment + Smartlead for sending + AI for personalization at scale,,2026-02-04
ALPHA1427,Industry Research,https://napolify.com/blogs/news/tiktok-shop-how-much,CONTENT_FARM,"Small TikTok creators under 50K followers get 30% click rate vs 7% for 100K-200K accounts. Micro-influencers hitting $80-$120 per thousand on TikTok Shop. Interest-based algo means follower count less critical than content resonance.",HIGHEST,IMMEDIATE,PENDING_REVIEW,MM006 CF001-CF013,N002_fitness N003_tech,96,Content farm strategy validated. Small accounts = higher engagement = better affiliate revenue.,,AUTHENTIC,TRUE,Build multiple small niche accounts (5K-50K) not one big account,,2026-02-04
ALPHA1428,Industry Research,https://www.blog.jonathansnow.com/p/my-10-predictions-for-ecommerce-in-2026,PLATFORM_ARBITRAGE,"TikTok Shop projected $30B GMV in US in 2026. Traditional pay-for-post/UGC influencer model is dead. Creative Volume and Creative Diversity are the two most important phrases of 2026.",HIGHEST,IMMEDIATE,PENDING_REVIEW,MM006 AI_INFLUENCER,ALL,94,Validates AI UGC factory approach. Volume of creative variants > single perfect ad.,,AUTHENTIC,FALSE,Create creative volume (many variants) not single perfect creative,,2026-02-04
ALPHA1429,@demirdjiantwins,https://x.com/demirdjiantwins/status/2010079231230054805,AI_INFLUENCER,"Linah AI + Nano Banana Pro + Fastmoss = fully automated UGC content factory. Turns proven TikTok Shop content into hyper-realistic AI UGC videos. Claims: CPMs under $0.10 no paid ads no creators no samples.",HIGH,THIS_WEEK,PENDING_REVIEW,AI001-AI008,ALL,88,Stack worth testing. CPM claims need verification. Fastmoss for research Nano Banana for visuals Linah for UGC videos.,,SUSPICIOUS,FALSE,Fastmoss (product research) + Nano Banana Pro (visuals) + Linah AI (UGC videos),,2026-02-04
ALPHA1430,RevenueCat,https://www.revenuecat.com/blog/growth/web-to-app-funnels/,APP_FACTORY,"Web-to-App adoption grew 77% YoY UA spend in channel up 54%. Route Facebook/TikTok ads to mobile-optimized web pages complete purchase on web (2-5% fees vs 30%) then redirect to app. Restores full attribution data post-iOS 14.5.",HIGHEST,IMMEDIATE,PENDING_REVIEW,MM001 MM092,ALL,98,HIGHEST synergy stack. Bypass 30% fees + restore attribution. Must implement for Lock Apps.,,AUTHENTIC,TRUE,Web landing page with payment > app download. Stripe fees (2-5%) vs App Store (30%),,2026-02-04
ALPHA1431,RevenueCat,https://www.revenuecat.com/blog/growth/hard-paywall-vs-soft-paywall/,MONETIZATION,"Median 14-day revenue approximately 8x higher for hard paywalls vs freemium. Retention: hard paywall 12.8% vs soft/freemium 9.3%. Higher refund rates (5.8%) but net positive. Works best for apps with clear immediate value.",HIGHEST,IMMEDIATE,PENDING_REVIEW,MM001,N001_faith N002_fitness,96,Validates hard paywall strategy for Lock Apps. 8x revenue multiplier is massive. Already shipped to biomaxx.,,AUTHENTIC,TRUE,Hard paywall from day 1 for apps with clear value proposition,,2026-02-04
ALPHA1432,Indie Hackers,https://www.indiehackers.com/post/tech/growing-a-portfolio-of-mobile-apps-to-185k-mo-hZ4hqICtByIljkiJECQv,APP_FACTORY,"Connor Burd: $185K/mo MRR from mobile app portfolio. Independent app studio focused on consumer subscription apps. Key: distribution from day 1 partner with influencers build around validated audiences. App Payout started with TikTok trend research.",HIGHEST,IMMEDIATE,PENDING_REVIEW,MM001,ALL,95,Verified via Indie Hackers interview. Distribution-first approach. Influencer partnerships for launch.,,AUTHENTIC,TRUE,Distribution first (influencer partnership before building) + consumer subscription focus,,2026-02-04
ALPHA1433,Indie Hackers,https://www.indiehackers.com/post/tech/from-failed-app-to-30-app-portfolio-making-22k-mo-in-less-than-a-year-myy3U7K9evxGOVOHti8s,APP_FACTORY,"Max Artemov: 30-app portfolio at $22K/mo built in less than 1 year. ASO-first approach: find keywords with popularity 20+ and difficulty under 60 build app around keyword use in title/subtitle/description. ASO boosted metrics 50%.",HIGHEST,IMMEDIATE,PENDING_REVIEW,MM001,ALL,94,ASO-first validation. Keyword research BEFORE building. 50% improvement from ASO alone. Goal: $100K MRR in 2026.,,AUTHENTIC,TRUE,ASO keyword research first build app around keyword 30-app portfolio strategy,,2026-02-04
ALPHA1434,Industry Research,https://blog.authoritytech.io/reddit-perplexity-geo-strategy-2026,SEO_GEO_ASO,"Reddit appears in 68% of AI search responses. #2 most visible site in Google US results (after Wikipedia). Reddit citations in AI overviews surged from 1.30% to 7.15% in Q2. Expected 75%+ citation rate by end of 2026.",HIGHEST,IMMEDIATE,PENDING_REVIEW,MM003 MM006,ALL,97,Reddit GEO is massive opportunity. Strategic Reddit presence = AI citation = organic discovery.,,AUTHENTIC,N/A,Create strategic Reddit presence for best X and comparison queries,,2026-02-04
ALPHA1435,Industry Research,https://www.wearefounders.uk/the-30-highest-valued-solo-startups-of-2026/,PLATFORM_ARBITRAGE,"Solo founders reaching $1M+ ARR with 0-3 employees becoming common. Anthropic CEO predicted first solo unicorn in 2026. 75% launched on Product Hunt 90% built audiences on Twitter 95% spent $0 on ads. Build-in-public + speed to market = primary moats.",HIGH,THIS_WEEK,PENDING_REVIEW,ALL,ALL,90,Validates solo founder approach. Build in public + Product Hunt + Twitter = distribution without ads.,,AUTHENTIC,FALSE,Build in public launch Product Hunt build Twitter audience zero ad spend,,2026-02-04
ALPHA1436,Industry Research,https://fliki.ai/blog/nano-banana-pro-review,TOOL_ALPHA,"Nano Banana Pro (Google Gemini 3) creates 4K AI images with flawless text rendering and reasoning. Combined with Veo 2 (cinematic scenes) and Kling (b-roll/transformations) covers all AI video production needs for 2026.",HIGH,THIS_WEEK,PENDING_REVIEW,AI001-AI008 MM006,ALL,88,Tool stack for AI content factory. Compare to current Leonardo + HeyGen + D-ID stack.,,AUTHENTIC,N/A,Nano Banana Pro (images) + Veo 2 (scenes) + Kling (b-roll) = full AI video pipeline,,2026-02-04
ALPHA1437,Tim Sweeney (Epic CEO),https://x.com/TimSweeneyEpic,PLATFORM_ARBITRAGE,"Epic Games Store offers 0% fee on first $1M revenue via web payments then 12% after (vs Apple/Google 30%). Post Epic vs Apple ruling US apps can link to external payment options. Web-to-app + Epic = massive fee savings.",HIGHEST,IMMEDIATE,PENDING_REVIEW,MM001,ALL,94,0% to $1M is significant. Combined with web-to-app funnel saves 30%+ on all revenue up to $1M.,,AUTHENTIC,TRUE,Web payments via Epic Games Store for 0% fees up to $1M revenue,,2026-02-04
ALPHA1438,Gartner,https://www.gartner.com,EMERGING_PLATFORM,"Gartner projects 40% of enterprise software will have AI agents by end of 2026 (8x explosion from current). Build AI-native not AI-added. Agentic AI creating new class of solo unicorns.",HIGHEST,IMMEDIATE,PENDING_REVIEW,MM051 MM056,ALL,92,AI agent infrastructure is the opportunity. Build tools/platforms for AI agents not just AI-powered tools for humans.,,AUTHENTIC,N/A,Build for AI agent economy not just AI-powered human tools,,2026-02-04
