ALPHA9035,@karpathy,https://x.com/karpathy/status/2004607146781278521,AI_CODING,"Vibe coding phase shift: 80% agent coding / 20% manual edits (reversed from Nov 2025). 'Magnitude 9 career earthquake' in software engineering. New programmable layer: agents subagents prompts contexts memory modes permissions tools plugins skills hooks MCP LSP slash commands workflows IDE integrations. Programming in English now.",HIGHEST,IMMEDIATE,PENDING_REVIEW,ALL,ALL,98,Former Tesla AI Director. Coined 'vibe coding'. Published Jan 2026. Industry paradigm shift.,,AUTHENTIC,N/A,Phase shift: 80% agent coding vs 20% manual (reversed from Nov),,2026-02-04
ALPHA9036,@karpathy,https://karpathy.bearblog.dev/year-in-review-2025/,AI_CODING,"Claude Code = first convincing LLM Agent demonstration. Loopy tool use + reasoning for extended problem solving. Runs on your computer with private environment data context. Anthropic packaged it into CLI form factor. 'Little spirit/ghost that lives on your computer' - new paradigm of AI interaction distinct from website model.",HIGHEST,IMMEDIATE,PENDING_REVIEW,TOOL_ALPHA,ALL,96,Karpathy endorsement of Claude Code as breakthrough. Direct quote.,,AUTHENTIC,N/A,Claude Code = first convincing LLM Agent paradigm shift,,2026-02-04
ALPHA9037,@karpathy + Boris Cherny,https://x.com/karpathy/status/1915581920022585597,AI_CODING,"Anthropic internal: 100% code written by Claude Code. Boris Cherny (Claude Code creator): 'Pretty much 100% of our code is written by Claude Code. For me personally it has been 100% for two+ months now I dont even make small edits by hand.' Production validation from creators themselves.",HIGHEST,IMMEDIATE,PENDING_REVIEW,TOOL_ALPHA,ALL,97,Direct from Anthropic staff. 100% AI-written code in production.,,AUTHENTIC,TRUE,Anthropic: 100% of code written by Claude Code for 2+ months,,2026-02-04
ALPHA9038,@karpathy,https://karpathy.bearblog.dev/year-in-review-2025/,GROWTH_HACK,"2026 'slopacolypse' prediction: GitHub arXiv social media all digital platforms flooded with massive low-quality AI-generated content. Information filtering cost dramatically increases. Early movers with quality content have window before flood. Differentiation through authentic voice becomes critical.",HIGH,IMMEDIATE,PENDING_REVIEW,CONTENT_FARM,ALL,90,Content quality moat. Window before AI content flood closes.,,AUTHENTIC,N/A,2026 slopacolypse: AI content flood makes quality differentiation critical,,2026-02-04
ALPHA9039,@steipete,https://steipete.me/posts/2025/optimal-ai-development-workflow,TOOL_ALPHA,"Peter Steinberger AI workflow: Ghostty terminal + VS Code + Claude Code as main driver. After months of experimentation. Built Peekaboo (macOS MCP screenshot tool) + Poltergeist (universal build watcher). PSPDFKit founder (~$100M exit) now building AI dev tools. 'Came back from retirement to mess with AI.'",HIGHEST,IMMEDIATE,PENDING_REVIEW,AI_CODING,ALL,95,Verified $100M exit founder. Production AI workflow documented.,,AUTHENTIC,TRUE,Steinberger AI stack: Ghostty + VS Code + Claude Code main driver,,2026-02-04
ALPHA9040,@steipete,https://whatisskills.com/clawdbot/founder,AI_AGENTS,"OpenClaw/Clawdbot AI agent framework: 100K+ GitHub stars in 2 months. Node.js orchestration layer between LLMs and tools. 50+ integrations. Long-term memory. Runs locally - no cloud data. Created by Peter Steinberger. Renamed twice (Clawdbot -> Moltbot -> OpenClaw) after Anthropic trademark request.",HIGHEST,IMMEDIATE,PENDING_REVIEW,TOOL_ALPHA,ALL,97,100K stars fastest growing. First-mover in local AI agents.,,AUTHENTIC,N/A,OpenClaw: 100K GitHub stars in 2 months - local AI agent framework,,2026-02-04
ALPHA9041,@steipete,https://www.case-conf.com/speaker/peter-steinberger,AI_CODING,"Agentic engineering paradigm: 2026 = inflection point with AI tools breakthrough in 2025. Shift from writing code to orchestrating intelligent agents. '99% AI-generated code' live demos. 'Full-breadth developer' concept - orchestration over implementation. Speaking at case Conference 2026 Berlin.",HIGH,SOON,PENDING_REVIEW,AI_CODING,ALL,88,Conference talk confirms industry direction. Agentic engineering terminology.,,AUTHENTIC,N/A,Agentic engineering: orchestrating agents vs writing code paradigm,,2026-02-04
ALPHA9042,Moltbook,https://www.moltbook.com/,AI_AGENTS,"Moltbook AI social network: 1.5M AI agents signed up. Reddit-like format. Agents post comment argue joke upvote. Humans observe only. Created by Clawd Clawderberg (OpenClaw agent built by Matt Schlicht). Spawned 'crustafarianism' bot religion. Elon Musk: 'very early stages of singularity.'",HIGHEST,IMMEDIATE,PENDING_REVIEW,EMERGING_PLATFORMS,ALL,92,1.5M agents = massive scale. Study for AI discourse patterns.,,SUSPICIOUS,FALSE,Moltbook: 1.5M AI agents on Reddit-like social network,,2026-02-04
ALPHA9043,Moltbook Security,https://fortune.com/2026/02/02/moltbook-security-agents-singularity-disaster-gary-marcus-andrej-karpathy/,PLATFORM_ARB,"Moltbook security vulnerabilities: Wiz found unauthenticated database access in minutes. 17K humans control 1.5M agents (88 agents/person avg). No verification of agent vs human with script. Karpathy later called it 'dumpster fire' after initial enthusiasm. Gary Marcus skeptical.",HIGH,IMMEDIATE,PENDING_REVIEW,RISK_INTEL,ALL,90,Security research opportunity. Platform vulnerability = arbitrage window.,,AUTHENTIC,N/A,Moltbook security: 88 agents/person avg no verification system,,2026-02-04
ALPHA9044,RentAHuman,https://rentahuman.ai,AI_AGENTS,"RentAHuman.ai: AI agents hire humans for IRL tasks. 70K humans signed up. Built in one weekend by Alexander Liteplo (Risk Labs). MCP integration for AI agent frameworks. Tasks: shopping delivery meetings photography signatures. Crypto payment. 'Meatspace layer for AI.' First 130 signups included AI startup founders/CEOs.",HIGHEST,IMMEDIATE,PENDING_REVIEW,EMERGING_PLATFORMS,ALL,94,New market: AI-to-human task marketplace. MCP native integration.,,AUTHENTIC,N/A,RentAHuman: 70K humans available for AI agents to hire via MCP,,2026-02-04
ALPHA9045,@emollick,https://knowledge.wharton.upenn.edu/podcast/this-week-in-business/where-artificial-intelligence-stands-heading-into-2026/,AI_PRODUCTIVITY,"Ethan Mollick AI insights: 49% of jobs can use AI in 25%+ of tasks (up from 36% early 2025). 'Secret cyborgs' - 50%+ Americans use AI at work. 3x performance improvement on 20% of AI-assisted tasks (self-reported). Use AI for everything to learn what its good/bad at. Not just for technical people.",HIGHEST,IMMEDIATE,PENDING_REVIEW,AUTOMATION,ALL,95,Wharton research. 49% job AI-usability threshold crossed.,,AUTHENTIC,N/A,49% jobs can use AI in 25%+ tasks - secret cyborg phenomenon,,2026-02-04
ALPHA9046,Anthropic Economic Index,https://www.anthropic.com/research/anthropic-economic-index-january-2026-report,AI_PRODUCTIVITY,"Anthropic productivity forecast revision: Cut from 1.8pp to 1.0-1.2pp annual US labor productivity growth after analyzing real failure rates. Based on 1M Claude.ai + 1M API conversations Nov 2025. 52% augmentation / 48% automation split. AI helping people do jobs not replacing them.",HIGHEST,IMMEDIATE,PENDING_REVIEW,AI_PRODUCTIVITY,ALL,96,Anthropic internal data. Productivity boost halved from initial estimates.,,AUTHENTIC,TRUE,Anthropic cuts AI productivity forecasts in half after failure rate analysis,,2026-02-04
ALPHA9047,Anthropic Study,https://www.sovereignmagazine.com/education/anthropic-study-finds-ai-coding-assistants-speed-up-work-but-reduce-skills/,AI_PRODUCTIVITY,"AI coding deskilling: 17% lower quiz scores for AI-assisted developers vs manual coders. Study: 52 engineers learning Trio (Python async library). Gap = nearly 2 letter grades. Shen + Tamkin (Anthropic): AI 'not a shortcut to competence.' Skills formation inhibited.",HIGHEST,IMMEDIATE,PENDING_REVIEW,AI_CODING,ALL,94,RCT study design. Quantified skill reduction from AI assistance.,,AUTHENTIC,TRUE,AI coding assistants reduce skill mastery by 17% (2 letter grades),,2026-02-04
ALPHA9048,Anthropic Internal,https://www.anthropic.com/research/how-ai-is-transforming-work-at-anthropic,AI_PRODUCTIVITY,"Anthropic internal AI usage: 60% of work uses Claude. 50% productivity boost (2-3x increase from 2025). Slightly less time per task but considerably more output volume. Claude = first stop for questions that used to go to colleagues. Fewer mentorship/collaboration opportunities as result.",HIGHEST,IMMEDIATE,PENDING_REVIEW,AUTOMATION,ALL,93,Direct from Anthropic. 60% AI usage + 50% productivity boost internally.,,AUTHENTIC,TRUE,Anthropic: 60% work uses Claude 50% productivity boost fewer mentorship opps,,2026-02-04
ALPHA9049,MCP Foundation,https://www.anthropic.com/news/donating-the-model-context-protocol-and-establishing-of-the-agentic-ai-foundation,TOOL_ALPHA,"MCP ecosystem: 97M monthly SDK downloads in 13 months. Donated to Agentic AI Foundation (Linux Foundation). Co-founded by Anthropic Block OpenAI. Supported by Google Microsoft AWS Cloudflare Bloomberg. 10K active servers. First-class support in ChatGPT Claude Cursor Gemini Copilot VS Code.",HIGHEST,IMMEDIATE,PENDING_REVIEW,TOOL_ALPHA,ALL,97,97M downloads = industry standard. Build MCP tools now.,,AUTHENTIC,TRUE,MCP: 97M SDK downloads 10K servers - USB-C of AI infrastructure,,2026-02-04
ALPHA9050,Vibe Coding Tools,https://vibecoding.app/blog/cursor-vs-windsurf,AI_CODING,"Cursor vs Windsurf 2026: Cursor still king for vibe coding (Composer multi-file edits). Windsurf (acquired by OpenAI) has Cascade autonomous agent. 78% organizations integrated AI into dev workflows. AI-savvy developers earn 40% premium. Free tier: Cursor free -> $20/mo Pro. Windsurf free -> $15/mo Pro.",HIGHEST,IMMEDIATE,PENDING_REVIEW,TOOL_ALPHA,ALL,92,Tool comparison with pricing. Cursor preferred for multi-file.,,AUTHENTIC,N/A,Cursor vs Windsurf: Cursor still king - 78% orgs use AI dev tools,,2026-02-04
ALPHA9051,CodeScene Research,https://www.creolestudios.com/vibe-coding-comparison-for-decision-makers/,AI_CODING,"AI coding defect risk: CodeScene early 2026 research shows AI assistants increase defect risk by at least 30% in projects with poor code health. AI prioritizes short-term fixes = technical debt multiplier not productivity accelerator. Quality code health required to benefit from AI.",HIGH,IMMEDIATE,PENDING_REVIEW,AI_CODING,ALL,88,Quantified risk. Poor code + AI = 30% more defects.,,AUTHENTIC,N/A,AI coding increases defect risk 30% in poor code health projects,,2026-02-04
ALPHA9052,@0xROAS,https://x.com/0xROAS,PAID_ADS,"0xROAS paid ads philosophy: 'Treat ad spend like a venture capitalist seeking asymmetric returns.' '#1 best thing about mastering Facebook ads is realizing how much is just psychology. Once you learn to sell through words headlines hooks you can print money anywhere.' AI creative workflows: nano banana pro + AI lipsync.",HIGH,IMMEDIATE,PENDING_REVIEW,PAID_ADS,ALL,88,Psychology-first approach to ads. AI creative workflow mentioned.,,AUTHENTIC,N/A,Paid ads = psychology mastery - can print money anywhere once learned,,2026-02-04
ALPHA9053,@rryssf_,https://truthsignal.ai/analysis/meta-spice-breakthrough-self-improving-ai,AI_RESEARCH,"Meta SPICE paper: Self-Play in Corpus Environments. Model becomes own teacher - no humans no labels no datasets. Challenger copy digs through documents to create fact-grounded reasoning problems. Reasoner copy solves without source access. +9.1% reasoning Qwen3-4B +11.9% OctoThinker-8B. Beats prior self-play methods.",HIGH,SOON,PENDING_REVIEW,AI_RESEARCH,ALL,86,Meta research. Self-improving AI via corpus-grounded self-play.,,AUTHENTIC,N/A,Meta SPICE: +9-12% reasoning via self-play corpus environments,,2026-02-04
ALPHA9054,Workday AI Research,https://investor.workday.com/news-and-events/press-releases/news-details/2026/New-Workday-Research-Companies-Are-Leaving-AI-Gains-on-the-Table/default.aspx,AI_PRODUCTIVITY,"AI productivity rework problem: 85% employees save 1-7 hours/week with AI BUT much offset by rework on low-quality AI outputs. Companies leaving gains on table. Generic tools = quality issues requiring fixing rewriting double-checking. Specialized tools needed.",HIGH,IMMEDIATE,PENDING_REVIEW,AI_PRODUCTIVITY,ALL,89,Workday research. AI time savings offset by rework on AI output.,,AUTHENTIC,TRUE,85% save 1-7hr/wk with AI but gains offset by rework on AI output,,2026-02-04
ALPHA9055,@MengTo,https://mengto.com/,AI_DESIGN,"MengTo design + AI: Teaching 'design prompting in the era of AI.' Free templates available. 13K Instagram followers. Tools used: Sketch Figma. Focus on accessible design education. Cross-platform following (Twitter Instagram Medium).",MEDIUM,BACKLOG,PENDING_REVIEW,AI_DESIGN,ALL,78,Design educator adapting to AI. Templates as lead gen.,,AUTHENTIC,N/A,Design prompting in AI era - free templates as lead gen strategy,,2026-02-04
ALPHA9056,Design Tools 2026,https://webdesignerdepot.com/exciting-new-tools-for-designers-january-2026/,TOOL_ALPHA,"New design tools Jan 2026: Dessix.io = 'thinking space' for creators build context visually making AI extension of thinking. Jitter = 'Figma for motion design' - animations for videos websites apps in browser actions not keyframes. Launch Shots = quick App Store screenshots with templates real device frames.",HIGH,SOON,PENDING_REVIEW,TOOL_ALPHA,ALL,85,New tools for design workflows. Jitter particularly interesting.,,AUTHENTIC,N/A,Jitter = Figma for motion design - actions not keyframes in browser,,2026-02-04
ALPHA9057,X Smart Cashtags,https://www.coindesk.com/tech/2026/01/11/x-s-head-of-product-teases-crypto-aware-smart-cashtags-one-day-after-crypto-twitter-backlash,PLATFORM_ARB,"X Smart Cashtags: Crypto-aware cashtags recognize specific assets including tokens and smart contracts. X head of product collecting feedback. Possible February 2026 launch. Crypto integration into X platform deepening.",MEDIUM,SOON,PENDING_REVIEW,PLATFORM_ARB,ALL,82,X crypto integration. Watch for launch window.,,AUTHENTIC,N/A,X Smart Cashtags: crypto-aware asset recognition coming Feb 2026,,2026-02-04
ALPHA9058,xAI Crypto Hiring,https://www.coindesk.com/tech/2026/02/03/elon-musk-s-xai-is-hiring-crypto-specialists-to-train-its-ai-models,PLATFORM_ARB,"xAI hiring crypto specialists: Remote 'Finance Expert - Crypto' role to help AI models understand digital asset markets beyond price prediction. Expert annotations evaluations reasoning traces based on real-world crypto trading behavior. xAI integrating crypto into Grok.",HIGH,SOON,PENDING_REVIEW,ALGO_TRADING,ALL,84,xAI crypto integration signal. AI + crypto training data opportunity.,,AUTHENTIC,N/A,xAI hiring crypto specialists to train AI models on trading behavior,,2026-02-04
ALPHA9059,OpenClaw Security,https://creati.ai/ai-news/2026-02-02/openclaw-ai-agent-buzz-security-fears/,RISK_INTEL,"OpenClaw security risks: Palo Alto Networks warns of 'lethal trifecta' - private data access + untrusted content exposure + external communications with memory retention. Supply chain risks from extensible architecture. Compromised modules could enable privilege escalation or arbitrary code execution. Advanced users only.",HIGHEST,IMMEDIATE,PENDING_REVIEW,RISK_INTEL,ALL,91,Security research. OpenClaw risks documented by Palo Alto.,,AUTHENTIC,N/A,OpenClaw lethal trifecta: data access + untrusted content + external comms,,2026-02-04
ALPHA9060,Justin Sun AI Crypto,https://www.coindesk.com/markets/2026/02/03/crypto-s-ai-push-stalls-without-a-chatgpt-moment-justin-sun-says,PLATFORM_ARB,"AI crypto stall: Justin Sun (Tron founder) says most AI-linked tokens remain conceptual not functional. Sector lacks 'ChatGPT moment.' Investors cite AI as next catalyst but Sun skeptical. Consensus Hong Kong 2026 interview. Gap between AI token hype and actual utility.",MEDIUM,BACKLOG,PENDING_REVIEW,ALGO_TRADING,ALL,80,Skeptical take on AI tokens. Wait for functional products.,,AUTHENTIC,N/A,Justin Sun: AI crypto tokens mostly conceptual lacking ChatGPT moment,,2026-02-04
