alpha_id,source,source_url,category,tactic,roi_potential,priority,status,applicable_methods,applicable_niches,synergy_score,reviewer_notes,quality_issues,engagement_authenticity,earnings_verified,extracted_method,compliance_notes,date_added
ALPHA10800,r/microsaas + Greensighter analysis,https://www.greensighter.com/blog/micro-saas-ideas,SAAS_TACTICS,Clickpilot (YouTube thumbnail A/B testing SaaS) hit $1600 MRR in 5 months. Niche: creator tools. Validates YouTube thumbnail testing as viable micro SaaS.,HIGH,NOW,PENDING_REVIEW,MM001_APP_FACTORY|MM027_MICRO_SAAS,N003_tech|N016_content_creators,82,Validated MRR with timeline. Creator tools niche growing. Could clone with AI twist (auto-generate thumbnails + test).,None,AUTHENTIC,SCREENSHOT,Build YouTube thumbnail A/B tester. Use Claude API for thumbnail generation suggestions. Charge $19-49/mo. Target YouTube creators via Reddit/Twitter.,None,2026-02-05
ALPHA10801,r/SaaS + Pieter Levels case study,https://solopreneurpage.com/blog/micro-saas-ideas-successful-examples-solo-founders,SAAS_TACTICS,Pieter Levels Photo AI: $132K MRR 18 months after launch. Nomad List: $1.5M ARR solo with no employees. AI wrapper SaaS with focused niche = massive solo founder revenue.,HIGHEST,BACKLOG,PENDING_REVIEW,MM001_APP_FACTORY|MM027_MICRO_SAAS|MM026_AI_WRAPPER,N003_tech,90,Levels is proven case study but hard to replicate at his scale. Key insight: AI wrapper + focused niche + existing audience. Photo AI specifically targeted AI headshots.,earnings_verified for Photo AI likely inflated in aggregation but Levels is public about numbers,AUTHENTIC,SCREENSHOT,AI wrapper SaaS in focused niche. Photo AI model: charge per generation ($5-20). Build on top of open source models to reduce API costs. Focus on one specific use case.,None,2026-02-05
ALPHA10802,r/coldemail + StartupSpells,https://startupspells.com/p/how-i-accidentally-generated-6-leads-to-a-cold-email-agency-from-reddit,GROWTH_HACK,Generated 6 leads for cold email agency accidentally from single Reddit post. Valuable content post on r/coldemail became top post of all time. Content-led lead gen on Reddit = free qualified leads.,HIGH,NOW,PENDING_REVIEW,MM007_COLD_OUTBOUND|MM028_LOCAL_LEAD_GEN|CF001_CONTENT_FARM,N003_tech|N004_agencies,80,Reddit content marketing for lead gen. Write genuinely valuable posts on relevant subreddits. Leads come to you. 90/10 rule: 90% value / 10% business. Works for ANY service business.,None,AUTHENTIC,FALSE,Write 1 genuinely valuable post per week on r/coldemail r/SaaS r/Entrepreneur. Include real data/case studies. Bio links to service page. Let leads come inbound. Zero ad spend.,None,2026-02-05
ALPHA10803,r/startups + SubredditSignals,https://www.subredditsignals.com/blog/reddit-marketing-strategies-for-startups-2025-2026-how-to-find-high-intent-threads-and-turn-them-into-product-demos-without-getting-downvoted,GROWTH_HACK,Reddit demo plays for startups: 120 leads and $1800 revenue in 45 days from Reddit referrals. 150% signup lift. 35% conversion rate. Models roasted in threads converted 22% better with 37 days from mockery to $10k/mo.,HIGH,NOW,PENDING_REVIEW,MM001_APP_FACTORY|MM027_MICRO_SAAS|CF001_CONTENT_FARM,N003_tech,78,Specific conversion numbers from Reddit marketing. 35% conversion from Reddit referrals is exceptional (vs 2-3% typical web). Even negative Reddit attention converts. $1800 in 45 days is real.,None,AUTHENTIC,SCREENSHOT,Monitor subreddits for pain point discussions. Offer demo/solution in comments (genuine not spammy). Target: 120 leads / 45 days. 35% conversion rate achievable with Reddit traffic.,None,2026-02-05
ALPHA10804,r/passive_income + Shopify analysis,https://www.shopify.com/blog/passive-income-ideas,MONETIZATION,Notion template creators on Gumroad earn $5K-$20K/mo (top). Average: $500-$1K/mo with 3-5 solid templates. $50M+ annual market across platforms. Lowest barrier digital product.,HIGHEST,NOW,PENDING_REVIEW,MM024_DIGITAL_PRODUCTS|MM025_AMAZON_KDP,N003_tech|N001_ecommerce,88,Notion templates = fastest path to first dollar. $500-1K/mo realistic with 3-5 templates. $0 to create. Gumroad = free until sale. Can launch today. Top creators at $20K/mo proves scale potential.,None,AUTHENTIC,FALSE,Create 5 Notion templates this week. List on Gumroad ($0 cost). Target: productivity solopreneurs fitness trackers content calendars. Price $7-$19 each. Promote via Reddit + Twitter.,None,2026-02-05
ALPHA10805,r/passive_income + Medium analysis,https://simplifiedbusinesscoach.medium.com/26-uncommon-passive-income-ideas-for-2026-ef5a6012e918,MONETIZATION,Online courses earn $1K-$10K/mo. One marketer's Freelance Writing 101 course on Teachable earns $3K/mo after 6 months promotion. 3-12 months intensive then 2-5 hrs/week maintenance.,HIGH,SOON,PENDING_REVIEW,MM024_DIGITAL_PRODUCTS|MM002_INFO_PRODUCTS,N003_tech|N002_fitness|N001_faith,75,Course creation is high-effort upfront but true passive after. $3K/mo from single course is validated. Could create courses from our existing playbooks/methods. Teachable or Whop as platform.,None,AUTHENTIC,FALSE,Package existing PRINTMAXX methods into course. Teachable or Whop platform. Price $47-$97. Target: solopreneurs. Promote via Twitter build-in-public + Reddit.,None,2026-02-05
ALPHA10806,r/affiliatemarketing + various,https://thunderbit.com/blog/affiliate-marketing-stats,AFFILIATE,Affiliate marketing average income $8038/mo. Top niche: education/e-learning at $15551/mo average. SEO drives 78% of affiliate traffic. AI tools used by 80% of affiliates for content. Industry growing 15.2% CAGR to $20B+ in 2026.,HIGH,SOON,PENDING_REVIEW,MM003_AFFILIATE_SITES|MM024_DIGITAL_PRODUCTS,N003_tech|N002_fitness|N005_finance,80,Education niche highest earning for affiliates. Our content (playbooks/courses) could include affiliate links for tools mentioned. SEO + AI content = scalable affiliate revenue.,None,AUTHENTIC,FALSE,Add affiliate links to all tool recommendations in playbooks/content. Focus on education/tech niche. Use AI for SEO content generation. Target $500-$1K/mo affiliate in 6 months.,None,2026-02-05
ALPHA10807,r/juststart + OnlineMediaMasters,https://onlinemediamasters.com/how-to-make-money-with-affiliate-marketing/,AFFILIATE,One affiliate marketer grew from $267/mo to $21853/mo over 19 months. Strategy: specific niche + high-quality SEO content. Some r/juststart posters making six figures/year.,HIGHEST,SOON,PENDING_REVIEW,MM003_AFFILIATE_SITES|MM029_FACELESS_YOUTUBE,N003_tech|N005_finance,85,$267 to $21.8K in 19 months is exceptional growth. SEO content in specific niche is the method. Could replicate with AI-generated content at scale. r/juststart community has proven case studies.,earnings claim from single source - typical for affiliate space,AUTHENTIC,SCREENSHOT,Pick 1 niche. Create 50+ SEO articles with AI assistance. Target long-tail keywords. Monetize with affiliate links. Timeline: 6-19 months to $5K+/mo.,None,2026-02-05
ALPHA10808,r/AppBusiness + BusinessOfApps,https://www.businessofapps.com/data/reddit-statistics/,APP_FACTORY,Global app revenue projected $613B by 2026. Top 5% of apps earn 90% of revenue. Hybrid monetization (IAP + ads) increases ARPU 20-40%. 70% of users churn within 3 days.,HIGH,NOW,PENDING_REVIEW,MM001_APP_FACTORY,N003_tech|N002_fitness|N001_faith,78,Key insight: hybrid monetization is 20-40% more revenue than single model. Hard paywall alone leaves money on table. Must add ads + IAP + subscriptions. 70% 3-day churn means onboarding is critical.,None,AUTHENTIC,N/A,Implement hybrid monetization in all apps: subscriptions + ads + IAP. Focus on reducing 3-day churn with strong onboarding. Target ARPU lift of 20-40% vs subscription-only.,None,2026-02-05
ALPHA10809,r/growthhacking + Martal analysis,https://martal.ca/linkedin-outreach-lb/,COLD_OUTBOUND,LinkedIn cold outreach 2026: 20-55% connection acceptance rate with personalization + 2nd degree contacts. 48.14% positive reply ratio on optimized campaigns. 25% meeting rate. Multichannel (LinkedIn + email + calls) = 287% higher response vs single channel.,HIGHEST,NOW,PENDING_REVIEW,MM007_COLD_OUTBOUND|MM051_AI_AUTOMATION_AGENCY,N003_tech|N004_agencies,92,287% higher response with multichannel is the key number. LinkedIn + email + cold call combined. 25% meeting rate is very high. Our cold outbound should be multichannel from day 1.,None,AUTHENTIC,FALSE,Run multichannel outreach: LinkedIn DM + cold email + cold call via VA. Expected 287% lift vs email alone. Personalize with 2nd-degree connections. Target 25% meeting booking rate.,None,2026-02-05
ALPHA10810,r/buildinpublic + various,https://nealschaffer.com/how-to-make-money-on-twitter/,CONTENT_FORMAT,X/Twitter build-in-public community: 180K+ members. 10K followers achievable in 3-6 months with 2-3 hrs/day. Post 3-5x daily engage 20+ accounts. Educational threads = highest performing format. Mid-tier (10-50K followers) = few hundred $/mo from ads. Brand deals = biggest revenue.,HIGH,NOW,PENDING_REVIEW,CF001_CONTENT_FARM|MM002_INFO_PRODUCTS|AI001_NICHE_EXPERTS,N003_tech|N016_content_creators,80,Build-in-public on X is free customer acquisition channel. 10K followers in 3-6 months is realistic with consistent effort. Revenue from ads low at that level but brand deals + product sales are real.,None,AUTHENTIC,FALSE,Post 3-5x daily on X. Engage 20+ accounts. Educational threads. Build to 10K in 3-6 months. Monetize via products (Gumroad) not ad revenue. Brand deals at 10K+.,None,2026-02-05
ALPHA10811,r/passive_income + faceless stats,https://autofaceless.ai/blog/faceless-content-creator-statistics-2026,CONTENT_FORMAT,Faceless channels = 38% of new creator ventures (up from 12% in 2022). Top earners $80K+/mo. Production costs 58% lower than face-based. BUT requires 39% more uploads to hit monetization. Daily Dose of Internet: $138K-$388K/mo ad revenue.,HIGHEST,NOW,PENDING_REVIEW,MM029_FACELESS_YOUTUBE|CF001_CONTENT_FARM|AI001_NICHE_EXPERTS,N003_tech|N002_fitness|N001_faith|N016_content_creators,90,Faceless content is 3x faster growing than face-based (12% to 38%). 58% lower production costs is key for solo ops. $80K/mo top end. BUT 39% more uploads needed = must automate production pipeline.,Daily Dose numbers likely at extreme end,AUTHENTIC,FALSE,Launch 3 faceless channels (faith/fitness/tech). Automate with AI: script generation + voiceover + video assembly. 15-20 videos/month per channel. 58% lower cost than face-based.,None,2026-02-05
ALPHA10812,r/SaaS + AI wrapper analysis,https://mktclarity.com/blogs/news/ai-tools-top,SAAS_TACTICS,AI wrapper revenue spectrum: Magai $100K/mo (32 months to $1M ARR). EasyGen $41.5K/mo (hit in first year). Textero $20K/mo (under 1 year). Bolt.new $3.3M/mo in 5 months. Key: deep workflow integration not thin wrapper.,HIGHEST,SOON,PENDING_REVIEW,MM026_AI_WRAPPER|MM027_MICRO_SAAS|MM001_APP_FACTORY,N003_tech,88,AI wrappers printing money when integrated into workflows. Thin wrappers die. Deep integration survives. Magai 6 pricing tiers ($19-$249) = classic SaaS upsell. Speed to market critical (Bolt.new 5mo to $3.3M).,Some numbers may be peak not sustained,AUTHENTIC,SCREENSHOT,Build AI wrapper deeply integrated into specific workflow (not general chatbot). Multiple pricing tiers ($19-$249). Target vertical-specific use case. Speed to market = advantage.,None,2026-02-05
ALPHA10813,r/SaaS + AI wrapper analysis,https://www.getmonetizely.com/blogs/the-economics-of-ai-first-b2b-saas-in-2026,SAAS_TACTICS,AI SaaS economics: if AI deeply integrated domain-specific features then AI cost is only 20% of perceived value. Customers pay for solution not API wrapper. Hybrid pricing (project $2.5K-$15K + monthly $2K-$8K) working for AI agencies.,HIGH,NOW,PENDING_REVIEW,MM051_AI_AUTOMATION_AGENCY|MM026_AI_WRAPPER|MM027_MICRO_SAAS,N003_tech|N004_agencies,82,Key pricing insight: AI cost = 20% of value when deeply integrated. Charge for outcome not API calls. Hybrid pricing model working. Setup fee + monthly retainer.,None,AUTHENTIC,N/A,Price AI services on outcome not API cost. Setup $2.5K-$15K + retainer $2K-$8K/mo. AI cost is 20% of customer-perceived value. Deep integration into workflows.,None,2026-02-05
ALPHA10814,r/Entrepreneur + AI agency Reddit success,https://callin.io/ai-automation-agency-reddit/,MONETIZATION,AI automation agency: Reddit success story - former call center supervisor to 27 clients and $40K MRR in 18 months (AI voice assistants for FAQ). Another: AI sales pitch gen for real estate agents scaled to $25K/mo with 1 VA.,HIGHEST,NOW,PENDING_REVIEW,MM051_AI_AUTOMATION_AGENCY|MM062_FRACTIONAL_EXEC_SERVICE,N003_tech|N004_agencies,90,Two validated case studies. $40K MRR from AI voice assistants (niche: FAQ handling). $25K/mo from AI sales pitch gen for real estate (1 VA only). Both demonstrate: pick ONE industry become expert.,Reddit success stories may be embellished,AUTHENTIC,FALSE,Pick one niche for AI automation agency. Build demo video of automation solving their problem. Send unsolicited demo videos (not cold calls). Target $2K-8K/mo per client retainer.,None,2026-02-05
ALPHA10815,r/growthhacking + Reddit/AI SEO,https://koanthic.com/en/reddit-ai-search-complete-seo-optimization-guide-2026/,SEO_GEO_ASO,Reddit citations in AI overviews surged from 1.3% to 7.15% in 3 months. Some categories show Reddit cited 14-38% of the time by AI. Reddit is now critical for GEO (Generative Engine Optimization).,HIGHEST,NOW,PENDING_REVIEW,CF001_CONTENT_FARM|MM003_AFFILIATE_SITES,N003_tech,92,Reddit's share of AI citations is growing exponentially. 1.3% to 7.15% in 3 months. Being cited on Reddit = being cited by ChatGPT/Perplexity/Gemini. Reddit GEO is alpha.,None,AUTHENTIC,N/A,Post authoritative content on Reddit. Reddit is cited by AI 7-38% of time depending on category. Reddit posts = GEO optimization = free AI referral traffic. Target high-authority subreddits.,None,2026-02-05
ALPHA10816,r/juststart + SEO evolution,https://vertu.com/lifestyle/seo-is-evolving-the-definitive-guide-to-aio-geo-and-aeo-in-2026/,SEO_GEO_ASO,SEO evolved into 3 pillars: SEO (Google ranking) + AEO (AI answer optimization) + GEO (generative engine optimization). E-E-A-T is now critical across all three. First-hand experience + specific data = what AI cites.,HIGH,NOW,PENDING_REVIEW,CF001_CONTENT_FARM|MM003_AFFILIATE_SITES|MM024_DIGITAL_PRODUCTS,N003_tech,80,Must optimize for all three: traditional SEO + AI answers + generative AI. First-hand experience and specific numbers are what AI models cite. Our build-in-public content naturally has E-E-A-T signals.,None,AUTHENTIC,N/A,Optimize all content for SEO + AEO + GEO. Include first-hand experience and specific numbers. E-E-A-T compliance. Reddit posts count toward GEO. Structure content for AI citation.,None,2026-02-05
ALPHA10817,r/indiehackers + Product Hunt launch,https://www.indiehackers.com/post/idea-to-first-sale-in-4-weeks-my-solopreneurship-story-5c18a9db31,GROWTH_HACK,Idea to first sale in 4 weeks: ShipThat.App. 24 waitlist signups from landing page. Launched on Product Hunt from train in Italy. 5 sales on Black Friday weekend. Key: focused visuals for PH launch + X engagement with 70 followers.,HIGH,NOW,PENDING_REVIEW,MM001_APP_FACTORY|MM024_DIGITAL_PRODUCTS,N003_tech,72,4 weeks idea to sale is rapid timeline. Product Hunt still works for launches. Even 70 Twitter followers can drive sales with good content. Waitlist validates before building. PH + Twitter + email = launch stack.,None,AUTHENTIC,CLAIMED,Launch on Product Hunt + X/Twitter simultaneously. Build waitlist first (validate demand). 4-week sprint from idea to sale. Focus on visuals for PH. Email waitlist on launch day.,None,2026-02-05
ALPHA10818,r/passive_income + Gumroad/Whop,https://whop.com/blog/best-digital-products-to-sell/,MONETIZATION,Whop creators sold $2B+ total. Best sellers: courses/coaching ($100-thousands per client) > templates/toolkits > personal finance products > wellness guides > 3D models. Digital products market projected $416B by 2030.,HIGH,NOW,PENDING_REVIEW,MM024_DIGITAL_PRODUCTS|MM002_INFO_PRODUCTS,N003_tech|N002_fitness|N001_faith|N005_finance,82,Whop $2B+ in creator sales validates platform. Courses/coaching highest per-customer revenue. Templates lowest barrier. Our stack: templates first (quick wins) then courses (higher revenue).,None,AUTHENTIC,N/A,Start with Gumroad templates ($7-19). Graduate to Whop courses ($47-97). Package existing PRINTMAXX methods. Target solopreneur audience. Templates > courses > coaching ladder.,None,2026-02-05
ALPHA10819,r/SideProject + Reddit as launch platform,https://jonathanrintala.com/blog/reddit-growth-hacking-guide-b2b-saas/,GROWTH_HACK,Reddit B2B SaaS growth: 1M+ views from Reddit posts. Reddit cost-per-click 50-70% lower than FB/IG. Key: genuine value-first posts not promotion. 10-20 highly relevant communities > wide spray.,HIGH,NOW,PENDING_REVIEW,MM001_APP_FACTORY|MM027_MICRO_SAAS|CF001_CONTENT_FARM,N003_tech,80,1M+ views achievable on Reddit with genuine content. Focus on 10-20 subreddits not hundreds. Reddit = cheapest qualified traffic available. Must be value-first not promotional.,None,AUTHENTIC,FALSE,Identify 10-20 target subreddits for each product. Post 1 genuinely valuable piece per week per subreddit. No promotion in post. Link in profile. Track signups from Reddit referrals.,None,2026-02-05
ALPHA10820,r/SaaS + no-code SaaS builder,https://blog.startupstash.com/how-i-built-a-3-200-month-micro-saas-without-writing-a-single-line-of-code-38bd6996347b,SAAS_TACTICS,$3200/mo micro SaaS built with no code. First month: $87 from 3 paying customers. Grew through content marketing + ProductHunt. No-code tools = faster time to market = test more ideas faster.,HIGH,NOW,PENDING_REVIEW,MM027_MICRO_SAAS|MM001_APP_FACTORY,N003_tech,75,No-code to $3.2K/mo is validated path. Even $87 first month proves willingness to pay. Speed matters: no-code = test 3 ideas in time it takes to code 1. AI vibe-coding is even faster than no-code now.,None,AUTHENTIC,SCREENSHOT,Use AI vibe-coding (faster than no-code) to prototype micro SaaS in days. Validate with $87 first month. Scale with content marketing. Test 3-5 ideas rapid fire.,None,2026-02-05
ALPHA10821,@levelsio,https://x.com/levelsio/status/1961611241908044048,MONETIZATION,X/Twitter creator program paying $11.5K/mo: $7870 ad rev share + $2683 X subs revenue. Record month. Consistent $9-11K range across multiple months.,HIGH,SOON,PENDING_REVIEW,"CF001_CONTENT_FARM,MM015_NEWSLETTER,AI001_NICHE_EXPERTS","N003_tech,N001_ai_utilities",78,Verified across multiple monthly reports. Requires large following (600K+). Still shows X monetization is real and scaling. Good benchmark for content accounts.,None,AUTHENTIC,SCREENSHOT,Build X following to 100K+. Apply for X creator program. Post consistently (daily). Revenue scales with impressions. Ad rev share + subscription model stacks.,None,2026-02-05
ALPHA10822,@gregisenberg,https://x.com/gregisenberg/status/2005317303370486015,APP_FACTORY,How to build mobile apps with AI in 2026: (1) Claude Code/Rork/Vibecode for MVP same day (2) Claude Code for edge cases (3) Design core interaction for 10-second screen recording (4) Use short-form video as live feedback channel (5) Ship-demo-observe-tighten-charge-repeat.,HIGH,NOW,PENDING_REVIEW,"MM001_APP_FACTORY,MM027_MICRO_SAAS,MM069_AI_GENERATED_MERCH","N001_ai_utilities,N003_tech,N002_fitness,N004_faith",85,Specific 31-point framework. Key insight: paste TikTok/Reels comments into Claude Code to cluster feedback into product changes. Demo video IS the marketing. Ship smallest change that makes demo clearer then re-record same day.,None,AUTHENTIC,N/A,MVP same day with Claude Code/Rork/Vibecode. Record 10-sec demo. Post to short-form platforms. Read comments. Paste into Claude Code for product iteration. Re-record. Charge when momentum compounds. Video = feedback channel not just marketing.,None,2026-02-05
ALPHA10823,@gregisenberg,https://x.com/gregisenberg/status/1984641062527197234,GROWTH_HACK,What's coming: (1) AI kills 9-5 for millions (2) Livestreaming explodes 100x as only way to prove you're real (3) Portfolio of agent-assisted micro-businesses replaces jobs (4) Most valuable 2026 skill: knowing when NOT to use AI. Human touch trades at 20x premium.,HIGH,SOON,PENDING_REVIEW,"MM001_APP_FACTORY,CF001_CONTENT_FARM,MM062_FRACTIONAL_EXEC_SERVICE","N003_tech,N001_ai_utilities",80,Directional signal. Actionable: (a) Build tools for the 'forced freelancer' wave (b) Livestreaming infrastructure/tools (c) Position human-touch services at premium pricing (d) AI agent portfolio management tools.,None,AUTHENTIC,N/A,Position for forced-freelancer wave. Build agent-assisted micro-business tools. Invest in livestreaming (proof-of-human). Offer human-touch premium services alongside AI automation. Portfolio of small AI apps model.,None,2026-02-05
ALPHA10824,@gregisenberg,https://x.com/gregisenberg/status/2019090260697767970,GROWTH_HACK,SaaS stock correction coming. AI productivity gains lead to 100K+ SaaS layoffs in 2026. Laid-off workers become founders. 'Portfolio of apps' becomes common phrase. Massive supply of technical talent entering indie hacking.,HIGH,SOON,PENDING_REVIEW,"MM001_APP_FACTORY,MM027_MICRO_SAAS,MM025_DIGITAL_PRODUCTS","N001_ai_utilities,N003_tech",75,Directional signal. Actionable: (a) Build for the wave of new founders (tools/templates/courses) (b) Hire from the talent surplus (c) Position now before competition floods in (d) Info products teaching 'portfolio of apps' model.,None,AUTHENTIC,N/A,Build tools/templates for incoming wave of laid-off-turned-founders. Info products on 'portfolio of apps' model. Hire technical talent at discount during surplus. Move fast before flood of new competitors.,None,2026-02-05
ALPHA10825,@gregisenberg,https://x.com/gregisenberg/status/2018679347717025920,APP_FACTORY,YC Spring 2026 Request for Startups breakdown: (1) Cursor for product managers (AI decides what to build not just how) (2) AI-native systems synthesizing customer feedback into product requirements (3) Agents that ship features autonomously.,HIGH,BACKLOG,PENDING_REVIEW,"MM001_APP_FACTORY,MM056_AI_WORKFLOW_MARKETPLACE,MM051_AI_AUTOMATION_AGENCY","N001_ai_utilities,N003_tech",80,YC signals = where VC money flows. Cursor-for-X architecture = default for knowledge work. Build AI PM tools that take customer calls + usage data and output 'build this next' + tasks. Vertical applications of this pattern.,None,AUTHENTIC,N/A,Build 'Cursor for X' tools for non-engineering knowledge work (legal/finance/marketing/sales/ops). AI PM tool that ingests customer feedback and outputs prioritized features + agent-executable tasks.,None,2026-02-05
ALPHA10826,@marc_louvion,https://x.com/marc_louvion/status/1982837690379960445,APP_FACTORY,Day 375 growing SaaS to $1M. 40% MoM growth. $94.8K/mo across portfolio: CodeFast $73.8K + ShipFast $31.5K + IndiePage $2K + DataFast $1.7K + 7 other micro-products. Strategy: launch many small products and share results publicly.,HIGHEST,NOW,PENDING_REVIEW,"MM001_APP_FACTORY,MM025_DIGITAL_PRODUCTS,MM027_MICRO_SAAS","N003_tech,N001_ai_utilities",88,Feb 2025 revenue breakdown verified via public tweet. CodeFast is an info product (coding course) not SaaS. Key insight: info products 10x easier to sell than SaaS. Portfolio of 12 products diversifies risk. 40% MoM growth on flagship.,None,AUTHENTIC,SCREENSHOT,Portfolio approach: 12 micro-products. Info products (courses) outsell SaaS 10x. Share revenue publicly to build audience. Use audience to launch next product. Flywheel: launch-share-grow-launch.,None,2026-02-05
ALPHA10827,@marc_louvion,https://x.com/marc_louvion/status/1919409762653065670,GROWTH_HACK,Grew Twitter to 170K followers with 3 steps: (1) Launch tiny startups (2) Share results (3) Repeat. Built DataFast analytics tool to share your metrics with a public link. Audience grows when you start winning publicly.,HIGH,NOW,PENDING_REVIEW,"CF001_CONTENT_FARM,MM025_DIGITAL_PRODUCTS,MM015_NEWSLETTER","N003_tech,N001_ai_utilities",82,Verified follower count. Simple but effective: build-in-public as distribution strategy. DataFast tool makes sharing analytics frictionless. Each product launch = content event = follower growth = next product audience.,None,AUTHENTIC,N/A,Build in public. Every product launch = content event. Share real numbers (revenue/users/growth). Build tools that make sharing results frictionless (DataFast-style). Audience from Product A becomes customers for Product B.,None,2026-02-05
ALPHA10828,@marc_louvion,https://x.com/marc_louvion/status/1863133982885573118,MONETIZATION,Info products 10x easier to sell than SaaS. CodeFast course made $92K in 2 days at launch. 3 reasons: (1) Universal problem (everyone wants to learn to code) (2) Lots of social proof from building in public (3) Built-in audience from prior products.,HIGHEST,NOW,PENDING_REVIEW,"MM002_INFO_PRODUCTS,MM025_DIGITAL_PRODUCTS","N003_tech,N001_ai_utilities",85,Verified $92K in 2 days. Key: course priced at $169. Universal pain point + existing audience + social proof = explosive launch. Replicable for any skill where you have proven results.,None,AUTHENTIC,SCREENSHOT,Info products > SaaS for initial revenue. Price at $99-199 range. Target universal problems. Build audience first via building in public. Use social proof from real products. Launch to existing audience for explosive day-1 revenue.,None,2026-02-05
