alpha_id,source,source_url,category,tactic,roi_potential,priority,status,applicable_methods,applicable_niches,synergy_score,reviewer_notes,quality_issues,engagement_authenticity,earnings_verified,extracted_method,compliance_notes,date_added
ALPHA10829,@dvassallo,https://x.com/dvassallo/status/1912506861552869409,MONETIZATION,Sold Small Bets community to Gumroad for $3.6M. Deal: 50% cash ($1.8M) + 50% stock options. Community had 6692 lifetime members. Vassallo continues running it as autonomous subsidiary. Open-sourced the Campfire platform.,HIGHEST,BACKLOG,PENDING_REVIEW,"MM002_INFO_PRODUCTS,MM025_DIGITAL_PRODUCTS,MM069_AI_GENERATED_MERCH","N003_tech,N001_ai_utilities",80,Verified via multiple sources. Key insight: communities are acquirable assets. $3.6M / 6692 members = $537/member lifetime value. Build community + course + open-source platform = triple asset value. Gumroad acquiring communities to become education platform.,None,AUTHENTIC,VERIFIED,Build paid community around a methodology (small bets/portfolio approach). Open-source the platform to add enterprise value. Position for acquisition by larger platform. $537/member = benchmark for community valuation.,None,2026-02-05
ALPHA10830,@dvassallo,https://x.com/dvassallo/status/1970489062185185497,TOOL_ALPHA,Small Bets platform open-sourced (modified Campfire). GitHub bounties for contributors. Community-driven development. Strategy: open-source your platform adds enterprise value and creates ecosystem around your brand.,HIGH,BACKLOG,PENDING_REVIEW,"MM001_APP_FACTORY,MM027_MICRO_SAAS","N003_tech,N001_ai_utilities",70,Open-source strategy contributed to acquisition value. Campfire fork = purpose-built community platform. Bounties attract developers. Open-source creates lock-in paradoxically because community builds on your platform.,None,AUTHENTIC,N/A,Open-source your community platform. Use GitHub bounties to attract contributors. Modified Campfire = custom community experience. Open-source adds enterprise value for potential acquirers.,None,2026-02-05
ALPHA10831,@alxberman,https://www.alxberman.com/sales-page1721143358150,OUTBOUND,The Baking Method: year-long cold email follow-up sequence. Automated 12-month nurture. Key insight: most deals close in follow-up months 3-12 not initial send. Prevents getting ghosted. Proven across manufacturing to tech services.,HIGH,SOON,PENDING_REVIEW,"MM007_COLD_OUTBOUND,MM029_LOCAL_LEAD_GEN,MM051_AI_AUTOMATION_AGENCY","N003_tech,N001_ai_utilities",75,Alex Berman has 100K+ YouTube subscribers and 14K+ agencies trained. Method sold at $497. Key: most cold emailers give up after 3-5 follow-ups. 12-month sequence captures deals competitors abandon. Automation makes this zero-effort after setup.,Selling to cold email audience so method claims need verification,AUTHENTIC,FALSE,Build 12-month automated follow-up sequence. Most deals close months 3-12 not on first email. Use Instantly/Smartlead for automation. Set up once then forget. Captures deals competitors abandon after week 2.,None,2026-02-05
ALPHA10832,@dickiebush,https://www.ship30for30.com/,CONTENT_FORMAT,Ship 30 for 30: daily writing challenge turned into $5M+ business. Started at $50/cohort in 2021 now $999/cohort ($1999 premium). 326K Twitter followers in 30 months. Framework: everything starts as tweet then expand to atomic essay then long-form.,HIGHEST,BACKLOG,PENDING_REVIEW,"MM002_INFO_PRODUCTS,MM025_DIGITAL_PRODUCTS,MM015_NEWSLETTER","N003_tech,N001_ai_utilities",78,$5M from single digital product verified via multiple interviews. Pricing evolution from $50 to $999 = 20x increase as audience grew. Key: cohort model creates urgency + community + accountability. Lean writing system: tweet-first then expand.,Selling course about making money from courses. Earnings claim HIGH but verified via multiple sources,AUTHENTIC,SCREENSHOT,Cohort-based writing course model. Start at low price ($50) build social proof then raise (now $999). Everything starts as tweet. Lean writing: tweet > atomic essay > long-form. Daily publishing builds audience. 326K followers in 30 months via consistent daily shipping.,None,2026-02-05
ALPHA10833,@BLUECOW009,https://github.com/NeoVertex1/SuperPrompt,TOOL_ALPHA,SuperPrompt: open-source XML agent prompt that makes Claude generate novel ideas. Uses XML tags + mathematical/philosophical concepts to explore areas of the model usually unexplored. Forces out-of-the-box thinking via structured prompt engineering.,HIGH,NOW,PENDING_REVIEW,"MM001_APP_FACTORY,MM033_PROMPT_ENGINEERING,MM066_CUSTOM_GPT_BUSINESS","N001_ai_utilities,N003_tech",72,GitHub repo (NeoVertex1/SuperPrompt). Technical tool for prompt engineering. Can be used to generate novel product ideas or content angles. Works best with Claude. Practical application: use as system prompt for brainstorming sessions.,None,AUTHENTIC,N/A,Use SuperPrompt (open-source XML agent) as system prompt for Claude brainstorming sessions. Forces LLM into novel reasoning patterns. Apply to: product ideation + content angle generation + problem-solving. Free tool on GitHub.,None,2026-02-05
ALPHA10834,@zephyr_z9,https://x.com/zephyr_z9/status/2003157047987315149,GROWTH_HACK,2026 sector calls: (1) Solar energy stocks up 50-60% already (2) Testing and packaging equipment suppliers up (3) Google CAPEX $111B in 2026 (+29% YoY) (4) DRAM demand from OpenAI 900K WPM by 2029 (5) SanDisk won Google eSSD contract ramping 1H 2026.,MEDIUM,BACKLOG,PENDING_REVIEW,"MM012_ALGO_TRADING,MM064_DEPIN_NODE_OPERATOR","N014_stocks,N013_crypto",65,Technical semiconductor analysis. Not directly actionable for solopreneur ops but relevant for: (a) investment portfolio allocation (b) understanding AI infrastructure buildout trajectory (c) content creation for finance niche accounts.,None,AUTHENTIC,N/A,Sector investing signals: solar energy + testing/packaging equipment + DRAM suppliers benefiting from AI infrastructure buildout. Google CAPEX $111B in 2026. Use for stock/crypto content creation and personal portfolio allocation.,None,2026-02-05
ALPHA10835,@dannypostmaa,https://x.com/dannypostmaa/status/1819566233450434853,APP_FACTORY,Comfyflows marketplace for ComfyUI workflows. Built and launched in 26 hours. Features: find/share/sell workflows + run as API. ComfyUI rebuilt their Python pipeline to be 2x faster. Marketplace model = other people create the product you just provide the platform.,HIGH,SOON,PENDING_REVIEW,"MM001_APP_FACTORY,MM056_AI_WORKFLOW_MARKETPLACE,MM027_MICRO_SAAS","N001_ai_utilities,N003_tech",80,Danny Postma (HeadshotPro founder) built marketplace in 26 hours. Key insight: marketplace model where community creates content/workflows and you take a cut. ComfyUI is dominant open-source AI image pipeline. Workflow marketplace = sell pickaxes in gold rush.,None,AUTHENTIC,N/A,Build marketplace for AI tool workflows/templates (ComfyUI/n8n/Make). 26-hour build. Community creates the product. You take platform cut. Sell pickaxes in AI gold rush. Target: creators who want to monetize their workflows.,None,2026-02-05
ALPHA10836,@dannypostmaa,https://x.com/dannypostmaa/status/1926128390127472651,GROWTH_HACK,Transition from solopreneur to team. Key learning: shadowing other remote team structures before hiring. Scaling from solo to team is the hardest transition. HeadshotPro growth required hiring but the mindset shift is what matters most.,MEDIUM,BACKLOG,PENDING_REVIEW,"MM001_APP_FACTORY,MM051_AI_AUTOMATION_AGENCY","N003_tech,N001_ai_utilities",60,Honest about difficulties scaling. Not a tactical framework but a directional signal: when to hire and how to transition. Relevant for PRINTMAXX when scaling past solo capacity.,None,AUTHENTIC,N/A,When scaling past solo capacity: shadow other remote teams before hiring your own. Study their structures. Mindset shift matters more than process. Start with contractors before full-time.,None,2026-02-05
ALPHA10837,@godofprompt,https://www.godofprompt.ai/prompt-engineering-guide,TOOL_ALPHA,God of Prompt platform: curated prompt engineering products with lifetime updates. Structured prompt engineering boosts AI model accuracy by up to 25%. Key prediction: 60% of Fortune 500 will integrate prompt engineering into AI strategies by 2026.,MEDIUM,BACKLOG,PENDING_REVIEW,"MM033_PROMPT_ENGINEERING,MM066_CUSTOM_GPT_BUSINESS,MM025_DIGITAL_PRODUCTS","N001_ai_utilities,N003_tech",68,Platform selling prompt bundles. 25% accuracy improvement stat from blockchain.news (needs verification). Actionable: prompt engineering products (templates/guides/courses) remain viable digital product category. Enterprise demand growing.,Quality of 25% claim unclear - sourced from blockchain.news aggregator,AUTHENTIC,FALSE,Sell prompt engineering products (bundles/guides/templates). Enterprise demand growing. Structured prompts boost accuracy ~25%. Package as Gumroad digital products at $27-97 range. Lifetime updates model creates recurring value perception.,None,2026-02-05
ALPHA10838,@thesamparr,https://x.com/thesamparr,MONETIZATION,Sam Parr model: sold The Hustle to HubSpot. Now co-founded Hampton (high-end entrepreneur community). My First Million podcast drives deal flow. Pattern: media company > exit > high-ticket community > podcast flywheel.,HIGH,BACKLOG,PENDING_REVIEW,"MM002_INFO_PRODUCTS,MM015_NEWSLETTER,MM061_PODCAST_LEAD_ENGINE","N003_tech,N001_ai_utilities",75,Verified exit (HubSpot acquisition of The Hustle). Hampton = vetted membership community for entrepreneurs/founders/CEOs. Pattern: build audience via newsletter > exit > reinvest into premium community > use podcast for deal flow and authority.,None,AUTHENTIC,VERIFIED,Newsletter-to-exit pipeline: build newsletter audience > monetize > exit to larger company > reinvest into premium community ($5K+/yr membership). Use podcast as deal flow + authority engine. Media company = startup with built-in distribution.,None,2026-02-05
ALPHA10839,@gregisenberg,https://x.com/gregisenberg/status/1906697683089101113,APP_FACTORY,ChatGPT 4o image gen is as big as the ChatGPT launch itself. Will birth 1000+ businesses doing $1-100M/year in vertical software. We're in the 'MP3 Napster era' of content. Millions of creators don't realize their back catalog is being consumed by AI.,HIGHEST,NOW,PENDING_REVIEW,"MM001_APP_FACTORY,MM026_AI_WRAPPER,MM056_AI_WORKFLOW_MARKETPLACE,MM069_AI_GENERATED_MERCH","N001_ai_utilities,N003_tech,N020_lifestyle",88,Two distinct insights: (1) Image gen = massive vertical software opportunity (build niche image tools like levelsio's InteriorAI) (2) Creator content being consumed by AI = new rights/licensing business opportunity. Both are HIGHEST ROI.,None,AUTHENTIC,N/A,Build vertical image generation tools for specific niches (interior design/real estate/fashion/food). ChatGPT 4o image gen = platform shift. Also: creator content licensing/protection tools = emerging market. 1000+ $1-100M businesses to be built.,None,2026-02-05
ALPHA10840,Product Hunt,https://www.producthunt.com/products/createos,TOOL_ALPHA,CreateOS: unified workspace to build/deploy/scale apps from any AI coding tool. Zero-friction deployment: hit deploy and get a URL. No pipelines or YAML. Revenue marketplace built into core infra. 509 PH upvotes on launch day (Feb 4 2026).,HIGHEST,NOW,PENDING_REVIEW,"MM001_APP_FACTORY,MM027_MICRO_SAAS,MM050_MCP_SERVER_PRODUCTS","N001_AI_UTILITIES,N016_TECH",92,Top PH product Feb 4. Solves the messy middle between AI prototyping and deployment. Direct competitor to Vercel but with built-in monetization layer. Could replace our deployment workflow entirely.,NONE,AUTHENTIC,N/A,Use CreateOS to deploy apps built with Claude Code/Cursor without DevOps overhead. Template marketplace = potential revenue stream for selling app templates.,NONE,2026-02-05
ALPHA10841,Product Hunt,https://www.genstore.ai/,ECOM_ARB,Genstore.ai: AI-native ecommerce. Describe store idea in prompt and get complete storefront in 2 minutes. Autonomous AI agent teams handle design/products/SEO/analytics. #1 PH Product of Day. $10M seed. Beta users already processed $2.3M GMV. 387 PH upvotes.,HIGHEST,NOW,PENDING_REVIEW,"MM022_ECOM_DROPSHIP,MM023_ECOM_ARB,MM024_PRINT_ON_DEMAND,MM069_AI_GENERATED_MERCH","N001_AI_UTILITIES,ALL_NICHES",88,Extremely relevant. Could spin up niche storefronts (faith merch/fitness gear/tech accessories) in minutes instead of hours. $2.3M GMV from beta validates demand. Agent team architecture is novel. 4 specialized AI agents: Design/Product/Launch/Analytics.,NONE,AUTHENTIC,TRUE,Prompt-to-storefront in 2 min. Use for rapid A/B testing of niche ecom concepts. Stack with POD suppliers for zero-inventory model.,FTC disclosure needed for AI-generated product descriptions,2026-02-05
ALPHA10842,Product Hunt / Vercel,https://hunted.space/history,TOOL_ALPHA,v0 by Vercel: now full-stack vibe coding platform (not just UI). 290 PH upvotes Feb 5. Generates complete apps from prompts with backend/database/auth included. Major upgrade from UI-only tool.,HIGH,NOW,PENDING_REVIEW,"MM001_APP_FACTORY,MM027_MICRO_SAAS,MM028_LOCAL_LEAD_GEN","N001_AI_UTILITIES,N016_TECH",85,v0 upgraded from frontend-only to full-stack. Combined with Vercel deployment this is end-to-end app building. Direct competition with Replit/Bolt/Lovable. Test for rapid MVP creation.,NONE,AUTHENTIC,N/A,Use v0 for rapid full-stack MVP prototyping. Compare speed/quality vs Claude Code + manual deploy vs Replit mobile apps.,NONE,2026-02-05
ALPHA10843,Product Hunt,https://supaboard.ai/,TOOL_ALPHA,Supaboard 2.0: agentic BI tool. Ask questions in plain English and get accurate answers from data. Connects to 600+ sources. Custom agents follow your business logic. 440 PH upvotes Feb 5 (trending #1).,HIGH,SOON,PENDING_REVIEW,"MM027_MICRO_SAAS,MM058_CURATED_DATA_PRODUCTS","N001_AI_UTILITIES,N016_TECH",72,Could use for our own analytics dashboard replacement. Also a model to study for building data products. Plain-English querying of business data is exactly what solopreneurs need. Free tier available.,NONE,AUTHENTIC,N/A,Connect Supaboard to our LEDGER CSVs or financial trackers for instant BI dashboards. Also study their monetization model for our data product ideas.,NONE,2026-02-05
ALPHA10844,Mistral AI,https://mistral.ai/news/voxtral-transcribe-2,TOOL_ALPHA,Voxtral Transcribe 2: open-source (Apache 2.0) real-time speech-to-text. Sub-200ms latency. Speaker diarization. 13 languages. $0.003/min (cheapest in market). 4% word error rate. Launched Feb 4 2026.,HIGHEST,NOW,PENDING_REVIEW,"MM051_AI_AUTOMATION_AGENCY,MM066_CUSTOM_GPT_BUSINESS,MM067_AI_MUSIC_PRODUCTION","N001_AI_UTILITIES,ALL_NICHES",90,Game-changing for voice-to-text workflows. Apache 2.0 = can run on-device. $0.003/min is 10x cheaper than Whisper API. Real-time mode enables voice agents. Diarization enables meeting transcription products. Can build transcription SaaS or integrate into cold calling VA workflow.,NONE,AUTHENTIC,N/A,Build voice-to-content pipeline: speak ideas -> Voxtral transcribes -> Claude refines -> auto-post. Also enables AI cold calling transcription and meeting summarizer products.,NONE,2026-02-05
ALPHA10845,Higgsfield,https://higgsfield.ai/vibe-motion,TOOL_ALPHA,Higgsfield Vibe Motion: AI motion design. Upload logo/brand assets and generate professional animations in 10 min for ~$10 vs agencies charging $10K+. Claude-powered. Editable output (not flat video). Free tier available. Launched Feb 5 2026.,HIGH,NOW,PENDING_REVIEW,"MM008_UGC_ARBITRAGE,MM009_AI_INFLUENCER,CF001_RELAX,CF006_CLIPS","N001_AI_UTILITIES,ALL_NICHES",85,Massive cost reduction for motion graphics. $10 vs $10K. Could generate animated logos and branded content for all niche accounts. Editable output means we can iterate. Claude-powered so quality should be high. Free tier for testing.,NONE,AUTHENTIC,N/A,Use for: animated logo reveals for all apps/brands. Social media motion graphics. Product promo videos. Ad creative generation. Stack with Kling/HeyGen for full video pipeline.,NONE,2026-02-05
ALPHA10846,Replit,https://replit.com/mobile-apps,PLATFORM_ARBITRAGE,Replit Mobile Apps: vibe code iOS apps from text prompts. React Native + Expo under hood. Scan QR to test. Direct App Store submission. Transparent build process. No Xcode required. Launched Jan 2026.,HIGH,NOW,PENDING_REVIEW,"MM001_APP_FACTORY,MM027_MICRO_SAAS","N001_AI_UTILITIES,N002_FAITH,N003_FITNESS,N004_PET",88,Could 10x our app factory velocity. Describe app -> build -> test on phone -> submit to App Store. Compare quality vs our Claude Code builds. React Native means cross-platform. Key question: does output quality match hand-coded apps?,NONE,AUTHENTIC,N/A,Test Replit Mobile Apps for rapid app prototyping. Build a simple utility app and compare time/quality vs current Claude Code workflow. If quality sufficient could shift app factory to this pipeline.,NONE,2026-02-05
ALPHA10847,Indie Hackers,https://www.indiehackers.com/post/tech/growing-a-portfolio-of-mobile-apps-to-185k-mo-hZ4hqICtByIljkiJECQv,APP_FACTORY,Connor Burd: mobile app portfolio at $185K/mo. Portfolio approach validated at massive scale. Combined with Max's $22K/mo story this confirms multi-app portfolios as proven revenue model in 2026.,HIGHEST,NOW,PENDING_REVIEW,MM001_APP_FACTORY,ALL_NICHES,95,$185K/mo from mobile app portfolio. This is the ceiling case for our APP_FACTORY strategy. Even 10% of this ($18.5K/mo) would be life-changing. Need to study his specific app categories and monetization mix.,round number but Indie Hackers community validated,AUTHENTIC,FALSE,Scale app portfolio aggressively. Focus on utility apps across niches. ASO-first distribution. Portfolio diversification.,NONE,2026-02-05
ALPHA10848,Typefully / SocialWick,https://typefully.com/blog/x-algorithm-open-source,PLATFORM_META,X/Twitter Algorithm Jan 2026 update: Grok-powered transformer architecture. Bookmarks carry 5x multiplier (+10 vs +0.5 for likes). Premium subs get +4 to +16 boost. Grok monitors tone: positive/constructive gets wider distribution. Negative/combative gets suppressed even with high engagement. Short tweets (71-100 chars) get 17% higher engagement. Video tweets get 10x engagement.,HIGHEST,NOW,PENDING_REVIEW,"CF001-CF013,MM009_AI_INFLUENCER,AI001-AI008",ALL_NICHES,98,CRITICAL platform meta update. Direct implications: (1) Optimize for BOOKMARKS not likes (5x weight). (2) Keep positive tone (Grok penalizes negativity). (3) Video in every post (10x boost). (4) Short punchy tweets (71-100 chars). (5) Get Premium for algorithmic boost. This changes our entire X content strategy.,NONE,AUTHENTIC,N/A,Restructure X posting: add bookmark-worthy value (save-able tips/lists). Keep tone constructive not combative. Add video to posts. Keep tweets 71-100 chars. Get X Premium for +4 to +16 boost.,NONE,2026-02-05
ALPHA10849,Buffer / SproutSocial,https://buffer.com/resources/instagram-algorithms/,PLATFORM_META,Instagram 2026: Shifted to rewarding original creators and penalizing content aggregators. Views now primary metric across all formats. Watch time + likes per reach + sends per reach are top 3 signals. Reels 2.46% engagement rate. 3-min Reels now recommended in Explore. Sends/shares most important signal.,HIGH,NOW,PENDING_REVIEW,"CF001-CF013,MM009_AI_INFLUENCER",ALL_NICHES,90,Instagram penalizing aggregator accounts = risk for content farm approach. Must create ORIGINAL content not reposts. Sends/shares > likes. 3-min Reels now viable (was previously penalized). Key shift: create content people SEND to friends.,NONE,AUTHENTIC,N/A,Create original content (not reposts from other platforms). Optimize for sends: make content people want to share via DM. 3-min Reels now viable for tutorials/behind-scenes. Track sends per reach as key metric.,Content must be original or risk suppression,2026-02-05
ALPHA10850,SocialBee / Miraflow,https://socialbee.com/blog/youtube-algorithm/,PLATFORM_META,YouTube 2026: Shorts now up to 3 min (was 60 sec). New search filter lets users EXCLUDE Shorts. Satisfaction-weighted discovery replaces pure engagement metrics. Completion rate + watch time influence Shorts RPM. Shorts-to-longform traffic flow intentionally boosted by algo.,HIGH,NOW,PENDING_REVIEW,"MM014_YOUTUBE_LONGFORM,MM029_FACELESS_YOUTUBE,CF012_YOUTUBE_SHORTS",ALL_NICHES,88,Key changes: (1) 3-min Shorts = more storytelling room. (2) Users can filter OUT Shorts from search = less discoverability but higher intent. (3) Satisfaction > engagement = quality over clickbait. (4) Shorts as funnel to longform is algorithmically supported. Strategy: use Shorts to hook -> drive to longform.,NONE,AUTHENTIC,N/A,Create 3-min Shorts with story arc. Use Shorts as top-of-funnel to drive longform views. Focus on satisfaction signals not clickbait. Completion rate matters more for RPM.,NONE,2026-02-05
ALPHA10851,Wispr Flow,https://wisprflow.ai,TOOL_ALPHA,Wispr Flow: AI dictation with auto-editing. 97.2% accuracy. Removes filler words/adds punctuation automatically. Whisper mode for quiet environments. 80% reduction in post-dictation editing. 2000-word doc needs ~3 min cleanup vs 20 min with standard dictation. $15/mo Pro. Free tier: 2000 words/week.,HIGH,SOON,PENDING_REVIEW,"MM051_AI_AUTOMATION_AGENCY,MM066_CUSTOM_GPT_BUSINESS","N001_AI_UTILITIES,N016_TECH",70,Useful productivity tool. 4x faster than typing. Auto-editing removes the main pain of dictation. Could speed up content generation significantly. Privacy concern: cloud-processed voice data. Free tier sufficient for testing.,Privacy concerns noted - cloud processing,AUTHENTIC,N/A,Use Wispr Flow for rapid content drafting: speak ideas -> auto-cleaned text -> Claude refinement -> publish. Could 4x content output speed.,Review privacy policy before using for sensitive content,2026-02-05
ALPHA10852,YC / Superframeworks,https://superframeworks.com/articles/yc-rfs-startup-ideas-indie-hackers-2026,MONETIZATION,YC Spring 2026 RFS highlights AI-powered agencies as #1 opportunity for solo founders. Don't sell AI tool access for $50/mo. Use AI yourself and sell finished work for $5K. Example: AI legal docs for startups. Law firms charge $500/hr for work AI does in minutes. 8 categories total including AI dev tools and government AI.,HIGHEST,NOW,PENDING_REVIEW,"MM051_AI_AUTOMATION_AGENCY,MM005_AGENCY_SERVICES,MM062_FRACTIONAL_EXEC_SERVICE","N001_AI_UTILITIES,N016_TECH",92,YC explicitly validating our AI automation agency method (MM051). The key insight: sell RESULTS not tool access. Charge $5K for what AI produces in minutes. Legal docs/compliance/audits are highest-margin applications. This is the clearest signal from YC about what works for solo founders in 2026.,NONE,AUTHENTIC,N/A,Launch AI-powered agency: pick one vertical (legal/compliance/design). Use Claude to produce deliverables. Charge $2-5K per project. Don't build a SaaS: sell the OUTPUT.,NONE,2026-02-05
ALPHA10853,WebKarobar / Nucamp,https://webkarobar.net/app-monetization-in-2026/,MONETIZATION,Vibe coding monetization 2026: custom builds $300-800. Micro-SaaS $5-15/mo targeting 10-20 users. Internal tools $300-1000 + $50-100/mo maintenance. 95% of apps are free = monetize post-install. Replit + Stripe integration enables instant monetization. Global app downloads hit 181B in 2026.,HIGH,SOON,PENDING_REVIEW,"MM001_APP_FACTORY,MM027_MICRO_SAAS","N001_AI_UTILITIES,ALL_NICHES",80,Vibe coding is creating a new class of app builders. The pricing tiers are useful benchmarks. Custom builds at $300-800 are the quickest cash. Micro-SaaS at $5-15/mo is the recurring play. Internal tools with maintenance = hybrid model. 181B downloads = massive addressable market.,NONE,AUTHENTIC,N/A,Use vibe coding tools (Replit/Cursor/Claude Code) to build custom apps for clients at $300-800. Simultaneously build own micro-SaaS portfolio at $5-15/mo. Stack custom work for cash + SaaS for recurring.,NONE,2026-02-05
ALPHA10854,GitHub / opensourceboilerplates.com,https://github.com/EinGuterWaran/awesome-opensource-boilerplates,APP_FACTORY,Open SaaS (Wasp framework) = 10K+ GitHub stars. Free MIT-licensed SaaS boilerplate with React/Node/Prisma. Saasfly = MIT Next.js enterprise boilerplate. Nextacular = MIT multi-tenant SaaS starter. ixartz SaaS-Boilerplate = Next.js + Tailwind + Shadcn + Auth + Multi-tenancy + i18n. All production-ready and free.,HIGH,NOW,PENDING_REVIEW,"MM001_APP_FACTORY,MM027_MICRO_SAAS,MM004_SAAS","N001_AI_UTILITIES,N016_TECH",85,Stop building from scratch. These MIT boilerplates have auth/payments/multi-tenancy/i18n built in. Open SaaS at 10K stars is community-validated. Clone + customize + ship. Could cut app development time by 60-80% for SaaS products.,NONE,AUTHENTIC,N/A,Fork Open SaaS or ixartz boilerplate. Add niche-specific features. Deploy on Vercel or CreateOS. Ship micro-SaaS products 3-5x faster than building from scratch.,NONE,2026-02-05
ALPHA10855,n8n / ParallelLabs,https://parallellabs.app/200-free-n8n-workflow-templates-that-save-solopreneurs-100-hours-monthly-without-writing-a-single-line-of-code/,TOOL_ALPHA,n8n: 200+ free workflow templates for solopreneurs. 600+ AI automation templates. 5288 community AI workflows. Free tier: 2500 executions/mo. One consultant saves 12 hrs/week automating client reports. Self-hostable. Connects to 600+ sources. Open source.,HIGH,NOW,PENDING_REVIEW,"MM051_AI_AUTOMATION_AGENCY,MM027_MICRO_SAAS","N001_AI_UTILITIES,ALL_NICHES",88,n8n is the automation backbone we need. 200+ ready templates means we don't build from scratch. Self-hostable = no vendor lock-in. Key use cases: auto-post content across platforms + auto-generate reports + lead nurture sequences + data pipeline from LEDGER CSVs. 2500 free executions/mo is enough to start.,NONE,AUTHENTIC,N/A,Deploy n8n self-hosted. Set up: (1) content auto-posting across platforms (2) lead nurture email sequences (3) alpha staging pipeline automation (4) financial tracker auto-updates. Use community templates as starting point.,NONE,2026-02-05
